date,ceo,company,positive,neutral,negative,total,neg_pct,theme,alias
2025-11-05,Timothy NeCastro,Erie Insurance,4,10,1,15,6.7,,Timothy NeCastro Erie Insurance
2025-11-05,Wendell Weeks,Corning,3,19,3,25,12.0,,Wendell Weeks Corning
2025-11-05,Kathleen Johnson,Lumen Technologies,5,19,1,25,4.0,,Kathleen Johnson Lumen Technologies
2025-11-05,Brian Tierney,FirstEnergy,4,17,4,25,16.0,,Brian Tierney FirstEnergy
2025-11-05,Adam Schechter,Labcorp Holdings,6,13,3,22,13.6,,Adam Schechter Labcorp Holdings
2025-11-05,Tiang Yew Tan,Western Digital,2,4,1,7,14.3,,Tiang Yew Tan Western Digital
2025-11-05,Rick McKenney,Unum Group,13,11,1,25,4.0,,Rick McKenney Unum Group
2025-11-05,Javier Rodriguez,DaVita,12,13,0,25,0.0,,Javier Rodriguez DaVita
2025-11-05,Steven Cahillane,Kellanova,11,12,2,25,8.0,,Steven Cahillane Kellanova
2025-11-05,Stanley Bergman,Henry Schein,3,20,2,25,8.0,,Stanley Bergman Henry Schein
2025-11-05,Robert Sanchez,Ryder System,11,12,2,25,8.0,,Robert Sanchez Ryder System
2025-11-05,Tim Hingtgen,Community Health Systems,6,15,4,25,16.0,,Tim Hingtgen Community Health Systems
2025-11-05,Avigal Soreq,Delek US,5,16,4,25,16.0,,Avigal Soreq Delek US
2025-11-05,Gerardo Norcia,DTE Energy,11,3,1,15,6.7,,Gerardo Norcia DTE Energy
2025-11-05,Mark Pearson,Equitable Holdings,8,14,2,24,8.3,,Mark Pearson Equitable Holdings
2025-11-05,Lori Koch,DuPont de Nemours,5,20,0,25,0.0,,Lori Koch DuPont
2025-11-05,Rich Steinmeier,LPL Financial,14,9,2,25,8.0,,Rich Steinmeier LPL Financial
2025-11-05,Bruce Van Saun,Citizens Financial Group,10,15,0,25,0.0,,Bruce Van Saun Citizens Financial Group
2025-11-05,José Mas,MasTec,7,17,1,25,4.0,,José Mas MasTec
2025-11-05,Andrés Gluski,AES,11,12,2,25,8.0,,Andrés Gluski AES
2025-11-05,Kevin Kwilinski,Berry Global,5,19,1,25,4.0,,Kevin Kwilinski Berry Global
2025-11-05,Mark George,Norfolk Southern,8,16,1,25,4.0,,Mark George Norfolk Southern
2025-11-05,Eduardo Menezes,Air Products & Chemicals,4,17,4,25,16.0,,Eduardo Menezes Air Products & Chemicals
2025-11-05,Shelley Simpson,JB Hunt Transport Services,3,19,3,25,12.0,,Shelley Simpson JB Hunt Transport Services
2025-11-05,Daniel Fisher,Ball Corporation,4,19,2,25,8.0,,Daniel Fisher Ball Corporation
2025-11-05,Sean Connolly,Conagra Brands,8,14,3,25,12.0,,Sean Connolly Conagra Brands
2025-11-05,Stephen Steinour,Huntington Bancshares,10,13,2,25,8.0,,Stephen Steinour Huntington Bancshares
2025-11-05,James Snee,Hormel Foods,0,24,1,25,4.0,,James Snee Hormel Foods
2025-11-05,Joseph Nolan,Eversource Energy,9,12,4,25,16.0,,Joseph Nolan Eversource Energy
2025-11-05,William Oplinger,Alcoa Corporation,1,14,10,25,40.0,,William Oplinger Alcoa Corporation
2025-11-05,Andrew Marsh,Entergy,6,12,1,19,5.3,,Andrew Marsh Entergy
2025-11-05,Keith Demmings,Assurant,2,9,0,11,0.0,,Keith Demmings Assurant
2025-11-05,Sumit Singh,Chewy,7,12,6,25,24.0,,Sumit Singh Chewy
2025-11-05,Niraj Shah,Wayfair,8,13,4,25,16.0,,Niraj Shah Wayfair
2025-11-05,Joseph Ferraro,Avis Budget,3,17,5,25,20.0,,Joseph Ferraro Avis Budget
2025-11-05,Jeffrey Sprecher,Intercontinental Exchange,7,18,0,25,0.0,,Jeffrey Sprecher Intercontinental Exchange
2025-11-05,Benito Minicucci,Alaska Air,2,6,2,10,20.0,,Benito Minicucci Alaska Air
2025-11-05,Malcolm Wilson,GXO Logistics,5,20,0,25,0.0,,Malcolm Wilson GXO Logistics
2025-11-05,Eric Hansotia,AGCO,7,12,6,25,24.0,,Eric Hansotia AGCO
2025-11-05,Kathleen Mazzarella,Graybar Electric,6,17,0,23,0.0,,Kathleen Mazzarella Graybar Electric
2025-11-05,Gavin Hattersley,Molson Coors Beverage,4,19,2,25,8.0,,Gavin Hattersley Molson Coors Beverage
2025-11-05,Patrick Gallagher,Arthur J Gallagher,6,17,2,25,8.0,,Patrick Gallagher Arthur J Gallagher
2025-11-05,Christopher Kastner,Huntington Ingalls Industries,8,17,0,25,0.0,,Christopher Kastner Huntington Ingalls Industries
2025-11-05,Erik Fyrwald,International Flavors & Fragrances,11,11,3,25,12.0,,Erik Fyrwald International Flavors & Fragrances
2025-11-05,Ricardo Cardenas,Darden Restaurants,8,17,0,25,0.0,,Ricardo Cardenas Darden Restaurants
2025-11-05,Stephen Spray,CIncinnati Financial,4,17,4,25,16.0,,Stephen Spray CIncinnati Financial
2025-11-05,Scott Boatwright,Chipotle Mexican Grill,3,6,16,25,64.0,,Scott Boatwright Chipotle Mexican Grill
2025-11-05,Joey Wat,Yum China,9,15,1,25,4.0,,Joey Wat Yum China
2025-11-05,Robert Goldstein,Las Vegas Sands,6,16,3,25,12.0,,Robert Goldstein Las Vegas Sands
2025-11-05,Kecia Steelman,Ulta Beauty,18,5,2,25,8.0,,Kecia Steelman Ulta Beauty
2025-11-05,Thomas Reeg,Caesars Entertainment,10,13,2,25,8.0,,Thomas Reeg Caesars Entertainment
2025-11-05,Jon Rousseau,BrightSpring Health Services,11,14,0,25,0.0,,Jon Rousseau BrightSpring Health Services
2025-11-05,William Krueger,The Andersons Inc,4,16,0,20,0.0,,William Krueger The Andersons Inc
2025-11-05,Michele Buck,Hershey,2,22,1,25,4.0,,Michele Buck Hershey
2025-11-05,Christopher Nassetta,Hilton Worldwide,9,12,4,25,16.0,,Christopher Nassetta Hilton Worldwide
2025-11-05,Bruce Bodine,The Mosaic Company,5,12,5,22,22.7,,Bruce Bodine The Mosaic Company
2025-11-05,Brian Chesky,Airbnb,5,12,8,25,32.0,,Brian Chesky Airbnb
2025-11-05,Kaes Van’t Hof,Diamondback Energy,17,7,1,25,4.0,,Kaes Van’t Hof Diamondback Energy
2025-11-05,Steven Vondran,American Tower,6,9,2,17,11.8,,Steven Vondran American Tower
2025-11-05,Reshma Kewalramani,Vertex Pharmaceuticals,14,7,4,25,16.0,,Reshma Kewalramani Vertex Pharmaceuticals
2025-11-05,William McDermott,ServiceNow,3,17,5,25,20.0,,William McDermott ServiceNow
2025-11-05,Brian Chambers,Owens Corning,3,21,1,25,4.0,,Brian Chambers Owens Corning
2025-11-05,Teresa Rasmussen,Thrivent Financial for Lutherans,3,7,0,10,0.0,,Teresa Rasmussen Thrivent Financial for Lutherans
2025-11-05,Shane O'Kelly,Advance Auto Parts,8,14,3,25,12.0,,Shane O'Kelly Advance Auto Parts
2025-11-05,Douglas Yearley,Toll Brothers,5,15,5,25,20.0,,Douglas Yearley Toll Brothers
2025-11-05,Jeffrey Lorberbaum,Mohawk Industries,12,11,2,25,8.0,,Jeffrey Lorberbaum Mohawk Industries
2025-11-05,Gregory Brown,Motorola Solutions,7,15,3,25,12.0,,Gregory Brown Motorola Solutions
2025-11-05,John Pfeifer,Oshkosh Corporation,6,19,0,25,0.0,,John Pfeifer Oshkosh Corporation
2025-11-05,Tony Xu,DoorDash,6,14,5,25,20.0,,Tony Xu DoorDash
2025-11-05,Edward Pesicka,Owens & Minor,4,19,2,25,8.0,,Edward Pesicka Owens & Minor
2025-11-05,Eugene Bredow,NVR Inc,0,9,1,10,10.0,,Eugene Bredow NVR Inc
2025-11-05,Philippe Krakowsky,Interpublic Group,7,17,1,25,4.0,,Philippe Krakowsky Interpublic Group
2025-11-05,Horacio Rozanski,Booz Allen Hamilton,11,10,4,25,16.0,,Horacio Rozanski Booz Allen Hamilton
2025-11-05,Michael O’Sullivan,Burlington Stores,4,19,2,25,8.0,,Michael O’Sullivan Burlington Stores
2025-11-05,Daniel Wall,Expeditors International of Washington,5,9,0,14,0.0,,Daniel Wall Expeditors International of Washington
2025-11-05,Calvin McDonald,Lululemon athletica,5,16,4,25,16.0,,Calvin McDonald Lululemon athletica
2025-11-05,Stephanie Ferris,Fidelity National Information Services,10,13,2,25,8.0,,Stephanie Ferris Fidelity National Information Services
2025-11-05,Rich Handler,Jefferies Financial,6,11,8,25,32.0,,Rich Handler Jefferies Financial
2025-11-05,Alan Armstrong,Williams Companies,10,14,1,25,4.0,,Alan Armstrong Williams Companies
2025-11-05,Bracken Darrell,VF Corporation,7,15,3,25,12.0,,Bracken Darrell VF Corporation
2025-11-05,Mikael Bratt,Autoliv,4,11,7,22,31.8,,Mikael Bratt Autoliv
2025-11-05,Rafael Santana,Westinghouse Air Brake Technologies,8,13,4,25,16.0,,Rafael Santana Westinghouse Air Brake Technologies
2025-11-05,Ralph LaRossa,Public Service Enterprise Group,7,14,4,25,16.0,,Ralph LaRossa Public Service Enterprise Group
2025-11-05,Jamie Iannone,Ebay,4,20,1,25,4.0,,Jamie Iannone Ebay
2025-11-05,Scott Richardson,Celanese,5,14,2,21,9.5,,Scott Richardson Celanese
2025-11-05,Cameron Bready,Global Payments,8,17,0,25,0.0,,Cameron Bready Global Payments
2025-11-05,Robert Thomson,News Corp,0,19,6,25,24.0,,Robert Thomson News Corp
2025-11-05,Robert Martin,THOR Industries,7,9,3,19,15.8,,Robert Martin THOR Industries
2025-11-05,David Rawlinson II,QVC Group,10,12,3,25,12.0,,David Rawlinson II QVC Group
2025-11-05,Andrew Teno,Icahn Enterprises,4,13,3,20,15.0,,Andrew Teno Icahn Enterprises
2025-11-05,William Newlands,Constellation Brands,5,15,5,25,20.0,,William Newlands Constellation Brands
2025-11-05,James Davis,Quest Diagnostics,9,14,2,25,8.0,,James Davis Quest Diagnostics
2025-11-05,Richard Wallace,KLA,4,7,2,13,15.4,,Richard Wallace KLA
2025-11-05,Brad Jacobs,QXO Building Products,5,17,3,25,12.0,,Brad Jacobs QXO Building Products
2025-11-05,John Christmann IV,APA,2,10,0,12,0.0,,John Christmann IV APA
2025-11-05,Gregory Roberts,A-Mark Precious Metals,20,3,2,25,8.0,,Gregory Roberts A-Mark Precious Metals
2025-11-05,Christopher Viehbacher,Biogen,4,18,3,25,12.0,,Christopher Viehbacher Biogen
2025-11-05,Mick Beekhuizen,Campbell Soup,4,20,1,25,4.0,,Mick Beekhuizen Campbell Soup
2025-11-05,Christopher Caldwell,Concentrix,16,5,1,22,4.5,,Christopher Caldwell Concentrix
2025-11-05,Todd Schneider,Cintas,10,11,4,25,16.0,,Todd Schneider Cintas
2025-11-05,Tony Sarsam,SpartanNash,12,13,0,25,0.0,,Tony Sarsam SpartanNash
2025-11-05,John Venhuizen,Ace Hardware,7,17,1,25,4.0,,John Venhuizen Ace Hardware
2025-11-05,Vincent Roche,Analog Devices,14,10,1,25,4.0,,Vincent Roche Analog Devices
2025-11-05,Mark Costa,Eastman Chemical,2,16,7,25,28.0,,Mark Costa Eastman Chemical
2025-11-05,Milan Galik,Interactive Brokers,6,17,2,25,8.0,,Milan Galik Interactive Brokers
2025-11-05,John Turner,Regions Financial,11,12,2,25,8.0,,John Turner Regions Financial
2025-11-05,Joanna Geraghty,JetBlue Airways,9,9,7,25,28.0,,Joanna Geraghty JetBlue Airways
2025-11-05,Kristin Peck,Zoetis,7,17,1,25,4.0,,Kristin Peck Zoetis
2025-11-05,Christopher Gorman,KeyCorp,9,15,1,25,4.0,,Christopher Gorman KeyCorp
2025-11-05,Mark Bertolini,Oscar Health,6,15,4,25,16.0,,Mark Bertolini Oscar Health
2025-11-05,Brendan McCracken,Ovintiv,9,9,4,22,18.2,,Brendan McCracken Ovintiv
2025-11-05,Robert Steer,Seaboard,1,6,0,7,0.0,,Robert Steer Seaboard
2025-11-05,Gil West,Hertz,7,16,2,25,8.0,,Gil West Hertz
2025-11-05,Robert Greenberg,Skechers USA,1,24,0,25,0.0,,Robert Greenberg Skechers USA
2025-11-05,Dennis Mathew,Altice USA,7,14,4,25,16.0,,Dennis Mathew Altice USA
2025-11-05,Clay Williams,NOV,6,16,3,25,12.0,,Clay Williams NOV
2025-11-05,Michael Doss,Graphic Packaging,9,13,3,25,12.0,,Michael Doss Graphic Packaging
2025-11-05,Deon Stander,Avery Dennison,1,14,2,17,11.8,,Deon Stander Avery Dennison
2025-11-05,Adaire Fox-Martin,Equinix,7,14,4,25,16.0,,Adaire Fox-Martin Equinix
2025-11-05,Joyce Mullen,Insight Enterprises,5,19,1,25,4.0,,Joyce Mullen Insight Enterprises
2025-11-05,Jennifer Witz,Sirius XM,10,13,2,25,8.0,,Jennifer Witz Sirius XM
2025-11-05,Stefan Larsson,PVH,5,13,7,25,28.0,,Stefan Larsson PVH
2025-11-05,Jason P Wells,CenterPoint Energy,17,4,4,25,16.0,,Jason P Wells CenterPoint Energy
2025-11-05,Scott Lauber,WEC Energy,15,8,0,23,0.0,,Scott Lauber WEC Energy
2025-11-05,Matthew Pine,Xylem Inc,8,16,1,25,4.0,,Matthew Pine Xylem Inc
2025-11-05,Jennifer Johnson,Franklin Resources,5,17,3,25,12.0,,Jennifer Johnson Franklin Resources
2025-11-05,Vincent Sorgi,PPL Corporation,8,17,0,25,0.0,,Vincent Sorgi PPL Corporation
2025-11-05,Carl Eschenbach,Workday,6,13,6,25,24.0,,Carl Eschenbach Workday
2025-11-05,Richard Tobin,Dover Corporation,3,20,2,25,8.0,,Richard Tobin Dover Corporation
2025-11-05,Mark Kowlzan,Packaging Corp of America,8,14,3,25,12.0,,Mark Kowlzan Packaging Corp of America
2025-11-05,Scott Salmirs,ABM Industries,11,10,2,23,8.7,,Scott Salmirs ABM Industries
2025-11-05,Gary Guthart,Intuitive Surgical,8,13,4,25,16.0,,Gary Guthart Intuitive Surgical
2025-11-05,Carl Lindner lll,American Financial Group,7,13,5,25,20.0,,Carl Lindner lll American Financial Group
2025-11-05,Blake Moret,Rockwell Automation,8,15,2,25,8.0,,Blake Moret Rockwell Automation
2025-11-05,Bryan Hanson,Solventum,6,16,3,25,12.0,,Bryan Hanson Solventum
2025-11-05,Craig Smiddy,Old Republic International,6,13,1,20,5.0,,Craig Smiddy Old Republic International
2025-11-05,Christopher Hilger,Securian Financial,2,22,1,25,4.0,,Christopher Hilger Securian Financial
2025-11-05,Hamid Moghadam,Prologis,0,21,4,25,16.0,,Hamid Moghadam Prologis
2025-11-05,Mark Smucker,JM Smucker,7,15,3,25,12.0,,Mark Smucker JM Smucker
2025-11-05,Sheryl Palmer,Taylor Morrison Home,5,15,5,25,20.0,,Sheryl Palmer Taylor Morrison Home
2025-11-05,Mario Harik,XPO,6,17,2,25,8.0,,Mario Harik XPO
2025-11-05,Heather Lavallee,Voya Financial,4,19,2,25,8.0,,Heather Lavallee Voya Financial
2025-11-05,Nikesh Arora,Palo Alto Networks,5,11,9,25,36.0,,Nikesh Arora Palo Alto Networks
2025-11-05,Giordano Albertazzi,Vertiv,8,17,0,25,0.0,,Giordano Albertazzi Vertiv
2025-11-05,Shankh Mitra,Welltower,10,13,2,25,8.0,,Shankh Mitra Welltower
2025-11-05,Mary Dillon,Foot Locker,4,18,3,25,12.0,,Mary Dillon Foot Locker
2025-11-05,William Monteleone,Par Pacific,2,6,0,8,0.0,,William Monteleone Par Pacific
2025-11-05,Kevin Stein,TransDigm,7,16,2,25,8.0,,Kevin Stein TransDigm
2025-11-05,Peter Matt,Commercial Metals,8,13,4,25,16.0,,Peter Matt Commercial Metals
2025-11-05,Rob Vitale,Post Holdings,0,19,6,25,24.0,,Rob Vitale Post Holdings
2025-11-05,Keith Allman,Masco,8,16,1,25,4.0,,Keith Allman Masco
2025-11-05,Rusty Rush,Rush Enterprises,10,12,3,25,12.0,,Rusty Rush Rush Enterprises
2025-11-05,Stuart Bradie,KBR,10,13,2,25,8.0,,Stuart Bradie KBR
2025-11-05,Jack Sinclair,Sprouts Farmers Market,10,12,3,25,12.0,,Jack Sinclair Sprouts Farmers Market
2025-11-05,Laura Alber,Williams-Sonoma,5,16,4,25,16.0,,Laura Alber Williams-Sonoma
2025-11-05,Ivan Tornos,Zimmer Biomet,6,19,0,25,0.0,,Ivan Tornos Zimmer Biomet
2025-11-05,John Mengucci,CACI International,12,12,1,25,4.0,,John Mengucci CACI International
2025-11-05,Steve Sanghi,Microchip Technology,5,18,2,25,8.0,,Steve Sanghi Microchip Technology
2025-11-05,Albert Nahmad,Watsco,9,13,3,25,12.0,,Albert Nahmad Watsco
2025-11-05,Christopher Peterson,Newell Brands,4,19,2,25,8.0,,Christopher Peterson Newell Brands
2025-11-05,Arie Kotler,ARKO,3,21,1,25,4.0,,Arie Kotler ARKO
2025-11-05,Jure Sola,Sanmina,4,18,3,25,12.0,,Jure Sola Sanmina
2025-11-05,Andrew Wilson,Electronic Arts,11,10,4,25,16.0,,Andrew Wilson Electronic Arts
2025-11-05,David Gibbs,Yum Brands,1,24,0,25,0.0,,David Gibbs Yum Brands
2025-11-05,Daniel Florness,Fastenal,8,15,2,25,8.0,,Daniel Florness Fastenal
2025-11-05,Garrick Rochow,CMS Energy,22,2,1,25,4.0,,Garrick Rochow CMS Energy
2025-11-05,Rodney Sacks,Monster Beverage,10,13,2,25,8.0,,Rodney Sacks Monster Beverage
2025-11-05,Mark Shapiro,Endeavor Group Holdings,0,20,5,25,20.0,,Mark Shapiro Endeavor Group Holdings
2025-11-05,Toni Townes-Whitley,Science Applications International,5,18,2,25,8.0,,Toni Townes-Whitley Science Applications International
2025-11-05,Mark Witkowski,Core & Main,2,16,7,25,28.0,,Mark Witkowski Core & Main
2025-11-05,John Plant,Howmet Aerospace,5,16,4,25,16.0,,John Plant Howmet Aerospace
2025-11-05,James Zallie,Ingredion,9,15,1,25,4.0,,James Zallie Ingredion
2025-11-05,Thomas Hill,Vulcan Materials,11,13,1,25,4.0,,Thomas Hill Vulcan Materials
2025-11-05,Donald Zurbay,Patterson Companies Inc,0,6,3,9,33.3,,Donald Zurbay Patterson Companies Inc
2025-11-05,Anthony Smurfit,Smurfit Westrock,8,10,7,25,28.0,,Anthony Smurfit Smurfit Westrock
2025-11-05,Richard P Dealy,Pioneer Natural Resources,3,6,0,9,0.0,,Richard P Dealy Pioneer Natural Resources
2025-11-05,Derek Chang,Liberty Media,25,0,0,25,0.0,,Derek Chang Liberty Media
2025-11-05,Timothy J Donahue,Crown Holdings,3,21,1,25,4.0,,Timothy J Donahue Crown Holdings
2025-11-05,R Bruce McDonald,Dana Incorporated,5,18,1,24,4.2,,R Bruce McDonald Dana Incorporated
2025-11-05,J Kent Masters,Albemarle Corporation,3,11,6,20,30.0,,J Kent Masters Albemarle Corporation
2025-11-05,Malcolm C Roberts,FM Global,8,12,5,25,20.0,,Malcolm C Roberts FM Global
2025-11-05,Mike Speetzen,Polaris Inc,1,18,6,25,24.0,,Mike Speetzen Polaris Inc
2025-11-05,Bob Flexon,UGI Utilities Inc,2,5,3,10,30.0,,Bob Flexon UGI Utilities Inc
2025-11-05,Robert D Lawler,Continental Resources,0,1,0,1,0.0,,Robert D Lawler Continental Resources
2025-11-05,Domenic Dell’Osso Jr,Expand Energy Corporation,11,0,0,11,0.0,,Domenic Dell’Osso Jr Expand Energy Corporation
2025-11-05,H Michael Krimbill,NGL Energy Partners,7,3,0,10,0.0,,H Michael Krimbill NGL Energy Partners
2025-11-05,Hassane El-Khoury,ON Semiconductor,2,16,7,25,28.0,,Hassane El-Khoury ON Semiconductor
2025-11-05,Joseph M Otting,Flagstar Financial,7,9,3,19,15.8,,Joseph M Otting Flagstar Financial
2025-11-05,Gerry P Smith,ODP Business Solutions,3,4,2,9,22.2,,Gerry P Smith ODP Business Solutions
2025-11-05,Devin Stockfish,Weyerhaeuser,8,15,2,25,8.0,,Devin Stockfish Weyerhaeuser
2025-11-05,Thomas J McInerney,Genworth Financial,6,4,1,11,9.1,,Thomas J McInerney Genworth Financial
2025-11-05,Daniel Heaf,Bath & Body Works,7,17,1,25,4.0,,Daniel Heaf Bath & Body Works
2025-11-05,Linda Rendle,Clorox,2,20,3,25,12.0,,Linda Rendle Clorox
2025-11-05,Frank C Sullivan,RPM International,6,18,1,25,4.0,,Frank C Sullivan RPM International
2025-11-05,Matthew Missad,UFP Industries,9,8,2,19,10.5,,Matthew Missad UFP Industries
2025-11-05,Martin J Lyons,Ameren,1,11,2,14,14.3,,Martin J Lyons Ameren
2025-11-05,Adam W Miller,Knight Swift Transportation,4,10,2,16,12.5,,Adam W Miller Knight Swift Transportation
2025-11-05,Charles Liang,Super Micro Computer,19,3,3,25,12.0,,Charles Liang Super Micro Computer
2025-11-05,Gordon J Hardie,O-I Glass,0,4,0,4,0.0,,Gordon J Hardie O-I Glass
2025-11-05,Steve Henry,Domtar,2,11,0,13,0.0,,Steve Henry Domtar
2025-11-05,Chuck Treadway,CommScope,4,19,2,25,8.0,,Chuck Treadway CommScope
2025-11-05,Steven J Moskowitz,Crown Castle,4,6,4,14,28.6,,Steven J Moskowitz Crown Castle
2025-11-05,Emmanuel Ligner,Avantor,4,15,3,22,13.6,,Emmanuel Ligner Avantor
2025-11-05,Kaz Nejatian,Opendoor Technologies,9,14,2,25,8.0,,Kaz Nejatian Opendoor Technologies
2025-11-05,Russell Becker,APi Group,5,20,0,25,0.0,,Russell Becker APi Group
2025-11-05,Toby Rice,EQT,13,11,1,25,4.0,,Toby Rice EQT
2025-11-05,Jesse Arenivas,EnLink Midstream,6,13,0,19,0.0,,Jesse Arenivas EnLink Midstream
2025-11-05,Steven Bandrowczak,Xerox,5,17,3,25,12.0,,Steven Bandrowczak Xerox
2025-11-05,Vicente Reynal,Ingersoll Rand,7,16,2,25,8.0,,Vicente Reynal Ingersoll Rand
2025-11-05,William T Dillard II,Dillards,10,11,4,25,16.0,,William T Dillard II Dillards
2025-11-05,C Howard Nye,Martin Marietta Materials,2,5,4,11,36.4,,C Howard Nye Martin Marietta Materials
2025-11-05,Stephane Bancel,Moderna,6,9,10,25,40.0,,Stephane Bancel Moderna
2025-11-05,Nate R Jorgensen,Boise Cascade,1,1,0,2,0.0,,Nate R Jorgensen Boise Cascade
2025-11-05,Padraig McDonnell,Agilent Technologies,9,16,0,25,0.0,,Padraig McDonnell Agilent Technologies
2025-11-05,Kenneth T Lane,Olin,1,3,0,4,0.0,,Kenneth T Lane Olin
2025-11-05,Randall C Stuewe,Darling Ingredients,24,1,0,25,0.0,,Randall C Stuewe Darling Ingredients
2025-11-05,R Howard Coker,Sonoco Products,3,7,2,12,16.7,,R Howard Coker Sonoco Products
2025-11-05,Lee M Tillman,Marathon Oil,1,14,3,18,16.7,,Lee M Tillman Marathon Oil
2025-11-05,Mark Hoplamazian,Hyatt Hotels,6,18,1,25,4.0,,Mark Hoplamazian Hyatt Hotels
2025-11-05,David S Chernow,Select Medical Holdings,1,10,0,11,0.0,,David S Chernow Select Medical Holdings
2025-11-05,Brendan M Foley,McCormick & Company,5,20,0,25,0.0,,Brendan M Foley McCormick & Company
2025-11-05,Joanne Crevoiserat,Tapestry,11,11,3,25,12.0,,Joanne Crevoiserat Tapestry
2025-11-05,W Anthony Will,CF Industries,6,19,0,25,0.0,,W Anthony Will CF Industries
2025-11-05,David A Zapico,Ametek,5,18,2,25,8.0,,David A Zapico Ametek
2025-11-05,Craig Billings,Wynn Resorts,5,15,5,25,20.0,,Craig Billings Wynn Resorts
2025-11-05,Giel Rutten,Amkor Technology,6,18,1,25,4.0,,Giel Rutten Amkor Technology
2025-11-05,Paul Sarvadi,Insperity,6,18,1,25,4.0,,Paul Sarvadi Insperity
2025-11-05,Rob Sharps,T Rowe Price,8,12,5,25,20.0,,Rob Sharps T Rowe Price
2025-11-05,Patrice Louvet,Ralph Lauren,7,13,5,25,20.0,,Patrice Louvet Ralph Lauren
2025-11-05,Jeffrey Mezger,KB Home,2,14,9,25,36.0,,Jeffrey Mezger KB Home
2025-11-05,David M Foulkes,Brunswick Corporation,3,16,0,19,0.0,,David M Foulkes Brunswick Corporation
2025-11-05,M Keith Waddell,Robert Half,15,9,1,25,4.0,,M Keith Waddell Robert Half
2025-11-05,Jay Snowden,PENN Entertainment,9,10,6,25,24.0,,Jay Snowden PENN Entertainment
2025-11-05,George Kurian,NetApp,15,8,2,25,8.0,,George Kurian NetApp
2025-11-05,Kevin Ali,Organon,2,8,15,25,60.0,,Kevin Ali Organon
2025-11-05,Joel D Anderson,Petco Health and Wellness,2,12,0,14,0.0,,Joel D Anderson Petco Health and Wellness
2025-11-05,Louis V Pinkham,Regal Rexnord,0,12,1,13,7.7,,Louis V Pinkham Regal Rexnord
2025-11-05,Jay Geldmacher,Resideo Technologies,15,9,1,25,4.0,,Jay Geldmacher Resideo Technologies
2025-11-05,Marcus Lemonis,Camping World,7,8,10,25,40.0,,Marcus Lemonis Camping World
2025-11-05,Peter R Huntsman,Huntsman,6,14,5,25,20.0,,Peter R Huntsman Huntsman
2025-11-05,Hillary Super,Victorias Secret,9,7,9,25,36.0,,Hillary Super Victorias Secret
2025-11-05,Michelle Gass,Levi Strauss,8,17,0,25,0.0,,Michelle Gass Levi Strauss
2025-11-05,Neil Hunn,Roper Technologies,6,18,1,25,4.0,,Neil Hunn Roper Technologies
2025-11-05,Steven P Lawrence,Academy Sports and Outdoors,1,6,2,9,22.2,,Steven P Lawrence Academy Sports and Outdoors
2025-11-05,Phillippe Lord,Meritage Homes,7,17,1,25,4.0,,Phillippe Lord Meritage Homes
2025-11-05,David C Dauch,American Axle & Manufacturing,10,14,1,25,4.0,,David C Dauch American Axle & Manufacturing
2025-11-05,Olumide Soroye,Fortive,1,8,1,10,10.0,,Olumide Soroye Fortive
2025-11-05,Adena Friedman,Nasdaq Inc,10,13,2,25,8.0,,Adena Friedman Nasdaq Inc
2025-11-05,Tim Gokey,Broadridge Financial Solutions,6,18,1,25,4.0,,Tim Gokey Broadridge Financial Solutions
2025-11-05,Patrick M Shanahan,Spirit AeroSystems,2,19,3,24,12.5,,Patrick M Shanahan Spirit AeroSystems
2025-11-05,Robert Kyncl,Warner Music Group,9,12,4,25,16.0,,Robert Kyncl Warner Music Group
2025-11-05,Denise Dignam,Chemours,4,20,1,25,4.0,,Denise Dignam Chemours
2025-11-05,Jim DeVries,ADT,10,7,2,19,10.5,,Jim DeVries ADT
2025-11-05,Bernard Zovighian,Edwards Lifesciences,6,9,2,17,11.8,,Bernard Zovighian Edwards Lifesciences
2025-11-05,Mark E Seaton,First American Financial,2,18,0,20,0.0,,Mark E Seaton First American Financial
2025-11-05,John C Roche,Hanover Insurance Group,3,10,1,14,7.1,,John C Roche Hanover Insurance Group
2025-11-05,Adam J Greenlee,Silgan,3,5,1,9,11.1,,Adam J Greenlee Silgan
2025-11-05,Jayne Hrdlicka,Endeavor Group,3,20,2,25,8.0,,Jayne Hrdlicka Endeavor Group
2025-11-05,Robert Fauber,Moodys Corporation,7,13,4,24,16.7,,Robert Fauber Moodys Corporation
2025-11-05,Thomas E Jorden,Coterra Energy,12,1,0,13,0.0,,Thomas E Jorden Coterra Energy
2025-11-05,Eugene A Hall,Gartner,7,16,2,25,8.0,,Eugene A Hall Gartner
2025-11-05,Kevin Plank,Under Armour,4,18,3,25,12.0,,Kevin Plank Under Armour
2025-11-05,James W Lanning,Ingles Markets,3,6,0,9,0.0,,James W Lanning Ingles Markets
2025-11-05,Matthew T Farrell,Church & Dwight,12,12,1,25,4.0,,Matthew T Farrell Church & Dwight
2025-11-05,Kevin M Freeman,Old Dominion Freight Line,4,7,1,12,8.3,,Kevin M Freeman Old Dominion Freight Line
2025-11-05,Joe Shoen,U-Haul,5,15,5,25,20.0,,Joe Shoen U-Haul
2025-11-05,Jayshree Ullal,Arista Networks,11,13,1,25,4.0,,Jayshree Ullal Arista Networks
2025-11-05,Sassine Ghazi,Synopsys,8,13,4,25,16.0,,Sassine Ghazi Synopsys
2025-11-05,Jochen Zeitz,Harley-Davidson,3,17,5,25,20.0,,Jochen Zeitz Harley-Davidson
2025-11-05,Nick Jeffery,Frontier Communications,5,20,0,25,0.0,,Nick Jeffery Frontier Communications
2025-11-05,Thomas Edward McCormick,Primoris Services,1,3,1,5,20.0,,Thomas Edward McCormick Primoris Services
2025-11-05,D Christian Koch,Carlisle Companies,4,18,1,23,4.3,,D Christian Koch Carlisle Companies
2025-11-05,David E Simon,Simon Property Group,5,16,4,25,16.0,,David E Simon Simon Property Group
2025-11-05,Stephen Bratspies,Hanesbrands,4,18,3,25,12.0,,Stephen Bratspies Hanesbrands
2025-11-05,Ryan M. Schneider,Anywhere Real Estate Inc,1,20,4,25,16.0,,Ryan M. Schneider Anywhere Real Estate Inc
2025-11-05,George Bobb III,Teledyne Technologies,1,9,0,10,0.0,,George Bobb III Teledyne Technologies
2025-11-05,Terrence A Duffy,CME Group,1,23,1,25,4.0,,Terrence A Duffy CME Group
2025-11-05,Rami Rahim,Juniper Networks,6,18,1,25,4.0,,Rami Rahim Juniper Networks
2025-11-05,Sue Nabi,Coty,6,15,4,25,16.0,,Sue Nabi Coty
2025-11-05,Peter D Arvan,Pool Corporation,6,16,3,25,12.0,,Peter D Arvan Pool Corporation
2025-11-05,David Campbell,Evergy,11,10,4,25,16.0,,David Campbell Evergy
2025-11-05,Matthew J Murphy,Marvell Technology,4,11,2,17,11.8,,Matthew J Murphy Marvell Technology
2025-11-05,Lloyd Yates,NiSource,11,13,1,25,4.0,,Lloyd Yates NiSource
2025-11-05,William C Stone,SS&C Technologies,10,10,5,25,20.0,,William C Stone SS&C Technologies
2025-11-05,Mark Rourke,Schneider National,6,19,0,25,0.0,,Mark Rourke Schneider National
2025-11-05,Andrew Anagnost,Autodesk,5,15,5,25,20.0,,Andrew Anagnost Autodesk
2025-11-05,Dustin Semach,Sealed Air Corporation,4,21,0,25,0.0,,Dustin Semach Sealed Air Corporation
2025-11-05,William L Meaney,Iron Mountain,5,15,3,23,13.0,,William L Meaney Iron Mountain
2025-11-05,Andy P Power,Digital Realty Trust,7,6,0,13,0.0,,Andy P Power Digital Realty Trust
2025-11-05,Satish Dhanasekaran,Keysight Technologies,2,11,0,13,0.0,,Satish Dhanasekaran Keysight Technologies
2025-11-05,Frank M Svoboda,Globe Life,3,6,3,12,25.0,,Frank M Svoboda Globe Life
2025-11-05,Carey A Smith,Parsons Corporation,10,13,2,25,8.0,,Carey A Smith Parsons Corporation
2025-11-05,Ynon Kreiz,Mattel,5,16,4,25,16.0,,Ynon Kreiz Mattel
2025-11-05,Karen S Haller,Southwest Gas Holdings,3,8,0,11,0.0,,Karen S Haller Southwest Gas Holdings
2025-11-05,Terrance Williams,TruStage,10,8,1,19,5.3,,Terrance Williams TruStage
2025-11-05,Eric W Gerstenberg,Clean Harbors,5,2,1,8,12.5,,Eric W Gerstenberg Clean Harbors
2025-11-05,Gunner Smith,Cornerstone Building Brands,1,6,2,9,22.2,,Gunner Smith Cornerstone Building Brands
