date,ceo,company,positive,neutral,negative,total,neg_pct,theme,alias
2025-10-17,Doug McMillon,Walmart,6,17,2,25,8.0,,Doug McMillon Walmart
2025-10-17,Andy Jassy,Amazon,6,9,10,25,40.0,,Andy Jassy Amazon
2025-10-17,Stephen Hemsley,UnitedHealth,3,18,4,25,16.0,,Stephen Hemsley UnitedHealth
2025-10-17,Tim Cook,Apple,7,17,1,25,4.0,,Tim Cook Apple
2025-10-17,David Joyner,CVS Health,7,14,4,25,16.0,,David Joyner CVS Health
2025-10-17,Warren Buffett,Berkshire Hathaway,3,17,5,25,20.0,,Warren Buffett Berkshire Hathaway
2025-10-17,Sundar Pichai,Alphabet,6,16,3,25,12.0,,Sundar Pichai Alphabet
2025-10-17,Darren Woods,Exxon Mobil,7,13,5,25,20.0,,Darren Woods Exxon Mobil
2025-10-17,Brian Tyler,McKesson,4,14,7,25,28.0,,Brian Tyler McKesson
2025-10-17,Robert Mauch,Cencora,4,13,0,17,0.0,,Robert Mauch Cencora
2025-10-17,Jamie Dimon,JPMorgan Chase,6,10,9,25,36.0,,Jamie Dimon JPMorgan Chase
2025-10-17,Ron Vachris,Costco,2,21,2,25,8.0,,Ron Vachris Costco
2025-10-17,David Cordani,Cigna,14,9,2,25,8.0,,David Cordani Cigna
2025-10-17,Satya Nadella,Microsoft,6,18,1,25,4.0,,Satya Nadella Microsoft
2025-10-17,Jason Hollar,Cardinal Health,8,12,5,25,20.0,,Jason Hollar Cardinal Health
2025-10-17,Mike Wirth,Chevron,9,12,4,25,16.0,,Mike Wirth Chevron
2025-10-17,Brian Moynihan,Bank of America,7,15,3,25,12.0,,Brian Moynihan Bank of America
2025-10-17,Mary Barra,General Motors,5,14,6,25,24.0,,Mary Barra General Motors
2025-10-17,Jim Farley,Ford Motor,8,13,4,25,16.0,,Jim Farley Ford Motor
2025-10-17,Gail Boudreaux,Elevance Health,12,7,6,25,24.0,,Gail Boudreaux Elevance Health
2025-10-17,Jane Fraser,Citigroup,13,12,0,25,0.0,,Jane Fraser Citigroup
2025-10-17,Mark Zuckerberg,Meta Platforms,9,11,5,25,20.0,,Mark Zuckerberg Meta Platforms
2025-10-17,Sarah London,Centene,10,8,7,25,28.0,,Sarah London Centene
2025-10-17,Ted Decker,Home Depot,8,14,3,25,12.0,,Ted Decker Home Depot
2025-10-17,Priscilla Almodovar,Fannie Mae,6,6,13,25,52.0,,Priscilla Almodovar Fannie Mae
2025-10-17,Ron Sargent,Kroger,4,16,5,25,20.0,,Ron Sargent Kroger
2025-10-17,Mark Lashier,Phillips 66,7,10,8,25,32.0,,Mark Lashier Phillips 66
2025-10-17,Maryann Mannen,Marathon Petroleum,7,17,1,25,4.0,,Maryann Mannen Marathon Petroleum
2025-10-17,Dan Schulman,Verizon,3,20,2,25,8.0,,Dan Schulman Verizon
2025-10-17,Jensen Huang,Nvidia,9,14,2,25,8.0,,Jensen Huang Nvidia
2025-10-17,David Solomon,Goldman Sachs,6,13,6,25,24.0,,David Solomon Goldman Sachs
2025-10-17,Charles Scharf,Wells Fargo,18,3,4,25,16.0,,Charles Scharf Wells Fargo
2025-10-17,Lane Riggs,Valero Energy,13,10,2,25,8.0,,Lane Riggs Valero Energy
2025-10-17,Brian Roberts,Comcast,5,15,5,25,20.0,,Brian Roberts Comcast
2025-10-17,Jon Farney,State Farm Insurance,2,17,6,25,24.0,,Jon Farney State Farm Insurance
2025-10-17,John Stankey,AT&T,7,13,5,25,20.0,,John Stankey AT&T
2025-10-17,Michael Hutchins,Freddie Mac,2,21,2,25,8.0,,Michael Hutchins Freddie Mac
2025-10-17,Jim Rechtin,Humana,12,11,2,25,8.0,,Jim Rechtin Humana
2025-10-17,Ted Pick,Morgan Stanley,11,12,2,25,8.0,,Ted Pick Morgan Stanley
2025-10-17,Michael Fiddelke,Target Corporation,4,15,6,25,24.0,,Michael Fiddelke Target Corporation
2025-10-17,Philip Smith,StoneX Group,3,15,0,18,0.0,,Philip Smith StoneX Group
2025-10-17,Elon Musk,Tesla,5,11,9,25,36.0,,Elon Musk Tesla
2025-10-17,Michael Dell,Dell Technologies,10,14,1,25,4.0,,Michael Dell Dell Technologies
2025-10-17,Ramon Laguarta,PepsiCo,5,15,5,25,20.0,,Ramon Laguarta PepsiCo
2025-10-17,Bob Iger,Walt Disney,6,12,7,25,28.0,,Bob Iger Walt Disney
2025-10-17,Carol Tome,UPS,9,8,8,25,32.0,,Carol Tome UPS
2025-10-17,Joaquin Duato,Johnson & Johnson,7,14,4,25,16.0,,Joaquin Duato Johnson & Johnson
2025-10-17,Rajesh Subramaniam,FedEx,5,13,7,25,28.0,,Rajesh Subramaniam FedEx
2025-10-17,Juan Luciano,Archer Daniels Midland,3,6,16,25,64.0,,Juan Luciano Archer Daniels Midland
2025-10-17,Jon Moeller,Procter & Gamble,2,17,6,25,24.0,,Jon Moeller Procter & Gamble
2025-10-17,Marvin Ellison,Lowe's,9,13,3,25,12.0,,Marvin Ellison Lowe's
2025-10-17,Thomas Long,Energy Transfer,19,1,5,25,20.0,,Thomas Long Energy Transfer
2025-10-17,Christopher Calio,RTX,4,19,2,25,8.0,,Christopher Calio RTX
2025-10-17,Susan Morris,Albertsons,4,20,1,25,4.0,,Susan Morris Albertsons
2025-10-17,Kevin Hourican,Sysco,4,15,6,25,24.0,,Kevin Hourican Sysco
2025-10-17,Tricia Griffith,Progressive Insurance,10,12,3,25,12.0,,Tricia Griffith Progressive Insurance
2025-10-17,Stephen Squeri,American Express,6,18,1,25,4.0,,Stephen Squeri American Express
2025-10-17,James Taiclet,Lockheed Martin,8,9,8,25,32.0,,James Taiclet Lockheed Martin
2025-10-17,Michel Khalaf,MetLife,9,15,1,25,4.0,,Michel Khalaf MetLife
2025-10-17,Samuel Hazen,HCA Healthcare,8,15,2,25,8.0,,Samuel Hazen HCA Healthcare
2025-10-17,Andrew Sullivan,Prudential Financial,8,16,1,25,4.0,,Andrew Sullivan Prudential Financial
2025-10-17,Kelly Ortberg,Boeing,7,16,2,25,8.0,,Kelly Ortberg Boeing
2025-10-17,Joe Creed,Caterpillar,6,18,1,25,4.0,,Joe Creed Caterpillar
2025-10-17,Robert M Davis,Merck,2,19,4,25,16.0,,Robert M Davis Merck
2025-10-17,Thomas J Wilson,Allstate,5,14,6,25,24.0,,Thomas J Wilson Allstate
2025-10-17,Albert Bourla,Pfizer,7,10,8,25,32.0,,Albert Bourla Pfizer
2025-10-17,Arvind Krishna,IBM,9,12,4,25,16.0,,Arvind Krishna IBM
2025-10-17,Craig DeSanto,New York Life Insurance,4,21,0,25,0.0,,Craig DeSanto New York Life Insurance
2025-10-17,Ed Bastian,Delta Air Lines,10,12,3,25,12.0,,Ed Bastian Delta Air Lines
2025-10-17,Kevin Murphy,Publix Super Markets,13,35,2,50,4.0,,Kevin Murphy Publix Super Markets
2025-10-17,Kirt Walker,Nationwide Insurance,9,15,1,25,4.0,,Kirt Walker Nationwide Insurance
2025-10-17,Patrick Zammit,TD Synnex,9,15,1,25,4.0,,Patrick Zammit TD Synnex
2025-10-17,Scott Kirby,United Airlines,21,0,4,25,16.0,,Scott Kirby United Airlines
2025-10-17,Ryan Lance,ConocoPhillips,8,11,6,25,24.0,,Ryan Lance ConocoPhillips
2025-10-17,Ernie Herrman,TJX,12,12,1,25,4.0,,Ernie Herrman TJX
2025-10-17,Bob Michael,AbbVie,6,18,1,25,4.0,,Bob Michael AbbVie
2025-10-17,AJ Jim Teague,Enterprise Products Partners,10,15,0,25,0.0,,AJ Jim Teague Enterprise Products Partners
2025-10-17,Christopher Winfrey,Charter Communications,7,14,4,25,16.0,,Christopher Winfrey Charter Communications
2025-10-17,George Holm,Performance Food,8,15,2,25,8.0,,George Holm Performance Food
2025-10-17,Robert Isom,American Airlines,5,18,2,25,8.0,,Robert Isom American Airlines
2025-10-17,Richard Fairbank,Capital One,11,10,4,25,16.0,,Richard Fairbank Capital One
2025-10-17,Chuck Robbins,Cisco Systems,6,16,3,25,12.0,,Chuck Robbins Cisco Systems
2025-10-17,Enrique Lores,HP,4,16,5,25,20.0,,Enrique Lores HP
2025-10-17,Donnie King,Tyson Foods,1,16,8,25,32.0,,Donnie King Tyson Foods
2025-10-17,Lip-Bu Tan,Intel,6,9,10,25,40.0,,Lip-Bu Tan Intel
2025-10-17,Clay Magouyrk,Oracle,8,13,4,25,16.0,,Clay Magouyrk Oracle
2025-10-17,Mike Sicilia,Oracle,7,15,3,25,12.0,,Mike Sicilia Oracle
2025-10-17,Hock Tan,Broadcom,7,15,3,25,12.0,,Hock Tan Broadcom
2025-10-17,John May,Deere,5,14,6,25,24.0,,John May Deere
2025-10-17,Elliott Hill,Nike,7,17,1,25,4.0,,Elliott Hill Nike
2025-10-17,Timothy M Sweeney,Liberty Mutual Insurance,25,0,0,25,0.0,,Timothy M Sweeney Liberty Mutual Insurance
2025-10-17,Willie Chiang,Plains GP,4,8,1,13,7.7,,Willie Chiang Plains GP
2025-10-17,Juan Andrade,USAA,4,17,4,25,16.0,,Juan Andrade USAA
2025-10-17,Chris Boerner,Bristol-Myers Squibb,6,17,2,25,8.0,,Chris Boerner Bristol-Myers Squibb
2025-10-17,Paul Bay,Ingram Micro,5,17,3,25,12.0,,Paul Bay Ingram Micro
2025-10-17,Phebe Novakovic,General Dynamics,17,6,2,25,8.0,,Phebe Novakovic General Dynamics
2025-10-17,James Quincey,The Coca-Cola Company,8,16,1,25,4.0,,James Quincey The Coca-Cola Company
2025-10-17,Thasunda Brown Duckett,TIAA,12,12,1,25,4.0,,Thasunda Brown Duckett TIAA
2025-10-17,Alan Schnitzer,Travelers Insurance,8,14,3,25,12.0,,Alan Schnitzer Travelers Insurance
2025-10-17,David Ricks,Eli Lilly,5,11,9,25,36.0,,David Ricks Eli Lilly
2025-10-17,Dara Khosrowshahi,Uber,11,13,1,25,4.0,,Dara Khosrowshahi Uber
2025-10-17,Roger Crandall,Mass Mutual,5,16,4,25,16.0,,Roger Crandall Mass Mutual
2025-10-17,Marc Casper,Thermo Fisher Scientific,8,15,2,25,8.0,,Marc Casper Thermo Fisher Scientific
2025-10-17,Gunjan Kedia,US Bancorp,11,12,2,25,8.0,,Gunjan Kedia US Bancorp
2025-10-17,Michael Kasbar,World Kinect,1,10,0,11,0.0,,Michael Kasbar World Kinect
2025-10-17,Robert Ford,Abbott Laboratories,8,12,5,25,20.0,,Robert Ford Abbott Laboratories
2025-10-17,Corie Barry,Best Buy,24,1,0,25,0.0,,Corie Barry Best Buy
2025-10-17,Tim Gerend,Northwestern Mutual,3,20,2,25,8.0,,Tim Gerend Northwestern Mutual
2025-10-17,Kathy Warden,Northrop Grumman,10,14,1,25,4.0,,Kathy Warden Northrop Grumman
2025-10-17,Joe Zubretsky,Molina Healthcare,7,14,4,25,16.0,,Joe Zubretsky Molina Healthcare
2025-10-17,Todd Vasos,Dollar General,1,21,3,25,12.0,,Todd Vasos Dollar General
2025-10-17,Robin Vince,Bank of New York Mellon,9,14,2,25,8.0,,Robin Vince Bank of New York Mellon
2025-10-17,David Zaslav,Warner Bros Discovery,4,14,7,25,28.0,,David Zaslav Warner Bros Discovery
2025-10-17,Jay Debertin,CHS,5,18,2,25,8.0,,Jay Debertin CHS
2025-10-17,Ted Sarandos,Netflix,7,17,1,25,4.0,,Ted Sarandos Netflix
2025-10-17,Cristiano Amon,Qualcomm,7,16,2,25,8.0,,Cristiano Amon Qualcomm
2025-10-17,Vimal Kapur,Honeywell,9,15,1,25,4.0,,Vimal Kapur Honeywell
2025-10-17,Marc Benioff,Salesforce,5,12,8,25,32.0,,Marc Benioff Salesforce
2025-10-17,Jacek Olczak,Philip Morris International,8,16,1,25,4.0,,Jacek Olczak Philip Morris International
2025-10-17,David Flitman,US Foods,2,19,4,25,16.0,,David Flitman US Foods
2025-10-17,Paul Romanowski,DR Horton,6,14,5,25,20.0,,Paul Romanowski DR Horton
2025-10-17,Bryan DeBoer,Lithia Motors,5,18,2,25,8.0,,Bryan DeBoer Lithia Motors
2025-10-17,Dirk Van de Put,Mondelez,5,14,6,25,24.0,,Dirk Van de Put Mondelez
2025-10-17,Brian Niccol,Starbucks,1,16,8,25,32.0,,Brian Niccol Starbucks
2025-10-17,Ryan McInerney,Visa Inc,12,11,2,25,8.0,,Ryan McInerney Visa Inc
2025-10-17,Robert Sulentic,CBRE Group,6,18,1,25,4.0,,Robert Sulentic CBRE Group
2025-10-17,Jonathan Jaffe,Lennar,2,8,2,12,16.7,,Jonathan Jaffe Lennar
2025-10-17,Scott Strazik,GE Vernova,5,15,5,25,20.0,,Scott Strazik GE Vernova
2025-10-17,William Demchak,PNC Financial Services,6,16,3,25,12.0,,William Demchak PNC Financial Services
2025-10-17,Jennifer Rumsey,Cummins Inc,3,16,6,25,24.0,,Jennifer Rumsey Cummins Inc
2025-10-17,Preston Feight,Paccar,8,15,2,25,8.0,,Preston Feight Paccar
2025-10-17,Robert Bradway,Amgen,4,19,2,25,8.0,,Robert Bradway Amgen
2025-10-17,Matthew Lucey,PBF Energy,13,7,0,20,0.0,,Matthew Lucey PBF Energy
2025-10-17,Brian D Pieninck,GuideWell Mutual,0,6,0,6,0.0,,Brian D Pieninck GuideWell Mutual
2025-10-17,Alex Chriss,PayPal,6,17,2,25,8.0,,Alex Chriss PayPal
2025-10-17,Sandy Douglas,United Natural Foods,17,8,0,25,0.0,,Sandy Douglas United Natural Foods
2025-10-17,Michael Creedon,Dollar Tree,2,21,2,25,8.0,,Michael Creedon Dollar Tree
2025-10-17,Leon Topalian,Nucor,6,15,4,25,16.0,,Leon Topalian Nucor
2025-10-17,Roger Penske,Penske Automotive,11,12,2,25,8.0,,Roger Penske Penske Automotive
2025-10-17,Bom Kim,Coupang,5,19,1,25,4.0,,Bom Kim Coupang
2025-10-17,Antonio Neri,Hewlett Packard Enterprise,8,13,4,25,16.0,,Antonio Neri Hewlett Packard Enterprise
2025-10-17,Harry Sideris,Duke Energy,24,1,0,25,0.0,,Harry Sideris Duke Energy
2025-10-17,Joseph Bae,KKR & Co,15,9,1,25,4.0,,Joseph Bae KKR & Co
2025-10-17,Brian Robbins,Paramount Global,5,17,3,25,12.0,,Brian Robbins Paramount Global
2025-10-17,Michael Dastoor,Jabil,4,11,10,25,40.0,,Michael Dastoor Jabil
2025-10-17,Daniel O'Day,Gilead Sciences,10,13,2,25,8.0,,Daniel O'Day Gilead Sciences
2025-10-17,Tim Go,HF Sinclair,11,10,4,25,16.0,,Tim Go HF Sinclair
2025-10-17,William Nash,CarMax,8,11,6,25,24.0,,William Nash CarMax
2025-10-17,Michael Miebach,Mastercard,7,15,3,25,12.0,,Michael Miebach Mastercard
2025-10-17,Lawrence Coben,NRG Energy,8,8,2,18,11.1,,Lawrence Coben NRG Energy
2025-10-17,Sean Kerins,Arrow Electronics,5,18,2,25,8.0,,Sean Kerins Arrow Electronics
2025-10-17,Lorenzo Simonelli,Baker Hughes,11,12,2,25,8.0,,Lorenzo Simonelli Baker Hughes
2025-10-17,Bob Jordan,Southwest Airlines,1,18,6,25,24.0,,Bob Jordan Southwest Airlines
2025-10-17,Peter Zaffino,AIG,3,15,7,25,28.0,,Peter Zaffino AIG
2025-10-17,Gary Dickerson,Applied Materials,1,13,11,25,44.0,,Gary Dickerson Applied Materials
2025-10-17,Vicki Hollub,Occidental Petroleum,6,14,5,25,20.0,,Vicki Hollub Occidental Petroleum
2025-10-17,Michael Manley,AutoNation,5,19,1,25,4.0,,Michael Manley AutoNation
2025-10-17,Christopher Womack,Southern Company,10,13,2,25,8.0,,Christopher Womack Southern Company
2025-10-17,Christopher Swift,The Hartford,5,17,3,25,12.0,,Christopher Swift The Hartford
2025-10-17,Marc Rowan,Apollo Global Management,3,16,6,25,24.0,,Marc Rowan Apollo Global Management
2025-10-17,Rick Wurster,Charles Schwab,7,16,2,25,8.0,,Rick Wurster Charles Schwab
2025-10-17,Chris Kempczinski,McDonalds,9,10,6,25,24.0,,Chris Kempczinski McDonalds
2025-10-17,Carlos Abrams-Rivera,Kraft Heinz,7,14,4,25,16.0,,Carlos Abrams-Rivera Kraft Heinz
2025-10-17,Lisa Su,Advanced Micro Devices,0,0,0,0,0.0,,Lisa Su Advanced Micro Devices
2025-10-17,William H Rogers Jr,Truist Financial,5,12,2,19,10.5,,William H Rogers Jr Truist Financial
2025-10-17,Kathleen Quirk,Freeport-McMoRan,11,9,5,25,20.0,,Kathleen Quirk Freeport-McMoRan
2025-10-17,Sanjay Mehrotra,Micron Technology,7,13,5,25,20.0,,Sanjay Mehrotra Micron Technology
2025-10-17,Anthony Capuano,Marriott International,6,17,2,25,8.0,,Anthony Capuano Marriott International
2025-10-17,David Gitlin,Carrier Global,11,11,3,25,12.0,,David Gitlin Carrier Global
2025-10-17,John Ketchum,NextEra Energy,16,9,0,25,0.0,,John Ketchum NextEra Energy
2025-10-17,William M Brown,3M Company,4,19,2,25,8.0,,William M Brown 3M Company
2025-10-17,John Doyle,Marsh & McLennan,6,14,5,25,20.0,,John Doyle Marsh & McLennan
2025-10-17,Patricia Poppe,PG&E,9,11,5,25,20.0,,Patricia Poppe PG&E
2025-10-17,Jim Vena,Union Pacific,10,14,1,25,4.0,,Jim Vena Union Pacific
2025-10-17,Brian Doubles,Synchrony Financial,6,18,1,25,4.0,,Brian Doubles Synchrony Financial
2025-10-17,Rainer Blair,Danaher,9,14,2,25,8.0,,Rainer Blair Danaher
2025-10-17,Philip Gallagher,Avnet,2,22,1,25,4.0,,Philip Gallagher Avnet
2025-10-17,Glenn Fogel,Booking Holdings,8,12,5,25,20.0,,Glenn Fogel Booking Holdings
2025-10-17,Ezra Yacob,EOG Resources,14,10,1,25,4.0,,Ezra Yacob EOG Resources
2025-10-17,Earl Austin,Quanta Services,7,9,2,18,11.1,,Earl Austin Quanta Services
2025-10-17,Michael Shepherd,Discover Financial,6,17,2,25,8.0,,Michael Shepherd Discover Financial
2025-10-17,Joseph Dominguez,Constellation Energy,12,10,3,25,12.0,,Joseph Dominguez Constellation Energy
2025-10-17,William Stengel II,Genuine Parts,2,13,0,15,0.0,,William Stengel II Genuine Parts
2025-10-17,Christian Ulbrich,Jones Lang LaSalle,10,13,2,25,8.0,,Christian Ulbrich Jones Lang LaSalle
2025-10-17,Raymond E Scott,Lear Corporation,10,12,3,25,12.0,,Raymond E Scott Lear Corporation
2025-10-17,Michael Rapino,Live Nation Entertainment,6,15,4,25,16.0,,Michael Rapino Live Nation Entertainment
2025-10-17,Heidi Petz,Sherwin-Williams,5,13,7,25,28.0,,Heidi Petz Sherwin-Williams
2025-10-17,Calvin G Butler Jr,Exelon,5,7,1,13,7.7,,Calvin G Butler Jr Exelon
2025-10-17,Tony Spring,Macys,6,17,2,25,8.0,,Tony Spring Macys
2025-10-17,Jeff Miller,Halliburton,11,4,10,25,40.0,,Jeff Miller Halliburton
2025-10-17,Kevin Lobo,Stryker,8,13,4,25,16.0,,Kevin Lobo Stryker
2025-10-17,Tony Cheng,Reinsurance Group of America,1,16,2,19,10.5,,Tony Cheng Reinsurance Group of America
2025-10-17,Ronald P O'Hanley,State Street,4,18,3,25,12.0,,Ronald P O'Hanley State Street
2025-10-17,John Engel,WESCO International,8,16,1,25,4.0,,John Engel WESCO International
2025-10-17,Pierce Norton II,Oneok,13,10,2,25,8.0,,Pierce Norton II Oneok
2025-10-17,Shantanu Narayen,Adobe,12,12,1,25,4.0,,Shantanu Narayen Adobe
2025-10-17,Bill Westrate,American Family Insurance,8,14,3,25,12.0,,Bill Westrate American Family Insurance
2025-10-17,Chris Kubasik,L3Harris Technologies,10,15,0,25,0.0,,Chris Kubasik L3Harris Technologies
2025-10-17,James Conroy,Ross Stores,3,21,1,25,4.0,,James Conroy Ross Stores
2025-10-17,Christine Leahy,CDW,1,22,2,25,8.0,,Christine Leahy CDW
2025-10-17,Saumya Sutaria,Tenet Healthcare,3,8,1,12,8.3,,Saumya Sutaria Tenet Healthcare
2025-10-17,Bob Eddy,BJ's Wholesale Club,4,17,4,25,16.0,,Bob Eddy BJ's Wholesale Club
2025-10-17,Mike Lyons,Fiserv,2,22,1,25,4.0,,Mike Lyons Fiserv
2025-10-17,William Gifford,Altria,5,18,2,25,8.0,,William Gifford Altria
2025-10-17,Larry Fink,BlackRock,7,17,1,25,4.0,,Larry Fink BlackRock
2025-10-17,Thomas Polen,Becton Dickinson,9,13,3,25,12.0,,Thomas Polen Becton Dickinson
2025-10-17,Noel Wallace,Colgate-Palmolive,7,17,1,25,4.0,,Noel Wallace Colgate-Palmolive
2025-10-17,Michael Hsu,Kimberly-Clark,9,16,0,25,0.0,,Michael Hsu Kimberly-Clark
2025-10-17,Daryl Kenningham,Group 1 Automotive,3,19,3,25,12.0,,Daryl Kenningham Group 1 Automotive
2025-10-17,Jennifer Parmentier,Parker-Hannifin,2,17,0,19,0.0,,Jennifer Parmentier Parker-Hannifin
2025-10-17,Jeffrey Harmening,General Mills,7,13,5,25,20.0,,Jeffrey Harmening General Mills
2025-10-17,Ravi Kumar S,Cognizant Technology Solutions,7,14,4,25,16.0,,Ravi Kumar S Cognizant Technology Solutions
2025-10-17,William Fehrman,American Electric Power,4,15,0,19,0.0,,William Fehrman American Electric Power
2025-10-17,Peter Arduini,GE HealthCare Technologies,7,14,4,25,16.0,,Peter Arduini GE HealthCare Technologies
2025-10-17,Maria Black,Automatic Data Processing,11,14,0,25,0.0,,Maria Black Automatic Data Processing
2025-10-17,Lourenco Goncalves,Cleveland-Cliffs,5,12,8,25,32.0,,Lourenco Goncalves Cleveland-Cliffs
2025-10-17,Dan Amos,Aflac,3,15,7,25,28.0,,Dan Amos Aflac
2025-10-17,Mark Stewart,Goodyear Tire & Rubber,2,23,0,25,0.0,,Mark Stewart Goodyear Tire & Rubber
2025-10-17,Kevin Hogan,Corebridge Financial,8,14,2,24,8.3,,Kevin Hogan Corebridge Financial
2025-10-17,Thomas Palmer,Newmont,3,21,1,25,4.0,,Thomas Palmer Newmont
2025-10-17,Andrew Silvernail,International Paper,6,15,4,25,16.0,,Andrew Silvernail International Paper
2025-10-17,Philip Daniele III,AutoZone,4,17,4,25,16.0,,Philip Daniele III AutoZone
2025-10-17,Ellen Cooper,Lincoln National,5,19,1,25,4.0,,Ellen Cooper Lincoln National
2025-10-17,Ryan Marshall,PulteGroup,8,12,5,25,20.0,,Ryan Marshall PulteGroup
2025-10-17,James Cracchiolo,Ameriprise Financial,1,18,6,25,24.0,,James Cracchiolo Ameriprise Financial
2025-10-17,Andrew Clyde,Murphy USA,12,12,1,25,4.0,,Andrew Clyde Murphy USA
2025-10-17,Jonas Prising,ManpowerGroup,7,16,2,25,8.0,,Jonas Prising ManpowerGroup
2025-10-17,David Bozeman,CH Robinson Worldwide,2,21,2,25,8.0,,David Bozeman CH Robinson Worldwide
2025-10-17,Timothy Knavish,PPG Industries,0,10,1,11,9.1,,Timothy Knavish PPG Industries
2025-10-17,Pedro Pizarro,Edison International,2,4,19,25,76.0,,Pedro Pizarro Edison International
2025-10-17,Mark Millett,Steel Dynamics,22,3,0,25,0.0,,Mark Millett Steel Dynamics
2025-10-17,Benjamin Tisch,Loews,1,18,0,19,0.0,,Benjamin Tisch Loews
2025-10-17,Karsanbhai,Emerson Electric,2,21,2,25,8.0,,Karsanbhai Emerson Electric
2025-10-17,John Zillmer,Aramark,7,16,2,25,8.0,,John Zillmer Aramark
2025-10-17,William Hornbuckle,MGM Resorts International,11,11,3,25,12.0,,William Hornbuckle MGM Resorts International
2025-10-17,James Burke,Vistra,13,5,0,18,0.0,,James Burke Vistra
2025-10-17,David Hult,Asbury Automotive Group,3,22,0,25,0.0,,David Hult Asbury Automotive Group
2025-10-17,DG Macpherson,WW Grainger,5,11,2,18,11.1,,DG Macpherson WW Grainger
2025-10-17,Eric Slifka,Global Partners,4,16,5,25,20.0,,Eric Slifka Global Partners
2025-10-17,Bob Pragada,Jacobs Solutions,10,13,2,25,8.0,,Bob Pragada Jacobs Solutions
2025-10-17,Charles Magro,Corteva,1,9,2,12,16.7,,Charles Magro Corteva
2025-10-17,Rick Lanoha,Peter Kiewit Sons',0,5,0,5,0.0,,Rick Lanoha Peter Kiewit Sons'
2025-10-17,Michael Mahoney,Boston Scientific,6,17,2,25,8.0,,Michael Mahoney Boston Scientific
2025-10-17,Brad Beckham,O'Reilly Automotive,6,19,0,25,0.0,,Brad Beckham O'Reilly Automotive
2025-10-17,Thomas Bell,Leidos,6,17,2,25,8.0,,Thomas Bell Leidos
2025-10-17,Thomas Gayner,Markel Group,8,16,1,25,4.0,,Thomas Gayner Markel Group
2025-10-17,Marc Bitzer,Whirlpool,7,11,7,25,28.0,,Marc Bitzer Whirlpool
2025-10-17,Andrew McMahon,Guardian Life insurance,5,20,0,25,0.0,,Andrew McMahon Guardian Life insurance
2025-10-17,Peter Jackson,Builders FirstSource,4,17,1,22,4.5,,Peter Jackson Builders FirstSource
2025-10-17,Michael Rhodes,Ally Financial,7,16,2,25,8.0,,Michael Rhodes Ally Financial
2025-10-17,Matthew Meloy,Targa Resources,8,9,1,18,5.6,,Matthew Meloy Targa Resources
2025-10-17,James Breuer,Fluor,4,9,1,14,7.1,,James Breuer Fluor
2025-10-17,Sasan Goodarzi,Intuit,6,18,1,25,4.0,,Sasan Goodarzi Intuit
2025-10-17,Troy Rudd,AECOM,3,19,3,25,12.0,,Troy Rudd AECOM
2025-10-17,Penny Pennington,Edward Jones,7,12,6,25,24.0,,Penny Pennington Edward Jones
2025-10-17,Michael Bender,Kohl's,0,17,8,25,32.0,,Michael Bender Kohl's
2025-10-17,Beth Ford,Land O'Lakes,7,15,3,25,12.0,,Beth Ford Land O'Lakes
2025-10-17,Deanna Strable-Soethout,PrIncipal Financial,1,9,0,10,0.0,,Deanna Strable-Soethout PrIncipal Financial
2025-10-17,Robert Blue,Dominion Energy,21,3,1,25,4.0,,Robert Blue Dominion Energy
2025-10-17,Martin Schroeter,Kyndryl,9,15,1,25,4.0,,Martin Schroeter Kyndryl
2025-10-17,Jon Vander Ark,Republic Services,6,5,14,25,56.0,,Jon Vander Ark Republic Services
2025-10-17,Clay Gaspar,Devon Energy,22,2,1,25,4.0,,Clay Gaspar Devon Energy
2025-10-17,Christopher O'Herlihy,Illinois Tool Works,2,12,1,15,6.7,,Christopher O'Herlihy Illinois Tool Works
2025-10-17,Michael O'Grady,Northern Trust,18,7,0,25,0.0,,Michael O'Grady Northern Trust
2025-10-17,Jamie Whisnant,Auto-Owners Insurance,0,2,0,2,0.0,,Jamie Whisnant Auto-Owners Insurance
2025-10-17,Marc Miller,Universal Health Services,8,15,2,25,8.0,,Marc Miller Universal Health Services
2025-10-17,Darryl Button,Pacific Life,5,17,0,22,0.0,,Darryl Button Pacific Life
2025-10-17,Hamid Akhavan,EchoStar,6,13,6,25,24.0,,Hamid Akhavan EchoStar
2025-10-17,Christophe Beck,Ecolab,16,7,2,25,8.0,,Christophe Beck Ecolab
2025-10-17,Jack Fusco,Cheniere Energy,13,10,2,25,8.0,,Jack Fusco Cheniere Energy
2025-10-17,John Wren,Omnicom Group,7,13,5,25,20.0,,John Wren Omnicom Group
2025-10-17,Haviv Ilan,Texas Instruments,5,17,3,25,12.0,,Haviv Ilan Texas Instruments
2025-10-17,David Burritt,United States Steel,5,12,8,25,32.0,,David Burritt United States Steel
2025-10-17,Stéphane de La Faverie,Estée Lauder,10,10,5,25,20.0,,Stéphane de La Faverie Estée Lauder
2025-10-17,Raul Nicholas Vargas Ochoa,Farmers Insurance Exchange,0,0,0,0,0.0,,Raul Nicholas Vargas Ochoa Farmers Insurance Exchange
2025-10-17,Kirk Perry,Kenvue,4,17,4,25,16.0,,Kirk Perry Kenvue
2025-10-17,Ari Bousbib,IQVIA,8,16,1,25,4.0,,Ari Bousbib IQVIA
2025-10-17,Donald Allan,Stanley Black & Decker,6,16,3,25,12.0,,Donald Allan Stanley Black & Decker
2025-10-17,Timothy Cofer,Keurig Dr Pepper,4,10,1,15,6.7,,Timothy Cofer Keurig Dr Pepper
2025-10-17,Matthew Flannery,United Rentals,24,1,0,25,0.0,,Matthew Flannery United Rentals
2025-10-17,Timothy Cawley,Consolidated Edison,5,7,4,16,25.0,,Timothy Cawley Consolidated Edison
2025-10-17,Adam Norwitt,Amphenol,5,19,1,25,4.0,,Adam Norwitt Amphenol
2025-10-17,Brent Shafer,Baxter International,2,20,1,23,4.3,,Brent Shafer Baxter International
2025-10-17,Kimberly Dang,Kinder Morgan,14,1,1,16,6.2,,Kimberly Dang Kinder Morgan
2025-10-17,Erik Nordstrom,Nordstrom,7,16,2,25,8.0,,Erik Nordstrom Nordstrom
2025-10-17,Frank Holding,First Citizens BancShares,8,17,0,25,0.0,,Frank Holding First Citizens BancShares
2025-10-17,Paul Shoukry,Raymond James Financial,8,16,1,25,4.0,,Paul Shoukry Raymond James Financial
2025-10-17,Timothy Archer,Lam Research,6,14,5,25,20.0,,Timothy Archer Lam Research
2025-10-17,Harry Lawton III,Tractor Supply,3,5,2,10,20.0,,Harry Lawton III Tractor Supply
2025-10-17,Darren Rebelez,Caseys General Stores,9,14,2,25,8.0,,Darren Rebelez Caseys General Stores
2025-10-17,Scott Smith,Viatris,9,16,0,25,0.0,,Scott Smith Viatris
2025-10-17,James Blackledge,Mutual of Omaha,1,21,1,23,4.3,,James Blackledge Mutual of Omaha
2025-10-17,Anthony Guzzi,EMCOR Group,3,7,1,11,9.1,,Anthony Guzzi EMCOR Group
2025-10-17,Joseph Hinrichs,CSX,7,12,6,25,24.0,,Joseph Hinrichs CSX
2025-10-17,Justin Jude,LKQ,3,8,1,12,8.3,,Justin Jude LKQ
2025-10-17,Judith Marks,Otis Worldwide,3,9,2,14,14.3,,Judith Marks Otis Worldwide
2025-10-17,David Bruton Smith,Sonic Automotive,1,16,8,25,32.0,,David Bruton Smith Sonic Automotive
2025-10-17,Martina Cheung,S&P Global,6,19,0,25,0.0,,Martina Cheung S&P Global
2025-10-17,Leonard Schleifer,Regeneron Pharmaceuticals,5,15,5,25,20.0,,Leonard Schleifer Regeneron Pharmaceuticals
2025-10-17,Joseph Fadool,BorgWarner,2,15,0,17,0.0,,Joseph Fadool BorgWarner
2025-10-17,Karla Lewis,Reliance Inc,7,11,0,18,0.0,,Karla Lewis Reliance Inc
2025-10-17,John Barrett,Western & Southern Financial,5,20,0,25,0.0,,John Barrett Western & Southern Financial
2025-10-17,Scott Donnelly,Textron,7,15,3,25,12.0,,Scott Donnelly Textron
2025-10-17,Ariane Gorin,Expedia,6,16,3,25,12.0,,Ariane Gorin Expedia
2025-10-17,Michael Nolan,Fidelity National Financial,1,13,2,16,12.5,,Michael Nolan Fidelity National Financial
2025-10-17,Ernest Garcia III,Carvana,17,7,1,25,4.0,,Ernest Garcia III Carvana
2025-10-17,Raul Fernandez,DXC Technology,3,21,1,25,4.0,,Raul Fernandez DXC Technology
2025-10-17,Robert Berkley,WR Berkley,4,18,3,25,12.0,,Robert Berkley WR Berkley
2025-10-17,René Jones,M&T Bank,8,15,2,25,8.0,,René Jones M&T Bank
2025-10-17,Lauren Hobart,Dicks Sporting Goods,4,15,6,25,24.0,,Lauren Hobart Dicks Sporting Goods
2025-10-17,Robert Frenzel,Xcel Energy,11,10,4,25,16.0,,Robert Frenzel Xcel Energy
2025-10-17,Timothy Spence,Fifth Third Bancorp,8,11,6,25,24.0,,Timothy Spence Fifth Third Bancorp
2025-10-17,Stephen Schwarzman,Blackstone,4,16,5,25,20.0,,Stephen Schwarzman Blackstone
2025-10-17,Walker Martin,Sempra,2,2,0,4,0.0,,Walker Martin Sempra
