date,ceo,company,positive,neutral,negative,total,neg_pct,theme,alias
2025-10-27,Gerben W Bakker,Hubbell,1,4,0,5,0.0,,Gerben W Bakker Hubbell
2025-10-27,Dave Davis,Spirit Airlines,3,15,7,25,28.0,,Dave Davis Spirit Airlines
2025-10-27,Michael J Smith,Lamb Weston,1,14,10,25,40.0,,Michael J Smith Lamb Weston
2025-10-27,Strauss Zelnick,Take-Two Interactive Software,7,13,5,25,20.0,,Strauss Zelnick Take-Two Interactive Software
2025-10-27,John C Turner Jr,GMS,5,20,0,25,0.0,,John C Turner Jr GMS
2025-10-27,David M O'Malley,Penn Mutual Life Insurance,2,7,2,11,18.2,,David M O'Malley Penn Mutual Life Insurance
2025-10-27,Frank A Lonegro,Landstar System,4,7,1,12,8.3,,Frank A Lonegro Landstar System
2025-10-27,James F Risoleo,Host Hotels & Resorts,5,14,1,20,5.0,,James F Risoleo Host Hotels & Resorts
2025-10-27,Ken Xie,Fortinet,10,11,4,25,16.0,,Ken Xie Fortinet
2025-10-27,Doug Shulman,OneMain,2,7,0,9,0.0,,Doug Shulman OneMain
2025-10-27,Ryan Cohen,GameStop,10,11,4,25,16.0,,Ryan Cohen GameStop
2025-10-27,Mark W Begor,Equifax,4,20,1,25,4.0,,Mark W Begor Equifax
2025-10-27,Jay L Schottenstein,American Eagle Outfitters,9,12,4,25,16.0,,Jay L Schottenstein American Eagle Outfitters
2025-10-27,Curtis C Farmer,Comerica,6,10,0,16,0.0,,Curtis C Farmer Comerica
2025-10-27,Ole Rosgaard,Greif,5,17,3,25,12.0,,Ole Rosgaard Greif
2025-10-27,Brian E Lane,Comfort Systems USA,20,0,0,20,0.0,,Brian E Lane Comfort Systems USA
2025-10-27,Robert M Buck,TopBuild,1,8,0,9,0.0,,Robert M Buck TopBuild
2025-10-27,Ralph Andretta,Bread Financial,6,13,0,19,0.0,,Ralph Andretta Bread Financial
2025-10-27,Jim Anderson,Coherent,2,20,3,25,12.0,,Jim Anderson Coherent
2025-10-27,Walter C. D. Carlson,Telephone & Data Systems,2,10,3,15,20.0,,Walter C. D. Carlson Telephone & Data Systems
2025-10-27,Ronald Kruszewski,Stifel Financial,10,14,1,25,4.0,,Ronald Kruszewski Stifel Financial
2025-10-27,Richard Hayne,Urban Outfitters,7,15,3,25,12.0,,Richard Hayne Urban Outfitters
2025-10-27,Simon Meester,Terex,2,20,3,25,12.0,,Simon Meester Terex
2025-10-27,Edward J Lehner,Ryerson Holding,0,3,0,3,0.0,,Edward J Lehner Ryerson Holding
2025-10-27,Nicholas T Pinchuk,Snap-on,6,8,3,17,17.6,,Nicholas T Pinchuk Snap-on
2025-10-27,Ryals McMullian,Flowers Foods,3,20,2,25,8.0,,Ryals McMullian Flowers Foods
2025-10-27,D Bryan Jordan,First Horizon,9,13,3,25,12.0,,D Bryan Jordan First Horizon
2025-10-27,John B Gibson,Paychex,2,8,2,12,16.7,,John B Gibson Paychex
2025-10-27,Chris Cocks,Hasbro,10,9,6,25,24.0,,Chris Cocks Hasbro
2025-10-27,Pete McPartland,Sentry Insurance Group,6,13,0,19,0.0,,Pete McPartland Sentry Insurance Group
2025-10-27,Michael Arougheti,Ares Management,7,14,4,25,16.0,,Michael Arougheti Ares Management
2025-10-27,Alok Maskara,Lennox International,11,12,1,24,4.2,,Alok Maskara Lennox International
2025-10-27,James C Grech,Peabody Energy,3,1,2,6,33.3,,James C Grech Peabody Energy
2025-10-27,Joseph P Lacher Jr,Kemper Corporation,6,18,1,25,4.0,,Joseph P Lacher Jr Kemper Corporation
2025-10-27,Perry A Sook,Nexstar Media Group,4,17,4,25,16.0,,Perry A Sook Nexstar Media Group
2025-10-27,Wade Davis,TelevisaUnivision,5,19,1,25,4.0,,Wade Davis TelevisaUnivision
2025-10-27,Scott L Thompson,Tempur Sealy International,0,9,1,10,10.0,,Scott L Thompson Tempur Sealy International
2025-10-27,Mike Simonds,TriNet Group,5,11,0,16,0.0,,Mike Simonds TriNet Group
2025-10-27,B Andrew Rose,Worthington Enterprises,0,9,0,9,0.0,,B Andrew Rose Worthington Enterprises
2025-10-27,Bruce L Caswell,Maximus,5,10,0,15,0.0,,Bruce L Caswell Maximus
2025-10-27,Robert L Reffkin,Compass Group,3,7,1,11,9.1,,Robert L Reffkin Compass Group
2025-10-27,Mark Eubanks,Brinks Company,5,11,3,19,15.8,,Mark Eubanks Brinks Company
2025-10-27,Peter Quigley,Kelly Services Inc,9,16,0,25,0.0,,Peter Quigley Kelly Services Inc
2025-10-27,David L Yowan,Navient,1,5,1,7,14.3,,David L Yowan Navient
2025-10-27,Mary E Kipp,Puget Sound Energy,6,3,1,10,10.0,,Mary E Kipp Puget Sound Energy
2025-10-27,Adam Aron,AMC Entertainment,10,8,7,25,28.0,,Adam Aron AMC Entertainment
2025-10-27,Mark J Tarr,Encompass Health,2,6,2,10,20.0,,Mark J Tarr Encompass Health
2025-10-27,Liam K Griffin,Skyworks Solutions,1,7,2,10,20.0,,Liam K Griffin Skyworks Solutions
2025-10-27,Richard G Kyle,Timken,3,21,1,25,4.0,,Richard G Kyle Timken
2025-10-27,Ron Gusek,Liberty Energy,25,0,0,25,0.0,,Ron Gusek Liberty Energy
2025-10-27,John E Geller Jr,Marriott Vacations Worldwide,3,8,1,12,8.3,,John E Geller Jr Marriott Vacations Worldwide
2025-10-27,Karl G. Glassman,Leggett & Platt,0,5,1,6,16.7,,Karl G. Glassman Leggett & Platt
2025-10-27,Jonathan H Weis,Weis Markets,5,20,0,25,0.0,,Jonathan H Weis Weis Markets
2025-10-27,Jeffrey B Guldner,Pinnacle West Capital,3,3,1,7,14.3,,Jeffrey B Guldner Pinnacle West Capital
2025-10-27,Arkadiy Dobkin,EPAM Systems,8,16,1,25,4.0,,Arkadiy Dobkin EPAM Systems
2025-10-27,Paul M Rady,Antero Resources,5,15,0,20,0.0,,Paul M Rady Antero Resources
2025-10-27,Michael Spanos,Bloomin Brands,4,18,3,25,12.0,,Michael Spanos Bloomin Brands
2025-10-27,Nicole A Kivisto,MDU Resources Group,7,9,0,16,0.0,,Nicole A Kivisto MDU Resources Group
2025-10-27,Gerald L Morgan,Texas Roadhouse,4,8,7,19,36.8,,Gerald L Morgan Texas Roadhouse
2025-10-27,Gabriel Tirador,Mercury General,4,11,0,15,0.0,,Gabriel Tirador Mercury General
2025-10-27,Nicholas I Fink,Fortune Brands Innovations,1,23,1,25,4.0,,Nicholas I Fink Fortune Brands Innovations
2025-10-27,Paul E Burdiss,Zions Bancorp,1,7,0,8,0.0,,Paul E Burdiss Zions Bancorp
2025-10-27,William J Christensen,JELD-WEN Holding,1,14,1,16,6.2,,William J Christensen JELD-WEN Holding
2025-10-27,Evan Spiegel,Snap Inc,7,13,5,25,20.0,,Evan Spiegel Snap Inc
2025-10-27,Bill Burns,Zebra Technologies,4,20,1,25,4.0,,Bill Burns Zebra Technologies
2025-10-27,Steven Sell,Agilon Health,4,10,6,20,30.0,,Steven Sell Agilon Health
2025-10-27,Richard M Olson,Toro Company,2,19,4,25,16.0,,Richard M Olson Toro Company
2025-10-27,Eric S Yuan,Zoom Video Communications,8,15,2,25,8.0,,Eric S Yuan Zoom Video Communications
2025-10-27,Dan L Batrack,Tetra Tech,4,4,3,11,27.3,,Dan L Batrack Tetra Tech
2025-10-27,Joseph D Russell Jr,Public Storage,0,7,1,8,12.5,,Joseph D Russell Jr Public Storage
2025-10-27,Jacob Thaysen,Illumina Inc,7,17,1,25,4.0,,Jacob Thaysen Illumina Inc
2025-10-27,Debra A Cafaro,Ventas Inc,13,11,1,25,4.0,,Debra A Cafaro Ventas Inc
2025-10-27,Pierre R Brondeau,FMC Corporation,3,5,2,10,20.0,,Pierre R Brondeau FMC Corporation
2025-10-27,Judy R McReynolds,ArcBest,8,16,1,25,4.0,,Judy R McReynolds ArcBest
2025-10-27,Russell J Weiner,Dominos Pizza Inc,12,9,4,25,16.0,,Russell J Weiner Dominos Pizza Inc
2025-10-27,Theodore S Hanson,ASGN,3,5,1,9,11.1,,Theodore S Hanson ASGN
2025-10-27,RJ Scaringe,Rivian Automotive,2,11,12,25,48.0,,RJ Scaringe Rivian Automotive
2025-10-27,Jeffrey N Simmons,Elanco Animal Health,9,12,4,25,16.0,,Jeffrey N Simmons Elanco Animal Health
2025-10-27,Tim O Shaughnessy,Graham Holdings Company,3,20,1,24,4.2,,Tim O Shaughnessy Graham Holdings Company
2025-10-27,Thomas V Taylor,Floor & Decor,1,3,2,6,33.3,,Thomas V Taylor Floor & Decor
2025-10-27,Neil A Schrimsher,Applied Industrial Technologies,4,10,0,14,0.0,,Neil A Schrimsher Applied Industrial Technologies
2025-10-27,Robert E Price,PriceSmart,5,6,1,12,8.3,,Robert E Price PriceSmart
2025-10-27,John David Risher,Lyft,9,13,3,25,12.0,,John David Risher Lyft
2025-10-27,Gary B Smith,Ciena,7,18,0,25,0.0,,Gary B Smith Ciena
2025-10-27,Joey Levin,IAC,7,17,1,25,4.0,,Joey Levin IAC
2025-10-27,Jim Jacobs,Country Financial,9,13,3,25,12.0,,Jim Jacobs Country Financial
2025-10-27,Devin B McGranahan,Western Union,6,14,1,21,4.8,,Devin B McGranahan Western Union
2025-10-27,R Scott Rowe,Flowserve,6,2,2,10,20.0,,R Scott Rowe Flowserve
2025-10-27,Kenneth A Vecchione,Western Alliance Bancorp,11,6,8,25,32.0,,Kenneth A Vecchione Western Alliance Bancorp
2025-10-27,John C Rademacher,Option Care Health,15,3,0,18,0.0,,John C Rademacher Option Care Health
2025-10-27,Doug Black,SiteOne Landscape Supply,3,21,1,25,4.0,,Doug Black SiteOne Landscape Supply
2025-10-27,Oliver G Brewer III,Topgolf Callaway Brands,1,2,0,3,0.0,,Oliver G Brewer III Topgolf Callaway Brands
2025-10-27,Glenn Sanford,eXp World,7,17,1,25,4.0,,Glenn Sanford eXp World
2025-10-27,Fran Horowitz,Abercrombie & Fitch,11,11,3,25,12.0,,Fran Horowitz Abercrombie & Fitch
2025-10-27,Kevin Akers,Atmos Energy,8,1,2,11,18.2,,Kevin Akers Atmos Energy
2025-10-27,Alessandro Maselli,Catalent,5,19,1,25,4.0,,Alessandro Maselli Catalent
2025-10-27,J Powell Brown,Brown & Brown,7,14,4,25,16.0,,J Powell Brown Brown & Brown
2025-10-27,Aman Bhutani,GoDaddy,6,18,1,25,4.0,,Aman Bhutani GoDaddy
2025-10-27,John C. Griffith,American Water Works,0,8,2,10,20.0,,John C. Griffith American Water Works
2025-10-27,John J Marchioni,Selective Insurance Group,5,14,2,21,9.5,,John J Marchioni Selective Insurance Group
2025-10-27,Lawson E Whiting,Brown-Forman,5,16,4,25,16.0,,Lawson E Whiting Brown-Forman
2025-10-27,Dave Peacock,Advantage Solutions,21,2,2,25,8.0,,Dave Peacock Advantage Solutions
2025-10-27,Mick Farrell,ResMed,13,12,0,25,0.0,,Mick Farrell ResMed
2025-10-27,Kamal Hathi,Splunk,7,9,0,16,0.0,,Kamal Hathi Splunk
2025-10-27,Todd Kelsey,Plexus Corp,3,6,0,9,0.0,,Todd Kelsey Plexus Corp
2025-10-27,Phillip D Yeager,Hub Group,3,9,0,12,0.0,,Phillip D Yeager Hub Group
2025-10-27,Steven B Hedlund,Lincoln Electric,5,16,0,21,0.0,,Steven B Hedlund Lincoln Electric
2025-10-27,Timothy C Oliver,NCR Atleos,3,3,0,6,0.0,,Timothy C Oliver NCR Atleos
2025-10-27,Bruce Fleming,Calumet Inc,2,4,2,8,25.0,,Bruce Fleming Calumet Inc
2025-10-27,Daniel S. Peyovich,Dycom Industries,0,4,0,4,0.0,,Daniel S. Peyovich Dycom Industries
2025-10-27,Avner M Applbaum,Valmont Industries,1,9,0,10,0.0,,Avner M Applbaum Valmont Industries
2025-10-27,Kimberly A Fields,ATI Inc,7,18,0,25,0.0,,Kimberly A Fields ATI Inc
2025-10-27,Khozema Z Shipchandler,Twilio,1,7,2,10,20.0,,Khozema Z Shipchandler Twilio
2025-10-27,Gary C Bhojwani,CNO Financial Group,2,10,0,12,0.0,,Gary C Bhojwani CNO Financial Group
2025-10-27,William Andrew Hendricks Jr,Patterson-UTI Energy,3,0,1,4,25.0,,William Andrew Hendricks Jr Patterson-UTI Energy
2025-10-27,Kevin D Hochman,Brinker International,8,16,1,25,4.0,,Kevin D Hochman Brinker International
2025-10-27,James C Foster,Charles River Laboratories International,4,20,1,25,4.0,,James C Foster Charles River Laboratories International
2025-10-27,Rajiv K Prasad,Hyster-Yale,1,7,0,8,0.0,,Rajiv K Prasad Hyster-Yale
2025-10-27,Eric T Steigerwalt,Brighthouse Financial,1,15,2,18,11.1,,Eric T Steigerwalt Brighthouse Financial
2025-10-27,Thomas L Ryan,Service Corp International,8,14,1,23,4.3,,Thomas L Ryan Service Corp International
2025-10-27,Charles M Nifong Jr,CrossAmerica Partners,0,1,0,1,0.0,,Charles M Nifong Jr CrossAmerica Partners
2025-10-27,Anirudh Devgan,Cadence,7,16,2,25,8.0,,Anirudh Devgan Cadence
2025-10-27,Andi Owen,MillerKnoll,9,10,6,25,24.0,,Andi Owen MillerKnoll
2025-10-27,Sumit Roy,Realty Income,12,10,3,25,12.0,,Sumit Roy Realty Income
2025-10-27,Timothy John Fitzgerald,Middleby,0,0,0,0,0.0,,Timothy John Fitzgerald Middleby
2025-10-27,Robert H Schottenstein,M/I Homes,5,10,2,17,11.8,,Robert H Schottenstein M/I Homes
2025-10-27,Stephen P MacMillan,Hologic,6,6,0,12,0.0,,Stephen P MacMillan Hologic
2025-10-27,Lisa M Barton,Alliant Energy,5,1,0,6,0.0,,Lisa M Barton Alliant Energy
2025-10-27,Aaron P Jagdfeld,Generac,3,9,2,14,14.3,,Aaron P Jagdfeld Generac
2025-10-27,Erik Gershwind,MSC Industrial Direct,2,22,1,25,4.0,,Erik Gershwind MSC Industrial Direct
2025-10-27,Varun Krishna,Rocket Companies,5,18,2,25,8.0,,Varun Krishna Rocket Companies
2025-10-27,Fahmi Karam,Upbound Group,4,4,0,8,0.0,,Fahmi Karam Upbound Group
2025-10-27,NADominic Ng,East West Bancorp,0,0,0,0,0.0,,NADominic Ng East West Bancorp
2025-10-27,Mark Wang,Hilton Grand Vacations,25,0,0,25,0.0,,Mark Wang Hilton Grand Vacations
2025-10-27,Robert J Sheedy Jr,Grocery Outlet Holding,0,1,0,1,0.0,,Robert J Sheedy Jr Grocery Outlet Holding
2025-10-27,Simon D Campion,Dentsply Sirona,0,11,1,12,8.3,,Simon D Campion Dentsply Sirona
2025-10-27,Jeremy Wensinger,V2X,14,11,0,25,0.0,,Jeremy Wensinger V2X
2025-10-27,Andrew Rees,Crocs,7,11,7,25,28.0,,Andrew Rees Crocs
2025-10-27,David M Maura,Spectrum Brands,8,5,1,14,7.1,,David M Maura Spectrum Brands
2025-10-27,Sachin S Lawande,Visteon,9,15,1,25,4.0,,Sachin S Lawande Visteon
2025-10-27,Neil M Ashe,Acuity Inc,1,9,0,10,0.0,,Neil M Ashe Acuity Inc
2025-10-27,Lorie L Tekorius,The Greenbrier Companies,1,6,3,10,30.0,,Lorie L Tekorius The Greenbrier Companies
2025-10-27,John R Ciulla,Webster Financial,5,17,1,23,4.3,,John R Ciulla Webster Financial
2025-10-27,Sean D Keohane,Cabot Corporation,4,7,1,12,8.3,,Sean D Keohane Cabot Corporation
2025-10-27,Drew M Wilkerson,RXO Inc,1,7,2,10,20.0,,Drew M Wilkerson RXO Inc
2025-10-27,Daniel E Brown,Chord Energy,1,0,0,1,0.0,,Daniel E Brown Chord Energy
2025-10-27,Javier D Ferrer Fernandez,Popular Inc,3,3,2,8,25.0,,Javier D Ferrer Fernandez Popular Inc
2025-10-27,Olivier Rabiller,Garrett Motion Inc,2,13,0,15,0.0,,Olivier Rabiller Garrett Motion Inc
2025-10-27,Ronald N Tutor,Tutor Perini Corporation,3,15,2,20,10.0,,Ronald N Tutor Tutor Perini Corporation
2025-10-27,Jeff Liaw,Copart,8,11,2,21,9.5,,Jeff Liaw Copart
2025-10-27,Aman Narang,Toast Inc,7,15,3,25,12.0,,Aman Narang Toast Inc
2025-10-27,Joseph M Hogan,Align Technology,7,13,5,25,20.0,,Joseph M Hogan Align Technology
2025-10-27,Kevin J Wheeler,A O Smith,2,23,0,25,0.0,,Kevin J Wheeler A O Smith
2025-10-27,Christopher A Cartwright,TransUnion,9,13,3,25,12.0,,Christopher A Cartwright TransUnion
2025-10-27,James Kelly,NCR Voyix,1,11,0,12,0.0,,James Kelly NCR Voyix
2025-10-27,Tom Leighton,Akamai Technologies,14,9,2,25,8.0,,Tom Leighton Akamai Technologies
2025-10-27,Robert G Painter,Trimble Inc,15,4,1,20,5.0,,Robert G Painter Trimble Inc
2025-10-27,Tony Helton,Medical Mutual of Ohio,3,5,1,9,11.1,,Tony Helton Medical Mutual of Ohio
2025-10-27,Caroline S Grace,AMN Healthcare Services,0,0,0,0,0.0,,Caroline S Grace AMN Healthcare Services
2025-10-27,Patrick Kaltenbach,Mettler-Toledo International,2,5,0,7,0.0,,Patrick Kaltenbach Mettler-Toledo International
2025-10-27,Michael L Baur,ScanSource,1,3,1,5,20.0,,Michael L Baur ScanSource
2025-10-27,Jason Lippert,LCI Industries,7,17,1,25,4.0,,Jason Lippert LCI Industries
2025-10-27,Fredric J Tomczyk,Cboe Global Markets,0,12,3,15,20.0,,Fredric J Tomczyk Cboe Global Markets
2025-10-27,Octavio Marquez,Diebold Nixdorf,7,12,1,20,5.0,,Octavio Marquez Diebold Nixdorf
2025-10-27,Sivasankaran Somasundaram,ChampionX,6,3,1,10,10.0,,Sivasankaran Somasundaram ChampionX
2025-10-27,Ronald F Clarke,Corpay,3,4,1,8,12.5,,Ronald F Clarke Corpay
2025-10-27,Robert W Pittman,iHeartMedia,8,15,1,24,4.2,,Robert W Pittman iHeartMedia
2025-10-27,Patrick Zalupski,Dream Finders Homes,14,9,2,25,8.0,,Patrick Zalupski Dream Finders Homes
2025-10-27,Keith E Smith,Boyd Gaming,3,19,1,23,4.3,,Keith E Smith Boyd Gaming
2025-10-27,Mehran Assadi,NLV Financial,0,1,0,1,0.0,,Mehran Assadi NLV Financial
2025-10-27,Barry R Port,Ensign Group,4,8,2,14,14.3,,Barry R Port Ensign Group
2025-10-27,Denise A Paulonis,Sally Beauty,16,4,0,20,0.0,,Denise A Paulonis Sally Beauty
2025-10-27,Clifford A Skelton,Conduent,1,5,1,7,14.3,,Clifford A Skelton Conduent
2025-10-27,Jean-Michel Ribieras,Sylvamo,1,7,0,8,0.0,,Jean-Michel Ribieras Sylvamo
2025-10-27,Douglas F Bauer,Tri Pointe Homes,0,9,0,9,0.0,,Douglas F Bauer Tri Pointe Homes
2025-10-27,Shawn O'Connell,EnerSys,4,4,1,9,11.1,,Shawn O'Connell EnerSys
2025-10-27,Bill Meury,Incyte,5,17,0,22,0.0,,Bill Meury Incyte
2025-10-27,Dale Francescon,Century Communities,1,23,1,25,4.0,,Dale Francescon Century Communities
2025-10-27,Michael Nierenberg,Rithm Capital,9,12,4,25,16.0,,Michael Nierenberg Rithm Capital
2025-10-27,Michael J Brown,Euronet Worldwide,4,5,2,11,18.2,,Michael J Brown Euronet Worldwide
2025-10-27,Scott Seu,Hawaiian Electric Industries,6,15,4,25,16.0,,Scott Seu Hawaiian Electric Industries
2025-10-27,Jason D Robins,DraftKings,4,12,9,25,36.0,,Jason D Robins DraftKings
2025-10-27,Jonathan J Mazelsky,IDEXX Laboratories,1,3,3,7,42.9,,Jonathan J Mazelsky IDEXX Laboratories
2025-10-27,Richard S Swartz,MYR Group,1,0,0,1,0.0,,Richard S Swartz MYR Group
2025-10-27,Stefano Caroti,Deckers Outdoor,13,11,1,25,4.0,,Stefano Caroti Deckers Outdoor
2025-10-27,Kevin R Sayer,DexCom,4,8,8,20,40.0,,Kevin R Sayer DexCom
2025-10-27,John T C Lee,MKS Instruments,8,17,0,25,0.0,,John T C Lee MKS Instruments
2025-10-27,Edward B Pitoniak,VICI Properties,2,8,1,11,9.1,,Edward B Pitoniak VICI Properties
2025-10-27,Albert White III,Cooper Cos,6,8,3,17,17.6,,Albert White III Cooper Cos
2025-10-27,Barry L Biffle,Frontier Airlines,3,15,7,25,28.0,,Barry L Biffle Frontier Airlines
2025-10-27,Robert A Bruggeworth,Qorvo,2,7,2,11,18.2,,Robert A Bruggeworth Qorvo
2025-10-27,Winnie Park,Five Below,7,17,1,25,4.0,,Winnie Park Five Below
2025-10-27,Steven Oakland,TreeHouse Foods,5,19,1,25,4.0,,Steven Oakland TreeHouse Foods
2025-10-27,James S Hagedorn,Scotts Miracle-Gro,2,6,1,9,11.1,,James S Hagedorn Scotts Miracle-Gro
2025-10-27,Michael Cannon-Brookes,Atlassian,10,12,3,25,12.0,,Michael Cannon-Brookes Atlassian
2025-10-27,Bertrand Loy,Entegris,8,13,4,25,16.0,,Bertrand Loy Entegris
2025-10-27,William E Waltz,Atkore,2,4,0,6,0.0,,William E Waltz Atkore
2025-10-27,Celeste B Mastin,HB Fuller,0,9,0,9,0.0,,Celeste B Mastin HB Fuller
2025-10-27,Kyle T Larkin,Granite Construction,1,12,0,13,0.0,,Kyle T Larkin Granite Construction
2025-10-27,Michael J Happe,Winnebago Industries,3,5,2,10,20.0,,Michael J Happe Winnebago Industries
2025-10-27,Steven H Gunby,FTI Consulting,7,15,0,22,0.0,,Steven H Gunby FTI Consulting
2025-10-27,Stephan B Tanda,AptarGroup,4,16,4,24,16.7,,Stephan B Tanda AptarGroup
2025-10-27,Timothy P Boyle,Columbia Sportswear,4,6,3,13,23.1,,Timothy P Boyle Columbia Sportswear
2025-10-27,Anthony J Wood,Roku,10,8,7,25,28.0,,Anthony J Wood Roku
2025-10-27,M Christopher Doyle,Civitas Resources,2,3,2,7,28.6,,M Christopher Doyle Civitas Resources
2025-10-27,Andy Eidson,Alpha Metallurgical Resources,3,8,4,15,26.7,,Andy Eidson Alpha Metallurgical Resources
2025-10-27,Andy L Nemeth,Patrick Industries,5,5,0,10,0.0,,Andy L Nemeth Patrick Industries
2025-10-27,Roger W Jenkins,Murphy Oil,6,15,4,25,16.0,,Roger W Jenkins Murphy Oil
2025-10-27,Kevin S Blair,Synovus Financial,4,8,0,12,0.0,,Kevin S Blair Synovus Financial
2025-10-27,Julie Felss Masino,Cracker Barrel Old Country Store,3,9,13,25,52.0,,Julie Felss Masino Cracker Barrel Old Country Store
2025-10-27,David M Overton,Cheesecake Factory,6,18,1,25,4.0,,David M Overton Cheesecake Factory
2025-10-27,Nick DeIuliis,CNX Resources,11,11,3,25,12.0,,Nick DeIuliis CNX Resources
2025-10-27,Christopher Pappas,Chefs Warehouse,4,15,2,21,9.5,,Christopher Pappas Chefs Warehouse
2025-10-27,Tod Carpenter,Donaldson Company,5,8,4,17,23.5,,Tod Carpenter Donaldson Company
2025-10-27,Gregory L Christopher,Mueller Industries,4,7,1,12,8.3,,Gregory L Christopher Mueller Industries
2025-10-27,Rob Saltiel,MRC Global,5,13,1,19,5.3,,Rob Saltiel MRC Global
2025-10-27,Jillian C Evanko,Chart Industries,3,8,0,11,0.0,,Jillian C Evanko Chart Industries
2025-10-27,Dave Guilmette,Alight Solutions,1,13,0,14,0.0,,Dave Guilmette Alight Solutions
2025-10-27,Joel Smejkal,Vishay Intertechnology,2,9,2,13,15.4,,Joel Smejkal Vishay Intertechnology
2025-10-27,Dennis Degner,Range Resources,4,7,0,11,0.0,,Dennis Degner Range Resources
2025-10-27,Ira D Robbins,Valley National Bancorp,4,8,2,14,14.3,,Ira D Robbins Valley National Bancorp
2025-10-27,Bernard Kim,Match Group,6,13,6,25,24.0,,Bernard Kim Match Group
2025-10-27,Vincent Pilette,Gen Digital,3,10,0,13,0.0,,Vincent Pilette Gen Digital
2025-10-27,Timothy S Crane,Wintrust Financial,0,7,0,7,0.0,,Timothy S Crane Wintrust Financial
2025-10-27,Pat Roche,Moog Inc,6,11,4,21,19.0,,Pat Roche Moog Inc
2025-10-27,Mark R Widmar,First Solar,8,13,4,25,16.0,,Mark R Widmar First Solar
2025-10-27,Niko Lahanas,Central Garden & Pet,2,9,0,11,0.0,,Niko Lahanas Central Garden & Pet
2025-10-27,Chris Osowski,Green Plains Inc,6,11,3,20,15.0,,Chris Osowski Green Plains Inc
2025-10-27,Derek J Leathers,Werner Enterprises,2,8,2,12,16.7,,Derek J Leathers Werner Enterprises
2025-10-27,Adam Foroughi,AppLovin,5,18,2,25,8.0,,Adam Foroughi AppLovin
2025-10-27,Luca Savi,ITT,1,12,0,13,0.0,,Luca Savi ITT
2025-10-27,Lawrence H Silber,Herc Rentals,2,2,0,4,0.0,,Lawrence H Silber Herc Rentals
2025-10-27,Hilton H Howell Jr,Gray Television,6,18,1,25,4.0,,Hilton H Howell Jr Gray Television
2025-10-27,Eric D Ashleman,IDEX,1,11,1,13,7.7,,Eric D Ashleman IDEX
2025-10-27,Owen D Thomas,Boston Properties,6,18,1,25,4.0,,Owen D Thomas Boston Properties
2025-10-27,Kurt Wolf,Pitney Bowes,7,18,0,25,0.0,,Kurt Wolf Pitney Bowes
2025-10-27,Sara E Armbruster,Steelcase,12,3,0,15,0.0,,Sara E Armbruster Steelcase
2025-10-27,Charles D. Young,Sun Communities,8,8,1,17,5.9,,Charles D. Young Sun Communities
2025-10-27,Suzanne Foster,AdaptHealth,5,17,2,24,8.3,,Suzanne Foster AdaptHealth
2025-10-27,Grant E Sims,Genesis Energy,6,2,0,8,0.0,,Grant E Sims Genesis Energy
2025-10-27,Laura Prieskorn,Jackson Financial,6,13,4,23,17.4,,Laura Prieskorn Jackson Financial
2025-10-27,Rick L Wessel,FirstCash,2,7,2,11,18.2,,Rick L Wessel FirstCash
2025-10-27,Sherman Miller,Cal-Maine Foods,8,16,1,25,4.0,,Sherman Miller Cal-Maine Foods
2025-10-27,Paul A Lang,Arch Resources,17,6,2,25,8.0,,Paul A Lang Arch Resources
2025-10-27,Ashish K Khandpur,Avient,2,7,1,10,10.0,,Ashish K Khandpur Avient
2025-10-27,Shyam K Reddy,BlueLinx,2,6,0,8,0.0,,Shyam K Reddy BlueLinx
2025-10-27,Christopher S Ripley,Sinclair,5,14,6,25,24.0,,Christopher S Ripley Sinclair
2025-10-27,Stacy Kymes,BOK Financial,13,10,2,25,8.0,,Stacy Kymes BOK Financial
2025-10-27,James H Walter,Permian Resources,0,4,0,4,0.0,,James H Walter Permian Resources
2025-10-27,Jason Murray,PACS Group,7,14,4,25,16.0,,Jason Murray PACS Group
2025-10-27,Brian Armstrong,Coinbase Global,4,18,3,25,12.0,,Brian Armstrong Coinbase Global
2025-10-27,Oscar K Brown,Western Midstream Partners,4,5,0,9,0.0,,Oscar K Brown Western Midstream Partners
2025-10-27,Nicholas R Lower,Federated Mutual Insurance,1,1,3,5,60.0,,Nicholas R Lower Federated Mutual Insurance
2025-10-27,Morris Goldfarb,G-III Apparel Group,7,13,5,25,20.0,,Morris Goldfarb G-III Apparel Group
2025-10-27,Mark D Morelli,Vontier,1,4,0,5,0.0,,Mark D Morelli Vontier
2025-10-27,Matthew J Cox,Matson Inc,5,10,0,15,0.0,,Matthew J Cox Matson Inc
2025-10-27,David W Grzebinski,Kirby Corporation,3,7,2,12,16.7,,David W Grzebinski Kirby Corporation
2025-10-27,Keith A Harvey,Kaiser Aluminum,4,12,3,19,15.8,,Keith A Harvey Kaiser Aluminum
2025-10-27,Eric Nyman,Vista Outdoor,2,13,1,16,6.2,,Eric Nyman Vista Outdoor
2025-10-27,Doug Howe,Designer Brands,7,18,0,25,0.0,,Doug Howe Designer Brands
2025-10-27,Jerry E Gahlhoff Jr,Rollins Inc,2,3,1,6,16.7,,Jerry E Gahlhoff Jr Rollins Inc
2025-10-27,D Scott Barbour,Advanced Drainage Systems,5,6,2,13,15.4,,D Scott Barbour Advanced Drainage Systems
2025-10-27,Sean Gamble,Cinemark,11,7,7,25,28.0,,Sean Gamble Cinemark
2025-10-27,George Kurtz,CrowdStrike,8,12,5,25,20.0,,George Kurtz CrowdStrike
2025-10-27,Bill Ready,Pinterest,14,10,1,25,4.0,,Bill Ready Pinterest
2025-10-27,Fidji Simo,Instacart,6,19,0,25,0.0,,Fidji Simo Instacart
2025-10-27,Kimberly K Ryan,Hillenbrand,1,10,0,11,0.0,,Kimberly K Ryan Hillenbrand
2025-10-27,David S Graziosi,Allison Transmission,0,25,0,25,0.0,,David S Graziosi Allison Transmission
2025-10-27,Gary G Friedman,Restoration Hardware,5,14,6,25,24.0,,Gary G Friedman Restoration Hardware
2025-10-27,Lucinda M Baier,Brookdale Senior Living,4,9,3,16,18.8,,Lucinda M Baier Brookdale Senior Living
2025-10-27,Brian J Blaser,QuidelOrtho,0,7,1,8,12.5,,Brian J Blaser QuidelOrtho
2025-10-27,E Jean Savage,Trinity Industries,3,13,9,25,36.0,,E Jean Savage Trinity Industries
2025-10-27,Liam J Kelly,Teleflex,2,2,2,6,33.3,,Liam J Kelly Teleflex
2025-10-27,Laurans A Mendelson,HEICO,4,18,3,25,12.0,,Laurans A Mendelson HEICO
2025-10-27,Frank H Laukien,Bruker,0,9,0,9,0.0,,Frank H Laukien Bruker
2025-10-27,Harvey M Schwartz,Carlyle Group,7,14,4,25,16.0,,Harvey M Schwartz Carlyle Group
2025-10-27,Mark S LaVigne,Energizer Holdings,7,3,0,10,0.0,,Mark S LaVigne Energizer Holdings
2025-10-27,Amar Maletira,Rackspace Technology,4,17,4,25,16.0,,Amar Maletira Rackspace Technology
2025-10-27,Udit Batra,Waters Corporation,7,13,5,25,20.0,,Udit Batra Waters Corporation
2025-10-27,Eric M Green,West Pharmaceutical Services,10,15,0,25,0.0,,Eric M Green West Pharmaceutical Services
2025-10-27,Doug Palladini,Carters Inc,0,8,1,9,11.1,,Doug Palladini Carters Inc
2025-10-27,G Mike Mikan,NeueHealth,3,6,1,10,10.0,,G Mike Mikan NeueHealth
2025-10-27,Russell Chip Childs,SkyWest,0,8,0,8,0.0,,Russell Chip Childs SkyWest
2025-10-27,Christopher H Hunter,Acadia Healthcare,1,3,1,5,20.0,,Christopher H Hunter Acadia Healthcare
2025-10-27,Prahlad Singh,Revvity,4,9,1,14,7.1,,Prahlad Singh Revvity
2025-10-27,Maria M Pope,Portland General Electric,8,14,3,25,12.0,,Maria M Pope Portland General Electric
2025-10-27,Charles Chip Blankenship,Woodward Inc,2,10,0,12,0.0,,Charles Chip Blankenship Woodward Inc
2025-10-27,Mike Steib,TEGNA,11,12,2,25,8.0,,Mike Steib TEGNA
2025-10-27,Kurt J Ekert,Sabre Corporation,1,0,0,1,0.0,,Kurt J Ekert Sabre Corporation
2025-10-27,Matt Wilson,Light & Wonder,9,13,3,25,12.0,,Matt Wilson Light & Wonder
2025-10-27,Rob Katz,Vail Resorts,3,5,17,25,68.0,,Rob Katz Vail Resorts
2025-10-27,Schnitzer Steel Industries,Radius Recycling,1,15,9,25,36.0,,Schnitzer Steel Industries Radius Recycling
2025-10-27,David A Spector,PennyMac Financial Services,11,14,0,25,0.0,,David A Spector PennyMac Financial Services
2025-10-27,Frederick J Holzgrefe III,Saia Inc,1,6,0,7,0.0,,Frederick J Holzgrefe III Saia Inc
2025-10-27,Mark J Parrell,Equity Residential,3,7,3,13,23.1,,Mark J Parrell Equity Residential
2025-10-27,John W Lindsay,Helmerich & Payne,2,5,2,9,22.2,,John W Lindsay Helmerich & Payne
2025-10-27,Gary D Burnison,Korn Ferry,11,12,2,25,8.0,,Gary D Burnison Korn Ferry
