date,ceo,company,positive,neutral,negative,total,neg_pct,theme,alias
2025-12-03,Doug McMillon,Walmart,7,18,0,25,0.0,,Doug McMillon Walmart
2025-12-03,Andy Jassy,Amazon,4,11,10,25,40.0,,Andy Jassy Amazon
2025-12-03,Stephen Hemsley,UnitedHealth,3,19,3,25,12.0,,Stephen Hemsley UnitedHealth
2025-12-03,Tim Cook,Apple,3,18,4,25,16.0,,Tim Cook Apple
2025-12-03,David Joyner,CVS Health,9,14,2,25,8.0,,David Joyner CVS Health
2025-12-03,Warren Buffett,Berkshire Hathaway,7,9,9,25,36.0,,Warren Buffett Berkshire Hathaway
2025-12-03,Sundar Pichai,Alphabet,6,13,6,25,24.0,,Sundar Pichai Alphabet
2025-12-03,Darren Woods,Exxon Mobil,6,12,7,25,28.0,,Darren Woods Exxon Mobil
2025-12-03,Brian Tyler,McKesson,5,13,7,25,28.0,,Brian Tyler McKesson
2025-12-03,Robert Mauch,Cencora,7,13,1,21,4.8,,Robert Mauch Cencora
2025-12-03,Jamie Dimon,JPMorgan Chase,2,17,6,25,24.0,,Jamie Dimon JPMorgan Chase
2025-12-03,Ron Vachris,Costco,3,22,0,25,0.0,,Ron Vachris Costco
2025-12-03,David Cordani,Cigna,15,7,3,25,12.0,,David Cordani Cigna
2025-12-03,Satya Nadella,Microsoft,11,5,9,25,36.0,,Satya Nadella Microsoft
2025-12-03,Jason Hollar,Cardinal Health,10,12,3,25,12.0,,Jason Hollar Cardinal Health
2025-12-03,Mike Wirth,Chevron,8,14,3,25,12.0,,Mike Wirth Chevron
2025-12-03,Brian Moynihan,Bank of America,2,19,4,25,16.0,,Brian Moynihan Bank of America
2025-12-03,Mary Barra,General Motors,7,13,5,25,20.0,,Mary Barra General Motors
2025-12-03,Jim Farley,Ford Motor,3,11,11,25,44.0,,Jim Farley Ford Motor
2025-12-03,Gail Boudreaux,Elevance Health,13,8,4,25,16.0,,Gail Boudreaux Elevance Health
2025-12-03,Jane Fraser,Citigroup,11,14,0,25,0.0,,Jane Fraser Citigroup
2025-12-03,Mark Zuckerberg,Meta Platforms,8,11,6,25,24.0,,Mark Zuckerberg Meta Platforms
2025-12-03,Sarah London,Centene,6,13,6,25,24.0,,Sarah London Centene
2025-12-03,Ted Decker,Home Depot,3,12,10,25,40.0,,Ted Decker Home Depot
2025-12-03,Priscilla Almodovar,Fannie Mae,4,14,7,25,28.0,,Priscilla Almodovar Fannie Mae
2025-12-03,Ron Sargent,Kroger,5,15,5,25,20.0,,Ron Sargent Kroger
2025-12-03,Mark Lashier,Phillips 66,6,14,5,25,20.0,,Mark Lashier Phillips 66
2025-12-03,Maryann Mannen,Marathon Petroleum,2,18,5,25,20.0,,Maryann Mannen Marathon Petroleum
2025-12-03,Dan Schulman,Verizon,3,12,10,25,40.0,,Dan Schulman Verizon
2025-12-03,Jensen Huang,Nvidia,5,14,6,25,24.0,,Jensen Huang Nvidia
2025-12-03,David Solomon,Goldman Sachs,6,13,6,25,24.0,,David Solomon Goldman Sachs
2025-12-03,Charles Scharf,Wells Fargo,18,2,5,25,20.0,,Charles Scharf Wells Fargo
2025-12-03,Lane Riggs,Valero Energy,14,9,2,25,8.0,,Lane Riggs Valero Energy
2025-12-03,Brian Roberts,Comcast,4,17,4,25,16.0,,Brian Roberts Comcast
2025-12-03,Jon Farney,State Farm Insurance,5,16,4,25,16.0,,Jon Farney State Farm Insurance
2025-12-03,John Stankey,AT&T,5,16,4,25,16.0,,John Stankey AT&T
2025-12-03,Michael Hutchins,Freddie Mac,3,20,2,25,8.0,,Michael Hutchins Freddie Mac
2025-12-03,Jim Rechtin,Humana,11,10,4,25,16.0,,Jim Rechtin Humana
2025-12-03,Ted Pick,Morgan Stanley,11,11,3,25,12.0,,Ted Pick Morgan Stanley
2025-12-03,Michael Fiddelke,Target Corporation,5,16,4,25,16.0,,Michael Fiddelke Target Corporation
2025-12-03,Philip Smith,StoneX Group,4,16,0,20,0.0,,Philip Smith StoneX Group
2025-12-03,Elon Musk,Tesla,8,8,9,25,36.0,,Elon Musk Tesla
2025-12-03,Michael Dell,Dell Technologies,10,15,0,25,0.0,,Michael Dell Dell Technologies
2025-12-03,Ramon Laguarta,PepsiCo,10,11,4,25,16.0,,Ramon Laguarta PepsiCo
2025-12-03,Bob Iger,Walt Disney,7,16,2,25,8.0,,Bob Iger Walt Disney
2025-12-03,Carol Tome,UPS,7,8,10,25,40.0,,Carol Tome UPS
2025-12-03,Joaquin Duato,Johnson & Johnson,12,9,4,25,16.0,,Joaquin Duato Johnson & Johnson
2025-12-03,Rajesh Subramaniam,FedEx,4,14,7,25,28.0,,Rajesh Subramaniam FedEx
2025-12-03,Juan Luciano,Archer Daniels Midland,4,7,14,25,56.0,,Juan Luciano Archer Daniels Midland
2025-12-03,Jon Moeller,Procter & Gamble,3,15,7,25,28.0,,Jon Moeller Procter & Gamble
2025-12-03,Marvin Ellison,Lowe's,8,15,2,25,8.0,,Marvin Ellison Lowe's
2025-12-03,Thomas Long,Energy Transfer,14,3,8,25,32.0,,Thomas Long Energy Transfer
2025-12-03,Christopher Calio,RTX,7,16,2,25,8.0,,Christopher Calio RTX
2025-12-03,Susan Morris,Albertsons,4,20,1,25,4.0,,Susan Morris Albertsons
2025-12-03,Kevin Hourican,Sysco,6,13,6,25,24.0,,Kevin Hourican Sysco
2025-12-03,Tricia Griffith,Progressive Insurance,9,13,3,25,12.0,,Tricia Griffith Progressive Insurance
2025-12-03,Stephen Squeri,American Express,8,16,1,25,4.0,,Stephen Squeri American Express
2025-12-03,James Taiclet,Lockheed Martin,7,11,7,25,28.0,,James Taiclet Lockheed Martin
2025-12-03,Michel Khalaf,MetLife Inc,11,13,1,25,4.0,,Michel Khalaf MetLife
2025-12-03,Samuel Hazen,HCA Healthcare,13,10,2,25,8.0,,Samuel Hazen HCA Healthcare
2025-12-03,Andrew Sullivan,Prudential Financial,9,15,1,25,4.0,,Andrew Sullivan Prudential Financial
2025-12-03,Kelly Ortberg,Boeing,7,14,4,25,16.0,,Kelly Ortberg Boeing
2025-12-03,Joe Creed,Caterpillar,8,17,0,25,0.0,,Joe Creed Caterpillar
2025-12-03,Robert M Davis,Merck,5,16,4,25,16.0,,Robert M Davis Merck
2025-12-03,Thomas J Wilson,Allstate,5,15,5,25,20.0,,Thomas J Wilson Allstate
2025-12-03,Albert Bourla,Pfizer,7,12,6,25,24.0,,Albert Bourla Pfizer
2025-12-03,Arvind Krishna,IBM,6,13,6,25,24.0,,Arvind Krishna IBM
2025-12-03,Craig DeSanto,New York Life Insurance,4,21,0,25,0.0,,Craig DeSanto New York Life Insurance
2025-12-03,Ed Bastian,Delta Air Lines,8,13,4,25,16.0,,Ed Bastian Delta Air Lines
2025-12-03,Kevin Murphy,Publix Super Markets,15,33,2,50,4.0,,Kevin Murphy Publix Super Markets
2025-12-03,Kirt Walker,Nationwide Insurance,7,17,1,25,4.0,,Kirt Walker Nationwide Insurance
2025-12-03,Patrick Zammit,TD Synnex,13,12,0,25,0.0,,Patrick Zammit TD Synnex
2025-12-03,Scott Kirby,United Airlines,23,1,1,25,4.0,,Scott Kirby United Airlines
2025-12-03,Ryan Lance,ConocoPhillips,13,6,6,25,24.0,,Ryan Lance ConocoPhillips
2025-12-03,Ernie Herrman,TJX,13,11,1,25,4.0,,Ernie Herrman TJX
2025-12-03,Bob Michael,AbbVie,6,18,1,25,4.0,,Bob Michael AbbVie
2025-12-03,AJ Jim Teague,Enterprise Products Partners,8,16,1,25,4.0,,AJ Jim Teague Enterprise Products Partners
2025-12-03,Christopher Winfrey,Charter Communications,7,15,3,25,12.0,,Christopher Winfrey Charter Communications
2025-12-03,George Holm,Performance Food,7,15,3,25,12.0,,George Holm Performance Food
2025-12-03,Robert Isom,American Airlines,2,21,2,25,8.0,,Robert Isom American Airlines
2025-12-03,Richard Fairbank,Capital One,13,10,2,25,8.0,,Richard Fairbank Capital One
2025-12-03,Chuck Robbins,Cisco Systems,9,13,3,25,12.0,,Chuck Robbins Cisco Systems
2025-12-03,Enrique Lores,HP,4,15,6,25,24.0,,Enrique Lores HP
2025-12-03,Donnie King,Tyson Foods,3,14,8,25,32.0,,Donnie King Tyson Foods
2025-12-03,Lip-Bu Tan,Intel,6,12,7,25,28.0,,Lip-Bu Tan Intel
2025-12-03,Clay Magouyrk,Oracle,8,14,3,25,12.0,,Clay Magouyrk Oracle
2025-12-03,Mike Sicilia,Oracle,9,13,3,25,12.0,,Mike Sicilia Oracle
2025-12-03,Hock Tan,Broadcom,6,14,5,25,20.0,,Hock Tan Broadcom
2025-12-03,John May,Deere,6,13,6,25,24.0,,John May Deere
2025-12-03,Elliott Hill,Nike,3,21,1,25,4.0,,Elliott Hill Nike
2025-12-03,Timothy M Sweeney,Liberty Mutual Insurance,24,0,1,25,4.0,,Timothy M Sweeney Liberty Mutual Insurance
2025-12-03,Willie Chiang,Plains GP,4,7,4,15,26.7,,Willie Chiang Plains GP
2025-12-03,Juan Andrade,USAA,5,15,5,25,20.0,,Juan Andrade USAA
2025-12-03,Chris Boerner,Bristol-Myers Squibb,3,19,3,25,12.0,,Chris Boerner Bristol-Myers Squibb
2025-12-03,Paul Bay,Ingram Micro,5,16,4,25,16.0,,Paul Bay Ingram Micro
2025-12-03,Phebe Novakovic,General Dynamics,17,7,1,25,4.0,,Phebe Novakovic General Dynamics
2025-12-03,James Quincey,The Coca-Cola Company,7,15,3,25,12.0,,James Quincey The Coca-Cola Company
2025-12-03,Thasunda Brown Duckett,TIAA,11,13,1,25,4.0,,Thasunda Brown Duckett TIAA
2025-12-03,Alan Schnitzer,Travelers Insurance,10,12,3,25,12.0,,Alan Schnitzer Travelers Insurance
2025-12-03,David Ricks,Eli Lilly,7,8,10,25,40.0,,David Ricks Eli Lilly
2025-12-03,Dara Khosrowshahi,Uber,10,13,2,25,8.0,,Dara Khosrowshahi Uber
2025-12-03,Roger Crandall,Mass Mutual,6,15,4,25,16.0,,Roger Crandall Mass Mutual
2025-12-03,Marc Casper,Thermo Fisher Scientific,7,16,2,25,8.0,,Marc Casper Thermo Fisher Scientific
2025-12-03,Gunjan Kedia,US Bancorp,8,15,2,25,8.0,,Gunjan Kedia US Bancorp
2025-12-03,Michael Kasbar,World Kinect,1,16,0,17,0.0,,Michael Kasbar World Kinect
2025-12-03,Robert Ford,Abbott Laboratories,5,13,7,25,28.0,,Robert Ford Abbott Laboratories
2025-12-03,Corie Barry,Best Buy,24,1,0,25,0.0,,Corie Barry Best Buy
2025-12-03,Tim Gerend,Northwestern Mutual,5,19,1,25,4.0,,Tim Gerend Northwestern Mutual
2025-12-03,Kathy Warden,Northrop Grumman,6,18,1,25,4.0,,Kathy Warden Northrop Grumman
2025-12-03,Joe Zubretsky,Molina Healthcare,5,14,6,25,24.0,,Joe Zubretsky Molina Healthcare
2025-12-03,Todd Vasos,Dollar General,0,22,3,25,12.0,,Todd Vasos Dollar General
2025-12-03,Robin Vince,Bank of New York Mellon,8,16,1,25,4.0,,Robin Vince Bank of New York Mellon
2025-12-03,David Zaslav,Warner Bros Discovery,9,10,6,25,24.0,,David Zaslav Warner Bros Discovery
2025-12-03,Jay Debertin,CHS,6,17,2,25,8.0,,Jay Debertin CHS
2025-12-03,Ted Sarandos,Netflix,7,11,7,25,28.0,,Ted Sarandos Netflix
2025-12-03,Cristiano Amon,Qualcomm,4,17,4,25,16.0,,Cristiano Amon Qualcomm
2025-12-03,Vimal Kapur,Honeywell,12,12,1,25,4.0,,Vimal Kapur Honeywell
2025-12-03,Marc Benioff,Salesforce,6,18,1,25,4.0,,Marc Benioff Salesforce
2025-12-03,Jacek Olczak,Philip Morris International,7,18,0,25,0.0,,Jacek Olczak Philip Morris International
2025-12-03,David Flitman,US Foods,3,19,3,25,12.0,,David Flitman US Foods
2025-12-03,Paul Romanowski,DR Horton Inc,5,13,7,25,28.0,,Paul Romanowski DR Horton
2025-12-03,Bryan DeBoer,Lithia Motors,9,15,1,25,4.0,,Bryan DeBoer Lithia Motors
2025-12-03,Dirk Van de Put,Mondelez,6,15,4,25,16.0,,Dirk Van de Put Mondelez
2025-12-03,Brian Niccol,Starbucks,4,8,13,25,52.0,,Brian Niccol Starbucks
2025-12-03,Ryan McInerney,Visa Inc,9,14,2,25,8.0,,Ryan McInerney Visa Inc
2025-12-03,Robert Sulentic,CBRE Group,8,15,2,25,8.0,,Robert Sulentic CBRE Group
2025-12-03,Jonathan Jaffe,Lennar,2,12,0,14,0.0,,Jonathan Jaffe Lennar
2025-12-03,Scott Strazik,GE Vernova,7,15,3,25,12.0,,Scott Strazik GE Vernova
2025-12-03,William Demchak,PNC Financial Services,7,16,2,25,8.0,,William Demchak PNC Financial Services
2025-12-03,Jennifer Rumsey,Cummins Inc,5,14,6,25,24.0,,Jennifer Rumsey Cummins Inc
2025-12-03,Preston Feight,Paccar,7,16,2,25,8.0,,Preston Feight Paccar
2025-12-03,Robert Bradway,Amgen,4,19,2,25,8.0,,Robert Bradway Amgen
2025-12-03,Matthew Lucey,PBF Energy,14,6,0,20,0.0,,Matthew Lucey PBF Energy
2025-12-03,Brian D Pieninck,GuideWell Mutual,0,6,0,6,0.0,,Brian D Pieninck GuideWell Mutual
2025-12-03,Alex Chriss,PayPal,8,13,4,25,16.0,,Alex Chriss PayPal
2025-12-03,Sandy Douglas,United Natural Foods,16,8,1,25,4.0,,Sandy Douglas United Natural Foods
2025-12-03,Michael Creedon,Dollar Tree,3,20,2,25,8.0,,Michael Creedon Dollar Tree
2025-12-03,Leon Topalian,Nucor,5,17,3,25,12.0,,Leon Topalian Nucor
2025-12-03,Roger Penske,Penske Automotive,12,11,2,25,8.0,,Roger Penske Penske Automotive
2025-12-03,Bom Kim,Coupang,4,15,6,25,24.0,,Bom Kim Coupang
2025-12-03,Antonio Neri,Hewlett Packard Enterprise,7,14,4,25,16.0,,Antonio Neri Hewlett Packard Enterprise
2025-12-03,Harry Sideris,Duke Energy,24,1,0,25,0.0,,Harry Sideris Duke Energy
2025-12-03,Joseph Bae,KKR & Co,10,13,2,25,8.0,,Joseph Bae KKR & Co
2025-12-03,Brian Robbins,Paramount Global,4,18,3,25,12.0,,Brian Robbins Paramount Global
2025-12-03,Michael Dastoor,Jabil,4,14,7,25,28.0,,Michael Dastoor Jabil
2025-12-03,Daniel O'Day,Gilead Sciences,10,13,2,25,8.0,,Daniel O'Day Gilead Sciences
2025-12-03,Tim Go,HF Sinclair,14,8,3,25,12.0,,Tim Go HF Sinclair
2025-12-03,William Nash,CarMax,6,11,8,25,32.0,,William Nash CarMax
2025-12-03,Michael Miebach,Mastercard,5,17,3,25,12.0,,Michael Miebach Mastercard
2025-12-03,Lawrence Coben,NRG Energy,7,5,3,15,20.0,,Lawrence Coben NRG Energy
2025-12-03,Sean Kerins,Arrow Electronics,6,17,2,25,8.0,,Sean Kerins Arrow Electronics
2025-12-03,Lorenzo Simonelli,Baker Hughes,8,14,3,25,12.0,,Lorenzo Simonelli Baker Hughes
2025-12-03,Bob Jordan,Southwest Airlines,4,15,6,25,24.0,,Bob Jordan Southwest Airlines
2025-12-03,Peter Zaffino,AIG,6,13,6,25,24.0,,Peter Zaffino AIG
2025-12-03,Gary Dickerson,Applied Materials,2,11,12,25,48.0,,Gary Dickerson Applied Materials
2025-12-03,Vicki Hollub,Occidental Petroleum,8,13,4,25,16.0,,Vicki Hollub Occidental Petroleum
2025-12-03,Michael Manley,AutoNation,4,20,1,25,4.0,,Michael Manley AutoNation
2025-12-03,Christopher Womack,Southern Company,9,14,2,25,8.0,,Christopher Womack Southern Company
2025-12-03,Christopher Swift,The Hartford,8,15,2,25,8.0,,Christopher Swift The Hartford
2025-12-03,Marc Rowan,Apollo Global Management,4,15,6,25,24.0,,Marc Rowan Apollo Global Management
2025-12-03,Rick Wurster,Charles Schwab,3,18,4,25,16.0,,Rick Wurster Charles Schwab
2025-12-03,Chris Kempczinski,McDonalds,10,10,5,25,20.0,,Chris Kempczinski McDonalds
2025-12-03,Carlos Abrams-Rivera,Kraft Heinz,6,15,4,25,16.0,,Carlos Abrams-Rivera Kraft Heinz
2025-12-03,Lisa Su,Advanced Micro Devices,7,13,5,25,20.0,,Lisa Su Advanced Micro Devices
2025-12-03,William H Rogers Jr,Truist Financial,8,12,4,24,16.7,,William H Rogers Jr Truist Financial
2025-12-03,Kathleen Quirk,Freeport-McMoRan,9,12,4,25,16.0,,Kathleen Quirk Freeport-McMoRan
2025-12-03,Sanjay Mehrotra,Micron Technology,7,15,3,25,12.0,,Sanjay Mehrotra Micron Technology
2025-12-03,Anthony Capuano,Marriott International,12,12,1,25,4.0,,Anthony Capuano Marriott International
2025-12-03,David Gitlin,Carrier Global,8,14,3,25,12.0,,David Gitlin Carrier Global
2025-12-03,John Ketchum,NextEra Energy,17,7,1,25,4.0,,John Ketchum NextEra Energy
2025-12-03,William M Brown,3M Company,6,17,2,25,8.0,,William M Brown 3M Company
2025-12-03,John Doyle,Marsh & McLennan,4,17,4,25,16.0,,John Doyle Marsh & McLennan
2025-12-03,Patricia Poppe,PG&E,9,14,2,25,8.0,,Patricia Poppe PG&E
2025-12-03,Jim Vena,Union Pacific,8,14,3,25,12.0,,Jim Vena Union Pacific
2025-12-03,Brian Doubles,Synchrony Financial,6,17,2,25,8.0,,Brian Doubles Synchrony Financial
2025-12-03,Rainer Blair,Danaher,7,16,2,25,8.0,,Rainer Blair Danaher
2025-12-03,Philip Gallagher,Avnet,4,16,0,20,0.0,,Philip Gallagher Avnet
2025-12-03,Glenn Fogel,Booking Holdings,9,13,3,25,12.0,,Glenn Fogel Booking Holdings
2025-12-03,Ezra Yacob,EOG Resources,12,12,1,25,4.0,,Ezra Yacob EOG Resources
2025-12-03,Earl Austin,Quanta Services,8,12,1,21,4.8,,Earl Austin Quanta Services
2025-12-03,Michael Shepherd,Discover Financial,8,15,2,25,8.0,,Michael Shepherd Discover Financial
2025-12-03,Joseph Dominguez,Constellation Energy,12,11,2,25,8.0,,Joseph Dominguez Constellation Energy
2025-12-03,William Stengel II,Genuine Parts,3,11,0,14,0.0,,William Stengel II Genuine Parts
2025-12-03,Christian Ulbrich,Jones Lang LaSalle,11,12,2,25,8.0,,Christian Ulbrich Jones Lang LaSalle
2025-12-03,Raymond E Scott,Lear Corporation,3,15,1,19,5.3,,Raymond E Scott Lear Corporation
2025-12-03,Michael Rapino,Live Nation Entertainment,7,12,6,25,24.0,,Michael Rapino Live Nation Entertainment
2025-12-03,Heidi Petz,Sherwin-Williams,4,15,6,25,24.0,,Heidi Petz Sherwin-Williams
2025-12-03,Calvin G Butler Jr,Exelon,7,10,1,18,5.6,,Calvin G Butler Jr Exelon
2025-12-03,Tony Spring,Macys,9,12,4,25,16.0,,Tony Spring Macys
2025-12-03,Jeff Miller,Halliburton,7,9,9,25,36.0,,Jeff Miller Halliburton
2025-12-03,Kevin Lobo,Stryker,9,12,4,25,16.0,,Kevin Lobo Stryker
2025-12-03,Tony Cheng,Reinsurance Group of America,0,10,2,12,16.7,,Tony Cheng Reinsurance Group of America
2025-12-03,Ronald P O'Hanley,State Street,6,17,2,25,8.0,,Ronald P O'Hanley State Street
2025-12-03,John Engel,WESCO International,6,18,1,25,4.0,,John Engel WESCO International
2025-12-03,Pierce Norton II,Oneok,12,10,3,25,12.0,,Pierce Norton II Oneok
2025-12-03,Shantanu Narayen,Adobe,10,13,2,25,8.0,,Shantanu Narayen Adobe
2025-12-03,Bill Westrate,American Family Insurance,6,16,3,25,12.0,,Bill Westrate American Family Insurance
2025-12-03,Chris Kubasik,L3Harris Technologies,12,13,0,25,0.0,,Chris Kubasik L3Harris Technologies
2025-12-03,James Conroy,Ross Stores,5,19,1,25,4.0,,James Conroy Ross Stores
2025-12-03,Christine Leahy,CDW,2,19,4,25,16.0,,Christine Leahy CDW
2025-12-03,Saumya Sutaria,Tenet Healthcare,3,5,2,10,20.0,,Saumya Sutaria Tenet Healthcare
2025-12-03,Bob Eddy,BJ's Wholesale Club,4,19,2,25,8.0,,Bob Eddy BJ's Wholesale Club
2025-12-03,Mike Lyons,Fiserv,3,16,6,25,24.0,,Mike Lyons Fiserv
2025-12-03,William Gifford,Altria,6,16,3,25,12.0,,William Gifford Altria
2025-12-03,Larry Fink,BlackRock,3,17,5,25,20.0,,Larry Fink BlackRock
2025-12-03,Thomas Polen,Becton Dickinson,9,14,2,25,8.0,,Thomas Polen Becton Dickinson
2025-12-03,Noel Wallace,Colgate-Palmolive,5,18,2,25,8.0,,Noel Wallace Colgate-Palmolive
2025-12-03,Michael Hsu,Kimberly-Clark,6,16,3,25,12.0,,Michael Hsu Kimberly-Clark
2025-12-03,Daryl Kenningham,Group 1 Automotive,5,15,5,25,20.0,,Daryl Kenningham Group 1 Automotive
2025-12-03,Jennifer Parmentier,Parker-Hannifin,4,20,0,24,0.0,,Jennifer Parmentier Parker-Hannifin
2025-12-03,Jeffrey Harmening,General Mills,7,13,5,25,20.0,,Jeffrey Harmening General Mills
2025-12-03,Ravi Kumar S,Cognizant Technology Solutions,8,15,2,25,8.0,,Ravi Kumar S Cognizant Technology Solutions
2025-12-03,William Fehrman,American Electric Power,6,12,0,18,0.0,,William Fehrman American Electric Power
2025-12-03,Peter Arduini,GE HealthCare Technologies,7,16,2,25,8.0,,Peter Arduini GE HealthCare Technologies
2025-12-03,Maria Black,Automatic Data Processing,11,14,0,25,0.0,,Maria Black Automatic Data Processing
2025-12-03,Lourenco Goncalves,Cleveland-Cliffs,6,12,7,25,28.0,,Lourenco Goncalves Cleveland-Cliffs
2025-12-03,Dan Amos,Aflac,3,16,6,25,24.0,,Dan Amos Aflac
2025-12-03,Mark Stewart,Goodyear Tire & Rubber,5,20,0,25,0.0,,Mark Stewart Goodyear Tire & Rubber
2025-12-03,Kevin Hogan,Corebridge Financial,7,10,1,18,5.6,,Kevin Hogan Corebridge Financial
2025-12-03,Thomas Palmer,Newmont,4,20,1,25,4.0,,Thomas Palmer Newmont
2025-12-03,Andrew Silvernail,International Paper,7,14,4,25,16.0,,Andrew Silvernail International Paper
2025-12-03,Philip Daniele III,AutoZone,4,16,5,25,20.0,,Philip Daniele III AutoZone
2025-12-03,Ellen Cooper,Lincoln National,6,18,1,25,4.0,,Ellen Cooper Lincoln National
2025-12-03,Ryan Marshall,PulteGroup,7,12,6,25,24.0,,Ryan Marshall PulteGroup
2025-12-03,James Cracchiolo,Ameriprise Financial,2,18,5,25,20.0,,James Cracchiolo Ameriprise Financial
2025-12-03,Andrew Clyde,Murphy USA,7,16,2,25,8.0,,Andrew Clyde Murphy USA
2025-12-03,Jonas Prising,ManpowerGroup,6,14,5,25,20.0,,Jonas Prising ManpowerGroup
2025-12-03,David Bozeman,CH Robinson Worldwide,4,19,2,25,8.0,,David Bozeman CH Robinson Worldwide
2025-12-03,Timothy Knavish,PPG Industries,2,9,1,12,8.3,,Timothy Knavish PPG Industries
2025-12-03,Pedro Pizarro,Edison International,4,8,13,25,52.0,,Pedro Pizarro Edison International
2025-12-03,Mark Millett,Steel Dynamics,22,3,0,25,0.0,,Mark Millett Steel Dynamics
2025-12-03,Benjamin Tisch,Loews,1,19,0,20,0.0,,Benjamin Tisch Loews
2025-12-03,Karsanbhai,Emerson Electric,1,20,4,25,16.0,,Karsanbhai Emerson Electric
2025-12-03,John Zillmer,Aramark,7,17,1,25,4.0,,John Zillmer Aramark
2025-12-03,William Hornbuckle,MGM Resorts International,9,8,8,25,32.0,,William Hornbuckle MGM Resorts International
2025-12-03,James Burke,Vistra,15,6,0,21,0.0,,James Burke Vistra
2025-12-03,David Hult,Asbury Automotive Group,4,19,2,25,8.0,,David Hult Asbury Automotive Group
2025-12-03,DG Macpherson,WW Grainger,4,10,3,17,17.6,,DG Macpherson WW Grainger
2025-12-03,Eric Slifka,Global Partners,3,17,5,25,20.0,,Eric Slifka Global Partners
2025-12-03,Bob Pragada,Jacobs Solutions,8,15,2,25,8.0,,Bob Pragada Jacobs Solutions
2025-12-03,Charles Magro,Corteva,1,9,1,11,9.1,,Charles Magro Corteva
2025-12-03,Rick Lanoha,Peter Kiewit Sons',0,5,0,5,0.0,,Rick Lanoha Peter Kiewit Sons'
2025-12-03,Michael Mahoney,Boston Scientific,5,17,3,25,12.0,,Michael Mahoney Boston Scientific
2025-12-03,Brad Beckham,O'Reilly Automotive,4,17,4,25,16.0,,Brad Beckham O'Reilly Automotive
2025-12-03,Thomas Bell,Leidos,7,17,1,25,4.0,,Thomas Bell Leidos
2025-12-03,Thomas Gayner,Markel Group,8,16,1,25,4.0,,Thomas Gayner Markel Group
2025-12-03,Marc Bitzer,Whirlpool,7,12,6,25,24.0,,Marc Bitzer Whirlpool
2025-12-03,Andrew McMahon,Guardian Life insurance,5,20,0,25,0.0,,Andrew McMahon Guardian Life insurance
2025-12-03,Peter Jackson,Builders FirstSource,3,17,1,21,4.8,,Peter Jackson Builders FirstSource
2025-12-03,Michael Rhodes,Ally Financial,5,18,2,25,8.0,,Michael Rhodes Ally Financial
2025-12-03,Matthew Meloy,Targa Resources,7,11,1,19,5.3,,Matthew Meloy Targa Resources
2025-12-03,James Breuer,Fluor,4,8,0,12,0.0,,James Breuer Fluor
2025-12-03,Sasan Goodarzi,Intuit,6,17,2,25,8.0,,Sasan Goodarzi Intuit
2025-12-03,Troy Rudd,AECOM,5,17,3,25,12.0,,Troy Rudd AECOM
2025-12-03,Penny Pennington,Edward Jones,6,14,5,25,20.0,,Penny Pennington Edward Jones
2025-12-03,Michael Bender,Kohl's,1,20,4,25,16.0,,Michael Bender Kohl's
2025-12-03,Beth Ford,Land O'Lakes,7,16,2,25,8.0,,Beth Ford Land O'Lakes
2025-12-03,Deanna Strable-Soethout,PrIncipal Financial,1,9,0,10,0.0,,Deanna Strable-Soethout PrIncipal Financial
2025-12-03,Robert Blue,Dominion Energy,16,7,2,25,8.0,,Robert Blue Dominion Energy
2025-12-03,Martin Schroeter,Kyndryl,10,13,2,25,8.0,,Martin Schroeter Kyndryl
2025-12-03,Jon Vander Ark,Republic Services,4,5,16,25,64.0,,Jon Vander Ark Republic Services
2025-12-03,Clay Gaspar,Devon Energy,22,1,2,25,8.0,,Clay Gaspar Devon Energy
2025-12-03,Christopher O'Herlihy,Illinois Tool Works,4,14,3,21,14.3,,Christopher O'Herlihy Illinois Tool Works
2025-12-03,Michael O'Grady,Northern Trust,20,5,0,25,0.0,,Michael O'Grady Northern Trust
2025-12-03,Jamie Whisnant,Auto-Owners Insurance,0,2,0,2,0.0,,Jamie Whisnant Auto-Owners Insurance
2025-12-03,Marc Miller,Universal Health Services,8,15,2,25,8.0,,Marc Miller Universal Health Services
2025-12-03,Darryl Button,Pacific Life,2,22,1,25,4.0,,Darryl Button Pacific Life
2025-12-03,Hamid Akhavan,EchoStar,9,10,6,25,24.0,,Hamid Akhavan EchoStar
2025-12-03,Christophe Beck,Ecolab,14,9,2,25,8.0,,Christophe Beck Ecolab
2025-12-03,Jack Fusco,Cheniere Energy,12,12,1,25,4.0,,Jack Fusco Cheniere Energy
2025-12-03,John Wren,Omnicom Group,5,16,4,25,16.0,,John Wren Omnicom Group
2025-12-03,Haviv Ilan,Texas Instruments,5,17,3,25,12.0,,Haviv Ilan Texas Instruments
2025-12-03,David Burritt,United States Steel,3,17,5,25,20.0,,David Burritt United States Steel
2025-12-03,Stéphane de La Faverie,Estée Lauder,10,13,2,25,8.0,,Stéphane de La Faverie Estée Lauder
2025-12-03,Raul Nicholas Vargas Ochoa,Farmers Insurance Exchange,0,0,0,0,0.0,,Raul Nicholas Vargas Ochoa Farmers Insurance Exchange
2025-12-03,Kirk Perry,Kenvue,5,17,3,25,12.0,,Kirk Perry Kenvue
2025-12-03,Ari Bousbib,IQVIA,9,14,2,25,8.0,,Ari Bousbib IQVIA
2025-12-03,Donald Allan,Stanley Black & Decker,5,17,3,25,12.0,,Donald Allan Stanley Black & Decker
2025-12-03,Timothy Cofer,Keurig Dr Pepper,4,10,1,15,6.7,,Timothy Cofer Keurig Dr Pepper
2025-12-03,Matthew Flannery,United Rentals,22,3,0,25,0.0,,Matthew Flannery United Rentals
2025-12-03,Timothy Cawley,Consolidated Edison,7,10,5,22,22.7,,Timothy Cawley Consolidated Edison
2025-12-03,Adam Norwitt,Amphenol,7,17,1,25,4.0,,Adam Norwitt Amphenol
2025-12-03,Brent Shafer,Baxter International,2,13,0,15,0.0,,Brent Shafer Baxter International
2025-12-03,Kimberly Dang,Kinder Morgan,13,2,1,16,6.2,,Kimberly Dang Kinder Morgan
2025-12-03,Erik Nordstrom,Nordstrom,5,17,3,25,12.0,,Erik Nordstrom Nordstrom
2025-12-03,Frank Holding,First Citizens BancShares,8,17,0,25,0.0,,Frank Holding First Citizens BancShares
2025-12-03,Paul Shoukry,Raymond James Financial,9,16,0,25,0.0,,Paul Shoukry Raymond James Financial
2025-12-03,Timothy Archer,Lam Research,8,11,6,25,24.0,,Timothy Archer Lam Research
2025-12-03,Harry Lawton III,Tractor Supply,4,6,1,11,9.1,,Harry Lawton III Tractor Supply
2025-12-03,Darren Rebelez,Caseys General Stores,8,15,2,25,8.0,,Darren Rebelez Caseys General Stores
2025-12-03,Scott Smith,Viatris,10,14,1,25,4.0,,Scott Smith Viatris
2025-12-03,James Blackledge,Mutual of Omaha,2,22,1,25,4.0,,James Blackledge Mutual of Omaha
2025-12-03,Anthony Guzzi,EMCOR Group,4,9,1,14,7.1,,Anthony Guzzi EMCOR Group
2025-12-03,Joseph Hinrichs,CSX,8,13,4,25,16.0,,Joseph Hinrichs CSX
2025-12-03,Justin Jude,LKQ,3,9,2,14,14.3,,Justin Jude LKQ
2025-12-03,Judith Marks,Otis Worldwide,5,15,5,25,20.0,,Judith Marks Otis Worldwide
2025-12-03,David Bruton Smith,Sonic Automotive,2,15,8,25,32.0,,David Bruton Smith Sonic Automotive
2025-12-03,Martina Cheung,S&P Global,8,16,1,25,4.0,,Martina Cheung S&P Global
2025-12-03,Leonard Schleifer,Regeneron Pharmaceuticals,2,18,5,25,20.0,,Leonard Schleifer Regeneron Pharmaceuticals
2025-12-03,Joseph Fadool,BorgWarner,1,15,0,16,0.0,,Joseph Fadool BorgWarner
2025-12-03,Karla Lewis,Reliance Inc,4,7,1,12,8.3,,Karla Lewis Reliance Inc
2025-12-03,John Barrett,Western & Southern Financial,5,20,0,25,0.0,,John Barrett Western & Southern Financial
2025-12-03,Scott Donnelly,Textron,8,16,1,25,4.0,,Scott Donnelly Textron
2025-12-03,Ariane Gorin,Expedia,9,14,2,25,8.0,,Ariane Gorin Expedia
2025-12-03,Michael Nolan,Fidelity National Financial,5,16,1,22,4.5,,Michael Nolan Fidelity National Financial
2025-12-03,Ernest Garcia III,Carvana,18,6,1,25,4.0,,Ernest Garcia III Carvana
2025-12-03,Raul Fernandez,DXC Technology,2,22,1,25,4.0,,Raul Fernandez DXC Technology
2025-12-03,Robert Berkley,WR Berkley,8,16,1,25,4.0,,Robert Berkley WR Berkley
2025-12-03,René Jones,M&T Bank,7,16,2,25,8.0,,René Jones M&T Bank
2025-12-03,Lauren Hobart,Dicks Sporting Goods,4,15,6,25,24.0,,Lauren Hobart Dicks Sporting Goods
2025-12-03,Robert Frenzel,Xcel Energy,13,5,7,25,28.0,,Robert Frenzel Xcel Energy
2025-12-03,Timothy Spence,Fifth Third Bancorp,7,13,5,25,20.0,,Timothy Spence Fifth Third Bancorp
2025-12-03,Stephen Schwarzman,Blackstone,6,16,3,25,12.0,,Stephen Schwarzman Blackstone
2025-12-03,Walker Martin,Sempra,1,4,0,5,0.0,,Walker Martin Sempra
