date,ceo,company,positive,neutral,negative,total,neg_pct,theme,alias
2025-11-05,Gerben W Bakker,Hubbell,1,4,1,6,16.7,,Gerben W Bakker Hubbell
2025-11-05,Dave Davis,Spirit Airlines,5,13,7,25,28.0,,Dave Davis Spirit Airlines
2025-11-05,Michael J Smith,Lamb Weston,0,14,11,25,44.0,,Michael J Smith Lamb Weston
2025-11-05,Strauss Zelnick,Take-Two Interactive Software,9,10,6,25,24.0,,Strauss Zelnick Take-Two Interactive Software
2025-11-05,John C Turner Jr,GMS,5,20,0,25,0.0,,John C Turner Jr GMS
2025-11-05,David M O'Malley,Penn Mutual Life Insurance,2,5,2,9,22.2,,David M O'Malley Penn Mutual Life Insurance
2025-11-05,Frank A Lonegro,Landstar System,4,8,1,13,7.7,,Frank A Lonegro Landstar System
2025-11-05,James F Risoleo,Host Hotels & Resorts,5,15,1,21,4.8,,James F Risoleo Host Hotels & Resorts
2025-11-05,Ken Xie,Fortinet,11,10,4,25,16.0,,Ken Xie Fortinet
2025-11-05,Doug Shulman,OneMain,5,8,0,13,0.0,,Doug Shulman OneMain
2025-11-05,Ryan Cohen,GameStop,9,11,5,25,20.0,,Ryan Cohen GameStop
2025-11-05,Mark W Begor,Equifax,2,23,0,25,0.0,,Mark W Begor Equifax
2025-11-05,Jay L Schottenstein,American Eagle Outfitters,9,13,3,25,12.0,,Jay L Schottenstein American Eagle Outfitters
2025-11-05,Curtis C Farmer,Comerica,8,12,1,21,4.8,,Curtis C Farmer Comerica
2025-11-05,Ole Rosgaard,Greif,5,19,1,25,4.0,,Ole Rosgaard Greif
2025-11-05,Brian E Lane,Comfort Systems USA,19,0,0,19,0.0,,Brian E Lane Comfort Systems USA
2025-11-05,Robert M Buck,TopBuild,3,6,0,9,0.0,,Robert M Buck TopBuild
2025-11-05,Ralph Andretta,Bread Financial,6,12,0,18,0.0,,Ralph Andretta Bread Financial
2025-11-05,Jim Anderson,Coherent,4,19,2,25,8.0,,Jim Anderson Coherent
2025-11-05,Walter C. D. Carlson,Telephone & Data Systems,1,10,2,13,15.4,,Walter C. D. Carlson Telephone & Data Systems
2025-11-05,Ronald Kruszewski,Stifel Financial,10,14,1,25,4.0,,Ronald Kruszewski Stifel Financial
2025-11-05,Richard Hayne,Urban Outfitters,6,16,3,25,12.0,,Richard Hayne Urban Outfitters
2025-11-05,Simon Meester,Terex,3,19,3,25,12.0,,Simon Meester Terex
2025-11-05,Edward J Lehner,Ryerson Holding,0,3,0,3,0.0,,Edward J Lehner Ryerson Holding
2025-11-05,Nicholas T Pinchuk,Snap-on,7,6,0,13,0.0,,Nicholas T Pinchuk Snap-on
2025-11-05,Ryals McMullian,Flowers Foods,5,18,2,25,8.0,,Ryals McMullian Flowers Foods
2025-11-05,D Bryan Jordan,First Horizon,7,15,3,25,12.0,,D Bryan Jordan First Horizon
2025-11-05,John B Gibson,Paychex,3,7,1,11,9.1,,John B Gibson Paychex
2025-11-05,Chris Cocks,Hasbro,9,8,8,25,32.0,,Chris Cocks Hasbro
2025-11-05,Pete McPartland,Sentry Insurance Group,7,13,0,20,0.0,,Pete McPartland Sentry Insurance Group
2025-11-05,Michael Arougheti,Ares Management,7,15,3,25,12.0,,Michael Arougheti Ares Management
2025-11-05,Alok Maskara,Lennox International,11,12,2,25,8.0,,Alok Maskara Lennox International
2025-11-05,James C Grech,Peabody Energy,1,1,1,3,33.3,,James C Grech Peabody Energy
2025-11-05,Joseph P Lacher Jr,Kemper Corporation,6,18,1,25,4.0,,Joseph P Lacher Jr Kemper Corporation
2025-11-05,Perry A Sook,Nexstar Media Group,2,21,2,25,8.0,,Perry A Sook Nexstar Media Group
2025-11-05,Wade Davis,TelevisaUnivision,5,19,1,25,4.0,,Wade Davis TelevisaUnivision
2025-11-05,Scott L Thompson,Tempur Sealy International,0,8,2,10,20.0,,Scott L Thompson Tempur Sealy International
2025-11-05,Mike Simonds,TriNet Group,7,17,1,25,4.0,,Mike Simonds TriNet Group
2025-11-05,B Andrew Rose,Worthington Enterprises,1,11,0,12,0.0,,B Andrew Rose Worthington Enterprises
2025-11-05,Bruce L Caswell,Maximus,6,6,0,12,0.0,,Bruce L Caswell Maximus
2025-11-05,Robert L Reffkin,Compass Group,4,7,1,12,8.3,,Robert L Reffkin Compass Group
2025-11-05,Mark Eubanks,Brinks Company,5,11,4,20,20.0,,Mark Eubanks Brinks Company
2025-11-05,Peter Quigley,Kelly Services Inc,10,15,0,25,0.0,,Peter Quigley Kelly Services Inc
2025-11-05,David L Yowan,Navient,1,4,0,5,0.0,,David L Yowan Navient
2025-11-05,Mary E Kipp,Puget Sound Energy,6,2,2,10,20.0,,Mary E Kipp Puget Sound Energy
2025-11-05,Adam Aron,AMC Entertainment,14,5,6,25,24.0,,Adam Aron AMC Entertainment
2025-11-05,Mark J Tarr,Encompass Health,3,7,1,11,9.1,,Mark J Tarr Encompass Health
2025-11-05,Liam K Griffin,Skyworks Solutions,1,6,5,12,41.7,,Liam K Griffin Skyworks Solutions
2025-11-05,Richard G Kyle,Timken,3,21,1,25,4.0,,Richard G Kyle Timken
2025-11-05,Ron Gusek,Liberty Energy,25,0,0,25,0.0,,Ron Gusek Liberty Energy
2025-11-05,John E Geller Jr,Marriott Vacations Worldwide,4,7,1,12,8.3,,John E Geller Jr Marriott Vacations Worldwide
2025-11-05,Karl G. Glassman,Leggett & Platt,1,5,2,8,25.0,,Karl G. Glassman Leggett & Platt
2025-11-05,Jonathan H Weis,Weis Markets,3,22,0,25,0.0,,Jonathan H Weis Weis Markets
2025-11-05,Jeffrey B Guldner,Pinnacle West Capital,2,7,1,10,10.0,,Jeffrey B Guldner Pinnacle West Capital
2025-11-05,Arkadiy Dobkin,EPAM Systems,8,17,0,25,0.0,,Arkadiy Dobkin EPAM Systems
2025-11-05,Paul M Rady,Antero Resources,3,12,0,15,0.0,,Paul M Rady Antero Resources
2025-11-05,Michael Spanos,Bloomin Brands,5,18,2,25,8.0,,Michael Spanos Bloomin Brands
2025-11-05,Nicole A Kivisto,MDU Resources Group,8,11,1,20,5.0,,Nicole A Kivisto MDU Resources Group
2025-11-05,Gerald L Morgan,Texas Roadhouse,5,8,6,19,31.6,,Gerald L Morgan Texas Roadhouse
2025-11-05,Gabriel Tirador,Mercury General,5,9,0,14,0.0,,Gabriel Tirador Mercury General
2025-11-05,Nicholas I Fink,Fortune Brands Innovations,2,21,2,25,8.0,,Nicholas I Fink Fortune Brands Innovations
2025-11-05,Paul E Burdiss,Zions Bancorp,1,5,0,6,0.0,,Paul E Burdiss Zions Bancorp
2025-11-05,William J Christensen,JELD-WEN Holding,1,12,0,13,0.0,,William J Christensen JELD-WEN Holding
2025-11-05,Evan Spiegel,Snap Inc,8,13,4,25,16.0,,Evan Spiegel Snap Inc
2025-11-05,Bill Burns,Zebra Technologies,6,19,0,25,0.0,,Bill Burns Zebra Technologies
2025-11-05,Steven Sell,Agilon Health,3,9,5,17,29.4,,Steven Sell Agilon Health
2025-11-05,Richard M Olson,Toro Company,0,21,4,25,16.0,,Richard M Olson Toro Company
2025-11-05,Eric S Yuan,Zoom Video Communications,8,14,3,25,12.0,,Eric S Yuan Zoom Video Communications
2025-11-05,Dan L Batrack,Tetra Tech,4,4,2,10,20.0,,Dan L Batrack Tetra Tech
2025-11-05,Joseph D Russell Jr,Public Storage,0,4,1,5,20.0,,Joseph D Russell Jr Public Storage
2025-11-05,Jacob Thaysen,Illumina Inc,7,17,1,25,4.0,,Jacob Thaysen Illumina Inc
2025-11-05,Debra A Cafaro,Ventas Inc,15,10,0,25,0.0,,Debra A Cafaro Ventas Inc
2025-11-05,Pierre R Brondeau,FMC Corporation,2,6,4,12,33.3,,Pierre R Brondeau FMC Corporation
2025-11-05,Judy R McReynolds,ArcBest,5,18,2,25,8.0,,Judy R McReynolds ArcBest
2025-11-05,Russell J Weiner,Dominos Pizza Inc,10,11,4,25,16.0,,Russell J Weiner Dominos Pizza Inc
2025-11-05,Theodore S Hanson,ASGN,1,4,1,6,16.7,,Theodore S Hanson ASGN
2025-11-05,RJ Scaringe,Rivian Automotive,3,15,7,25,28.0,,RJ Scaringe Rivian Automotive
2025-11-05,Jeffrey N Simmons,Elanco Animal Health,10,11,4,25,16.0,,Jeffrey N Simmons Elanco Animal Health
2025-11-05,Tim O Shaughnessy,Graham Holdings Company,3,19,1,23,4.3,,Tim O Shaughnessy Graham Holdings Company
2025-11-05,Thomas V Taylor,Floor & Decor,1,5,3,9,33.3,,Thomas V Taylor Floor & Decor
2025-11-05,Neil A Schrimsher,Applied Industrial Technologies,3,15,0,18,0.0,,Neil A Schrimsher Applied Industrial Technologies
2025-11-05,Robert E Price,PriceSmart,3,9,1,13,7.7,,Robert E Price PriceSmart
2025-11-05,John David Risher,Lyft,7,14,4,25,16.0,,John David Risher Lyft
2025-11-05,Gary B Smith,Ciena,6,19,0,25,0.0,,Gary B Smith Ciena
2025-11-05,Joey Levin,IAC,6,17,2,25,8.0,,Joey Levin IAC
2025-11-05,Jim Jacobs,Country Financial,7,14,1,22,4.5,,Jim Jacobs Country Financial
2025-11-05,Devin B McGranahan,Western Union,5,16,1,22,4.5,,Devin B McGranahan Western Union
2025-11-05,R Scott Rowe,Flowserve,4,5,2,11,18.2,,R Scott Rowe Flowserve
2025-11-05,Kenneth A Vecchione,Western Alliance Bancorp,9,9,7,25,28.0,,Kenneth A Vecchione Western Alliance Bancorp
2025-11-05,John C Rademacher,Option Care Health,15,2,0,17,0.0,,John C Rademacher Option Care Health
2025-11-05,Doug Black,SiteOne Landscape Supply,3,21,1,25,4.0,,Doug Black SiteOne Landscape Supply
2025-11-05,Oliver G Brewer III,Topgolf Callaway Brands,1,1,0,2,0.0,,Oliver G Brewer III Topgolf Callaway Brands
2025-11-05,Glenn Sanford,eXp World,10,14,1,25,4.0,,Glenn Sanford eXp World
2025-11-05,Fran Horowitz,Abercrombie & Fitch,10,10,5,25,20.0,,Fran Horowitz Abercrombie & Fitch
2025-11-05,Kevin Akers,Atmos Energy,13,4,0,17,0.0,,Kevin Akers Atmos Energy
2025-11-05,Alessandro Maselli,Catalent,2,21,2,25,8.0,,Alessandro Maselli Catalent
2025-11-05,J Powell Brown,Brown & Brown,7,14,4,25,16.0,,J Powell Brown Brown & Brown
2025-11-05,Aman Bhutani,GoDaddy,7,16,2,25,8.0,,Aman Bhutani GoDaddy
2025-11-05,John C. Griffith,American Water Works,3,20,2,25,8.0,,John C. Griffith American Water Works
2025-11-05,John J Marchioni,Selective Insurance Group,3,14,2,19,10.5,,John J Marchioni Selective Insurance Group
2025-11-05,Lawson E Whiting,Brown-Forman,4,17,4,25,16.0,,Lawson E Whiting Brown-Forman
2025-11-05,Dave Peacock,Advantage Solutions,20,3,2,25,8.0,,Dave Peacock Advantage Solutions
2025-11-05,Mick Farrell,ResMed,15,10,0,25,0.0,,Mick Farrell ResMed
2025-11-05,Kamal Hathi,Splunk,6,8,0,14,0.0,,Kamal Hathi Splunk
2025-11-05,Todd Kelsey,Plexus Corp,2,8,1,11,9.1,,Todd Kelsey Plexus Corp
2025-11-05,Phillip D Yeager,Hub Group,3,10,0,13,0.0,,Phillip D Yeager Hub Group
2025-11-05,Steven B Hedlund,Lincoln Electric,6,14,0,20,0.0,,Steven B Hedlund Lincoln Electric
2025-11-05,Timothy C Oliver,NCR Atleos,2,3,0,5,0.0,,Timothy C Oliver NCR Atleos
2025-11-05,Bruce Fleming,Calumet Inc,2,6,0,8,0.0,,Bruce Fleming Calumet Inc
2025-11-05,Daniel S. Peyovich,Dycom Industries,0,3,0,3,0.0,,Daniel S. Peyovich Dycom Industries
2025-11-05,Avner M Applbaum,Valmont Industries,1,8,0,9,0.0,,Avner M Applbaum Valmont Industries
2025-11-05,Kimberly A Fields,ATI Inc,7,18,0,25,0.0,,Kimberly A Fields ATI Inc
2025-11-05,Khozema Z Shipchandler,Twilio,1,6,2,9,22.2,,Khozema Z Shipchandler Twilio
2025-11-05,Gary C Bhojwani,CNO Financial Group,4,8,0,12,0.0,,Gary C Bhojwani CNO Financial Group
2025-11-05,William Andrew Hendricks Jr,Patterson-UTI Energy,4,0,0,4,0.0,,William Andrew Hendricks Jr Patterson-UTI Energy
2025-11-05,Kevin D Hochman,Brinker International,7,17,1,25,4.0,,Kevin D Hochman Brinker International
2025-11-05,James C Foster,Charles River Laboratories International,3,19,3,25,12.0,,James C Foster Charles River Laboratories International
2025-11-05,Rajiv K Prasad,Hyster-Yale,1,8,1,10,10.0,,Rajiv K Prasad Hyster-Yale
2025-11-05,Eric T Steigerwalt,Brighthouse Financial,5,13,2,20,10.0,,Eric T Steigerwalt Brighthouse Financial
2025-11-05,Thomas L Ryan,Service Corp International,6,17,1,24,4.2,,Thomas L Ryan Service Corp International
2025-11-05,Charles M Nifong Jr,CrossAmerica Partners,0,0,0,0,0.0,,Charles M Nifong Jr CrossAmerica Partners
2025-11-05,Anirudh Devgan,Cadence,9,15,1,25,4.0,,Anirudh Devgan Cadence
2025-11-05,Andi Owen,MillerKnoll,9,10,6,25,24.0,,Andi Owen MillerKnoll
2025-11-05,Sumit Roy,Realty Income,9,13,3,25,12.0,,Sumit Roy Realty Income
2025-11-05,Timothy John Fitzgerald,Middleby,0,0,0,0,0.0,,Timothy John Fitzgerald Middleby
2025-11-05,Robert H Schottenstein,M/I Homes,4,7,0,11,0.0,,Robert H Schottenstein M/I Homes
2025-11-05,Stephen P MacMillan,Hologic,5,8,1,14,7.1,,Stephen P MacMillan Hologic
2025-11-05,Lisa M Barton,Alliant Energy,8,1,0,9,0.0,,Lisa M Barton Alliant Energy
2025-11-05,Aaron P Jagdfeld,Generac,2,11,2,15,13.3,,Aaron P Jagdfeld Generac
2025-11-05,Erik Gershwind,MSC Industrial Direct,4,19,2,25,8.0,,Erik Gershwind MSC Industrial Direct
2025-11-05,Varun Krishna,Rocket Companies,3,17,5,25,20.0,,Varun Krishna Rocket Companies
2025-11-05,Fahmi Karam,Upbound Group,5,6,0,11,0.0,,Fahmi Karam Upbound Group
2025-11-05,NADominic Ng,East West Bancorp,0,0,0,0,0.0,,NADominic Ng East West Bancorp
2025-11-05,Mark Wang,Hilton Grand Vacations,25,0,0,25,0.0,,Mark Wang Hilton Grand Vacations
2025-11-05,Robert J Sheedy Jr,Grocery Outlet Holding,0,0,0,0,0.0,,Robert J Sheedy Jr Grocery Outlet Holding
2025-11-05,Simon D Campion,Dentsply Sirona,0,12,1,13,7.7,,Simon D Campion Dentsply Sirona
2025-11-05,Jeremy Wensinger,V2X,15,9,1,25,4.0,,Jeremy Wensinger V2X
2025-11-05,Andrew Rees,Crocs,5,12,8,25,32.0,,Andrew Rees Crocs
2025-11-05,David M Maura,Spectrum Brands,8,5,0,13,0.0,,David M Maura Spectrum Brands
2025-11-05,Sachin S Lawande,Visteon,9,14,2,25,8.0,,Sachin S Lawande Visteon
2025-11-05,Neil M Ashe,Acuity Inc,1,9,0,10,0.0,,Neil M Ashe Acuity Inc
2025-11-05,Lorie L Tekorius,The Greenbrier Companies,0,7,4,11,36.4,,Lorie L Tekorius The Greenbrier Companies
2025-11-05,John R Ciulla,Webster Financial,9,15,0,24,0.0,,John R Ciulla Webster Financial
2025-11-05,Sean D Keohane,Cabot Corporation,4,6,3,13,23.1,,Sean D Keohane Cabot Corporation
2025-11-05,Drew M Wilkerson,RXO Inc,2,6,2,10,20.0,,Drew M Wilkerson RXO Inc
2025-11-05,Daniel E Brown,Chord Energy,2,0,0,2,0.0,,Daniel E Brown Chord Energy
2025-11-05,Javier D Ferrer Fernandez,Popular Inc,1,4,1,6,16.7,,Javier D Ferrer Fernandez Popular Inc
2025-11-05,Olivier Rabiller,Garrett Motion Inc,3,11,0,14,0.0,,Olivier Rabiller Garrett Motion Inc
2025-11-05,Ronald N Tutor,Tutor Perini Corporation,5,17,2,24,8.3,,Ronald N Tutor Tutor Perini Corporation
2025-11-05,Jeff Liaw,Copart,7,10,2,19,10.5,,Jeff Liaw Copart
2025-11-05,Aman Narang,Toast Inc,6,16,3,25,12.0,,Aman Narang Toast Inc
2025-11-05,Joseph M Hogan,Align Technology,5,14,6,25,24.0,,Joseph M Hogan Align Technology
2025-11-05,Kevin J Wheeler,A O Smith,2,23,0,25,0.0,,Kevin J Wheeler A O Smith
2025-11-05,Christopher A Cartwright,TransUnion,7,14,4,25,16.0,,Christopher A Cartwright TransUnion
2025-11-05,James Kelly,NCR Voyix,1,14,0,15,0.0,,James Kelly NCR Voyix
2025-11-05,Tom Leighton,Akamai Technologies,14,11,0,25,0.0,,Tom Leighton Akamai Technologies
2025-11-05,Robert G Painter,Trimble Inc,12,4,1,17,5.9,,Robert G Painter Trimble Inc
2025-11-05,Tony Helton,Medical Mutual of Ohio,3,6,1,10,10.0,,Tony Helton Medical Mutual of Ohio
2025-11-05,Caroline S Grace,AMN Healthcare Services,1,0,0,1,0.0,,Caroline S Grace AMN Healthcare Services
2025-11-05,Patrick Kaltenbach,Mettler-Toledo International,3,3,0,6,0.0,,Patrick Kaltenbach Mettler-Toledo International
2025-11-05,Michael L Baur,ScanSource,2,3,2,7,28.6,,Michael L Baur ScanSource
2025-11-05,Jason Lippert,LCI Industries,10,15,0,25,0.0,,Jason Lippert LCI Industries
2025-11-05,Fredric J Tomczyk,Cboe Global Markets,0,16,4,20,20.0,,Fredric J Tomczyk Cboe Global Markets
2025-11-05,Octavio Marquez,Diebold Nixdorf,6,16,1,23,4.3,,Octavio Marquez Diebold Nixdorf
2025-11-05,Sivasankaran Somasundaram,ChampionX,6,4,0,10,0.0,,Sivasankaran Somasundaram ChampionX
2025-11-05,Ronald F Clarke,Corpay,3,4,1,8,12.5,,Ronald F Clarke Corpay
2025-11-05,Robert W Pittman,iHeartMedia,8,15,1,24,4.2,,Robert W Pittman iHeartMedia
2025-11-05,Patrick Zalupski,Dream Finders Homes,15,8,2,25,8.0,,Patrick Zalupski Dream Finders Homes
2025-11-05,Keith E Smith,Boyd Gaming,6,17,2,25,8.0,,Keith E Smith Boyd Gaming
2025-11-05,Mehran Assadi,NLV Financial,0,1,0,1,0.0,,Mehran Assadi NLV Financial
2025-11-05,Barry R Port,Ensign Group,2,9,2,13,15.4,,Barry R Port Ensign Group
2025-11-05,Denise A Paulonis,Sally Beauty,16,2,0,18,0.0,,Denise A Paulonis Sally Beauty
2025-11-05,Clifford A Skelton,Conduent,0,4,1,5,20.0,,Clifford A Skelton Conduent
2025-11-05,Jean-Michel Ribieras,Sylvamo,1,9,0,10,0.0,,Jean-Michel Ribieras Sylvamo
2025-11-05,Douglas F Bauer,Tri Pointe Homes,0,7,0,7,0.0,,Douglas F Bauer Tri Pointe Homes
2025-11-05,Shawn O'Connell,EnerSys,5,4,1,10,10.0,,Shawn O'Connell EnerSys
2025-11-05,Bill Meury,Incyte,5,18,1,24,4.2,,Bill Meury Incyte
2025-11-05,Dale Francescon,Century Communities,3,20,2,25,8.0,,Dale Francescon Century Communities
2025-11-05,Michael Nierenberg,Rithm Capital,9,14,2,25,8.0,,Michael Nierenberg Rithm Capital
2025-11-05,Michael J Brown,Euronet Worldwide,3,5,1,9,11.1,,Michael J Brown Euronet Worldwide
2025-11-05,Scott Seu,Hawaiian Electric Industries,4,17,4,25,16.0,,Scott Seu Hawaiian Electric Industries
2025-11-05,Jason D Robins,DraftKings,5,14,6,25,24.0,,Jason D Robins DraftKings
2025-11-05,Jonathan J Mazelsky,IDEXX Laboratories,1,4,4,9,44.4,,Jonathan J Mazelsky IDEXX Laboratories
2025-11-05,Richard S Swartz,MYR Group,1,0,0,1,0.0,,Richard S Swartz MYR Group
2025-11-05,Stefano Caroti,Deckers Outdoor,10,14,1,25,4.0,,Stefano Caroti Deckers Outdoor
2025-11-05,Kevin R Sayer,DexCom,3,9,7,19,36.8,,Kevin R Sayer DexCom
2025-11-05,John T C Lee,MKS Instruments,9,16,0,25,0.0,,John T C Lee MKS Instruments
2025-11-05,Edward B Pitoniak,VICI Properties,0,9,1,10,10.0,,Edward B Pitoniak VICI Properties
2025-11-05,Albert White III,Cooper Cos,7,14,4,25,16.0,,Albert White III Cooper Cos
2025-11-05,Barry L Biffle,Frontier Airlines,3,14,8,25,32.0,,Barry L Biffle Frontier Airlines
2025-11-05,Robert A Bruggeworth,Qorvo,2,7,3,12,25.0,,Robert A Bruggeworth Qorvo
2025-11-05,Winnie Park,Five Below,8,16,1,25,4.0,,Winnie Park Five Below
2025-11-05,Steven Oakland,TreeHouse Foods,4,20,1,25,4.0,,Steven Oakland TreeHouse Foods
2025-11-05,James S Hagedorn,Scotts Miracle-Gro,1,7,2,10,20.0,,James S Hagedorn Scotts Miracle-Gro
2025-11-05,Michael Cannon-Brookes,Atlassian,10,12,3,25,12.0,,Michael Cannon-Brookes Atlassian
2025-11-05,Bertrand Loy,Entegris,7,13,5,25,20.0,,Bertrand Loy Entegris
2025-11-05,William E Waltz,Atkore,2,4,1,7,14.3,,William E Waltz Atkore
2025-11-05,Celeste B Mastin,HB Fuller,1,13,1,15,6.7,,Celeste B Mastin HB Fuller
2025-11-05,Kyle T Larkin,Granite Construction,1,10,0,11,0.0,,Kyle T Larkin Granite Construction
2025-11-05,Michael J Happe,Winnebago Industries,3,5,3,11,27.3,,Michael J Happe Winnebago Industries
2025-11-05,Steven H Gunby,FTI Consulting,9,12,0,21,0.0,,Steven H Gunby FTI Consulting
2025-11-05,Stephan B Tanda,AptarGroup,2,19,4,25,16.0,,Stephan B Tanda AptarGroup
2025-11-05,Timothy P Boyle,Columbia Sportswear,5,8,3,16,18.8,,Timothy P Boyle Columbia Sportswear
2025-11-05,Anthony J Wood,Roku,9,10,3,22,13.6,,Anthony J Wood Roku
2025-11-05,M Christopher Doyle,Civitas Resources,2,3,1,6,16.7,,M Christopher Doyle Civitas Resources
2025-11-05,Andy Eidson,Alpha Metallurgical Resources,3,6,2,11,18.2,,Andy Eidson Alpha Metallurgical Resources
2025-11-05,Andy L Nemeth,Patrick Industries,2,5,0,7,0.0,,Andy L Nemeth Patrick Industries
2025-11-05,Roger W Jenkins,Murphy Oil,3,17,5,25,20.0,,Roger W Jenkins Murphy Oil
2025-11-05,Kevin S Blair,Synovus Financial,5,8,0,13,0.0,,Kevin S Blair Synovus Financial
2025-11-05,Julie Felss Masino,Cracker Barrel Old Country Store,2,9,14,25,56.0,,Julie Felss Masino Cracker Barrel Old Country Store
2025-11-05,David M Overton,Cheesecake Factory,6,18,1,25,4.0,,David M Overton Cheesecake Factory
2025-11-05,Nick DeIuliis,CNX Resources,12,12,1,25,4.0,,Nick DeIuliis CNX Resources
2025-11-05,Christopher Pappas,Chefs Warehouse,6,16,3,25,12.0,,Christopher Pappas Chefs Warehouse
2025-11-05,Tod Carpenter,Donaldson Company,6,10,5,21,23.8,,Tod Carpenter Donaldson Company
2025-11-05,Gregory L Christopher,Mueller Industries,6,13,1,20,5.0,,Gregory L Christopher Mueller Industries
2025-11-05,Rob Saltiel,MRC Global,4,16,1,21,4.8,,Rob Saltiel MRC Global
2025-11-05,Jillian C Evanko,Chart Industries,3,8,0,11,0.0,,Jillian C Evanko Chart Industries
2025-11-05,Dave Guilmette,Alight Solutions,1,11,0,12,0.0,,Dave Guilmette Alight Solutions
2025-11-05,Joel Smejkal,Vishay Intertechnology,9,14,2,25,8.0,,Joel Smejkal Vishay Intertechnology
2025-11-05,Dennis Degner,Range Resources,4,6,0,10,0.0,,Dennis Degner Range Resources
2025-11-05,Ira D Robbins,Valley National Bancorp,4,8,3,15,20.0,,Ira D Robbins Valley National Bancorp
2025-11-05,Bernard Kim,Match Group,6,13,6,25,24.0,,Bernard Kim Match Group
2025-11-05,Vincent Pilette,Gen Digital,3,8,0,11,0.0,,Vincent Pilette Gen Digital
2025-11-05,Timothy S Crane,Wintrust Financial,1,9,0,10,0.0,,Timothy S Crane Wintrust Financial
2025-11-05,Pat Roche,Moog Inc,4,15,4,23,17.4,,Pat Roche Moog Inc
2025-11-05,Mark R Widmar,First Solar,11,10,4,25,16.0,,Mark R Widmar First Solar
2025-11-05,Niko Lahanas,Central Garden & Pet,2,9,0,11,0.0,,Niko Lahanas Central Garden & Pet
2025-11-05,Chris Osowski,Green Plains Inc,6,8,2,16,12.5,,Chris Osowski Green Plains Inc
2025-11-05,Derek J Leathers,Werner Enterprises,2,8,3,13,23.1,,Derek J Leathers Werner Enterprises
2025-11-05,Adam Foroughi,AppLovin,5,18,2,25,8.0,,Adam Foroughi AppLovin
2025-11-05,Luca Savi,ITT,1,11,0,12,0.0,,Luca Savi ITT
2025-11-05,Lawrence H Silber,Herc Rentals,2,3,0,5,0.0,,Lawrence H Silber Herc Rentals
2025-11-05,Hilton H Howell Jr,Gray Television,7,17,1,25,4.0,,Hilton H Howell Jr Gray Television
2025-11-05,Eric D Ashleman,IDEX,1,7,0,8,0.0,,Eric D Ashleman IDEX
2025-11-05,Owen D Thomas,Boston Properties,6,18,1,25,4.0,,Owen D Thomas Boston Properties
2025-11-05,Kurt Wolf,Pitney Bowes,3,22,0,25,0.0,,Kurt Wolf Pitney Bowes
2025-11-05,Sara E Armbruster,Steelcase,11,3,0,14,0.0,,Sara E Armbruster Steelcase
2025-11-05,Charles D. Young,Sun Communities,9,13,0,22,0.0,,Charles D. Young Sun Communities
2025-11-05,Suzanne Foster,AdaptHealth,6,17,2,25,8.0,,Suzanne Foster AdaptHealth
2025-11-05,Grant E Sims,Genesis Energy,6,2,0,8,0.0,,Grant E Sims Genesis Energy
2025-11-05,Laura Prieskorn,Jackson Financial,6,14,4,24,16.7,,Laura Prieskorn Jackson Financial
2025-11-05,Rick L Wessel,FirstCash,1,6,2,9,22.2,,Rick L Wessel FirstCash
2025-11-05,Sherman Miller,Cal-Maine Foods,8,17,0,25,0.0,,Sherman Miller Cal-Maine Foods
2025-11-05,Paul A Lang,Arch Resources,16,7,2,25,8.0,,Paul A Lang Arch Resources
2025-11-05,Ashish K Khandpur,Avient,2,7,1,10,10.0,,Ashish K Khandpur Avient
2025-11-05,Shyam K Reddy,BlueLinx,1,8,0,9,0.0,,Shyam K Reddy BlueLinx
2025-11-05,Christopher S Ripley,Sinclair,5,14,6,25,24.0,,Christopher S Ripley Sinclair
2025-11-05,Stacy Kymes,BOK Financial,13,8,2,23,8.7,,Stacy Kymes BOK Financial
2025-11-05,James H Walter,Permian Resources,0,3,0,3,0.0,,James H Walter Permian Resources
2025-11-05,Jason Murray,PACS Group,8,14,3,25,12.0,,Jason Murray PACS Group
2025-11-05,Brian Armstrong,Coinbase Global,5,18,2,25,8.0,,Brian Armstrong Coinbase Global
2025-11-05,Oscar K Brown,Western Midstream Partners,4,6,0,10,0.0,,Oscar K Brown Western Midstream Partners
2025-11-05,Nicholas R Lower,Federated Mutual Insurance,1,2,3,6,50.0,,Nicholas R Lower Federated Mutual Insurance
2025-11-05,Morris Goldfarb,G-III Apparel Group,5,13,7,25,28.0,,Morris Goldfarb G-III Apparel Group
2025-11-05,Mark D Morelli,Vontier,1,4,0,5,0.0,,Mark D Morelli Vontier
2025-11-05,Matthew J Cox,Matson Inc,3,11,0,14,0.0,,Matthew J Cox Matson Inc
2025-11-05,David W Grzebinski,Kirby Corporation,4,8,2,14,14.3,,David W Grzebinski Kirby Corporation
2025-11-05,Keith A Harvey,Kaiser Aluminum,2,12,2,16,12.5,,Keith A Harvey Kaiser Aluminum
2025-11-05,Eric Nyman,Vista Outdoor,2,11,0,13,0.0,,Eric Nyman Vista Outdoor
2025-11-05,Doug Howe,Designer Brands,6,19,0,25,0.0,,Doug Howe Designer Brands
2025-11-05,Jerry E Gahlhoff Jr,Rollins Inc,2,4,1,7,14.3,,Jerry E Gahlhoff Jr Rollins Inc
2025-11-05,D Scott Barbour,Advanced Drainage Systems,3,5,1,9,11.1,,D Scott Barbour Advanced Drainage Systems
2025-11-05,Sean Gamble,Cinemark,12,7,6,25,24.0,,Sean Gamble Cinemark
2025-11-05,George Kurtz,CrowdStrike,8,13,4,25,16.0,,George Kurtz CrowdStrike
2025-11-05,Bill Ready,Pinterest,10,10,5,25,20.0,,Bill Ready Pinterest
2025-11-05,Fidji Simo,Instacart,6,19,0,25,0.0,,Fidji Simo Instacart
2025-11-05,Kimberly K Ryan,Hillenbrand,1,7,0,8,0.0,,Kimberly K Ryan Hillenbrand
2025-11-05,David S Graziosi,Allison Transmission,0,23,2,25,8.0,,David S Graziosi Allison Transmission
2025-11-05,Gary G Friedman,Restoration Hardware,5,16,4,25,16.0,,Gary G Friedman Restoration Hardware
2025-11-05,Lucinda M Baier,Brookdale Senior Living,4,10,2,16,12.5,,Lucinda M Baier Brookdale Senior Living
2025-11-05,Brian J Blaser,QuidelOrtho,0,7,1,8,12.5,,Brian J Blaser QuidelOrtho
2025-11-05,E Jean Savage,Trinity Industries,2,14,9,25,36.0,,E Jean Savage Trinity Industries
2025-11-05,Liam J Kelly,Teleflex,2,3,3,8,37.5,,Liam J Kelly Teleflex
2025-11-05,Laurans A Mendelson,HEICO,4,18,3,25,12.0,,Laurans A Mendelson HEICO
2025-11-05,Frank H Laukien,Bruker,0,12,1,13,7.7,,Frank H Laukien Bruker
2025-11-05,Harvey M Schwartz,Carlyle Group,7,15,3,25,12.0,,Harvey M Schwartz Carlyle Group
2025-11-05,Mark S LaVigne,Energizer Holdings,7,3,0,10,0.0,,Mark S LaVigne Energizer Holdings
2025-11-05,Amar Maletira,Rackspace Technology,2,18,5,25,20.0,,Amar Maletira Rackspace Technology
2025-11-05,Udit Batra,Waters Corporation,8,13,4,25,16.0,,Udit Batra Waters Corporation
2025-11-05,Eric M Green,West Pharmaceutical Services,10,15,0,25,0.0,,Eric M Green West Pharmaceutical Services
2025-11-05,Doug Palladini,Carters Inc,4,12,5,21,23.8,,Doug Palladini Carters Inc
2025-11-05,G Mike Mikan,NeueHealth,4,5,1,10,10.0,,G Mike Mikan NeueHealth
2025-11-05,Russell Chip Childs,SkyWest,0,7,0,7,0.0,,Russell Chip Childs SkyWest
2025-11-05,Christopher H Hunter,Acadia Healthcare,2,4,1,7,14.3,,Christopher H Hunter Acadia Healthcare
2025-11-05,Prahlad Singh,Revvity,5,12,0,17,0.0,,Prahlad Singh Revvity
2025-11-05,Maria M Pope,Portland General Electric,6,14,5,25,20.0,,Maria M Pope Portland General Electric
2025-11-05,Charles Chip Blankenship,Woodward Inc,2,11,0,13,0.0,,Charles Chip Blankenship Woodward Inc
2025-11-05,Mike Steib,TEGNA,11,12,2,25,8.0,,Mike Steib TEGNA
2025-11-05,Kurt J Ekert,Sabre Corporation,1,2,0,3,0.0,,Kurt J Ekert Sabre Corporation
2025-11-05,Matt Wilson,Light & Wonder,8,12,5,25,20.0,,Matt Wilson Light & Wonder
2025-11-05,Rob Katz,Vail Resorts,3,6,16,25,64.0,,Rob Katz Vail Resorts
2025-11-05,Schnitzer Steel Industries,Radius Recycling,0,15,10,25,40.0,,Schnitzer Steel Industries Radius Recycling
2025-11-05,David A Spector,PennyMac Financial Services,13,12,0,25,0.0,,David A Spector PennyMac Financial Services
2025-11-05,Frederick J Holzgrefe III,Saia Inc,1,3,0,4,0.0,,Frederick J Holzgrefe III Saia Inc
2025-11-05,Mark J Parrell,Equity Residential,5,10,2,17,11.8,,Mark J Parrell Equity Residential
2025-11-05,John W Lindsay,Helmerich & Payne,3,5,1,9,11.1,,John W Lindsay Helmerich & Payne
2025-11-05,Gary D Burnison,Korn Ferry,10,13,2,25,8.0,,Gary D Burnison Korn Ferry
