date,ceo,company,positive,neutral,negative,total,neg_pct,theme,alias
2025-10-27,Timothy J McGrath,PC Connection Inc,0,0,0,0,0.0,,Timothy J McGrath PC Connection Inc
2025-10-27,Lynn M Bamford,Curtiss-Wright,10,13,2,25,8.0,,Lynn M Bamford Curtiss-Wright
2025-10-27,Jonathan W Witter,Sallie Mae,4,4,1,9,11.1,,Jonathan W Witter Sallie Mae
2025-10-27,Jeff Benck,Benchmark Electronics,1,17,0,18,0.0,,Jeff Benck Benchmark Electronics
2025-10-27,Charles H Giancarlo,Pure Storage,5,12,1,18,5.6,,Charles H Giancarlo Pure Storage
2025-10-27,Brian R Gray,Knife River Corporation,1,1,0,2,0.0,,Brian R Gray Knife River Corporation
2025-10-27,Jay Schmidt,Caleres Inc,1,13,3,17,17.6,,Jay Schmidt Caleres Inc
2025-10-27,Dale Asplund,BrightView Holdings,1,8,0,9,0.0,,Dale Asplund BrightView Holdings
2025-10-27,Jeffrey S Edwards,Cooper-Standard,3,11,0,14,0.0,,Jeffrey S Edwards Cooper-Standard
2025-10-27,Glenn J Williams,Primerica,6,1,4,11,36.4,,Glenn J Williams Primerica
2025-10-27,Francois Locoh-Donou,F5,8,15,2,25,8.0,,Francois Locoh-Donou F5
2025-10-27,Joseph Wm Foran,Matador Resources,6,19,0,25,0.0,,Joseph Wm Foran Matador Resources
2025-10-27,Sridhar Ramaswamy,Snowflake Inc,9,15,1,25,4.0,,Sridhar Ramaswamy Snowflake Inc
2025-10-27,Mark D Dankberg,Viasat,1,7,5,13,38.5,,Mark D Dankberg Viasat
2025-10-27,Francisco J Leon,California Resources,1,4,2,7,28.6,,Francisco J Leon California Resources
2025-10-27,Peter Stern,Peloton Interactive,6,15,4,25,16.0,,Peter Stern Peloton Interactive
2025-10-27,David Baszucki,Roblox,6,15,4,25,16.0,,David Baszucki Roblox
2025-10-27,Jeffrey W Edwards,Installed Building Products,1,3,0,4,0.0,,Jeffrey W Edwards Installed Building Products
2025-10-27,Clark Lauritzen,First National of Nebraska,1,10,0,11,0.0,,Clark Lauritzen First National of Nebraska
2025-10-27,Carlos Alberini,Guess Inc,4,19,2,25,8.0,,Carlos Alberini Guess Inc
2025-10-27,Shyam P Kambeyanda,ESAB,3,3,0,6,0.0,,Shyam P Kambeyanda ESAB
2025-10-27,Edmund Shallcross III,Amica Mutual Insurance,3,7,0,10,0.0,,Edmund Shallcross III Amica Mutual Insurance
2025-10-27,Benjamin W Schall,AvalonBay Communities,2,13,1,16,6.2,,Benjamin W Schall AvalonBay Communities
2025-10-27,Allan C Thygesen,DocuSign,5,9,2,16,12.5,,Allan C Thygesen DocuSign
2025-10-27,Bryan J Knutson,Titan Machinery,1,2,1,4,25.0,,Bryan J Knutson Titan Machinery
2025-10-27,Heath Sampson,ModivCare,16,2,2,20,10.0,,Heath Sampson ModivCare
2025-10-27,Ara K Hovnanian,Hovnanian Enterprises,5,18,2,25,8.0,,Ara K Hovnanian Hovnanian Enterprises
2025-10-27,Joshua G Silverman,Etsy,7,15,3,25,12.0,,Joshua G Silverman Etsy
2025-10-27,Kevin Roycraft,Adams Resources & Energy,10,0,0,10,0.0,,Kevin Roycraft Adams Resources & Energy
2025-10-27,J Eric Evans,Surgery Partners,0,2,0,2,0.0,,J Eric Evans Surgery Partners
2025-10-27,Clint E Stein,Columbia Banking System,2,11,0,13,0.0,,Clint E Stein Columbia Banking System
2025-10-27,Lee M Shavel,Verisk Analytics,3,14,1,18,5.6,,Lee M Shavel Verisk Analytics
2025-10-27,Dave Banyard Jr,MasterBrand,0,0,1,1,100.0,,Dave Banyard Jr MasterBrand
2025-10-27,Peter R Ingram,Hawaiian Airlines Inc,2,10,2,14,14.3,,Peter R Ingram Hawaiian Airlines Inc
2025-10-27,Kristin A Dolan,AMC Networks,3,15,7,25,28.0,,Kristin A Dolan AMC Networks
2025-10-27,Brendan T Cavanagh,SBA Communications,2,8,0,10,0.0,,Brendan T Cavanagh SBA Communications
2025-10-27,George F Chappelle Jr,Americold Realty Trust,6,1,0,7,0.0,,George F Chappelle Jr Americold Realty Trust
2025-10-27,Thomas E Gottwald,NewMarket Corporation,1,11,0,12,0.0,,Thomas E Gottwald NewMarket Corporation
2025-10-27,Thomas J Baltimore Jr,Park Hotels & Resorts,4,20,1,25,4.0,,Thomas J Baltimore Jr Park Hotels & Resorts
2025-10-27,Peter M Moglia,Alexandria Real Estate Equities,2,7,0,9,0.0,,Peter M Moglia Alexandria Real Estate Equities
2025-10-27,Ronald J Kramer,Griffon Corporation,2,6,0,8,0.0,,Ronald J Kramer Griffon Corporation
2025-10-27,John L Plueger,Air Lease,4,21,0,25,0.0,,John L Plueger Air Lease
2025-10-27,Jennifer F Scanlon,UL Solutions,8,4,0,12,0.0,,Jennifer F Scanlon UL Solutions
2025-10-27,Greg Smith,Teradyne,4,14,3,21,14.3,,Greg Smith Teradyne
2025-10-27,Sean Trauschke,OGE Energy,20,4,1,25,4.0,,Sean Trauschke OGE Energy
2025-10-27,Norman D Schwartz,Bio-Rad Laboratories,4,4,1,9,11.1,,Norman D Schwartz Bio-Rad Laboratories
2025-10-27,Scott Doyle,Spire Inc,7,9,4,20,20.0,,Scott Doyle Spire Inc
2025-10-27,Michael E Reed,Gannett,0,5,2,7,28.6,,Michael E Reed Gannett
2025-10-27,Cindy J Miller,Stericycle,3,5,2,10,20.0,,Cindy J Miller Stericycle
2025-10-27,Phillip D Green,Cullen Frost Bankers,3,5,3,11,27.3,,Phillip D Green Cullen Frost Bankers
2025-10-27,Joseph D Margolis,Extra Space Storage,1,12,1,14,7.1,,Joseph D Margolis Extra Space Storage
2025-10-27,Mark A Skonieczny,REV Group,3,9,1,13,7.7,,Mark A Skonieczny REV Group
2025-10-27,Ladd Wilks,ProFrac Holding,3,1,0,4,0.0,,Ladd Wilks ProFrac Holding
2025-10-27,Sundaram Nagarajan,Nordson,8,16,1,25,4.0,,Sundaram Nagarajan Nordson
2025-10-27,Anne P Noonan,Summit Materials,1,8,0,9,0.0,,Anne P Noonan Summit Materials
2025-10-27,Lori Flees,Valvoline Inc,3,7,6,16,37.5,,Lori Flees Valvoline Inc
2025-10-27,Scott H Baxter,Kontoor Brands,4,5,1,10,10.0,,Scott H Baxter Kontoor Brands
2025-10-27,Tim Larson,Skyline Champion,14,1,0,15,0.0,,Tim Larson Skyline Champion
2025-10-27,Chuck Divita,Teladoc Health,7,15,3,25,12.0,,Chuck Divita Teladoc Health
2025-10-27,W Bradley Southern,Louisiana-Pacific Corporation,0,2,0,2,0.0,,W Bradley Southern Louisiana-Pacific Corporation
2025-10-27,George C Freeman III,Universal Corporation,6,18,1,25,4.0,,George C Freeman III Universal Corporation
2025-10-27,James A Brock,Consol Energy,9,4,0,13,0.0,,James A Brock Consol Energy
2025-10-27,Robert Antokol,Playtika Holding,1,7,1,9,11.1,,Robert Antokol Playtika Holding
2025-10-27,Joe Craft,Alliance Resource Partners,9,12,4,25,16.0,,Joe Craft Alliance Resource Partners
2025-10-27,Paul Keel,Envista,4,10,3,17,17.6,,Paul Keel Envista
2025-10-27,Jared Isaacman,Shift4 Payments,3,19,3,25,12.0,,Jared Isaacman Shift4 Payments
2025-10-27,Mark Mac McFarland,Talen Energy,7,1,1,9,11.1,,Mark Mac McFarland Talen Energy
2025-10-27,Tony R Thene,Carpenter Technology,1,14,0,15,0.0,,Tony R Thene Carpenter Technology
2025-10-27,Melissa D Smith,WEX,5,11,2,18,11.1,,Melissa D Smith WEX
2025-10-27,James Jim C Ryan III,Old National Bancorp,3,9,2,14,14.3,,James Jim C Ryan III Old National Bancorp
2025-10-27,Peter J Federico,AGNC Investment,1,1,1,3,33.3,,Peter J Federico AGNC Investment
2025-10-27,Brent L Yeagy,Wabash National,0,2,0,2,0.0,,Brent L Yeagy Wabash National
2025-10-27,Henry A Fernandez,MSCI,6,16,3,25,12.0,,Henry A Fernandez MSCI
2025-10-27,Mark Penn,Stagwell,5,17,3,25,12.0,,Mark Penn Stagwell
2025-10-27,Julie Schertell,Mativ,3,14,0,17,0.0,,Julie Schertell Mativ
2025-10-27,Ashish Chand,Belden,3,5,1,9,11.1,,Ashish Chand Belden
2025-10-27,Greg Anderson,Allegiant Travel Company,9,14,2,25,8.0,,Greg Anderson Allegiant Travel Company
2025-10-27,Drew Houston,Dropbox,7,14,4,25,16.0,,Drew Houston Dropbox
2025-10-27,Kevin T Conroy,Exact Sciences,2,12,11,25,44.0,,Kevin T Conroy Exact Sciences
2025-10-27,Rex D Geveden,BWX Technologies,8,11,1,20,5.0,,Rex D Geveden BWX Technologies
2025-10-27,Scott R Wells,Clear Channel Outdoor Hldgs,5,2,0,7,0.0,,Scott R Wells Clear Channel Outdoor Hldgs
2025-10-27,Casey Wasserman,Wasserman,12,13,0,25,0.0,,Casey Wasserman
2025-10-27,Mac Cummings,Terakeet,3,7,0,10,0.0,,Mac Cummings Terakeet
