date,ceo,company,positive,neutral,negative,total,neg_pct,theme,alias
2025-12-03,Gerben W Bakker,Hubbell,1,4,1,6,16.7,,Gerben W Bakker Hubbell
2025-12-03,Dave Davis,Spirit Airlines,5,15,5,25,20.0,,Dave Davis Spirit Airlines
2025-12-03,Michael J Smith,Lamb Weston,0,15,10,25,40.0,,Michael J Smith Lamb Weston
2025-12-03,Strauss Zelnick,Take-Two Interactive Software,10,11,4,25,16.0,,Strauss Zelnick Take-Two Interactive Software
2025-12-03,John C Turner Jr,GMS,6,18,1,25,4.0,,John C Turner Jr GMS
2025-12-03,David M O'Malley,Penn Mutual Life Insurance,2,7,0,9,0.0,,David M O'Malley Penn Mutual Life Insurance
2025-12-03,Frank A Lonegro,Landstar System,3,8,1,12,8.3,,Frank A Lonegro Landstar System
2025-12-03,James F Risoleo,Host Hotels & Resorts,6,18,1,25,4.0,,James F Risoleo Host Hotels & Resorts
2025-12-03,Ken Xie,Fortinet,12,10,3,25,12.0,,Ken Xie Fortinet
2025-12-03,Doug Shulman,OneMain,2,7,1,10,10.0,,Doug Shulman OneMain
2025-12-03,Ryan Cohen,GameStop,9,12,4,25,16.0,,Ryan Cohen GameStop
2025-12-03,Mark W Begor,Equifax,2,23,0,25,0.0,,Mark W Begor Equifax
2025-12-03,Jay L Schottenstein,American Eagle Outfitters,8,14,3,25,12.0,,Jay L Schottenstein American Eagle Outfitters
2025-12-03,Curtis C Farmer,Comerica,5,14,2,21,9.5,,Curtis C Farmer Comerica
2025-12-03,Ole Rosgaard,Greif,5,18,2,25,8.0,,Ole Rosgaard Greif
2025-12-03,Brian E Lane,Comfort Systems USA,23,0,0,23,0.0,,Brian E Lane Comfort Systems USA
2025-12-03,Robert M Buck,TopBuild,1,8,0,9,0.0,,Robert M Buck TopBuild
2025-12-03,Ralph Andretta,Bread Financial,4,12,0,16,0.0,,Ralph Andretta Bread Financial
2025-12-03,Jim Anderson,Coherent,2,21,2,25,8.0,,Jim Anderson Coherent
2025-12-03,Walter C. D. Carlson,Telephone & Data Systems,1,11,1,13,7.7,,Walter C. D. Carlson Telephone & Data Systems
2025-12-03,Ronald Kruszewski,Stifel Financial,9,14,2,25,8.0,,Ronald Kruszewski Stifel Financial
2025-12-03,Richard Hayne,Urban Outfitters,6,16,3,25,12.0,,Richard Hayne Urban Outfitters
2025-12-03,Simon Meester,Terex,3,20,2,25,8.0,,Simon Meester Terex
2025-12-03,Edward J Lehner,Ryerson Holding,0,1,0,1,0.0,,Edward J Lehner Ryerson Holding
2025-12-03,Nicholas T Pinchuk,Snap-on,4,5,0,9,0.0,,Nicholas T Pinchuk Snap-on
2025-12-03,Ryals McMullian,Flowers Foods,5,18,2,25,8.0,,Ryals McMullian Flowers Foods
2025-12-03,D Bryan Jordan,First Horizon,6,16,3,25,12.0,,D Bryan Jordan First Horizon
2025-12-03,John B Gibson,Paychex,2,8,1,11,9.1,,John B Gibson Paychex
2025-12-03,Chris Cocks,Hasbro,10,8,7,25,28.0,,Chris Cocks Hasbro
2025-12-03,Pete McPartland,Sentry Insurance Group,8,14,0,22,0.0,,Pete McPartland Sentry Insurance Group
2025-12-03,Michael Arougheti,Ares Management,9,14,2,25,8.0,,Michael Arougheti Ares Management
2025-12-03,Alok Maskara,Lennox International,12,9,2,23,8.7,,Alok Maskara Lennox International
2025-12-03,James C Grech,Peabody Energy,3,2,1,6,16.7,,James C Grech Peabody Energy
2025-12-03,Joseph P Lacher Jr,Kemper Corporation,3,20,2,25,8.0,,Joseph P Lacher Jr Kemper Corporation
2025-12-03,Perry A Sook,Nexstar Media Group,4,21,0,25,0.0,,Perry A Sook Nexstar Media Group
2025-12-03,Wade Davis,TelevisaUnivision,8,16,1,25,4.0,,Wade Davis TelevisaUnivision
2025-12-03,Scott L Thompson,Tempur Sealy International,0,8,0,8,0.0,,Scott L Thompson Tempur Sealy International
2025-12-03,Mike Simonds,TriNet Group,5,19,1,25,4.0,,Mike Simonds TriNet Group
2025-12-03,B Andrew Rose,Worthington Enterprises,1,9,0,10,0.0,,B Andrew Rose Worthington Enterprises
2025-12-03,Bruce L Caswell,Maximus,4,7,0,11,0.0,,Bruce L Caswell Maximus
2025-12-03,Robert L Reffkin,Compass Group,1,8,2,11,18.2,,Robert L Reffkin Compass Group
2025-12-03,Mark Eubanks,Brinks Company,6,11,4,21,19.0,,Mark Eubanks Brinks Company
2025-12-03,Peter Quigley,Kelly Services Inc,8,17,0,25,0.0,,Peter Quigley Kelly Services Inc
2025-12-03,David L Yowan,Navient,1,2,0,3,0.0,,David L Yowan Navient
2025-12-03,Mary E Kipp,Puget Sound Energy,6,3,1,10,10.0,,Mary E Kipp Puget Sound Energy
2025-12-03,Adam Aron,AMC Entertainment,9,9,7,25,28.0,,Adam Aron AMC Entertainment
2025-12-03,Mark J Tarr,Encompass Health,2,7,2,11,18.2,,Mark J Tarr Encompass Health
2025-12-03,Liam K Griffin,Skyworks Solutions,2,7,4,13,30.8,,Liam K Griffin Skyworks Solutions
2025-12-03,Richard G Kyle,Timken,2,22,1,25,4.0,,Richard G Kyle Timken
2025-12-03,Ron Gusek,Liberty Energy,24,0,1,25,4.0,,Ron Gusek Liberty Energy
2025-12-03,John E Geller Jr,Marriott Vacations Worldwide,5,11,2,18,11.1,,John E Geller Jr Marriott Vacations Worldwide
2025-12-03,Karl G. Glassman,Leggett & Platt,1,4,1,6,16.7,,Karl G. Glassman Leggett & Platt
2025-12-03,Jonathan H Weis,Weis Markets,5,20,0,25,0.0,,Jonathan H Weis Weis Markets
2025-12-03,Jeffrey B Guldner,Pinnacle West Capital,3,3,1,7,14.3,,Jeffrey B Guldner Pinnacle West Capital
2025-12-03,Arkadiy Dobkin,EPAM Systems,6,17,2,25,8.0,,Arkadiy Dobkin EPAM Systems
2025-12-03,Paul M Rady,Antero Resources,5,8,0,13,0.0,,Paul M Rady Antero Resources
2025-12-03,Michael Spanos,Bloomin Brands,3,20,2,25,8.0,,Michael Spanos Bloomin Brands
2025-12-03,Nicole A Kivisto,MDU Resources Group,10,14,1,25,4.0,,Nicole A Kivisto MDU Resources Group
2025-12-03,Gerald L Morgan,Texas Roadhouse,5,6,7,18,38.9,,Gerald L Morgan Texas Roadhouse
2025-12-03,Gabriel Tirador,Mercury General,3,10,0,13,0.0,,Gabriel Tirador Mercury General
2025-12-03,Nicholas I Fink,Fortune Brands Innovations,4,20,1,25,4.0,,Nicholas I Fink Fortune Brands Innovations
2025-12-03,Paul E Burdiss,Zions Bancorp,1,5,1,7,14.3,,Paul E Burdiss Zions Bancorp
2025-12-03,William J Christensen,JELD-WEN Holding,2,10,1,13,7.7,,William J Christensen JELD-WEN Holding
2025-12-03,Evan Spiegel,Snap Inc,8,14,3,25,12.0,,Evan Spiegel Snap Inc
2025-12-03,Bill Burns,Zebra Technologies,3,21,1,25,4.0,,Bill Burns Zebra Technologies
2025-12-03,Steven Sell,Agilon Health,4,10,6,20,30.0,,Steven Sell Agilon Health
2025-12-03,Richard M Olson,Toro Company,1,19,5,25,20.0,,Richard M Olson Toro Company
2025-12-03,Eric S Yuan,Zoom Video Communications,10,12,3,25,12.0,,Eric S Yuan Zoom Video Communications
2025-12-03,Dan L Batrack,Tetra Tech,5,5,0,10,0.0,,Dan L Batrack Tetra Tech
2025-12-03,Joseph D Russell Jr,Public Storage,0,10,2,12,16.7,,Joseph D Russell Jr Public Storage
2025-12-03,Jacob Thaysen,Illumina Inc,8,16,1,25,4.0,,Jacob Thaysen Illumina Inc
2025-12-03,Debra A Cafaro,Ventas Inc,14,10,1,25,4.0,,Debra A Cafaro Ventas Inc
2025-12-03,Pierre R Brondeau,FMC Corporation,3,7,4,14,28.6,,Pierre R Brondeau FMC Corporation
2025-12-03,Judy R McReynolds,ArcBest,6,18,1,25,4.0,,Judy R McReynolds ArcBest
2025-12-03,Russell J Weiner,Dominos Pizza Inc,8,13,4,25,16.0,,Russell J Weiner Dominos Pizza Inc
2025-12-03,Theodore S Hanson,ASGN,2,5,0,7,0.0,,Theodore S Hanson ASGN
2025-12-03,RJ Scaringe,Rivian Automotive,2,16,7,25,28.0,,RJ Scaringe Rivian Automotive
2025-12-03,Jeffrey N Simmons,Elanco Animal Health,12,9,4,25,16.0,,Jeffrey N Simmons Elanco Animal Health
2025-12-03,Tim O Shaughnessy,Graham Holdings Company,2,21,1,24,4.2,,Tim O Shaughnessy Graham Holdings Company
2025-12-03,Thomas V Taylor,Floor & Decor,2,6,3,11,27.3,,Thomas V Taylor Floor & Decor
2025-12-03,Neil A Schrimsher,Applied Industrial Technologies,4,11,0,15,0.0,,Neil A Schrimsher Applied Industrial Technologies
2025-12-03,Robert E Price,PriceSmart,3,8,0,11,0.0,,Robert E Price PriceSmart
2025-12-03,John David Risher,Lyft,7,14,4,25,16.0,,John David Risher Lyft
2025-12-03,Gary B Smith,Ciena,8,17,0,25,0.0,,Gary B Smith Ciena
2025-12-03,Joey Levin,IAC,7,17,1,25,4.0,,Joey Levin IAC
2025-12-03,Jim Jacobs,Country Financial,7,17,1,25,4.0,,Jim Jacobs Country Financial
2025-12-03,Devin B McGranahan,Western Union,7,18,0,25,0.0,,Devin B McGranahan Western Union
2025-12-03,R Scott Rowe,Flowserve,7,1,2,10,20.0,,R Scott Rowe Flowserve
2025-12-03,Kenneth A Vecchione,Western Alliance Bancorp,8,10,7,25,28.0,,Kenneth A Vecchione Western Alliance Bancorp
2025-12-03,John C Rademacher,Option Care Health,12,4,0,16,0.0,,John C Rademacher Option Care Health
2025-12-03,Doug Black,SiteOne Landscape Supply,3,21,1,25,4.0,,Doug Black SiteOne Landscape Supply
2025-12-03,Oliver G Brewer III,Topgolf Callaway Brands,1,3,0,4,0.0,,Oliver G Brewer III Topgolf Callaway Brands
2025-12-03,Glenn Sanford,eXp World,10,14,1,25,4.0,,Glenn Sanford eXp World
2025-12-03,Fran Horowitz,Abercrombie & Fitch,12,11,2,25,8.0,,Fran Horowitz Abercrombie & Fitch
2025-12-03,Kevin Akers,Atmos Energy,8,2,1,11,9.1,,Kevin Akers Atmos Energy
2025-12-03,Alessandro Maselli,Catalent,3,21,1,25,4.0,,Alessandro Maselli Catalent
2025-12-03,J Powell Brown,Brown & Brown,7,11,7,25,28.0,,J Powell Brown Brown & Brown
2025-12-03,Aman Bhutani,GoDaddy,7,16,2,25,8.0,,Aman Bhutani GoDaddy
2025-12-03,John C. Griffith,American Water Works,3,20,2,25,8.0,,John C. Griffith American Water Works
2025-12-03,John J Marchioni,Selective Insurance Group,2,12,3,17,17.6,,John J Marchioni Selective Insurance Group
2025-12-03,Lawson E Whiting,Brown-Forman,4,18,3,25,12.0,,Lawson E Whiting Brown-Forman
2025-12-03,Dave Peacock,Advantage Solutions,21,3,1,25,4.0,,Dave Peacock Advantage Solutions
2025-12-03,Mick Farrell,ResMed,11,13,1,25,4.0,,Mick Farrell ResMed
2025-12-03,Kamal Hathi,Splunk,7,8,0,15,0.0,,Kamal Hathi Splunk
2025-12-03,Todd Kelsey,Plexus Corp,4,5,1,10,10.0,,Todd Kelsey Plexus Corp
2025-12-03,Phillip D Yeager,Hub Group,4,9,0,13,0.0,,Phillip D Yeager Hub Group
2025-12-03,Steven B Hedlund,Lincoln Electric,6,18,0,24,0.0,,Steven B Hedlund Lincoln Electric
2025-12-03,Timothy C Oliver,NCR Atleos,1,3,0,4,0.0,,Timothy C Oliver NCR Atleos
2025-12-03,Bruce Fleming,Calumet Inc,4,7,1,12,8.3,,Bruce Fleming Calumet Inc
2025-12-03,Daniel S. Peyovich,Dycom Industries,0,4,0,4,0.0,,Daniel S. Peyovich Dycom Industries
2025-12-03,Avner M Applbaum,Valmont Industries,0,7,0,7,0.0,,Avner M Applbaum Valmont Industries
2025-12-03,Kimberly A Fields,ATI Inc,7,18,0,25,0.0,,Kimberly A Fields ATI Inc
2025-12-03,Khozema Z Shipchandler,Twilio,1,7,4,12,33.3,,Khozema Z Shipchandler Twilio
2025-12-03,Gary C Bhojwani,CNO Financial Group,1,12,1,14,7.1,,Gary C Bhojwani CNO Financial Group
2025-12-03,William Andrew Hendricks Jr,Patterson-UTI Energy,3,2,1,6,16.7,,William Andrew Hendricks Jr Patterson-UTI Energy
2025-12-03,Kevin D Hochman,Brinker International,9,13,3,25,12.0,,Kevin D Hochman Brinker International
2025-12-03,James C Foster,Charles River Laboratories International,4,20,1,25,4.0,,James C Foster Charles River Laboratories International
2025-12-03,Rajiv K Prasad,Hyster-Yale,0,8,1,9,11.1,,Rajiv K Prasad Hyster-Yale
2025-12-03,Eric T Steigerwalt,Brighthouse Financial,4,14,3,21,14.3,,Eric T Steigerwalt Brighthouse Financial
2025-12-03,Thomas L Ryan,Service Corp International,6,14,1,21,4.8,,Thomas L Ryan Service Corp International
2025-12-03,Charles M Nifong Jr,CrossAmerica Partners,0,0,0,0,0.0,,Charles M Nifong Jr CrossAmerica Partners
2025-12-03,Anirudh Devgan,Cadence,9,13,3,25,12.0,,Anirudh Devgan Cadence
2025-12-03,Andi Owen,MillerKnoll,7,11,7,25,28.0,,Andi Owen MillerKnoll
2025-12-03,Sumit Roy,Realty Income,8,16,1,25,4.0,,Sumit Roy Realty Income
2025-12-03,Timothy John Fitzgerald,Middleby,0,0,0,0,0.0,,Timothy John Fitzgerald Middleby
2025-12-03,Robert H Schottenstein,M/I Homes,4,8,0,12,0.0,,Robert H Schottenstein M/I Homes
2025-12-03,Stephen P MacMillan,Hologic,5,8,0,13,0.0,,Stephen P MacMillan Hologic
2025-12-03,Lisa M Barton,Alliant Energy,8,0,0,8,0.0,,Lisa M Barton Alliant Energy
2025-12-03,Aaron P Jagdfeld,Generac,1,10,2,13,15.4,,Aaron P Jagdfeld Generac
2025-12-03,Erik Gershwind,MSC Industrial Direct,8,14,3,25,12.0,,Erik Gershwind MSC Industrial Direct
2025-12-03,Varun Krishna,Rocket Companies,5,16,4,25,16.0,,Varun Krishna Rocket Companies
2025-12-03,Fahmi Karam,Upbound Group,5,7,0,12,0.0,,Fahmi Karam Upbound Group
2025-12-03,NADominic Ng,East West Bancorp,0,0,0,0,0.0,,NADominic Ng East West Bancorp
2025-12-03,Mark Wang,Hilton Grand Vacations,25,0,0,25,0.0,,Mark Wang Hilton Grand Vacations
2025-12-03,Robert J Sheedy Jr,Grocery Outlet Holding,0,0,0,0,0.0,,Robert J Sheedy Jr Grocery Outlet Holding
2025-12-03,Simon D Campion,Dentsply Sirona,0,8,1,9,11.1,,Simon D Campion Dentsply Sirona
2025-12-03,Jeremy Wensinger,V2X,8,8,0,16,0.0,,Jeremy Wensinger V2X
2025-12-03,Andrew Rees,Crocs,9,11,5,25,20.0,,Andrew Rees Crocs
2025-12-03,David M Maura,Spectrum Brands,7,3,1,11,9.1,,David M Maura Spectrum Brands
2025-12-03,Sachin S Lawande,Visteon,10,14,1,25,4.0,,Sachin S Lawande Visteon
2025-12-03,Neil M Ashe,Acuity Inc,0,10,1,11,9.1,,Neil M Ashe Acuity Inc
2025-12-03,Lorie L Tekorius,The Greenbrier Companies,0,9,1,10,10.0,,Lorie L Tekorius The Greenbrier Companies
2025-12-03,John R Ciulla,Webster Financial,10,15,0,25,0.0,,John R Ciulla Webster Financial
2025-12-03,Sean D Keohane,Cabot Corporation,3,7,1,11,9.1,,Sean D Keohane Cabot Corporation
2025-12-03,Drew M Wilkerson,RXO Inc,2,5,1,8,12.5,,Drew M Wilkerson RXO Inc
2025-12-03,Daniel E Brown,Chord Energy,2,0,0,2,0.0,,Daniel E Brown Chord Energy
2025-12-03,Javier D Ferrer Fernandez,Popular Inc,2,5,2,9,22.2,,Javier D Ferrer Fernandez Popular Inc
2025-12-03,Olivier Rabiller,Garrett Motion Inc,3,11,0,14,0.0,,Olivier Rabiller Garrett Motion Inc
2025-12-03,Ronald N Tutor,Tutor Perini Corporation,5,15,2,22,9.1,,Ronald N Tutor Tutor Perini Corporation
2025-12-03,Jeff Liaw,Copart,9,7,4,20,20.0,,Jeff Liaw Copart
2025-12-03,Aman Narang,Toast Inc,5,16,4,25,16.0,,Aman Narang Toast Inc
2025-12-03,Joseph M Hogan,Align Technology,7,13,5,25,20.0,,Joseph M Hogan Align Technology
2025-12-03,Kevin J Wheeler,A O Smith,3,21,1,25,4.0,,Kevin J Wheeler A O Smith
2025-12-03,Christopher A Cartwright,TransUnion,8,13,4,25,16.0,,Christopher A Cartwright TransUnion
2025-12-03,James Kelly,NCR Voyix,1,14,0,15,0.0,,James Kelly NCR Voyix
2025-12-03,Tom Leighton,Akamai Technologies,13,10,2,25,8.0,,Tom Leighton Akamai Technologies
2025-12-03,Robert G Painter,Trimble Inc,12,4,1,17,5.9,,Robert G Painter Trimble Inc
2025-12-03,Tony Helton,Medical Mutual of Ohio,2,7,1,10,10.0,,Tony Helton Medical Mutual of Ohio
2025-12-03,Caroline S Grace,AMN Healthcare Services,1,0,0,1,0.0,,Caroline S Grace AMN Healthcare Services
2025-12-03,Patrick Kaltenbach,Mettler-Toledo International,6,2,0,8,0.0,,Patrick Kaltenbach Mettler-Toledo International
2025-12-03,Michael L Baur,ScanSource,1,4,1,6,16.7,,Michael L Baur ScanSource
2025-12-03,Jason Lippert,LCI Industries,7,17,1,25,4.0,,Jason Lippert LCI Industries
2025-12-03,Fredric J Tomczyk,Cboe Global Markets,3,14,4,21,19.0,,Fredric J Tomczyk Cboe Global Markets
2025-12-03,Octavio Marquez,Diebold Nixdorf,5,15,0,20,0.0,,Octavio Marquez Diebold Nixdorf
2025-12-03,Sivasankaran Somasundaram,ChampionX,8,2,0,10,0.0,,Sivasankaran Somasundaram ChampionX
2025-12-03,Ronald F Clarke,Corpay,2,5,1,8,12.5,,Ronald F Clarke Corpay
2025-12-03,Robert W Pittman,iHeartMedia,8,17,0,25,0.0,,Robert W Pittman iHeartMedia
2025-12-03,Patrick Zalupski,Dream Finders Homes,14,9,2,25,8.0,,Patrick Zalupski Dream Finders Homes
2025-12-03,Keith E Smith,Boyd Gaming,5,12,1,18,5.6,,Keith E Smith Boyd Gaming
2025-12-03,Mehran Assadi,NLV Financial,0,1,0,1,0.0,,Mehran Assadi NLV Financial
2025-12-03,Barry R Port,Ensign Group,0,11,2,13,15.4,,Barry R Port Ensign Group
2025-12-03,Denise A Paulonis,Sally Beauty,20,4,0,24,0.0,,Denise A Paulonis Sally Beauty
2025-12-03,Clifford A Skelton,Conduent,2,6,0,8,0.0,,Clifford A Skelton Conduent
2025-12-03,Jean-Michel Ribieras,Sylvamo,2,10,0,12,0.0,,Jean-Michel Ribieras Sylvamo
2025-12-03,Douglas F Bauer,Tri Pointe Homes,0,8,0,8,0.0,,Douglas F Bauer Tri Pointe Homes
2025-12-03,Shawn O'Connell,EnerSys,4,4,1,9,11.1,,Shawn O'Connell EnerSys
2025-12-03,Bill Meury,Incyte,5,18,1,24,4.2,,Bill Meury Incyte
2025-12-03,Dale Francescon,Century Communities,4,19,2,25,8.0,,Dale Francescon Century Communities
2025-12-03,Michael Nierenberg,Rithm Capital,8,16,1,25,4.0,,Michael Nierenberg Rithm Capital
2025-12-03,Michael J Brown,Euronet Worldwide,3,5,1,9,11.1,,Michael J Brown Euronet Worldwide
2025-12-03,Scott Seu,Hawaiian Electric Industries,5,17,3,25,12.0,,Scott Seu Hawaiian Electric Industries
2025-12-03,Jason D Robins,DraftKings,4,16,5,25,20.0,,Jason D Robins DraftKings
2025-12-03,Jonathan J Mazelsky,IDEXX Laboratories,1,4,4,9,44.4,,Jonathan J Mazelsky IDEXX Laboratories
2025-12-03,Richard S Swartz,MYR Group,1,0,0,1,0.0,,Richard S Swartz MYR Group
2025-12-03,Stefano Caroti,Deckers Outdoor,10,13,2,25,8.0,,Stefano Caroti Deckers Outdoor
2025-12-03,Kevin R Sayer,DexCom,2,7,7,16,43.8,,Kevin R Sayer DexCom
2025-12-03,John T C Lee,MKS Instruments,6,19,0,25,0.0,,John T C Lee MKS Instruments
2025-12-03,Edward B Pitoniak,VICI Properties,0,10,0,10,0.0,,Edward B Pitoniak VICI Properties
2025-12-03,Albert White III,Cooper Cos,7,13,4,24,16.7,,Albert White III Cooper Cos
2025-12-03,Barry L Biffle,Frontier Airlines,4,11,10,25,40.0,,Barry L Biffle Frontier Airlines
2025-12-03,Robert A Bruggeworth,Qorvo,3,6,2,11,18.2,,Robert A Bruggeworth Qorvo
2025-12-03,Winnie Park,Five Below,9,15,1,25,4.0,,Winnie Park Five Below
2025-12-03,Steven Oakland,TreeHouse Foods,4,20,1,25,4.0,,Steven Oakland TreeHouse Foods
2025-12-03,James S Hagedorn,Scotts Miracle-Gro,1,7,2,10,20.0,,James S Hagedorn Scotts Miracle-Gro
2025-12-03,Michael Cannon-Brookes,Atlassian,9,13,3,25,12.0,,Michael Cannon-Brookes Atlassian
2025-12-03,Bertrand Loy,Entegris,5,16,4,25,16.0,,Bertrand Loy Entegris
2025-12-03,William E Waltz,Atkore,2,4,0,6,0.0,,William E Waltz Atkore
2025-12-03,Celeste B Mastin,HB Fuller,2,12,0,14,0.0,,Celeste B Mastin HB Fuller
2025-12-03,Kyle T Larkin,Granite Construction,2,13,0,15,0.0,,Kyle T Larkin Granite Construction
2025-12-03,Michael J Happe,Winnebago Industries,6,4,3,13,23.1,,Michael J Happe Winnebago Industries
2025-12-03,Steven H Gunby,FTI Consulting,6,18,0,24,0.0,,Steven H Gunby FTI Consulting
2025-12-03,Stephan B Tanda,AptarGroup,4,11,1,16,6.2,,Stephan B Tanda AptarGroup
2025-12-03,Timothy P Boyle,Columbia Sportswear,4,10,5,19,26.3,,Timothy P Boyle Columbia Sportswear
2025-12-03,Anthony J Wood,Roku,9,12,4,25,16.0,,Anthony J Wood Roku
2025-12-03,M Christopher Doyle,Civitas Resources,3,3,0,6,0.0,,M Christopher Doyle Civitas Resources
2025-12-03,Andy Eidson,Alpha Metallurgical Resources,5,6,12,23,52.2,,Andy Eidson Alpha Metallurgical Resources
2025-12-03,Andy L Nemeth,Patrick Industries,1,4,0,5,0.0,,Andy L Nemeth Patrick Industries
2025-12-03,Roger W Jenkins,Murphy Oil,5,16,4,25,16.0,,Roger W Jenkins Murphy Oil
2025-12-03,Kevin S Blair,Synovus Financial,3,5,0,8,0.0,,Kevin S Blair Synovus Financial
2025-12-03,Julie Felss Masino,Cracker Barrel Old Country Store,3,10,12,25,48.0,,Julie Felss Masino Cracker Barrel Old Country Store
2025-12-03,David M Overton,Cheesecake Factory,6,18,1,25,4.0,,David M Overton Cheesecake Factory
2025-12-03,Nick DeIuliis,CNX Resources,15,9,1,25,4.0,,Nick DeIuliis CNX Resources
2025-12-03,Christopher Pappas,Chefs Warehouse,5,17,2,24,8.3,,Christopher Pappas Chefs Warehouse
2025-12-03,Tod Carpenter,Donaldson Company,5,9,5,19,26.3,,Tod Carpenter Donaldson Company
2025-12-03,Gregory L Christopher,Mueller Industries,13,10,2,25,8.0,,Gregory L Christopher Mueller Industries
2025-12-03,Rob Saltiel,MRC Global,2,18,3,23,13.0,,Rob Saltiel MRC Global
2025-12-03,Jillian C Evanko,Chart Industries,2,6,2,10,20.0,,Jillian C Evanko Chart Industries
2025-12-03,Dave Guilmette,Alight Solutions,1,13,1,15,6.7,,Dave Guilmette Alight Solutions
2025-12-03,Joel Smejkal,Vishay Intertechnology,9,14,2,25,8.0,,Joel Smejkal Vishay Intertechnology
2025-12-03,Dennis Degner,Range Resources,3,6,0,9,0.0,,Dennis Degner Range Resources
2025-12-03,Ira D Robbins,Valley National Bancorp,5,4,2,11,18.2,,Ira D Robbins Valley National Bancorp
2025-12-03,Bernard Kim,Match Group,6,13,6,25,24.0,,Bernard Kim Match Group
2025-12-03,Vincent Pilette,Gen Digital,3,10,0,13,0.0,,Vincent Pilette Gen Digital
2025-12-03,Timothy S Crane,Wintrust Financial,1,9,0,10,0.0,,Timothy S Crane Wintrust Financial
2025-12-03,Pat Roche,Moog Inc,4,13,4,21,19.0,,Pat Roche Moog Inc
2025-12-03,Mark R Widmar,First Solar,10,8,7,25,28.0,,Mark R Widmar First Solar
2025-12-03,Niko Lahanas,Central Garden & Pet,3,10,0,13,0.0,,Niko Lahanas Central Garden & Pet
2025-12-03,Chris Osowski,Green Plains Inc,9,14,2,25,8.0,,Chris Osowski Green Plains Inc
2025-12-03,Derek J Leathers,Werner Enterprises,2,9,2,13,15.4,,Derek J Leathers Werner Enterprises
2025-12-03,Adam Foroughi,AppLovin,3,21,1,25,4.0,,Adam Foroughi AppLovin
2025-12-03,Luca Savi,ITT,1,10,0,11,0.0,,Luca Savi ITT
2025-12-03,Lawrence H Silber,Herc Rentals,3,3,0,6,0.0,,Lawrence H Silber Herc Rentals
2025-12-03,Hilton H Howell Jr,Gray Television,5,17,3,25,12.0,,Hilton H Howell Jr Gray Television
2025-12-03,Eric D Ashleman,IDEX,2,10,0,12,0.0,,Eric D Ashleman IDEX
2025-12-03,Owen D Thomas,Boston Properties,3,22,0,25,0.0,,Owen D Thomas Boston Properties
2025-12-03,Kurt Wolf,Pitney Bowes,4,20,1,25,4.0,,Kurt Wolf Pitney Bowes
2025-12-03,Sara E Armbruster,Steelcase,10,5,0,15,0.0,,Sara E Armbruster Steelcase
2025-12-03,Charles D. Young,Sun Communities,8,9,0,17,0.0,,Charles D. Young Sun Communities
2025-12-03,Suzanne Foster,AdaptHealth,6,13,3,22,13.6,,Suzanne Foster AdaptHealth
2025-12-03,Grant E Sims,Genesis Energy,8,2,0,10,0.0,,Grant E Sims Genesis Energy
2025-12-03,Laura Prieskorn,Jackson Financial,7,13,3,23,13.0,,Laura Prieskorn Jackson Financial
2025-12-03,Rick L Wessel,FirstCash,2,5,2,9,22.2,,Rick L Wessel FirstCash
2025-12-03,Sherman Miller,Cal-Maine Foods,9,16,0,25,0.0,,Sherman Miller Cal-Maine Foods
2025-12-03,Paul A Lang,Arch Resources,16,8,1,25,4.0,,Paul A Lang Arch Resources
2025-12-03,Ashish K Khandpur,Avient,1,7,1,9,11.1,,Ashish K Khandpur Avient
2025-12-03,Shyam K Reddy,BlueLinx,1,7,0,8,0.0,,Shyam K Reddy BlueLinx
2025-12-03,Christopher S Ripley,Sinclair,9,12,4,25,16.0,,Christopher S Ripley Sinclair
2025-12-03,Stacy Kymes,BOK Financial,14,7,1,22,4.5,,Stacy Kymes BOK Financial
2025-12-03,James H Walter,Permian Resources,0,3,0,3,0.0,,James H Walter Permian Resources
2025-12-03,Jason Murray,PACS Group,8,12,5,25,20.0,,Jason Murray PACS Group
2025-12-03,Brian Armstrong,Coinbase Global,9,13,3,25,12.0,,Brian Armstrong Coinbase Global
2025-12-03,Oscar K Brown,Western Midstream Partners,4,6,1,11,9.1,,Oscar K Brown Western Midstream Partners
2025-12-03,Nicholas R Lower,Federated Mutual Insurance,0,2,2,4,50.0,,Nicholas R Lower Federated Mutual Insurance
2025-12-03,Morris Goldfarb,G-III Apparel Group,5,15,5,25,20.0,,Morris Goldfarb G-III Apparel Group
2025-12-03,Mark D Morelli,Vontier,1,5,0,6,0.0,,Mark D Morelli Vontier
2025-12-03,Matthew J Cox,Matson Inc,2,9,0,11,0.0,,Matthew J Cox Matson Inc
2025-12-03,David W Grzebinski,Kirby Corporation,2,8,3,13,23.1,,David W Grzebinski Kirby Corporation
2025-12-03,Keith A Harvey,Kaiser Aluminum,1,8,1,10,10.0,,Keith A Harvey Kaiser Aluminum
2025-12-03,Eric Nyman,Vista Outdoor,2,14,1,17,5.9,,Eric Nyman Vista Outdoor
2025-12-03,Doug Howe,Designer Brands,6,18,1,25,4.0,,Doug Howe Designer Brands
2025-12-03,Jerry E Gahlhoff Jr,Rollins Inc,1,3,0,4,0.0,,Jerry E Gahlhoff Jr Rollins Inc
2025-12-03,D Scott Barbour,Advanced Drainage Systems,6,2,0,8,0.0,,D Scott Barbour Advanced Drainage Systems
2025-12-03,Sean Gamble,Cinemark,12,5,8,25,32.0,,Sean Gamble Cinemark
2025-12-03,George Kurtz,CrowdStrike,7,17,1,25,4.0,,George Kurtz CrowdStrike
2025-12-03,Bill Ready,Pinterest,12,10,3,25,12.0,,Bill Ready Pinterest
2025-12-03,Fidji Simo,Instacart,8,16,1,25,4.0,,Fidji Simo Instacart
2025-12-03,Kimberly K Ryan,Hillenbrand,1,8,0,9,0.0,,Kimberly K Ryan Hillenbrand
2025-12-03,David S Graziosi,Allison Transmission,0,23,2,25,8.0,,David S Graziosi Allison Transmission
2025-12-03,Gary G Friedman,Restoration Hardware,6,16,3,25,12.0,,Gary G Friedman Restoration Hardware
2025-12-03,Lucinda M Baier,Brookdale Senior Living,5,8,3,16,18.8,,Lucinda M Baier Brookdale Senior Living
2025-12-03,Brian J Blaser,QuidelOrtho,1,6,1,8,12.5,,Brian J Blaser QuidelOrtho
2025-12-03,E Jean Savage,Trinity Industries,4,12,9,25,36.0,,E Jean Savage Trinity Industries
2025-12-03,Liam J Kelly,Teleflex,2,2,2,6,33.3,,Liam J Kelly Teleflex
2025-12-03,Laurans A Mendelson,HEICO,5,17,3,25,12.0,,Laurans A Mendelson HEICO
2025-12-03,Frank H Laukien,Bruker,3,9,0,12,0.0,,Frank H Laukien Bruker
2025-12-03,Harvey M Schwartz,Carlyle Group,8,14,3,25,12.0,,Harvey M Schwartz Carlyle Group
2025-12-03,Mark S LaVigne,Energizer Holdings,7,0,0,7,0.0,,Mark S LaVigne Energizer Holdings
2025-12-03,Amar Maletira,Rackspace Technology,2,19,4,25,16.0,,Amar Maletira Rackspace Technology
2025-12-03,Udit Batra,Waters Corporation,5,15,5,25,20.0,,Udit Batra Waters Corporation
2025-12-03,Eric M Green,West Pharmaceutical Services,9,16,0,25,0.0,,Eric M Green West Pharmaceutical Services
2025-12-03,Doug Palladini,Carters Inc,4,8,3,15,20.0,,Doug Palladini Carters Inc
2025-12-03,G Mike Mikan,NeueHealth,5,5,2,12,16.7,,G Mike Mikan NeueHealth
2025-12-03,Russell Chip Childs,SkyWest,0,6,0,6,0.0,,Russell Chip Childs SkyWest
2025-12-03,Christopher H Hunter,Acadia Healthcare,1,5,2,8,25.0,,Christopher H Hunter Acadia Healthcare
2025-12-03,Prahlad Singh,Revvity,3,8,0,11,0.0,,Prahlad Singh Revvity
2025-12-03,Maria M Pope,Portland General Electric,12,9,4,25,16.0,,Maria M Pope Portland General Electric
2025-12-03,Charles Chip Blankenship,Woodward Inc,2,10,0,12,0.0,,Charles Chip Blankenship Woodward Inc
2025-12-03,Mike Steib,TEGNA,11,12,2,25,8.0,,Mike Steib TEGNA
2025-12-03,Kurt J Ekert,Sabre Corporation,2,3,0,5,0.0,,Kurt J Ekert Sabre Corporation
2025-12-03,Matt Wilson,Light & Wonder,10,12,3,25,12.0,,Matt Wilson Light & Wonder
2025-12-03,Rob Katz,Vail Resorts,6,6,13,25,52.0,,Rob Katz Vail Resorts
2025-12-03,Schnitzer Steel Industries,Radius Recycling,0,15,10,25,40.0,,Schnitzer Steel Industries Radius Recycling
2025-12-03,David A Spector,PennyMac Financial Services,12,13,0,25,0.0,,David A Spector PennyMac Financial Services
2025-12-03,Frederick J Holzgrefe III,Saia Inc,1,8,0,9,0.0,,Frederick J Holzgrefe III Saia Inc
2025-12-03,Mark J Parrell,Equity Residential,4,7,2,13,15.4,,Mark J Parrell Equity Residential
2025-12-03,John W Lindsay,Helmerich & Payne,3,5,2,10,20.0,,John W Lindsay Helmerich & Payne
2025-12-03,Gary D Burnison,Korn Ferry,7,13,1,21,4.8,,Gary D Burnison Korn Ferry
