date,ceo,company,positive,neutral,negative,total,neg_pct,theme,alias
2025-10-19,Gerben W Bakker,Hubbell,1,4,0,5,0.0,,Gerben W Bakker Hubbell
2025-10-19,Dave Davis,Spirit Airlines,7,11,7,25,28.0,,Dave Davis Spirit Airlines
2025-10-19,Michael J Smith,Lamb Weston,1,13,11,25,44.0,,Michael J Smith Lamb Weston
2025-10-19,Strauss Zelnick,Take-Two Interactive Software,7,13,5,25,20.0,,Strauss Zelnick Take-Two Interactive Software
2025-10-19,John C Turner Jr,GMS,6,19,0,25,0.0,,John C Turner Jr GMS
2025-10-19,David M O'Malley,Penn Mutual Life Insurance,2,7,1,10,10.0,,David M O'Malley Penn Mutual Life Insurance
2025-10-19,Frank A Lonegro,Landstar System,4,6,1,11,9.1,,Frank A Lonegro Landstar System
2025-10-19,James F Risoleo,Host Hotels & Resorts,5,15,0,20,0.0,,James F Risoleo Host Hotels & Resorts
2025-10-19,Ken Xie,Fortinet,9,13,3,25,12.0,,Ken Xie Fortinet
2025-10-19,Doug Shulman,OneMain,2,6,0,8,0.0,,Doug Shulman OneMain
2025-10-19,Ryan Cohen,GameStop,9,11,5,25,20.0,,Ryan Cohen GameStop
2025-10-19,Mark W Begor,Equifax,4,20,1,25,4.0,,Mark W Begor Equifax
2025-10-19,Jay L Schottenstein,American Eagle Outfitters,6,16,3,25,12.0,,Jay L Schottenstein American Eagle Outfitters
2025-10-19,Curtis C Farmer,Comerica,4,13,0,17,0.0,,Curtis C Farmer Comerica
2025-10-19,Ole Rosgaard,Greif,4,20,1,25,4.0,,Ole Rosgaard Greif
2025-10-19,Brian E Lane,Comfort Systems USA,20,0,0,20,0.0,,Brian E Lane Comfort Systems USA
2025-10-19,Robert M Buck,TopBuild,0,10,0,10,0.0,,Robert M Buck TopBuild
2025-10-19,Ralph Andretta,Bread Financial,5,10,0,15,0.0,,Ralph Andretta Bread Financial
2025-10-19,Jim Anderson,Coherent,3,20,2,25,8.0,,Jim Anderson Coherent
2025-10-19,Walter C. D. Carlson,Telephone & Data Systems,1,9,4,14,28.6,,Walter C. D. Carlson Telephone & Data Systems
2025-10-19,Ronald Kruszewski,Stifel Financial,11,13,1,25,4.0,,Ronald Kruszewski Stifel Financial
2025-10-19,Richard Hayne,Urban Outfitters,5,17,3,25,12.0,,Richard Hayne Urban Outfitters
2025-10-19,Simon Meester,Terex,2,20,3,25,12.0,,Simon Meester Terex
2025-10-19,Edward J Lehner,Ryerson Holding,0,2,0,2,0.0,,Edward J Lehner Ryerson Holding
2025-10-19,Nicholas T Pinchuk,Snap-on,6,9,0,15,0.0,,Nicholas T Pinchuk Snap-on
2025-10-19,Ryals McMullian,Flowers Foods,5,18,2,25,8.0,,Ryals McMullian Flowers Foods
2025-10-19,D Bryan Jordan,First Horizon,11,11,3,25,12.0,,D Bryan Jordan First Horizon
2025-10-19,John B Gibson,Paychex,2,6,2,10,20.0,,John B Gibson Paychex
2025-10-19,Chris Cocks,Hasbro,9,7,9,25,36.0,,Chris Cocks Hasbro
2025-10-19,Pete McPartland,Sentry Insurance Group,6,16,0,22,0.0,,Pete McPartland Sentry Insurance Group
2025-10-19,Michael Arougheti,Ares Management,9,14,2,25,8.0,,Michael Arougheti Ares Management
2025-10-19,Alok Maskara,Lennox International,11,12,1,24,4.2,,Alok Maskara Lennox International
2025-10-19,James C Grech,Peabody Energy,4,1,0,5,0.0,,James C Grech Peabody Energy
2025-10-19,Joseph P Lacher Jr,Kemper Corporation,8,17,0,25,0.0,,Joseph P Lacher Jr Kemper Corporation
2025-10-19,Perry A Sook,Nexstar Media Group,5,16,4,25,16.0,,Perry A Sook Nexstar Media Group
2025-10-19,Wade Davis,TelevisaUnivision,5,19,1,25,4.0,,Wade Davis TelevisaUnivision
2025-10-19,Scott L Thompson,Tempur Sealy International,0,10,0,10,0.0,,Scott L Thompson Tempur Sealy International
2025-10-19,Mike Simonds,TriNet Group,5,13,0,18,0.0,,Mike Simonds TriNet Group
2025-10-19,B Andrew Rose,Worthington Enterprises,1,7,0,8,0.0,,B Andrew Rose Worthington Enterprises
2025-10-19,Bruce L Caswell,Maximus,6,6,0,12,0.0,,Bruce L Caswell Maximus
2025-10-19,Robert L Reffkin,Compass Group,3,8,1,12,8.3,,Robert L Reffkin Compass Group
2025-10-19,Mark Eubanks,Brinks Company,5,13,3,21,14.3,,Mark Eubanks Brinks Company
2025-10-19,Peter Quigley,Kelly Services Inc,8,17,0,25,0.0,,Peter Quigley Kelly Services Inc
2025-10-19,David L Yowan,Navient,1,4,0,5,0.0,,David L Yowan Navient
2025-10-19,Mary E Kipp,Puget Sound Energy,7,2,1,10,10.0,,Mary E Kipp Puget Sound Energy
2025-10-19,Adam Aron,AMC Entertainment,10,9,6,25,24.0,,Adam Aron AMC Entertainment
2025-10-19,Mark J Tarr,Encompass Health,3,5,1,9,11.1,,Mark J Tarr Encompass Health
2025-10-19,Liam K Griffin,Skyworks Solutions,2,10,1,13,7.7,,Liam K Griffin Skyworks Solutions
2025-10-19,Richard G Kyle,Timken,2,22,1,25,4.0,,Richard G Kyle Timken
2025-10-19,Ron Gusek,Liberty Energy,24,1,0,25,0.0,,Ron Gusek Liberty Energy
2025-10-19,John E Geller Jr,Marriott Vacations Worldwide,4,8,0,12,0.0,,John E Geller Jr Marriott Vacations Worldwide
2025-10-19,Karl G. Glassman,Leggett & Platt,0,4,0,4,0.0,,Karl G. Glassman Leggett & Platt
2025-10-19,Jonathan H Weis,Weis Markets,6,19,0,25,0.0,,Jonathan H Weis Weis Markets
2025-10-19,Jeffrey B Guldner,Pinnacle West Capital,3,7,0,10,0.0,,Jeffrey B Guldner Pinnacle West Capital
2025-10-19,Arkadiy Dobkin,EPAM Systems,6,18,1,25,4.0,,Arkadiy Dobkin EPAM Systems
2025-10-19,Paul M Rady,Antero Resources,3,14,0,17,0.0,,Paul M Rady Antero Resources
2025-10-19,Michael Spanos,Bloomin Brands,4,19,2,25,8.0,,Michael Spanos Bloomin Brands
2025-10-19,Nicole A Kivisto,MDU Resources Group,8,10,0,18,0.0,,Nicole A Kivisto MDU Resources Group
2025-10-19,Gerald L Morgan,Texas Roadhouse,5,8,7,20,35.0,,Gerald L Morgan Texas Roadhouse
2025-10-19,Gabriel Tirador,Mercury General,6,10,0,16,0.0,,Gabriel Tirador Mercury General
2025-10-19,Nicholas I Fink,Fortune Brands Innovations,0,24,1,25,4.0,,Nicholas I Fink Fortune Brands Innovations
2025-10-19,Paul E Burdiss,Zions Bancorp,1,4,0,5,0.0,,Paul E Burdiss Zions Bancorp
2025-10-19,William J Christensen,JELD-WEN Holding,1,12,0,13,0.0,,William J Christensen JELD-WEN Holding
2025-10-19,Evan Spiegel,Snap Inc,8,13,4,25,16.0,,Evan Spiegel Snap Inc
2025-10-19,Bill Burns,Zebra Technologies,4,20,1,25,4.0,,Bill Burns Zebra Technologies
2025-10-19,Steven Sell,Agilon Health,4,9,8,21,38.1,,Steven Sell Agilon Health
2025-10-19,Richard M Olson,Toro Company,0,23,2,25,8.0,,Richard M Olson Toro Company
2025-10-19,Eric S Yuan,Zoom Video Communications,7,15,3,25,12.0,,Eric S Yuan Zoom Video Communications
2025-10-19,Dan L Batrack,Tetra Tech,5,6,1,12,8.3,,Dan L Batrack Tetra Tech
2025-10-19,Joseph D Russell Jr,Public Storage,0,10,0,10,0.0,,Joseph D Russell Jr Public Storage
2025-10-19,Jacob Thaysen,Illumina Inc,7,16,2,25,8.0,,Jacob Thaysen Illumina Inc
2025-10-19,Debra A Cafaro,Ventas Inc,13,11,1,25,4.0,,Debra A Cafaro Ventas Inc
2025-10-19,Pierre R Brondeau,FMC Corporation,1,7,3,11,27.3,,Pierre R Brondeau FMC Corporation
2025-10-19,Judy R McReynolds,ArcBest,5,18,2,25,8.0,,Judy R McReynolds ArcBest
2025-10-19,Russell J Weiner,Dominos Pizza Inc,9,11,5,25,20.0,,Russell J Weiner Dominos Pizza Inc
2025-10-19,Theodore S Hanson,ASGN,1,3,0,4,0.0,,Theodore S Hanson ASGN
2025-10-19,RJ Scaringe,Rivian Automotive,3,15,7,25,28.0,,RJ Scaringe Rivian Automotive
2025-10-19,Jeffrey N Simmons,Elanco Animal Health,10,11,4,25,16.0,,Jeffrey N Simmons Elanco Animal Health
2025-10-19,Tim O Shaughnessy,Graham Holdings Company,3,19,1,23,4.3,,Tim O Shaughnessy Graham Holdings Company
2025-10-19,Thomas V Taylor,Floor & Decor,1,4,2,7,28.6,,Thomas V Taylor Floor & Decor
2025-10-19,Neil A Schrimsher,Applied Industrial Technologies,3,12,0,15,0.0,,Neil A Schrimsher Applied Industrial Technologies
2025-10-19,Robert E Price,PriceSmart,4,3,0,7,0.0,,Robert E Price PriceSmart
2025-10-19,John David Risher,Lyft,7,15,3,25,12.0,,John David Risher Lyft
2025-10-19,Gary B Smith,Ciena,7,17,1,25,4.0,,Gary B Smith Ciena
2025-10-19,Joey Levin,IAC,6,18,1,25,4.0,,Joey Levin IAC
2025-10-19,Jim Jacobs,Country Financial,7,12,1,20,5.0,,Jim Jacobs Country Financial
2025-10-19,Devin B McGranahan,Western Union,6,9,0,15,0.0,,Devin B McGranahan Western Union
2025-10-19,R Scott Rowe,Flowserve,4,4,2,10,20.0,,R Scott Rowe Flowserve
2025-10-19,Kenneth A Vecchione,Western Alliance Bancorp,4,13,8,25,32.0,,Kenneth A Vecchione Western Alliance Bancorp
2025-10-19,John C Rademacher,Option Care Health,17,3,0,20,0.0,,John C Rademacher Option Care Health
2025-10-19,Doug Black,SiteOne Landscape Supply,3,21,1,25,4.0,,Doug Black SiteOne Landscape Supply
2025-10-19,Oliver G Brewer III,Topgolf Callaway Brands,1,2,0,3,0.0,,Oliver G Brewer III Topgolf Callaway Brands
2025-10-19,Glenn Sanford,eXp World,9,15,1,25,4.0,,Glenn Sanford eXp World
2025-10-19,Fran Horowitz,Abercrombie & Fitch,11,10,4,25,16.0,,Fran Horowitz Abercrombie & Fitch
2025-10-19,Kevin Akers,Atmos Energy,12,1,1,14,7.1,,Kevin Akers Atmos Energy
2025-10-19,Alessandro Maselli,Catalent,3,21,1,25,4.0,,Alessandro Maselli Catalent
2025-10-19,J Powell Brown,Brown & Brown,6,16,3,25,12.0,,J Powell Brown Brown & Brown
2025-10-19,Aman Bhutani,GoDaddy,4,20,1,25,4.0,,Aman Bhutani GoDaddy
2025-10-19,John C. Griffith,American Water Works,1,7,2,10,20.0,,John C. Griffith American Water Works
2025-10-19,John J Marchioni,Selective Insurance Group,3,14,1,18,5.6,,John J Marchioni Selective Insurance Group
2025-10-19,Lawson E Whiting,Brown-Forman,4,16,5,25,20.0,,Lawson E Whiting Brown-Forman
2025-10-19,Dave Peacock,Advantage Solutions,21,2,2,25,8.0,,Dave Peacock Advantage Solutions
2025-10-19,Mick Farrell,ResMed,11,14,0,25,0.0,,Mick Farrell ResMed
2025-10-19,Kamal Hathi,Splunk,8,8,0,16,0.0,,Kamal Hathi Splunk
2025-10-19,Todd Kelsey,Plexus Corp,2,4,1,7,14.3,,Todd Kelsey Plexus Corp
2025-10-19,Phillip D Yeager,Hub Group,3,10,0,13,0.0,,Phillip D Yeager Hub Group
2025-10-19,Steven B Hedlund,Lincoln Electric,5,13,0,18,0.0,,Steven B Hedlund Lincoln Electric
2025-10-19,Timothy C Oliver,NCR Atleos,1,5,0,6,0.0,,Timothy C Oliver NCR Atleos
2025-10-19,Bruce Fleming,Calumet Inc,4,7,0,11,0.0,,Bruce Fleming Calumet Inc
2025-10-19,Daniel S. Peyovich,Dycom Industries,0,3,0,3,0.0,,Daniel S. Peyovich Dycom Industries
2025-10-19,Avner M Applbaum,Valmont Industries,0,8,0,8,0.0,,Avner M Applbaum Valmont Industries
2025-10-19,Kimberly A Fields,ATI Inc,6,17,0,23,0.0,,Kimberly A Fields ATI Inc
2025-10-19,Khozema Z Shipchandler,Twilio,1,8,1,10,10.0,,Khozema Z Shipchandler Twilio
2025-10-19,Gary C Bhojwani,CNO Financial Group,2,8,0,10,0.0,,Gary C Bhojwani CNO Financial Group
2025-10-19,William Andrew Hendricks Jr,Patterson-UTI Energy,4,1,0,5,0.0,,William Andrew Hendricks Jr Patterson-UTI Energy
2025-10-19,Kevin D Hochman,Brinker International,6,18,1,25,4.0,,Kevin D Hochman Brinker International
2025-10-19,James C Foster,Charles River Laboratories International,3,19,3,25,12.0,,James C Foster Charles River Laboratories International
2025-10-19,Rajiv K Prasad,Hyster-Yale,1,8,0,9,0.0,,Rajiv K Prasad Hyster-Yale
2025-10-19,Eric T Steigerwalt,Brighthouse Financial,3,14,2,19,10.5,,Eric T Steigerwalt Brighthouse Financial
2025-10-19,Thomas L Ryan,Service Corp International,6,15,1,22,4.5,,Thomas L Ryan Service Corp International
2025-10-19,Charles M Nifong Jr,CrossAmerica Partners,0,1,0,1,0.0,,Charles M Nifong Jr CrossAmerica Partners
2025-10-19,Anirudh Devgan,Cadence,6,17,2,25,8.0,,Anirudh Devgan Cadence
2025-10-19,Andi Owen,MillerKnoll,8,10,7,25,28.0,,Andi Owen MillerKnoll
2025-10-19,Sumit Roy,Realty Income,9,15,1,25,4.0,,Sumit Roy Realty Income
2025-10-19,Timothy John Fitzgerald,Middleby,0,0,0,0,0.0,,Timothy John Fitzgerald Middleby
2025-10-19,Robert H Schottenstein,M/I Homes,5,10,0,15,0.0,,Robert H Schottenstein M/I Homes
2025-10-19,Stephen P MacMillan,Hologic,4,5,2,11,18.2,,Stephen P MacMillan Hologic
2025-10-19,Lisa M Barton,Alliant Energy,7,1,0,8,0.0,,Lisa M Barton Alliant Energy
2025-10-19,Aaron P Jagdfeld,Generac,1,10,2,13,15.4,,Aaron P Jagdfeld Generac
2025-10-19,Erik Gershwind,MSC Industrial Direct,8,15,2,25,8.0,,Erik Gershwind MSC Industrial Direct
2025-10-19,Varun Krishna,Rocket Companies,4,19,2,25,8.0,,Varun Krishna Rocket Companies
2025-10-19,Fahmi Karam,Upbound Group,4,5,0,9,0.0,,Fahmi Karam Upbound Group
2025-10-19,NADominic Ng,East West Bancorp,0,0,0,0,0.0,,NADominic Ng East West Bancorp
2025-10-19,Mark Wang,Hilton Grand Vacations,25,0,0,25,0.0,,Mark Wang Hilton Grand Vacations
2025-10-19,Robert J Sheedy Jr,Grocery Outlet Holding,0,1,0,1,0.0,,Robert J Sheedy Jr Grocery Outlet Holding
2025-10-19,Simon D Campion,Dentsply Sirona,0,10,1,11,9.1,,Simon D Campion Dentsply Sirona
2025-10-19,Jeremy Wensinger,V2X,13,12,0,25,0.0,,Jeremy Wensinger V2X
2025-10-19,Andrew Rees,Crocs,9,12,4,25,16.0,,Andrew Rees Crocs
2025-10-19,David M Maura,Spectrum Brands,9,5,0,14,0.0,,David M Maura Spectrum Brands
2025-10-19,Sachin S Lawande,Visteon,10,14,1,25,4.0,,Sachin S Lawande Visteon
2025-10-19,Neil M Ashe,Acuity Inc,1,8,0,9,0.0,,Neil M Ashe Acuity Inc
2025-10-19,Lorie L Tekorius,The Greenbrier Companies,2,8,0,10,0.0,,Lorie L Tekorius The Greenbrier Companies
2025-10-19,John R Ciulla,Webster Financial,6,17,0,23,0.0,,John R Ciulla Webster Financial
2025-10-19,Sean D Keohane,Cabot Corporation,4,7,2,13,15.4,,Sean D Keohane Cabot Corporation
2025-10-19,Drew M Wilkerson,RXO Inc,2,6,2,10,20.0,,Drew M Wilkerson RXO Inc
2025-10-19,Daniel E Brown,Chord Energy,1,0,0,1,0.0,,Daniel E Brown Chord Energy
2025-10-19,Javier D Ferrer Fernandez,Popular Inc,2,3,2,7,28.6,,Javier D Ferrer Fernandez Popular Inc
2025-10-19,Olivier Rabiller,Garrett Motion Inc,2,13,0,15,0.0,,Olivier Rabiller Garrett Motion Inc
2025-10-19,Ronald N Tutor,Tutor Perini Corporation,4,19,1,24,4.2,,Ronald N Tutor Tutor Perini Corporation
2025-10-19,Jeff Liaw,Copart,10,8,2,20,10.0,,Jeff Liaw Copart
2025-10-19,Aman Narang,Toast Inc,4,18,3,25,12.0,,Aman Narang Toast Inc
2025-10-19,Joseph M Hogan,Align Technology,6,16,3,25,12.0,,Joseph M Hogan Align Technology
2025-10-19,Kevin J Wheeler,A O Smith,0,25,0,25,0.0,,Kevin J Wheeler A O Smith
2025-10-19,Christopher A Cartwright,TransUnion,9,13,3,25,12.0,,Christopher A Cartwright TransUnion
2025-10-19,James Kelly,NCR Voyix,2,16,0,18,0.0,,James Kelly NCR Voyix
2025-10-19,Tom Leighton,Akamai Technologies,13,8,4,25,16.0,,Tom Leighton Akamai Technologies
2025-10-19,Robert G Painter,Trimble Inc,13,5,0,18,0.0,,Robert G Painter Trimble Inc
2025-10-19,Tony Helton,Medical Mutual of Ohio,3,6,1,10,10.0,,Tony Helton Medical Mutual of Ohio
2025-10-19,Caroline S Grace,AMN Healthcare Services,1,0,0,1,0.0,,Caroline S Grace AMN Healthcare Services
2025-10-19,Patrick Kaltenbach,Mettler-Toledo International,3,6,0,9,0.0,,Patrick Kaltenbach Mettler-Toledo International
2025-10-19,Michael L Baur,ScanSource,1,4,0,5,0.0,,Michael L Baur ScanSource
2025-10-19,Jason Lippert,LCI Industries,7,17,1,25,4.0,,Jason Lippert LCI Industries
2025-10-19,Fredric J Tomczyk,Cboe Global Markets,2,13,4,19,21.1,,Fredric J Tomczyk Cboe Global Markets
2025-10-19,Octavio Marquez,Diebold Nixdorf,5,14,1,20,5.0,,Octavio Marquez Diebold Nixdorf
2025-10-19,Sivasankaran Somasundaram,ChampionX,7,2,0,9,0.0,,Sivasankaran Somasundaram ChampionX
2025-10-19,Ronald F Clarke,Corpay,2,5,1,8,12.5,,Ronald F Clarke Corpay
2025-10-19,Robert W Pittman,iHeartMedia,8,13,1,22,4.5,,Robert W Pittman iHeartMedia
2025-10-19,Patrick Zalupski,Dream Finders Homes,13,10,2,25,8.0,,Patrick Zalupski Dream Finders Homes
2025-10-19,Keith E Smith,Boyd Gaming,6,14,1,21,4.8,,Keith E Smith Boyd Gaming
2025-10-19,Mehran Assadi,NLV Financial,1,1,0,2,0.0,,Mehran Assadi NLV Financial
2025-10-19,Barry R Port,Ensign Group,5,13,2,20,10.0,,Barry R Port Ensign Group
2025-10-19,Denise A Paulonis,Sally Beauty,16,4,0,20,0.0,,Denise A Paulonis Sally Beauty
2025-10-19,Clifford A Skelton,Conduent,1,6,0,7,0.0,,Clifford A Skelton Conduent
2025-10-19,Jean-Michel Ribieras,Sylvamo,1,7,0,8,0.0,,Jean-Michel Ribieras Sylvamo
2025-10-19,Douglas F Bauer,Tri Pointe Homes,0,5,0,5,0.0,,Douglas F Bauer Tri Pointe Homes
2025-10-19,Shawn O'Connell,EnerSys,4,6,2,12,16.7,,Shawn O'Connell EnerSys
2025-10-19,Bill Meury,Incyte,6,17,1,24,4.2,,Bill Meury Incyte
2025-10-19,Dale Francescon,Century Communities,5,17,3,25,12.0,,Dale Francescon Century Communities
2025-10-19,Michael Nierenberg,Rithm Capital,10,12,3,25,12.0,,Michael Nierenberg Rithm Capital
2025-10-19,Michael J Brown,Euronet Worldwide,5,6,0,11,0.0,,Michael J Brown Euronet Worldwide
2025-10-19,Scott Seu,Hawaiian Electric Industries,6,15,4,25,16.0,,Scott Seu Hawaiian Electric Industries
2025-10-19,Jason D Robins,DraftKings,3,15,7,25,28.0,,Jason D Robins DraftKings
2025-10-19,Jonathan J Mazelsky,IDEXX Laboratories,1,3,4,8,50.0,,Jonathan J Mazelsky IDEXX Laboratories
2025-10-19,Richard S Swartz,MYR Group,1,0,0,1,0.0,,Richard S Swartz MYR Group
2025-10-19,Stefano Caroti,Deckers Outdoor,10,15,0,25,0.0,,Stefano Caroti Deckers Outdoor
2025-10-19,Kevin R Sayer,DexCom,6,10,4,20,20.0,,Kevin R Sayer DexCom
2025-10-19,John T C Lee,MKS Instruments,9,15,1,25,4.0,,John T C Lee MKS Instruments
2025-10-19,Edward B Pitoniak,VICI Properties,1,8,1,10,10.0,,Edward B Pitoniak VICI Properties
2025-10-19,Albert White III,Cooper Cos,6,7,3,16,18.8,,Albert White III Cooper Cos
2025-10-19,Barry L Biffle,Frontier Airlines,4,14,7,25,28.0,,Barry L Biffle Frontier Airlines
2025-10-19,Robert A Bruggeworth,Qorvo,2,6,2,10,20.0,,Robert A Bruggeworth Qorvo
2025-10-19,Winnie Park,Five Below,7,17,1,25,4.0,,Winnie Park Five Below
2025-10-19,Steven Oakland,TreeHouse Foods,6,18,1,25,4.0,,Steven Oakland TreeHouse Foods
2025-10-19,James S Hagedorn,Scotts Miracle-Gro,1,7,1,9,11.1,,James S Hagedorn Scotts Miracle-Gro
2025-10-19,Michael Cannon-Brookes,Atlassian,10,13,2,25,8.0,,Michael Cannon-Brookes Atlassian
2025-10-19,Bertrand Loy,Entegris,5,16,4,25,16.0,,Bertrand Loy Entegris
2025-10-19,William E Waltz,Atkore,2,5,1,8,12.5,,William E Waltz Atkore
2025-10-19,Celeste B Mastin,HB Fuller,0,10,0,10,0.0,,Celeste B Mastin HB Fuller
2025-10-19,Kyle T Larkin,Granite Construction,1,12,0,13,0.0,,Kyle T Larkin Granite Construction
2025-10-19,Michael J Happe,Winnebago Industries,3,8,1,12,8.3,,Michael J Happe Winnebago Industries
2025-10-19,Steven H Gunby,FTI Consulting,7,11,0,18,0.0,,Steven H Gunby FTI Consulting
2025-10-19,Stephan B Tanda,AptarGroup,5,15,3,23,13.0,,Stephan B Tanda AptarGroup
2025-10-19,Timothy P Boyle,Columbia Sportswear,4,7,4,15,26.7,,Timothy P Boyle Columbia Sportswear
2025-10-19,Anthony J Wood,Roku,10,10,5,25,20.0,,Anthony J Wood Roku
2025-10-19,M Christopher Doyle,Civitas Resources,2,5,2,9,22.2,,M Christopher Doyle Civitas Resources
2025-10-19,Andy Eidson,Alpha Metallurgical Resources,3,8,3,14,21.4,,Andy Eidson Alpha Metallurgical Resources
2025-10-19,Andy L Nemeth,Patrick Industries,4,5,0,9,0.0,,Andy L Nemeth Patrick Industries
2025-10-19,Roger W Jenkins,Murphy Oil,6,16,3,25,12.0,,Roger W Jenkins Murphy Oil
2025-10-19,Kevin S Blair,Synovus Financial,7,8,0,15,0.0,,Kevin S Blair Synovus Financial
2025-10-19,Julie Felss Masino,Cracker Barrel Old Country Store,4,11,10,25,40.0,,Julie Felss Masino Cracker Barrel Old Country Store
2025-10-19,David M Overton,Cheesecake Factory,6,17,2,25,8.0,,David M Overton Cheesecake Factory
2025-10-19,Nick DeIuliis,CNX Resources,12,12,1,25,4.0,,Nick DeIuliis CNX Resources
2025-10-19,Christopher Pappas,Chefs Warehouse,4,19,2,25,8.0,,Christopher Pappas Chefs Warehouse
2025-10-19,Tod Carpenter,Donaldson Company,6,7,6,19,31.6,,Tod Carpenter Donaldson Company
2025-10-19,Gregory L Christopher,Mueller Industries,3,7,1,11,9.1,,Gregory L Christopher Mueller Industries
2025-10-19,Rob Saltiel,MRC Global,2,14,1,17,5.9,,Rob Saltiel MRC Global
2025-10-19,Jillian C Evanko,Chart Industries,3,8,0,11,0.0,,Jillian C Evanko Chart Industries
2025-10-19,Dave Guilmette,Alight Solutions,1,11,0,12,0.0,,Dave Guilmette Alight Solutions
2025-10-19,Joel Smejkal,Vishay Intertechnology,4,11,2,17,11.8,,Joel Smejkal Vishay Intertechnology
2025-10-19,Dennis Degner,Range Resources,8,4,0,12,0.0,,Dennis Degner Range Resources
2025-10-19,Ira D Robbins,Valley National Bancorp,3,11,2,16,12.5,,Ira D Robbins Valley National Bancorp
2025-10-19,Bernard Kim,Match Group,6,13,6,25,24.0,,Bernard Kim Match Group
2025-10-19,Vincent Pilette,Gen Digital,3,9,0,12,0.0,,Vincent Pilette Gen Digital
2025-10-19,Timothy S Crane,Wintrust Financial,1,7,0,8,0.0,,Timothy S Crane Wintrust Financial
2025-10-19,Pat Roche,Moog Inc,5,11,4,20,20.0,,Pat Roche Moog Inc
2025-10-19,Mark R Widmar,First Solar,8,13,4,25,16.0,,Mark R Widmar First Solar
2025-10-19,Niko Lahanas,Central Garden & Pet,2,12,0,14,0.0,,Niko Lahanas Central Garden & Pet
2025-10-19,Chris Osowski,Green Plains Inc,9,12,3,24,12.5,,Chris Osowski Green Plains Inc
2025-10-19,Derek J Leathers,Werner Enterprises,4,7,1,12,8.3,,Derek J Leathers Werner Enterprises
2025-10-19,Adam Foroughi,AppLovin,6,17,2,25,8.0,,Adam Foroughi AppLovin
2025-10-19,Luca Savi,ITT,1,10,1,12,8.3,,Luca Savi ITT
2025-10-19,Lawrence H Silber,Herc Rentals,2,2,0,4,0.0,,Lawrence H Silber Herc Rentals
2025-10-19,Hilton H Howell Jr,Gray Television,7,14,4,25,16.0,,Hilton H Howell Jr Gray Television
2025-10-19,Eric D Ashleman,IDEX,1,11,0,12,0.0,,Eric D Ashleman IDEX
2025-10-19,Owen D Thomas,Boston Properties,4,20,1,25,4.0,,Owen D Thomas Boston Properties
2025-10-19,Kurt Wolf,Pitney Bowes,7,18,0,25,0.0,,Kurt Wolf Pitney Bowes
2025-10-19,Sara E Armbruster,Steelcase,11,4,0,15,0.0,,Sara E Armbruster Steelcase
2025-10-19,Charles D. Young,Sun Communities,7,9,0,16,0.0,,Charles D. Young Sun Communities
2025-10-19,Suzanne Foster,AdaptHealth,2,15,1,18,5.6,,Suzanne Foster AdaptHealth
2025-10-19,Grant E Sims,Genesis Energy,5,2,0,7,0.0,,Grant E Sims Genesis Energy
2025-10-19,Laura Prieskorn,Jackson Financial,5,13,4,22,18.2,,Laura Prieskorn Jackson Financial
2025-10-19,Rick L Wessel,FirstCash,1,5,3,9,33.3,,Rick L Wessel FirstCash
2025-10-19,Sherman Miller,Cal-Maine Foods,7,17,1,25,4.0,,Sherman Miller Cal-Maine Foods
2025-10-19,Paul A Lang,Arch Resources,16,7,2,25,8.0,,Paul A Lang Arch Resources
2025-10-19,Ashish K Khandpur,Avient,1,7,1,9,11.1,,Ashish K Khandpur Avient
2025-10-19,Shyam K Reddy,BlueLinx,1,8,0,9,0.0,,Shyam K Reddy BlueLinx
2025-10-19,Christopher S Ripley,Sinclair,5,14,6,25,24.0,,Christopher S Ripley Sinclair
2025-10-19,Stacy Kymes,BOK Financial,12,10,1,23,4.3,,Stacy Kymes BOK Financial
2025-10-19,James H Walter,Permian Resources,0,4,0,4,0.0,,James H Walter Permian Resources
2025-10-19,Jason Murray,PACS Group,6,15,4,25,16.0,,Jason Murray PACS Group
2025-10-19,Brian Armstrong,Coinbase Global,5,15,5,25,20.0,,Brian Armstrong Coinbase Global
2025-10-19,Oscar K Brown,Western Midstream Partners,6,8,0,14,0.0,,Oscar K Brown Western Midstream Partners
2025-10-19,Nicholas R Lower,Federated Mutual Insurance,1,1,2,4,50.0,,Nicholas R Lower Federated Mutual Insurance
2025-10-19,Morris Goldfarb,G-III Apparel Group,7,11,7,25,28.0,,Morris Goldfarb G-III Apparel Group
2025-10-19,Mark D Morelli,Vontier,1,4,0,5,0.0,,Mark D Morelli Vontier
2025-10-19,Matthew J Cox,Matson Inc,5,11,0,16,0.0,,Matthew J Cox Matson Inc
2025-10-19,David W Grzebinski,Kirby Corporation,3,6,3,12,25.0,,David W Grzebinski Kirby Corporation
2025-10-19,Keith A Harvey,Kaiser Aluminum,2,10,2,14,14.3,,Keith A Harvey Kaiser Aluminum
2025-10-19,Eric Nyman,Vista Outdoor,2,12,1,15,6.7,,Eric Nyman Vista Outdoor
2025-10-19,Doug Howe,Designer Brands,8,17,0,25,0.0,,Doug Howe Designer Brands
2025-10-19,Jerry E Gahlhoff Jr,Rollins Inc,1,3,0,4,0.0,,Jerry E Gahlhoff Jr Rollins Inc
2025-10-19,D Scott Barbour,Advanced Drainage Systems,5,8,1,14,7.1,,D Scott Barbour Advanced Drainage Systems
2025-10-19,Sean Gamble,Cinemark,10,6,9,25,36.0,,Sean Gamble Cinemark
2025-10-19,George Kurtz,CrowdStrike,9,14,2,25,8.0,,George Kurtz CrowdStrike
2025-10-19,Bill Ready,Pinterest,13,11,1,25,4.0,,Bill Ready Pinterest
2025-10-19,Fidji Simo,Instacart,8,17,0,25,0.0,,Fidji Simo Instacart
2025-10-19,Kimberly K Ryan,Hillenbrand,1,9,0,10,0.0,,Kimberly K Ryan Hillenbrand
2025-10-19,David S Graziosi,Allison Transmission,1,23,1,25,4.0,,David S Graziosi Allison Transmission
2025-10-19,Gary G Friedman,Restoration Hardware,5,15,5,25,20.0,,Gary G Friedman Restoration Hardware
2025-10-19,Lucinda M Baier,Brookdale Senior Living,4,10,2,16,12.5,,Lucinda M Baier Brookdale Senior Living
2025-10-19,Brian J Blaser,QuidelOrtho,0,8,1,9,11.1,,Brian J Blaser QuidelOrtho
2025-10-19,E Jean Savage,Trinity Industries,3,16,6,25,24.0,,E Jean Savage Trinity Industries
2025-10-19,Liam J Kelly,Teleflex,2,3,1,6,16.7,,Liam J Kelly Teleflex
2025-10-19,Laurans A Mendelson,HEICO,6,17,2,25,8.0,,Laurans A Mendelson HEICO
2025-10-19,Frank H Laukien,Bruker,2,9,0,11,0.0,,Frank H Laukien Bruker
2025-10-19,Harvey M Schwartz,Carlyle Group,7,13,5,25,20.0,,Harvey M Schwartz Carlyle Group
2025-10-19,Mark S LaVigne,Energizer Holdings,6,2,0,8,0.0,,Mark S LaVigne Energizer Holdings
2025-10-19,Amar Maletira,Rackspace Technology,4,17,4,25,16.0,,Amar Maletira Rackspace Technology
2025-10-19,Udit Batra,Waters Corporation,8,12,5,25,20.0,,Udit Batra Waters Corporation
2025-10-19,Eric M Green,West Pharmaceutical Services,8,17,0,25,0.0,,Eric M Green West Pharmaceutical Services
2025-10-19,Doug Palladini,Carters Inc,1,8,1,10,10.0,,Doug Palladini Carters Inc
2025-10-19,G Mike Mikan,NeueHealth,4,5,1,10,10.0,,G Mike Mikan NeueHealth
2025-10-19,Russell Chip Childs,SkyWest,0,8,0,8,0.0,,Russell Chip Childs SkyWest
2025-10-19,Christopher H Hunter,Acadia Healthcare,3,3,2,8,25.0,,Christopher H Hunter Acadia Healthcare
2025-10-19,Prahlad Singh,Revvity,3,11,0,14,0.0,,Prahlad Singh Revvity
2025-10-19,Maria M Pope,Portland General Electric,8,13,4,25,16.0,,Maria M Pope Portland General Electric
2025-10-19,Charles Chip Blankenship,Woodward Inc,3,9,0,12,0.0,,Charles Chip Blankenship Woodward Inc
2025-10-19,Mike Steib,TEGNA,10,13,2,25,8.0,,Mike Steib TEGNA
2025-10-19,Kurt J Ekert,Sabre Corporation,1,0,0,1,0.0,,Kurt J Ekert Sabre Corporation
2025-10-19,Matt Wilson,Light & Wonder,8,12,5,25,20.0,,Matt Wilson Light & Wonder
2025-10-19,Rob Katz,Vail Resorts,4,4,17,25,68.0,,Rob Katz Vail Resorts
2025-10-19,Schnitzer Steel Industries,Radius Recycling,2,14,9,25,36.0,,Schnitzer Steel Industries Radius Recycling
2025-10-19,David A Spector,PennyMac Financial Services,9,15,1,25,4.0,,David A Spector PennyMac Financial Services
2025-10-19,Frederick J Holzgrefe III,Saia Inc,0,6,0,6,0.0,,Frederick J Holzgrefe III Saia Inc
2025-10-19,Mark J Parrell,Equity Residential,4,11,1,16,6.2,,Mark J Parrell Equity Residential
2025-10-19,John W Lindsay,Helmerich & Payne,1,8,0,9,0.0,,John W Lindsay Helmerich & Payne
2025-10-19,Gary D Burnison,Korn Ferry,9,14,2,25,8.0,,Gary D Burnison Korn Ferry
