date,ceo,company,positive,neutral,negative,total,neg_pct,theme,alias
2025-12-03,Timothy NeCastro,Erie Insurance,4,10,1,15,6.7,,Timothy NeCastro Erie Insurance
2025-12-03,Wendell Weeks,Corning,4,16,5,25,20.0,,Wendell Weeks Corning
2025-12-03,Kathleen Johnson,Lumen Technologies,3,21,1,25,4.0,,Kathleen Johnson Lumen Technologies
2025-12-03,Brian Tierney,FirstEnergy,8,12,5,25,20.0,,Brian Tierney FirstEnergy
2025-12-03,Adam Schechter,Labcorp Holdings,10,13,1,24,4.2,,Adam Schechter Labcorp Holdings
2025-12-03,Tiang Yew Tan,Western Digital,3,3,0,6,0.0,,Tiang Yew Tan Western Digital
2025-12-03,Rick McKenney,Unum Group,14,9,2,25,8.0,,Rick McKenney Unum Group
2025-12-03,Javier Rodriguez,DaVita,11,13,1,25,4.0,,Javier Rodriguez DaVita
2025-12-03,Steven Cahillane,Kellanova,9,14,2,25,8.0,,Steven Cahillane Kellanova
2025-12-03,Stanley Bergman,Henry Schein,3,20,2,25,8.0,,Stanley Bergman Henry Schein
2025-12-03,Robert Sanchez,Ryder System,11,11,3,25,12.0,,Robert Sanchez Ryder System
2025-12-03,Tim Hingtgen,Community Health Systems,6,16,3,25,12.0,,Tim Hingtgen Community Health Systems
2025-12-03,Avigal Soreq,Delek US,6,13,5,24,20.8,,Avigal Soreq Delek US
2025-12-03,Gerardo Norcia,DTE Energy,8,2,1,11,9.1,,Gerardo Norcia DTE Energy
2025-12-03,Mark Pearson,Equitable Holdings,8,13,2,23,8.7,,Mark Pearson Equitable Holdings
2025-12-03,Lori Koch,DuPont de Nemours,5,20,0,25,0.0,,Lori Koch DuPont
2025-12-03,Rich Steinmeier,LPL Financial,12,11,2,25,8.0,,Rich Steinmeier LPL Financial
2025-12-03,Bruce Van Saun,Citizens Financial Group,11,14,0,25,0.0,,Bruce Van Saun Citizens Financial Group
2025-12-03,José Mas,MasTec,7,17,1,25,4.0,,José Mas MasTec
2025-12-03,Andrés Gluski,AES,13,9,3,25,12.0,,Andrés Gluski AES
2025-12-03,Kevin Kwilinski,Berry Global,6,19,0,25,0.0,,Kevin Kwilinski Berry Global
2025-12-03,Mark George,Norfolk Southern,8,16,1,25,4.0,,Mark George Norfolk Southern
2025-12-03,Eduardo Menezes,Air Products & Chemicals,4,16,5,25,20.0,,Eduardo Menezes Air Products & Chemicals
2025-12-03,Shelley Simpson,JB Hunt Transport Services,3,19,3,25,12.0,,Shelley Simpson JB Hunt Transport Services
2025-12-03,Daniel Fisher,Ball Corporation,2,17,6,25,24.0,,Daniel Fisher Ball Corporation
2025-12-03,Sean Connolly,Conagra Brands,6,17,2,25,8.0,,Sean Connolly Conagra Brands
2025-12-03,Stephen Steinour,Huntington Bancshares,8,15,2,25,8.0,,Stephen Steinour Huntington Bancshares
2025-12-03,James Snee,Hormel Foods,1,23,1,25,4.0,,James Snee Hormel Foods
2025-12-03,Joseph Nolan,Eversource Energy,9,14,2,25,8.0,,Joseph Nolan Eversource Energy
2025-12-03,William Oplinger,Alcoa Corporation,3,14,8,25,32.0,,William Oplinger Alcoa Corporation
2025-12-03,Andrew Marsh,Entergy,5,10,0,15,0.0,,Andrew Marsh Entergy
2025-12-03,Keith Demmings,Assurant,2,12,0,14,0.0,,Keith Demmings Assurant
2025-12-03,Sumit Singh,Chewy,7,12,6,25,24.0,,Sumit Singh Chewy
2025-12-03,Niraj Shah,Wayfair,5,15,5,25,20.0,,Niraj Shah Wayfair
2025-12-03,Joseph Ferraro,Avis Budget,2,13,5,20,25.0,,Joseph Ferraro Avis Budget
2025-12-03,Jeffrey Sprecher,Intercontinental Exchange,8,17,0,25,0.0,,Jeffrey Sprecher Intercontinental Exchange
2025-12-03,Benito Minicucci,Alaska Air,2,7,2,11,18.2,,Benito Minicucci Alaska Air
2025-12-03,Malcolm Wilson,GXO Logistics,5,19,1,25,4.0,,Malcolm Wilson GXO Logistics
2025-12-03,Eric Hansotia,AGCO,8,13,4,25,16.0,,Eric Hansotia AGCO
2025-12-03,Kathleen Mazzarella,Graybar Electric,6,19,0,25,0.0,,Kathleen Mazzarella Graybar Electric
2025-12-03,Gavin Hattersley,Molson Coors Beverage,3,21,1,25,4.0,,Gavin Hattersley Molson Coors Beverage
2025-12-03,Patrick Gallagher,Arthur J Gallagher,5,19,1,25,4.0,,Patrick Gallagher Arthur J Gallagher
2025-12-03,Christopher Kastner,Huntington Ingalls Industries,5,19,1,25,4.0,,Christopher Kastner Huntington Ingalls Industries
2025-12-03,Erik Fyrwald,International Flavors & Fragrances,8,14,3,25,12.0,,Erik Fyrwald International Flavors & Fragrances
2025-12-03,Ricardo Cardenas,Darden Restaurants,7,9,1,17,5.9,,Ricardo Cardenas Darden Restaurants
2025-12-03,Stephen Spray,CIncinnati Financial,6,14,5,25,20.0,,Stephen Spray CIncinnati Financial
2025-12-03,Scott Boatwright,Chipotle Mexican Grill,7,8,10,25,40.0,,Scott Boatwright Chipotle Mexican Grill
2025-12-03,Joey Wat,Yum China,8,16,1,25,4.0,,Joey Wat Yum China
2025-12-03,Robert Goldstein,Las Vegas Sands,6,16,3,25,12.0,,Robert Goldstein Las Vegas Sands
2025-12-03,Kecia Steelman,Ulta Beauty,18,5,2,25,8.0,,Kecia Steelman Ulta Beauty
2025-12-03,Thomas Reeg,Caesars Entertainment,12,11,2,25,8.0,,Thomas Reeg Caesars Entertainment
2025-12-03,Jon Rousseau,BrightSpring Health Services,10,15,0,25,0.0,,Jon Rousseau BrightSpring Health Services
2025-12-03,William Krueger,The Andersons Inc,3,19,0,22,0.0,,William Krueger The Andersons Inc
2025-12-03,Michele Buck,Hershey,3,21,1,25,4.0,,Michele Buck Hershey
2025-12-03,Christopher Nassetta,Hilton Worldwide,9,13,3,25,12.0,,Christopher Nassetta Hilton Worldwide
2025-12-03,Bruce Bodine,The Mosaic Company,7,14,4,25,16.0,,Bruce Bodine The Mosaic Company
2025-12-03,Brian Chesky,Airbnb,5,12,8,25,32.0,,Brian Chesky Airbnb
2025-12-03,Kaes Van’t Hof,Diamondback Energy,15,8,2,25,8.0,,Kaes Van’t Hof Diamondback Energy
2025-12-03,Steven Vondran,American Tower,6,9,2,17,11.8,,Steven Vondran American Tower
2025-12-03,Reshma Kewalramani,Vertex Pharmaceuticals,12,10,3,25,12.0,,Reshma Kewalramani Vertex Pharmaceuticals
2025-12-03,William McDermott,ServiceNow,6,16,3,25,12.0,,William McDermott ServiceNow
2025-12-03,Brian Chambers,Owens Corning,3,20,2,25,8.0,,Brian Chambers Owens Corning
2025-12-03,Teresa Rasmussen,Thrivent Financial for Lutherans,3,7,0,10,0.0,,Teresa Rasmussen Thrivent Financial for Lutherans
2025-12-03,Shane O'Kelly,Advance Auto Parts,9,13,3,25,12.0,,Shane O'Kelly Advance Auto Parts
2025-12-03,Douglas Yearley,Toll Brothers,6,15,4,25,16.0,,Douglas Yearley Toll Brothers
2025-12-03,Jeffrey Lorberbaum,Mohawk Industries,14,10,1,25,4.0,,Jeffrey Lorberbaum Mohawk Industries
2025-12-03,Gregory Brown,Motorola Solutions,6,16,3,25,12.0,,Gregory Brown Motorola Solutions
2025-12-03,John Pfeifer,Oshkosh Corporation,6,19,0,25,0.0,,John Pfeifer Oshkosh Corporation
2025-12-03,Tony Xu,DoorDash,5,15,5,25,20.0,,Tony Xu DoorDash
2025-12-03,Edward Pesicka,Owens & Minor,5,17,3,25,12.0,,Edward Pesicka Owens & Minor
2025-12-03,Eugene Bredow,NVR Inc,0,10,0,10,0.0,,Eugene Bredow NVR Inc
2025-12-03,Philippe Krakowsky,Interpublic Group,5,18,2,25,8.0,,Philippe Krakowsky Interpublic Group
2025-12-03,Horacio Rozanski,Booz Allen Hamilton,10,11,4,25,16.0,,Horacio Rozanski Booz Allen Hamilton
2025-12-03,Michael O’Sullivan,Burlington Stores,6,18,1,25,4.0,,Michael O’Sullivan Burlington Stores
2025-12-03,Daniel Wall,Expeditors International of Washington,2,7,0,9,0.0,,Daniel Wall Expeditors International of Washington
2025-12-03,Calvin McDonald,Lululemon athletica,5,16,4,25,16.0,,Calvin McDonald Lululemon athletica
2025-12-03,Stephanie Ferris,Fidelity National Information Services,10,13,2,25,8.0,,Stephanie Ferris Fidelity National Information Services
2025-12-03,Rich Handler,Jefferies Financial,7,10,8,25,32.0,,Rich Handler Jefferies Financial
2025-12-03,Alan Armstrong,Williams Companies,10,14,1,25,4.0,,Alan Armstrong Williams Companies
2025-12-03,Bracken Darrell,VF Corporation,6,17,2,25,8.0,,Bracken Darrell VF Corporation
2025-12-03,Mikael Bratt,Autoliv,6,8,6,20,30.0,,Mikael Bratt Autoliv
2025-12-03,Rafael Santana,Westinghouse Air Brake Technologies,12,10,3,25,12.0,,Rafael Santana Westinghouse Air Brake Technologies
2025-12-03,Ralph LaRossa,Public Service Enterprise Group,9,14,2,25,8.0,,Ralph LaRossa Public Service Enterprise Group
2025-12-03,Jamie Iannone,Ebay,7,17,1,25,4.0,,Jamie Iannone Ebay
2025-12-03,Scott Richardson,Celanese,4,14,3,21,14.3,,Scott Richardson Celanese
2025-12-03,Cameron Bready,Global Payments,7,18,0,25,0.0,,Cameron Bready Global Payments
2025-12-03,Robert Thomson,News Corp,1,19,5,25,20.0,,Robert Thomson News Corp
2025-12-03,Robert Martin,THOR Industries,9,14,2,25,8.0,,Robert Martin THOR Industries
2025-12-03,David Rawlinson II,QVC Group,9,13,3,25,12.0,,David Rawlinson II QVC Group
2025-12-03,Andrew Teno,Icahn Enterprises,4,8,1,13,7.7,,Andrew Teno Icahn Enterprises
2025-12-03,William Newlands,Constellation Brands,3,16,6,25,24.0,,William Newlands Constellation Brands
2025-12-03,James Davis,Quest Diagnostics,9,13,3,25,12.0,,James Davis Quest Diagnostics
2025-12-03,Richard Wallace,KLA,5,5,4,14,28.6,,Richard Wallace KLA
2025-12-03,Brad Jacobs,QXO Building Products,3,18,4,25,16.0,,Brad Jacobs QXO Building Products
2025-12-03,John Christmann IV,APA,2,12,0,14,0.0,,John Christmann IV APA
2025-12-03,Gregory Roberts,A-Mark Precious Metals,23,2,0,25,0.0,,Gregory Roberts A-Mark Precious Metals
2025-12-03,Christopher Viehbacher,Biogen,6,15,4,25,16.0,,Christopher Viehbacher Biogen
2025-12-03,Mick Beekhuizen,Campbell Soup,5,17,3,25,12.0,,Mick Beekhuizen Campbell Soup
2025-12-03,Christopher Caldwell,Concentrix,12,13,0,25,0.0,,Christopher Caldwell Concentrix
2025-12-03,Todd Schneider,Cintas,6,14,5,25,20.0,,Todd Schneider Cintas
2025-12-03,Tony Sarsam,SpartanNash,11,13,1,25,4.0,,Tony Sarsam SpartanNash
2025-12-03,John Venhuizen,Ace Hardware,6,17,2,25,8.0,,John Venhuizen Ace Hardware
2025-12-03,Vincent Roche,Analog Devices,13,11,1,25,4.0,,Vincent Roche Analog Devices
2025-12-03,Mark Costa,Eastman Chemical,1,16,8,25,32.0,,Mark Costa Eastman Chemical
2025-12-03,Milan Galik,Interactive Brokers,5,19,1,25,4.0,,Milan Galik Interactive Brokers
2025-12-03,John Turner,Regions Financial,13,10,2,25,8.0,,John Turner Regions Financial
2025-12-03,Joanna Geraghty,JetBlue Airways,11,7,7,25,28.0,,Joanna Geraghty JetBlue Airways
2025-12-03,Kristin Peck,Zoetis,9,14,2,25,8.0,,Kristin Peck Zoetis
2025-12-03,Christopher Gorman,KeyCorp,7,18,0,25,0.0,,Christopher Gorman KeyCorp
2025-12-03,Mark Bertolini,Oscar Health,5,16,4,25,16.0,,Mark Bertolini Oscar Health
2025-12-03,Brendan McCracken,Ovintiv,6,9,3,18,16.7,,Brendan McCracken Ovintiv
2025-12-03,Robert Steer,Seaboard,2,8,0,10,0.0,,Robert Steer Seaboard
2025-12-03,Gil West,Hertz,5,15,5,25,20.0,,Gil West Hertz
2025-12-03,Robert Greenberg,Skechers USA,3,21,1,25,4.0,,Robert Greenberg Skechers USA
2025-12-03,Dennis Mathew,Altice USA,6,15,4,25,16.0,,Dennis Mathew Altice USA
2025-12-03,Clay Williams,NOV,10,11,4,25,16.0,,Clay Williams NOV
2025-12-03,Michael Doss,Graphic Packaging,8,15,2,25,8.0,,Michael Doss Graphic Packaging
2025-12-03,Deon Stander,Avery Dennison,2,19,1,22,4.5,,Deon Stander Avery Dennison
2025-12-03,Adaire Fox-Martin,Equinix,9,14,2,25,8.0,,Adaire Fox-Martin Equinix
2025-12-03,Joyce Mullen,Insight Enterprises,4,20,1,25,4.0,,Joyce Mullen Insight Enterprises
2025-12-03,Jennifer Witz,Sirius XM,6,15,4,25,16.0,,Jennifer Witz Sirius XM
2025-12-03,Stefan Larsson,PVH,6,11,8,25,32.0,,Stefan Larsson PVH
2025-12-03,Jason P Wells,CenterPoint Energy,17,5,3,25,12.0,,Jason P Wells CenterPoint Energy
2025-12-03,Scott Lauber,WEC Energy,16,9,0,25,0.0,,Scott Lauber WEC Energy
2025-12-03,Matthew Pine,Xylem Inc,4,11,1,16,6.2,,Matthew Pine Xylem Inc
2025-12-03,Jennifer Johnson,Franklin Resources,3,21,1,25,4.0,,Jennifer Johnson Franklin Resources
2025-12-03,Vincent Sorgi,PPL Corporation,9,16,0,25,0.0,,Vincent Sorgi PPL Corporation
2025-12-03,Carl Eschenbach,Workday,7,14,4,25,16.0,,Carl Eschenbach Workday
2025-12-03,Richard Tobin,Dover Corporation,1,24,0,25,0.0,,Richard Tobin Dover Corporation
2025-12-03,Mark Kowlzan,Packaging Corp of America,9,14,2,25,8.0,,Mark Kowlzan Packaging Corp of America
2025-12-03,Scott Salmirs,ABM Industries,11,12,2,25,8.0,,Scott Salmirs ABM Industries
2025-12-03,Gary Guthart,Intuitive Surgical,4,15,6,25,24.0,,Gary Guthart Intuitive Surgical
2025-12-03,Carl Lindner lll,American Financial Group,4,12,9,25,36.0,,Carl Lindner lll American Financial Group
2025-12-03,Blake Moret,Rockwell Automation,10,14,1,25,4.0,,Blake Moret Rockwell Automation
2025-12-03,Bryan Hanson,Solventum,7,15,3,25,12.0,,Bryan Hanson Solventum
2025-12-03,Craig Smiddy,Old Republic International,2,9,1,12,8.3,,Craig Smiddy Old Republic International
2025-12-03,Christopher Hilger,Securian Financial,5,14,1,20,5.0,,Christopher Hilger Securian Financial
2025-12-03,Hamid Moghadam,Prologis,0,22,3,25,12.0,,Hamid Moghadam Prologis
2025-12-03,Mark Smucker,JM Smucker,7,17,1,25,4.0,,Mark Smucker JM Smucker
2025-12-03,Sheryl Palmer,Taylor Morrison Home,5,16,4,25,16.0,,Sheryl Palmer Taylor Morrison Home
2025-12-03,Mario Harik,XPO,6,15,4,25,16.0,,Mario Harik XPO
2025-12-03,Heather Lavallee,Voya Financial,6,17,2,25,8.0,,Heather Lavallee Voya Financial
2025-12-03,Nikesh Arora,Palo Alto Networks,5,14,6,25,24.0,,Nikesh Arora Palo Alto Networks
2025-12-03,Giordano Albertazzi,Vertiv,9,15,1,25,4.0,,Giordano Albertazzi Vertiv
2025-12-03,Shankh Mitra,Welltower,11,12,2,25,8.0,,Shankh Mitra Welltower
2025-12-03,Mary Dillon,Foot Locker,4,18,3,25,12.0,,Mary Dillon Foot Locker
2025-12-03,William Monteleone,Par Pacific,3,5,0,8,0.0,,William Monteleone Par Pacific
2025-12-03,Kevin Stein,TransDigm,10,12,3,25,12.0,,Kevin Stein TransDigm
2025-12-03,Peter Matt,Commercial Metals,8,12,5,25,20.0,,Peter Matt Commercial Metals
2025-12-03,Rob Vitale,Post Holdings,0,17,8,25,32.0,,Rob Vitale Post Holdings
2025-12-03,Keith Allman,Masco,8,16,0,24,0.0,,Keith Allman Masco
2025-12-03,Rusty Rush,Rush Enterprises,8,14,3,25,12.0,,Rusty Rush Rush Enterprises
2025-12-03,Stuart Bradie,KBR,8,15,2,25,8.0,,Stuart Bradie KBR
2025-12-03,Jack Sinclair,Sprouts Farmers Market,8,16,1,25,4.0,,Jack Sinclair Sprouts Farmers Market
2025-12-03,Laura Alber,Williams-Sonoma,6,17,2,25,8.0,,Laura Alber Williams-Sonoma
2025-12-03,Ivan Tornos,Zimmer Biomet,6,15,4,25,16.0,,Ivan Tornos Zimmer Biomet
2025-12-03,John Mengucci,CACI International,12,12,1,25,4.0,,John Mengucci CACI International
2025-12-03,Steve Sanghi,Microchip Technology,11,12,2,25,8.0,,Steve Sanghi Microchip Technology
2025-12-03,Albert Nahmad,Watsco,4,19,2,25,8.0,,Albert Nahmad Watsco
2025-12-03,Christopher Peterson,Newell Brands,5,15,5,25,20.0,,Christopher Peterson Newell Brands
2025-12-03,Arie Kotler,ARKO,4,19,2,25,8.0,,Arie Kotler ARKO
2025-12-03,Jure Sola,Sanmina,3,19,3,25,12.0,,Jure Sola Sanmina
2025-12-03,Andrew Wilson,Electronic Arts,13,10,2,25,8.0,,Andrew Wilson Electronic Arts
2025-12-03,David Gibbs,Yum Brands,1,23,1,25,4.0,,David Gibbs Yum Brands
2025-12-03,Daniel Florness,Fastenal,6,19,0,25,0.0,,Daniel Florness Fastenal
2025-12-03,Garrick Rochow,CMS Energy,20,3,2,25,8.0,,Garrick Rochow CMS Energy
2025-12-03,Rodney Sacks,Monster Beverage,11,12,2,25,8.0,,Rodney Sacks Monster Beverage
2025-12-03,Mark Shapiro,Endeavor Group Holdings,0,21,4,25,16.0,,Mark Shapiro Endeavor Group Holdings
2025-12-03,Toni Townes-Whitley,Science Applications International,5,18,2,25,8.0,,Toni Townes-Whitley Science Applications International
2025-12-03,Mark Witkowski,Core & Main,3,16,6,25,24.0,,Mark Witkowski Core & Main
2025-12-03,John Plant,Howmet Aerospace,6,17,2,25,8.0,,John Plant Howmet Aerospace
2025-12-03,James Zallie,Ingredion,7,17,1,25,4.0,,James Zallie Ingredion
2025-12-03,Thomas Hill,Vulcan Materials,10,13,2,25,8.0,,Thomas Hill Vulcan Materials
2025-12-03,Donald Zurbay,Patterson Companies Inc,0,4,3,7,42.9,,Donald Zurbay Patterson Companies Inc
2025-12-03,Anthony Smurfit,Smurfit Westrock,6,12,7,25,28.0,,Anthony Smurfit Smurfit Westrock
2025-12-03,Richard P Dealy,Pioneer Natural Resources,3,5,0,8,0.0,,Richard P Dealy Pioneer Natural Resources
2025-12-03,Derek Chang,Liberty Media,24,1,0,25,0.0,,Derek Chang Liberty Media
2025-12-03,Timothy J Donahue,Crown Holdings,6,18,1,25,4.0,,Timothy J Donahue Crown Holdings
2025-12-03,R Bruce McDonald,Dana Incorporated,6,18,1,25,4.0,,R Bruce McDonald Dana Incorporated
2025-12-03,J Kent Masters,Albemarle Corporation,1,12,6,19,31.6,,J Kent Masters Albemarle Corporation
2025-12-03,Malcolm C Roberts,FM Global,4,15,3,22,13.6,,Malcolm C Roberts FM Global
2025-12-03,Mike Speetzen,Polaris Inc,2,17,6,25,24.0,,Mike Speetzen Polaris Inc
2025-12-03,Bob Flexon,UGI Utilities Inc,3,4,1,8,12.5,,Bob Flexon UGI Utilities Inc
2025-12-03,Robert D Lawler,Continental Resources,0,2,0,2,0.0,,Robert D Lawler Continental Resources
2025-12-03,Domenic Dell’Osso Jr,Expand Energy Corporation,10,1,0,11,0.0,,Domenic Dell’Osso Jr Expand Energy Corporation
2025-12-03,H Michael Krimbill,NGL Energy Partners,6,2,1,9,11.1,,H Michael Krimbill NGL Energy Partners
2025-12-03,Hassane El-Khoury,ON Semiconductor,2,15,8,25,32.0,,Hassane El-Khoury ON Semiconductor
2025-12-03,Joseph M Otting,Flagstar Financial,6,9,3,18,16.7,,Joseph M Otting Flagstar Financial
2025-12-03,Gerry P Smith,ODP Business Solutions,3,5,2,10,20.0,,Gerry P Smith ODP Business Solutions
2025-12-03,Devin Stockfish,Weyerhaeuser,7,18,0,25,0.0,,Devin Stockfish Weyerhaeuser
2025-12-03,Thomas J McInerney,Genworth Financial,5,5,1,11,9.1,,Thomas J McInerney Genworth Financial
2025-12-03,Daniel Heaf,Bath & Body Works,6,14,5,25,20.0,,Daniel Heaf Bath & Body Works
2025-12-03,Linda Rendle,Clorox,3,18,4,25,16.0,,Linda Rendle Clorox
2025-12-03,Frank C Sullivan,RPM International,4,19,2,25,8.0,,Frank C Sullivan RPM International
2025-12-03,Matthew Missad,UFP Industries,7,6,0,13,0.0,,Matthew Missad UFP Industries
2025-12-03,Martin J Lyons,Ameren,2,8,2,12,16.7,,Martin J Lyons Ameren
2025-12-03,Adam W Miller,Knight Swift Transportation,4,10,2,16,12.5,,Adam W Miller Knight Swift Transportation
2025-12-03,Charles Liang,Super Micro Computer,18,5,2,25,8.0,,Charles Liang Super Micro Computer
2025-12-03,Gordon J Hardie,O-I Glass,0,6,0,6,0.0,,Gordon J Hardie O-I Glass
2025-12-03,Steve Henry,Domtar,0,11,1,12,8.3,,Steve Henry Domtar
2025-12-03,Chuck Treadway,CommScope,4,19,2,25,8.0,,Chuck Treadway CommScope
2025-12-03,Steven J Moskowitz,Crown Castle,4,7,2,13,15.4,,Steven J Moskowitz Crown Castle
2025-12-03,Emmanuel Ligner,Avantor,7,16,2,25,8.0,,Emmanuel Ligner Avantor
2025-12-03,Kaz Nejatian,Opendoor Technologies,8,15,2,25,8.0,,Kaz Nejatian Opendoor Technologies
2025-12-03,Russell Becker,APi Group,7,18,0,25,0.0,,Russell Becker APi Group
2025-12-03,Toby Rice,EQT,13,10,2,25,8.0,,Toby Rice EQT
2025-12-03,Jesse Arenivas,EnLink Midstream,6,14,2,22,9.1,,Jesse Arenivas EnLink Midstream
2025-12-03,Steven Bandrowczak,Xerox,4,18,3,25,12.0,,Steven Bandrowczak Xerox
2025-12-03,Vicente Reynal,Ingersoll Rand,6,19,0,25,0.0,,Vicente Reynal Ingersoll Rand
2025-12-03,William T Dillard II,Dillards,11,11,3,25,12.0,,William T Dillard II Dillards
2025-12-03,C Howard Nye,Martin Marietta Materials,4,5,2,11,18.2,,C Howard Nye Martin Marietta Materials
2025-12-03,Stephane Bancel,Moderna,7,8,10,25,40.0,,Stephane Bancel Moderna
2025-12-03,Nate R Jorgensen,Boise Cascade,1,0,0,1,0.0,,Nate R Jorgensen Boise Cascade
2025-12-03,Padraig McDonnell,Agilent Technologies,12,13,0,25,0.0,,Padraig McDonnell Agilent Technologies
2025-12-03,Kenneth T Lane,Olin,1,2,0,3,0.0,,Kenneth T Lane Olin
2025-12-03,Randall C Stuewe,Darling Ingredients,24,1,0,25,0.0,,Randall C Stuewe Darling Ingredients
2025-12-03,R Howard Coker,Sonoco Products,5,8,2,15,13.3,,R Howard Coker Sonoco Products
2025-12-03,Lee M Tillman,Marathon Oil,3,11,4,18,22.2,,Lee M Tillman Marathon Oil
2025-12-03,Mark Hoplamazian,Hyatt Hotels,7,17,1,25,4.0,,Mark Hoplamazian Hyatt Hotels
2025-12-03,David S Chernow,Select Medical Holdings,0,8,0,8,0.0,,David S Chernow Select Medical Holdings
2025-12-03,Brendan M Foley,McCormick & Company,5,20,0,25,0.0,,Brendan M Foley McCormick & Company
2025-12-03,Joanne Crevoiserat,Tapestry,12,13,0,25,0.0,,Joanne Crevoiserat Tapestry
2025-12-03,W Anthony Will,CF Industries,6,16,0,22,0.0,,W Anthony Will CF Industries
2025-12-03,David A Zapico,Ametek,3,19,0,22,0.0,,David A Zapico Ametek
2025-12-03,Craig Billings,Wynn Resorts,4,19,2,25,8.0,,Craig Billings Wynn Resorts
2025-12-03,Giel Rutten,Amkor Technology,5,19,1,25,4.0,,Giel Rutten Amkor Technology
2025-12-03,Paul Sarvadi,Insperity,6,19,0,25,0.0,,Paul Sarvadi Insperity
2025-12-03,Rob Sharps,T Rowe Price,8,13,4,25,16.0,,Rob Sharps T Rowe Price
2025-12-03,Patrice Louvet,Ralph Lauren,7,12,6,25,24.0,,Patrice Louvet Ralph Lauren
2025-12-03,Jeffrey Mezger,KB Home,3,14,8,25,32.0,,Jeffrey Mezger KB Home
2025-12-03,David M Foulkes,Brunswick Corporation,2,14,0,16,0.0,,David M Foulkes Brunswick Corporation
2025-12-03,M Keith Waddell,Robert Half,11,12,2,25,8.0,,M Keith Waddell Robert Half
2025-12-03,Jay Snowden,PENN Entertainment,16,6,3,25,12.0,,Jay Snowden PENN Entertainment
2025-12-03,George Kurian,NetApp,12,10,3,25,12.0,,George Kurian NetApp
2025-12-03,Kevin Ali,Organon,2,9,14,25,56.0,,Kevin Ali Organon
2025-12-03,Joel D Anderson,Petco Health and Wellness,3,10,1,14,7.1,,Joel D Anderson Petco Health and Wellness
2025-12-03,Louis V Pinkham,Regal Rexnord,4,14,0,18,0.0,,Louis V Pinkham Regal Rexnord
2025-12-03,Jay Geldmacher,Resideo Technologies,13,11,0,24,0.0,,Jay Geldmacher Resideo Technologies
2025-12-03,Marcus Lemonis,Camping World,6,11,8,25,32.0,,Marcus Lemonis Camping World
2025-12-03,Peter R Huntsman,Huntsman,5,15,5,25,20.0,,Peter R Huntsman Huntsman
2025-12-03,Hillary Super,Victorias Secret,6,10,9,25,36.0,,Hillary Super Victorias Secret
2025-12-03,Michelle Gass,Levi Strauss,7,18,0,25,0.0,,Michelle Gass Levi Strauss
2025-12-03,Neil Hunn,Roper Technologies,8,17,0,25,0.0,,Neil Hunn Roper Technologies
2025-12-03,Steven P Lawrence,Academy Sports and Outdoors,2,8,2,12,16.7,,Steven P Lawrence Academy Sports and Outdoors
2025-12-03,Phillippe Lord,Meritage Homes,10,13,2,25,8.0,,Phillippe Lord Meritage Homes
2025-12-03,David C Dauch,American Axle & Manufacturing,7,17,1,25,4.0,,David C Dauch American Axle & Manufacturing
2025-12-03,Olumide Soroye,Fortive,1,7,1,9,11.1,,Olumide Soroye Fortive
2025-12-03,Adena Friedman,Nasdaq Inc,11,13,1,25,4.0,,Adena Friedman Nasdaq Inc
2025-12-03,Tim Gokey,Broadridge Financial Solutions,4,20,1,25,4.0,,Tim Gokey Broadridge Financial Solutions
2025-12-03,Patrick M Shanahan,Spirit AeroSystems,3,18,2,23,8.7,,Patrick M Shanahan Spirit AeroSystems
2025-12-03,Robert Kyncl,Warner Music Group,9,10,6,25,24.0,,Robert Kyncl Warner Music Group
2025-12-03,Denise Dignam,Chemours,8,16,1,25,4.0,,Denise Dignam Chemours
2025-12-03,Jim DeVries,ADT,10,12,2,24,8.3,,Jim DeVries ADT
2025-12-03,Bernard Zovighian,Edwards Lifesciences,7,10,2,19,10.5,,Bernard Zovighian Edwards Lifesciences
2025-12-03,Mark E Seaton,First American Financial,1,17,1,19,5.3,,Mark E Seaton First American Financial
2025-12-03,John C Roche,Hanover Insurance Group,4,17,0,21,0.0,,John C Roche Hanover Insurance Group
2025-12-03,Adam J Greenlee,Silgan,3,6,1,10,10.0,,Adam J Greenlee Silgan
2025-12-03,Jayne Hrdlicka,Endeavor Group,3,19,3,25,12.0,,Jayne Hrdlicka Endeavor Group
2025-12-03,Robert Fauber,Moodys Corporation,6,16,3,25,12.0,,Robert Fauber Moodys Corporation
2025-12-03,Thomas E Jorden,Coterra Energy,13,0,0,13,0.0,,Thomas E Jorden Coterra Energy
2025-12-03,Eugene A Hall,Gartner,8,16,1,25,4.0,,Eugene A Hall Gartner
2025-12-03,Kevin Plank,Under Armour,4,17,4,25,16.0,,Kevin Plank Under Armour
2025-12-03,James W Lanning,Ingles Markets,3,6,0,9,0.0,,James W Lanning Ingles Markets
2025-12-03,Matthew T Farrell,Church & Dwight,11,13,1,25,4.0,,Matthew T Farrell Church & Dwight
2025-12-03,Kevin M Freeman,Old Dominion Freight Line,3,9,0,12,0.0,,Kevin M Freeman Old Dominion Freight Line
2025-12-03,Joe Shoen,U-Haul,5,15,5,25,20.0,,Joe Shoen U-Haul
2025-12-03,Jayshree Ullal,Arista Networks,10,14,1,25,4.0,,Jayshree Ullal Arista Networks
2025-12-03,Sassine Ghazi,Synopsys,6,15,4,25,16.0,,Sassine Ghazi Synopsys
2025-12-03,Jochen Zeitz,Harley-Davidson,3,17,5,25,20.0,,Jochen Zeitz Harley-Davidson
2025-12-03,Nick Jeffery,Frontier Communications,5,20,0,25,0.0,,Nick Jeffery Frontier Communications
2025-12-03,Thomas Edward McCormick,Primoris Services,2,5,0,7,0.0,,Thomas Edward McCormick Primoris Services
2025-12-03,D Christian Koch,Carlisle Companies,3,16,2,21,9.5,,D Christian Koch Carlisle Companies
2025-12-03,David E Simon,Simon Property Group,7,14,4,25,16.0,,David E Simon Simon Property Group
2025-12-03,Stephen Bratspies,Hanesbrands,5,17,3,25,12.0,,Stephen Bratspies Hanesbrands
2025-12-03,Ryan M. Schneider,Anywhere Real Estate Inc,5,18,2,25,8.0,,Ryan M. Schneider Anywhere Real Estate Inc
2025-12-03,George Bobb III,Teledyne Technologies,0,14,0,14,0.0,,George Bobb III Teledyne Technologies
2025-12-03,Terrence A Duffy,CME Group,2,21,2,25,8.0,,Terrence A Duffy CME Group
2025-12-03,Rami Rahim,Juniper Networks,4,20,1,25,4.0,,Rami Rahim Juniper Networks
2025-12-03,Sue Nabi,Coty,9,14,2,25,8.0,,Sue Nabi Coty
2025-12-03,Peter D Arvan,Pool Corporation,9,14,2,25,8.0,,Peter D Arvan Pool Corporation
2025-12-03,David Campbell,Evergy,13,9,3,25,12.0,,David Campbell Evergy
2025-12-03,Matthew J Murphy,Marvell Technology,4,11,2,17,11.8,,Matthew J Murphy Marvell Technology
2025-12-03,Lloyd Yates,NiSource,12,13,0,25,0.0,,Lloyd Yates NiSource
2025-12-03,William C Stone,SS&C Technologies,12,9,4,25,16.0,,William C Stone SS&C Technologies
2025-12-03,Mark Rourke,Schneider National,7,18,0,25,0.0,,Mark Rourke Schneider National
2025-12-03,Andrew Anagnost,Autodesk,6,15,4,25,16.0,,Andrew Anagnost Autodesk
2025-12-03,Dustin Semach,Sealed Air Corporation,3,22,0,25,0.0,,Dustin Semach Sealed Air Corporation
2025-12-03,William L Meaney,Iron Mountain,4,16,3,23,13.0,,William L Meaney Iron Mountain
2025-12-03,Andy P Power,Digital Realty Trust,4,7,0,11,0.0,,Andy P Power Digital Realty Trust
2025-12-03,Satish Dhanasekaran,Keysight Technologies,3,18,0,21,0.0,,Satish Dhanasekaran Keysight Technologies
2025-12-03,Frank M Svoboda,Globe Life,1,5,4,10,40.0,,Frank M Svoboda Globe Life
2025-12-03,Carey A Smith,Parsons Corporation,7,15,3,25,12.0,,Carey A Smith Parsons Corporation
2025-12-03,Ynon Kreiz,Mattel,3,16,6,25,24.0,,Ynon Kreiz Mattel
2025-12-03,Karen S Haller,Southwest Gas Holdings,5,9,0,14,0.0,,Karen S Haller Southwest Gas Holdings
2025-12-03,Terrance Williams,TruStage,8,8,1,17,5.9,,Terrance Williams TruStage
2025-12-03,Eric W Gerstenberg,Clean Harbors,6,2,1,9,11.1,,Eric W Gerstenberg Clean Harbors
2025-12-03,Gunner Smith,Cornerstone Building Brands,1,6,1,8,12.5,,Gunner Smith Cornerstone Building Brands
