date,ceo,company,positive,neutral,negative,total,neg_pct,theme,alias
2025-12-04,Timothy J McGrath,PC Connection Inc,0,0,0,0,0.0,,Timothy J McGrath PC Connection Inc
2025-12-04,Lynn M Bamford,Curtiss-Wright,11,13,1,25,4.0,,Lynn M Bamford Curtiss-Wright
2025-12-04,Jonathan W Witter,Sallie Mae,3,4,2,9,22.2,,Jonathan W Witter Sallie Mae
2025-12-04,Jeff Benck,Benchmark Electronics,3,17,0,20,0.0,,Jeff Benck Benchmark Electronics
2025-12-04,Charles H Giancarlo,Pure Storage,5,16,1,22,4.5,,Charles H Giancarlo Pure Storage
2025-12-04,Brian R Gray,Knife River Corporation,1,1,0,2,0.0,,Brian R Gray Knife River Corporation
2025-12-04,Jay Schmidt,Caleres Inc,3,11,2,16,12.5,,Jay Schmidt Caleres Inc
2025-12-04,Dale Asplund,BrightView Holdings,0,8,0,8,0.0,,Dale Asplund BrightView Holdings
2025-12-04,Jeffrey S Edwards,Cooper-Standard,1,15,2,18,11.1,,Jeffrey S Edwards Cooper-Standard
2025-12-04,Glenn J Williams,Primerica,6,2,2,10,20.0,,Glenn J Williams Primerica
2025-12-04,Francois Locoh-Donou,F5,7,15,3,25,12.0,,Francois Locoh-Donou F5
2025-12-04,Joseph Wm Foran,Matador Resources,7,18,0,25,0.0,,Joseph Wm Foran Matador Resources
2025-12-04,Sridhar Ramaswamy,Snowflake Inc,7,16,2,25,8.0,,Sridhar Ramaswamy Snowflake Inc
2025-12-04,Mark D Dankberg,Viasat,3,9,6,18,33.3,,Mark D Dankberg Viasat
2025-12-04,Francisco J Leon,California Resources,1,5,2,8,25.0,,Francisco J Leon California Resources
2025-12-04,Peter Stern,Peloton Interactive,8,12,5,25,20.0,,Peter Stern Peloton Interactive
2025-12-04,David Baszucki,Roblox,9,8,8,25,32.0,,David Baszucki Roblox
2025-12-04,Jeffrey W Edwards,Installed Building Products,1,5,0,6,0.0,,Jeffrey W Edwards Installed Building Products
2025-12-04,Clark Lauritzen,First National of Nebraska,1,10,0,11,0.0,,Clark Lauritzen First National of Nebraska
2025-12-04,Carlos Alberini,Guess Inc,3,20,2,25,8.0,,Carlos Alberini Guess Inc
2025-12-04,Shyam P Kambeyanda,ESAB,3,6,0,9,0.0,,Shyam P Kambeyanda ESAB
2025-12-04,Edmund Shallcross III,Amica Mutual Insurance,3,7,0,10,0.0,,Edmund Shallcross III Amica Mutual Insurance
2025-12-04,Benjamin W Schall,AvalonBay Communities,1,10,2,13,15.4,,Benjamin W Schall AvalonBay Communities
2025-12-04,Allan C Thygesen,DocuSign,9,7,4,20,20.0,,Allan C Thygesen DocuSign
2025-12-04,Bryan J Knutson,Titan Machinery,1,2,1,4,25.0,,Bryan J Knutson Titan Machinery
2025-12-04,Heath Sampson,ModivCare,8,6,3,17,17.6,,Heath Sampson ModivCare
2025-12-04,Ara K Hovnanian,Hovnanian Enterprises,8,15,2,25,8.0,,Ara K Hovnanian Hovnanian Enterprises
2025-12-04,Joshua G Silverman,Etsy,7,16,2,25,8.0,,Joshua G Silverman Etsy
2025-12-04,Kevin Roycraft,Adams Resources & Energy,9,1,1,11,9.1,,Kevin Roycraft Adams Resources & Energy
2025-12-04,J Eric Evans,Surgery Partners,0,1,1,2,50.0,,J Eric Evans Surgery Partners
2025-12-04,Clint E Stein,Columbia Banking System,1,10,0,11,0.0,,Clint E Stein Columbia Banking System
2025-12-04,Lee M Shavel,Verisk Analytics,2,16,1,19,5.3,,Lee M Shavel Verisk Analytics
2025-12-04,Dave Banyard Jr,MasterBrand,1,0,1,2,50.0,,Dave Banyard Jr MasterBrand
2025-12-04,Peter R Ingram,Hawaiian Airlines Inc,2,9,2,13,15.4,,Peter R Ingram Hawaiian Airlines Inc
2025-12-04,Kristin A Dolan,AMC Networks,2,18,5,25,20.0,,Kristin A Dolan AMC Networks
2025-12-04,Brendan T Cavanagh,SBA Communications,1,11,1,13,7.7,,Brendan T Cavanagh SBA Communications
2025-12-04,George F Chappelle Jr,Americold Realty Trust,3,4,0,7,0.0,,George F Chappelle Jr Americold Realty Trust
2025-12-04,Thomas E Gottwald,NewMarket Corporation,1,11,0,12,0.0,,Thomas E Gottwald NewMarket Corporation
2025-12-04,Thomas J Baltimore Jr,Park Hotels & Resorts,4,20,1,25,4.0,,Thomas J Baltimore Jr Park Hotels & Resorts
2025-12-04,Peter M Moglia,Alexandria Real Estate Equities,2,7,1,10,10.0,,Peter M Moglia Alexandria Real Estate Equities
2025-12-04,Ronald J Kramer,Griffon Corporation,2,8,0,10,0.0,,Ronald J Kramer Griffon Corporation
2025-12-04,John L Plueger,Air Lease,4,15,0,19,0.0,,John L Plueger Air Lease
2025-12-04,Jennifer F Scanlon,UL Solutions,6,3,0,9,0.0,,Jennifer F Scanlon UL Solutions
2025-12-04,Greg Smith,Teradyne,3,20,2,25,8.0,,Greg Smith Teradyne
2025-12-04,Sean Trauschke,OGE Energy,19,4,2,25,8.0,,Sean Trauschke OGE Energy
2025-12-04,Norman D Schwartz,Bio-Rad Laboratories,4,6,2,12,16.7,,Norman D Schwartz Bio-Rad Laboratories
2025-12-04,Scott Doyle,Spire Inc,5,8,2,15,13.3,,Scott Doyle Spire Inc
2025-12-04,Michael E Reed,Gannett,3,5,3,11,27.3,,Michael E Reed Gannett
2025-12-04,Cindy J Miller,Stericycle,2,7,5,14,35.7,,Cindy J Miller Stericycle
2025-12-04,Phillip D Green,Cullen Frost Bankers,3,8,4,15,26.7,,Phillip D Green Cullen Frost Bankers
2025-12-04,Joseph D Margolis,Extra Space Storage,1,9,0,10,0.0,,Joseph D Margolis Extra Space Storage
2025-12-04,Mark A Skonieczny,REV Group,0,11,1,12,8.3,,Mark A Skonieczny REV Group
2025-12-04,Ladd Wilks,ProFrac Holding,4,3,2,9,22.2,,Ladd Wilks ProFrac Holding
2025-12-04,Sundaram Nagarajan,Nordson,6,18,1,25,4.0,,Sundaram Nagarajan Nordson
2025-12-04,Anne P Noonan,Summit Materials,1,6,0,7,0.0,,Anne P Noonan Summit Materials
2025-12-04,Lori Flees,Valvoline Inc,2,7,5,14,35.7,,Lori Flees Valvoline Inc
2025-12-04,Scott H Baxter,Kontoor Brands,2,7,1,10,10.0,,Scott H Baxter Kontoor Brands
2025-12-04,Tim Larson,Skyline Champion,18,0,0,18,0.0,,Tim Larson Skyline Champion
2025-12-04,Chuck Divita,Teladoc Health,6,16,3,25,12.0,,Chuck Divita Teladoc Health
2025-12-04,W Bradley Southern,Louisiana-Pacific Corporation,1,16,0,17,0.0,,W Bradley Southern Louisiana-Pacific Corporation
2025-12-04,George C Freeman III,Universal Corporation,8,17,0,25,0.0,,George C Freeman III Universal Corporation
2025-12-04,James A Brock,Consol Energy,6,5,0,11,0.0,,James A Brock Consol Energy
2025-12-04,Robert Antokol,Playtika Holding,0,9,1,10,10.0,,Robert Antokol Playtika Holding
2025-12-04,Joe Craft,Alliance Resource Partners,9,14,2,25,8.0,,Joe Craft Alliance Resource Partners
2025-12-04,Paul Keel,Envista,2,9,1,12,8.3,,Paul Keel Envista
2025-12-04,Jared Isaacman,Shift4 Payments,4,18,3,25,12.0,,Jared Isaacman Shift4 Payments
2025-12-04,Mark Mac McFarland,Talen Energy,6,2,1,9,11.1,,Mark Mac McFarland Talen Energy
2025-12-04,Tony R Thene,Carpenter Technology,1,14,1,16,6.2,,Tony R Thene Carpenter Technology
2025-12-04,Melissa D Smith,WEX,6,7,2,15,13.3,,Melissa D Smith WEX
2025-12-04,James Jim C Ryan III,Old National Bancorp,2,5,1,8,12.5,,James Jim C Ryan III Old National Bancorp
2025-12-04,Peter J Federico,AGNC Investment,5,4,2,11,18.2,,Peter J Federico AGNC Investment
2025-12-04,Brent L Yeagy,Wabash National,0,3,0,3,0.0,,Brent L Yeagy Wabash National
2025-12-04,Henry A Fernandez,MSCI,7,15,3,25,12.0,,Henry A Fernandez MSCI
2025-12-04,Mark Penn,Stagwell,6,16,3,25,12.0,,Mark Penn Stagwell
2025-12-04,Julie Schertell,Mativ,4,17,0,21,0.0,,Julie Schertell Mativ
2025-12-04,Ashish Chand,Belden,0,7,1,8,12.5,,Ashish Chand Belden
2025-12-04,Greg Anderson,Allegiant Travel Company,10,14,1,25,4.0,,Greg Anderson Allegiant Travel Company
2025-12-04,Drew Houston,Dropbox,7,14,4,25,16.0,,Drew Houston Dropbox
2025-12-04,Kevin T Conroy,Exact Sciences,4,12,9,25,36.0,,Kevin T Conroy Exact Sciences
2025-12-04,Rex D Geveden,BWX Technologies,14,9,2,25,8.0,,Rex D Geveden BWX Technologies
2025-12-04,Scott R Wells,Clear Channel Outdoor Hldgs,7,2,1,10,10.0,,Scott R Wells Clear Channel Outdoor Hldgs
2025-12-04,Casey Wasserman,Wasserman,11,13,1,25,4.0,,Casey Wasserman
2025-12-04,Mac Cummings,Terakeet,3,7,0,10,0.0,,Mac Cummings Terakeet
