date,ceo,company,positive,neutral,negative,total,neg_pct,theme,alias
2025-10-17,Gerben W Bakker,Hubbell,1,4,0,5,0.0,,Gerben W Bakker Hubbell
2025-10-17,Dave Davis,Spirit Airlines,6,12,7,25,28.0,,Dave Davis Spirit Airlines
2025-10-17,Michael J Smith,Lamb Weston,1,12,12,25,48.0,,Michael J Smith Lamb Weston
2025-10-17,Strauss Zelnick,Take-Two Interactive Software,8,11,6,25,24.0,,Strauss Zelnick Take-Two Interactive Software
2025-10-17,John C Turner Jr,GMS,5,20,0,25,0.0,,John C Turner Jr GMS
2025-10-17,David M O'Malley,Penn Mutual Life Insurance,2,7,1,10,10.0,,David M O'Malley Penn Mutual Life Insurance
2025-10-17,Frank A Lonegro,Landstar System,4,6,1,11,9.1,,Frank A Lonegro Landstar System
2025-10-17,James F Risoleo,Host Hotels & Resorts,5,14,0,19,0.0,,James F Risoleo Host Hotels & Resorts
2025-10-17,Ken Xie,Fortinet,10,13,2,25,8.0,,Ken Xie Fortinet
2025-10-17,Doug Shulman,OneMain,2,6,0,8,0.0,,Doug Shulman OneMain
2025-10-17,Ryan Cohen,GameStop,10,11,4,25,16.0,,Ryan Cohen GameStop
2025-10-17,Mark W Begor,Equifax,4,20,1,25,4.0,,Mark W Begor Equifax
2025-10-17,Jay L Schottenstein,American Eagle Outfitters,7,15,3,25,12.0,,Jay L Schottenstein American Eagle Outfitters
2025-10-17,Curtis C Farmer,Comerica,4,13,0,17,0.0,,Curtis C Farmer Comerica
2025-10-17,Ole Rosgaard,Greif,4,19,2,25,8.0,,Ole Rosgaard Greif
2025-10-17,Brian E Lane,Comfort Systems USA,17,0,0,17,0.0,,Brian E Lane Comfort Systems USA
2025-10-17,Robert M Buck,TopBuild,0,10,0,10,0.0,,Robert M Buck TopBuild
2025-10-17,Ralph Andretta,Bread Financial,6,10,0,16,0.0,,Ralph Andretta Bread Financial
2025-10-17,Jim Anderson,Coherent,2,21,2,25,8.0,,Jim Anderson Coherent
2025-10-17,Walter C. D. Carlson,Telephone & Data Systems,1,8,4,13,30.8,,Walter C. D. Carlson Telephone & Data Systems
2025-10-17,Ronald Kruszewski,Stifel Financial,11,13,1,25,4.0,,Ronald Kruszewski Stifel Financial
2025-10-17,Richard Hayne,Urban Outfitters,4,18,3,25,12.0,,Richard Hayne Urban Outfitters
2025-10-17,Simon Meester,Terex,3,19,3,25,12.0,,Simon Meester Terex
2025-10-17,Edward J Lehner,Ryerson Holding,0,3,0,3,0.0,,Edward J Lehner Ryerson Holding
2025-10-17,Nicholas T Pinchuk,Snap-on,4,7,0,11,0.0,,Nicholas T Pinchuk Snap-on
2025-10-17,Ryals McMullian,Flowers Foods,5,17,3,25,12.0,,Ryals McMullian Flowers Foods
2025-10-17,D Bryan Jordan,First Horizon,8,13,4,25,16.0,,D Bryan Jordan First Horizon
2025-10-17,John B Gibson,Paychex,1,7,1,9,11.1,,John B Gibson Paychex
2025-10-17,Chris Cocks,Hasbro,9,7,9,25,36.0,,Chris Cocks Hasbro
2025-10-17,Pete McPartland,Sentry Insurance Group,6,17,0,23,0.0,,Pete McPartland Sentry Insurance Group
2025-10-17,Michael Arougheti,Ares Management,9,14,2,25,8.0,,Michael Arougheti Ares Management
2025-10-17,Alok Maskara,Lennox International,11,13,1,25,4.0,,Alok Maskara Lennox International
2025-10-17,James C Grech,Peabody Energy,5,1,0,6,0.0,,James C Grech Peabody Energy
2025-10-17,Joseph P Lacher Jr,Kemper Corporation,8,16,1,25,4.0,,Joseph P Lacher Jr Kemper Corporation
2025-10-17,Perry A Sook,Nexstar Media Group,4,16,5,25,20.0,,Perry A Sook Nexstar Media Group
2025-10-17,Wade Davis,TelevisaUnivision,6,18,1,25,4.0,,Wade Davis TelevisaUnivision
2025-10-17,Scott L Thompson,Tempur Sealy International,0,10,0,10,0.0,,Scott L Thompson Tempur Sealy International
2025-10-17,Mike Simonds,TriNet Group,5,11,0,16,0.0,,Mike Simonds TriNet Group
2025-10-17,B Andrew Rose,Worthington Enterprises,1,7,0,8,0.0,,B Andrew Rose Worthington Enterprises
2025-10-17,Bruce L Caswell,Maximus,6,7,0,13,0.0,,Bruce L Caswell Maximus
2025-10-17,Robert L Reffkin,Compass Group,3,7,1,11,9.1,,Robert L Reffkin Compass Group
2025-10-17,Mark Eubanks,Brinks Company,5,17,3,25,12.0,,Mark Eubanks Brinks Company
2025-10-17,Peter Quigley,Kelly Services Inc,7,18,0,25,0.0,,Peter Quigley Kelly Services Inc
2025-10-17,David L Yowan,Navient,1,4,1,6,16.7,,David L Yowan Navient
2025-10-17,Mary E Kipp,Puget Sound Energy,7,2,1,10,10.0,,Mary E Kipp Puget Sound Energy
2025-10-17,Adam Aron,AMC Entertainment,9,9,7,25,28.0,,Adam Aron AMC Entertainment
2025-10-17,Mark J Tarr,Encompass Health,2,6,1,9,11.1,,Mark J Tarr Encompass Health
2025-10-17,Liam K Griffin,Skyworks Solutions,2,9,1,12,8.3,,Liam K Griffin Skyworks Solutions
2025-10-17,Richard G Kyle,Timken,2,22,1,25,4.0,,Richard G Kyle Timken
2025-10-17,Ron Gusek,Liberty Energy,24,1,0,25,0.0,,Ron Gusek Liberty Energy
2025-10-17,John E Geller Jr,Marriott Vacations Worldwide,4,7,0,11,0.0,,John E Geller Jr Marriott Vacations Worldwide
2025-10-17,Karl G. Glassman,Leggett & Platt,0,4,0,4,0.0,,Karl G. Glassman Leggett & Platt
2025-10-17,Jonathan H Weis,Weis Markets,6,19,0,25,0.0,,Jonathan H Weis Weis Markets
2025-10-17,Jeffrey B Guldner,Pinnacle West Capital,3,7,0,10,0.0,,Jeffrey B Guldner Pinnacle West Capital
2025-10-17,Arkadiy Dobkin,EPAM Systems,6,17,2,25,8.0,,Arkadiy Dobkin EPAM Systems
2025-10-17,Paul M Rady,Antero Resources,3,17,0,20,0.0,,Paul M Rady Antero Resources
2025-10-17,Michael Spanos,Bloomin Brands,4,19,2,25,8.0,,Michael Spanos Bloomin Brands
2025-10-17,Nicole A Kivisto,MDU Resources Group,8,11,1,20,5.0,,Nicole A Kivisto MDU Resources Group
2025-10-17,Gerald L Morgan,Texas Roadhouse,5,8,7,20,35.0,,Gerald L Morgan Texas Roadhouse
2025-10-17,Gabriel Tirador,Mercury General,6,10,0,16,0.0,,Gabriel Tirador Mercury General
2025-10-17,Nicholas I Fink,Fortune Brands Innovations,2,22,1,25,4.0,,Nicholas I Fink Fortune Brands Innovations
2025-10-17,Paul E Burdiss,Zions Bancorp,1,4,0,5,0.0,,Paul E Burdiss Zions Bancorp
2025-10-17,William J Christensen,JELD-WEN Holding,1,13,0,14,0.0,,William J Christensen JELD-WEN Holding
2025-10-17,Evan Spiegel,Snap Inc,7,14,4,25,16.0,,Evan Spiegel Snap Inc
2025-10-17,Bill Burns,Zebra Technologies,6,19,0,25,0.0,,Bill Burns Zebra Technologies
2025-10-17,Steven Sell,Agilon Health,4,8,7,19,36.8,,Steven Sell Agilon Health
2025-10-17,Richard M Olson,Toro Company,0,22,3,25,12.0,,Richard M Olson Toro Company
2025-10-17,Eric S Yuan,Zoom Video Communications,8,14,3,25,12.0,,Eric S Yuan Zoom Video Communications
2025-10-17,Dan L Batrack,Tetra Tech,5,6,1,12,8.3,,Dan L Batrack Tetra Tech
2025-10-17,Joseph D Russell Jr,Public Storage,0,8,0,8,0.0,,Joseph D Russell Jr Public Storage
2025-10-17,Jacob Thaysen,Illumina Inc,7,16,2,25,8.0,,Jacob Thaysen Illumina Inc
2025-10-17,Debra A Cafaro,Ventas Inc,13,11,1,25,4.0,,Debra A Cafaro Ventas Inc
2025-10-17,Pierre R Brondeau,FMC Corporation,1,8,3,12,25.0,,Pierre R Brondeau FMC Corporation
2025-10-17,Judy R McReynolds,ArcBest,6,17,2,25,8.0,,Judy R McReynolds ArcBest
2025-10-17,Russell J Weiner,Dominos Pizza Inc,11,10,4,25,16.0,,Russell J Weiner Dominos Pizza Inc
2025-10-17,Theodore S Hanson,ASGN,1,3,0,4,0.0,,Theodore S Hanson ASGN
2025-10-17,RJ Scaringe,Rivian Automotive,2,13,10,25,40.0,,RJ Scaringe Rivian Automotive
2025-10-17,Jeffrey N Simmons,Elanco Animal Health,10,11,4,25,16.0,,Jeffrey N Simmons Elanco Animal Health
2025-10-17,Tim O Shaughnessy,Graham Holdings Company,2,19,1,22,4.5,,Tim O Shaughnessy Graham Holdings Company
2025-10-17,Thomas V Taylor,Floor & Decor,1,4,2,7,28.6,,Thomas V Taylor Floor & Decor
2025-10-17,Neil A Schrimsher,Applied Industrial Technologies,4,13,0,17,0.0,,Neil A Schrimsher Applied Industrial Technologies
2025-10-17,Robert E Price,PriceSmart,4,2,0,6,0.0,,Robert E Price PriceSmart
2025-10-17,John David Risher,Lyft,7,14,4,25,16.0,,John David Risher Lyft
2025-10-17,Gary B Smith,Ciena,8,16,1,25,4.0,,Gary B Smith Ciena
2025-10-17,Joey Levin,IAC,6,18,1,25,4.0,,Joey Levin IAC
2025-10-17,Jim Jacobs,Country Financial,7,11,2,20,10.0,,Jim Jacobs Country Financial
2025-10-17,Devin B McGranahan,Western Union,5,9,0,14,0.0,,Devin B McGranahan Western Union
2025-10-17,R Scott Rowe,Flowserve,4,4,2,10,20.0,,R Scott Rowe Flowserve
2025-10-17,Kenneth A Vecchione,Western Alliance Bancorp,4,13,8,25,32.0,,Kenneth A Vecchione Western Alliance Bancorp
2025-10-17,John C Rademacher,Option Care Health,17,3,0,20,0.0,,John C Rademacher Option Care Health
2025-10-17,Doug Black,SiteOne Landscape Supply,3,21,1,25,4.0,,Doug Black SiteOne Landscape Supply
2025-10-17,Oliver G Brewer III,Topgolf Callaway Brands,1,2,0,3,0.0,,Oliver G Brewer III Topgolf Callaway Brands
2025-10-17,Glenn Sanford,eXp World,7,17,1,25,4.0,,Glenn Sanford eXp World
2025-10-17,Fran Horowitz,Abercrombie & Fitch,10,11,4,25,16.0,,Fran Horowitz Abercrombie & Fitch
2025-10-17,Kevin Akers,Atmos Energy,10,3,1,14,7.1,,Kevin Akers Atmos Energy
2025-10-17,Alessandro Maselli,Catalent,3,20,2,25,8.0,,Alessandro Maselli Catalent
2025-10-17,J Powell Brown,Brown & Brown,7,14,4,25,16.0,,J Powell Brown Brown & Brown
2025-10-17,Aman Bhutani,GoDaddy,6,18,1,25,4.0,,Aman Bhutani GoDaddy
2025-10-17,John C. Griffith,American Water Works,0,7,1,8,12.5,,John C. Griffith American Water Works
2025-10-17,John J Marchioni,Selective Insurance Group,4,14,1,19,5.3,,John J Marchioni Selective Insurance Group
2025-10-17,Lawson E Whiting,Brown-Forman,6,15,4,25,16.0,,Lawson E Whiting Brown-Forman
2025-10-17,Dave Peacock,Advantage Solutions,21,2,2,25,8.0,,Dave Peacock Advantage Solutions
2025-10-17,Mick Farrell,ResMed,12,13,0,25,0.0,,Mick Farrell ResMed
2025-10-17,Kamal Hathi,Splunk,9,9,0,18,0.0,,Kamal Hathi Splunk
2025-10-17,Todd Kelsey,Plexus Corp,3,5,1,9,11.1,,Todd Kelsey Plexus Corp
2025-10-17,Phillip D Yeager,Hub Group,3,10,0,13,0.0,,Phillip D Yeager Hub Group
2025-10-17,Steven B Hedlund,Lincoln Electric,5,16,0,21,0.0,,Steven B Hedlund Lincoln Electric
2025-10-17,Timothy C Oliver,NCR Atleos,2,3,0,5,0.0,,Timothy C Oliver NCR Atleos
2025-10-17,Bruce Fleming,Calumet Inc,3,7,0,10,0.0,,Bruce Fleming Calumet Inc
2025-10-17,Daniel S. Peyovich,Dycom Industries,0,3,0,3,0.0,,Daniel S. Peyovich Dycom Industries
2025-10-17,Avner M Applbaum,Valmont Industries,0,7,0,7,0.0,,Avner M Applbaum Valmont Industries
2025-10-17,Kimberly A Fields,ATI Inc,8,17,0,25,0.0,,Kimberly A Fields ATI Inc
2025-10-17,Khozema Z Shipchandler,Twilio,1,5,1,7,14.3,,Khozema Z Shipchandler Twilio
2025-10-17,Gary C Bhojwani,CNO Financial Group,2,10,0,12,0.0,,Gary C Bhojwani CNO Financial Group
2025-10-17,William Andrew Hendricks Jr,Patterson-UTI Energy,3,1,0,4,0.0,,William Andrew Hendricks Jr Patterson-UTI Energy
2025-10-17,Kevin D Hochman,Brinker International,7,17,1,25,4.0,,Kevin D Hochman Brinker International
2025-10-17,James C Foster,Charles River Laboratories International,3,22,0,25,0.0,,James C Foster Charles River Laboratories International
2025-10-17,Rajiv K Prasad,Hyster-Yale,0,8,0,8,0.0,,Rajiv K Prasad Hyster-Yale
2025-10-17,Eric T Steigerwalt,Brighthouse Financial,3,17,2,22,9.1,,Eric T Steigerwalt Brighthouse Financial
2025-10-17,Thomas L Ryan,Service Corp International,6,14,1,21,4.8,,Thomas L Ryan Service Corp International
2025-10-17,Charles M Nifong Jr,CrossAmerica Partners,0,1,0,1,0.0,,Charles M Nifong Jr CrossAmerica Partners
2025-10-17,Anirudh Devgan,Cadence,5,18,2,25,8.0,,Anirudh Devgan Cadence
2025-10-17,Andi Owen,MillerKnoll,8,10,7,25,28.0,,Andi Owen MillerKnoll
2025-10-17,Sumit Roy,Realty Income,9,15,1,25,4.0,,Sumit Roy Realty Income
2025-10-17,Timothy John Fitzgerald,Middleby,0,0,0,0,0.0,,Timothy John Fitzgerald Middleby
2025-10-17,Robert H Schottenstein,M/I Homes,5,9,0,14,0.0,,Robert H Schottenstein M/I Homes
2025-10-17,Stephen P MacMillan,Hologic,3,6,2,11,18.2,,Stephen P MacMillan Hologic
2025-10-17,Lisa M Barton,Alliant Energy,7,1,0,8,0.0,,Lisa M Barton Alliant Energy
2025-10-17,Aaron P Jagdfeld,Generac,1,9,2,12,16.7,,Aaron P Jagdfeld Generac
2025-10-17,Erik Gershwind,MSC Industrial Direct,8,15,2,25,8.0,,Erik Gershwind MSC Industrial Direct
2025-10-17,Varun Krishna,Rocket Companies,4,19,2,25,8.0,,Varun Krishna Rocket Companies
2025-10-17,Fahmi Karam,Upbound Group,5,5,0,10,0.0,,Fahmi Karam Upbound Group
2025-10-17,NADominic Ng,East West Bancorp,0,0,0,0,0.0,,NADominic Ng East West Bancorp
2025-10-17,Mark Wang,Hilton Grand Vacations,25,0,0,25,0.0,,Mark Wang Hilton Grand Vacations
2025-10-17,Robert J Sheedy Jr,Grocery Outlet Holding,0,1,0,1,0.0,,Robert J Sheedy Jr Grocery Outlet Holding
2025-10-17,Simon D Campion,Dentsply Sirona,0,10,1,11,9.1,,Simon D Campion Dentsply Sirona
2025-10-17,Jeremy Wensinger,V2X,15,10,0,25,0.0,,Jeremy Wensinger V2X
2025-10-17,Andrew Rees,Crocs,8,11,6,25,24.0,,Andrew Rees Crocs
2025-10-17,David M Maura,Spectrum Brands,8,4,0,12,0.0,,David M Maura Spectrum Brands
2025-10-17,Sachin S Lawande,Visteon,11,14,0,25,0.0,,Sachin S Lawande Visteon
2025-10-17,Neil M Ashe,Acuity Inc,0,10,0,10,0.0,,Neil M Ashe Acuity Inc
2025-10-17,Lorie L Tekorius,The Greenbrier Companies,2,7,0,9,0.0,,Lorie L Tekorius The Greenbrier Companies
2025-10-17,John R Ciulla,Webster Financial,7,17,1,25,4.0,,John R Ciulla Webster Financial
2025-10-17,Sean D Keohane,Cabot Corporation,4,7,2,13,15.4,,Sean D Keohane Cabot Corporation
2025-10-17,Drew M Wilkerson,RXO Inc,2,5,2,9,22.2,,Drew M Wilkerson RXO Inc
2025-10-17,Daniel E Brown,Chord Energy,2,0,0,2,0.0,,Daniel E Brown Chord Energy
2025-10-17,Javier D Ferrer Fernandez,Popular Inc,2,3,2,7,28.6,,Javier D Ferrer Fernandez Popular Inc
2025-10-17,Olivier Rabiller,Garrett Motion Inc,2,13,0,15,0.0,,Olivier Rabiller Garrett Motion Inc
2025-10-17,Ronald N Tutor,Tutor Perini Corporation,4,18,1,23,4.3,,Ronald N Tutor Tutor Perini Corporation
2025-10-17,Jeff Liaw,Copart,7,9,2,18,11.1,,Jeff Liaw Copart
2025-10-17,Aman Narang,Toast Inc,5,18,2,25,8.0,,Aman Narang Toast Inc
2025-10-17,Joseph M Hogan,Align Technology,6,16,3,25,12.0,,Joseph M Hogan Align Technology
2025-10-17,Kevin J Wheeler,A O Smith,3,22,0,25,0.0,,Kevin J Wheeler A O Smith
2025-10-17,Christopher A Cartwright,TransUnion,9,14,2,25,8.0,,Christopher A Cartwright TransUnion
2025-10-17,James Kelly,NCR Voyix,2,17,0,19,0.0,,James Kelly NCR Voyix
2025-10-17,Tom Leighton,Akamai Technologies,13,9,3,25,12.0,,Tom Leighton Akamai Technologies
2025-10-17,Robert G Painter,Trimble Inc,13,4,0,17,0.0,,Robert G Painter Trimble Inc
2025-10-17,Tony Helton,Medical Mutual of Ohio,3,6,1,10,10.0,,Tony Helton Medical Mutual of Ohio
2025-10-17,Caroline S Grace,AMN Healthcare Services,1,0,0,1,0.0,,Caroline S Grace AMN Healthcare Services
2025-10-17,Patrick Kaltenbach,Mettler-Toledo International,3,5,0,8,0.0,,Patrick Kaltenbach Mettler-Toledo International
2025-10-17,Michael L Baur,ScanSource,1,4,0,5,0.0,,Michael L Baur ScanSource
2025-10-17,Jason Lippert,LCI Industries,8,16,1,25,4.0,,Jason Lippert LCI Industries
2025-10-17,Fredric J Tomczyk,Cboe Global Markets,2,13,4,19,21.1,,Fredric J Tomczyk Cboe Global Markets
2025-10-17,Octavio Marquez,Diebold Nixdorf,4,15,1,20,5.0,,Octavio Marquez Diebold Nixdorf
2025-10-17,Sivasankaran Somasundaram,ChampionX,8,1,0,9,0.0,,Sivasankaran Somasundaram ChampionX
2025-10-17,Ronald F Clarke,Corpay,2,5,1,8,12.5,,Ronald F Clarke Corpay
2025-10-17,Robert W Pittman,iHeartMedia,7,13,1,21,4.8,,Robert W Pittman iHeartMedia
2025-10-17,Patrick Zalupski,Dream Finders Homes,12,11,2,25,8.0,,Patrick Zalupski Dream Finders Homes
2025-10-17,Keith E Smith,Boyd Gaming,5,12,1,18,5.6,,Keith E Smith Boyd Gaming
2025-10-17,Mehran Assadi,NLV Financial,1,1,0,2,0.0,,Mehran Assadi NLV Financial
2025-10-17,Barry R Port,Ensign Group,5,11,2,18,11.1,,Barry R Port Ensign Group
2025-10-17,Denise A Paulonis,Sally Beauty,15,4,0,19,0.0,,Denise A Paulonis Sally Beauty
2025-10-17,Clifford A Skelton,Conduent,1,6,0,7,0.0,,Clifford A Skelton Conduent
2025-10-17,Jean-Michel Ribieras,Sylvamo,1,7,0,8,0.0,,Jean-Michel Ribieras Sylvamo
2025-10-17,Douglas F Bauer,Tri Pointe Homes,0,7,0,7,0.0,,Douglas F Bauer Tri Pointe Homes
2025-10-17,Shawn O'Connell,EnerSys,4,7,1,12,8.3,,Shawn O'Connell EnerSys
2025-10-17,Bill Meury,Incyte,5,17,1,23,4.3,,Bill Meury Incyte
2025-10-17,Dale Francescon,Century Communities,4,19,2,25,8.0,,Dale Francescon Century Communities
2025-10-17,Michael Nierenberg,Rithm Capital,10,12,3,25,12.0,,Michael Nierenberg Rithm Capital
2025-10-17,Michael J Brown,Euronet Worldwide,4,6,0,10,0.0,,Michael J Brown Euronet Worldwide
2025-10-17,Scott Seu,Hawaiian Electric Industries,6,14,5,25,20.0,,Scott Seu Hawaiian Electric Industries
2025-10-17,Jason D Robins,DraftKings,5,14,6,25,24.0,,Jason D Robins DraftKings
2025-10-17,Jonathan J Mazelsky,IDEXX Laboratories,1,3,3,7,42.9,,Jonathan J Mazelsky IDEXX Laboratories
2025-10-17,Richard S Swartz,MYR Group,1,0,0,1,0.0,,Richard S Swartz MYR Group
2025-10-17,Stefano Caroti,Deckers Outdoor,12,13,0,25,0.0,,Stefano Caroti Deckers Outdoor
2025-10-17,Kevin R Sayer,DexCom,4,11,5,20,25.0,,Kevin R Sayer DexCom
2025-10-17,John T C Lee,MKS Instruments,9,16,0,25,0.0,,John T C Lee MKS Instruments
2025-10-17,Edward B Pitoniak,VICI Properties,1,8,1,10,10.0,,Edward B Pitoniak VICI Properties
2025-10-17,Albert White III,Cooper Cos,6,7,3,16,18.8,,Albert White III Cooper Cos
2025-10-17,Barry L Biffle,Frontier Airlines,4,14,7,25,28.0,,Barry L Biffle Frontier Airlines
2025-10-17,Robert A Bruggeworth,Qorvo,3,6,2,11,18.2,,Robert A Bruggeworth Qorvo
2025-10-17,Winnie Park,Five Below,8,16,1,25,4.0,,Winnie Park Five Below
2025-10-17,Steven Oakland,TreeHouse Foods,4,20,1,25,4.0,,Steven Oakland TreeHouse Foods
2025-10-17,James S Hagedorn,Scotts Miracle-Gro,1,6,1,8,12.5,,James S Hagedorn Scotts Miracle-Gro
2025-10-17,Michael Cannon-Brookes,Atlassian,7,15,3,25,12.0,,Michael Cannon-Brookes Atlassian
2025-10-17,Bertrand Loy,Entegris,5,17,3,25,12.0,,Bertrand Loy Entegris
2025-10-17,William E Waltz,Atkore,2,5,1,8,12.5,,William E Waltz Atkore
2025-10-17,Celeste B Mastin,HB Fuller,0,10,0,10,0.0,,Celeste B Mastin HB Fuller
2025-10-17,Kyle T Larkin,Granite Construction,1,12,0,13,0.0,,Kyle T Larkin Granite Construction
2025-10-17,Michael J Happe,Winnebago Industries,4,7,1,12,8.3,,Michael J Happe Winnebago Industries
2025-10-17,Steven H Gunby,FTI Consulting,5,11,0,16,0.0,,Steven H Gunby FTI Consulting
2025-10-17,Stephan B Tanda,AptarGroup,5,13,3,21,14.3,,Stephan B Tanda AptarGroup
2025-10-17,Timothy P Boyle,Columbia Sportswear,4,6,4,14,28.6,,Timothy P Boyle Columbia Sportswear
2025-10-17,Anthony J Wood,Roku,10,11,4,25,16.0,,Anthony J Wood Roku
2025-10-17,M Christopher Doyle,Civitas Resources,2,5,1,8,12.5,,M Christopher Doyle Civitas Resources
2025-10-17,Andy Eidson,Alpha Metallurgical Resources,4,9,3,16,18.8,,Andy Eidson Alpha Metallurgical Resources
2025-10-17,Andy L Nemeth,Patrick Industries,5,6,0,11,0.0,,Andy L Nemeth Patrick Industries
2025-10-17,Roger W Jenkins,Murphy Oil,5,17,3,25,12.0,,Roger W Jenkins Murphy Oil
2025-10-17,Kevin S Blair,Synovus Financial,6,8,0,14,0.0,,Kevin S Blair Synovus Financial
2025-10-17,Julie Felss Masino,Cracker Barrel Old Country Store,4,10,11,25,44.0,,Julie Felss Masino Cracker Barrel Old Country Store
2025-10-17,David M Overton,Cheesecake Factory,6,18,1,25,4.0,,David M Overton Cheesecake Factory
2025-10-17,Nick DeIuliis,CNX Resources,13,10,2,25,8.0,,Nick DeIuliis CNX Resources
2025-10-17,Christopher Pappas,Chefs Warehouse,4,18,2,24,8.3,,Christopher Pappas Chefs Warehouse
2025-10-17,Tod Carpenter,Donaldson Company,6,7,6,19,31.6,,Tod Carpenter Donaldson Company
2025-10-17,Gregory L Christopher,Mueller Industries,3,7,1,11,9.1,,Gregory L Christopher Mueller Industries
2025-10-17,Rob Saltiel,MRC Global,5,17,2,24,8.3,,Rob Saltiel MRC Global
2025-10-17,Jillian C Evanko,Chart Industries,3,8,0,11,0.0,,Jillian C Evanko Chart Industries
2025-10-17,Dave Guilmette,Alight Solutions,1,10,0,11,0.0,,Dave Guilmette Alight Solutions
2025-10-17,Joel Smejkal,Vishay Intertechnology,3,12,2,17,11.8,,Joel Smejkal Vishay Intertechnology
2025-10-17,Dennis Degner,Range Resources,10,7,0,17,0.0,,Dennis Degner Range Resources
2025-10-17,Ira D Robbins,Valley National Bancorp,3,12,2,17,11.8,,Ira D Robbins Valley National Bancorp
2025-10-17,Bernard Kim,Match Group,5,12,8,25,32.0,,Bernard Kim Match Group
2025-10-17,Vincent Pilette,Gen Digital,3,9,0,12,0.0,,Vincent Pilette Gen Digital
2025-10-17,Timothy S Crane,Wintrust Financial,1,7,0,8,0.0,,Timothy S Crane Wintrust Financial
2025-10-17,Pat Roche,Moog Inc,6,12,4,22,18.2,,Pat Roche Moog Inc
2025-10-17,Mark R Widmar,First Solar,8,15,2,25,8.0,,Mark R Widmar First Solar
2025-10-17,Niko Lahanas,Central Garden & Pet,2,12,0,14,0.0,,Niko Lahanas Central Garden & Pet
2025-10-17,Chris Osowski,Green Plains Inc,10,13,2,25,8.0,,Chris Osowski Green Plains Inc
2025-10-17,Derek J Leathers,Werner Enterprises,3,7,1,11,9.1,,Derek J Leathers Werner Enterprises
2025-10-17,Adam Foroughi,AppLovin,6,16,3,25,12.0,,Adam Foroughi AppLovin
2025-10-17,Luca Savi,ITT,1,10,1,12,8.3,,Luca Savi ITT
2025-10-17,Lawrence H Silber,Herc Rentals,3,2,0,5,0.0,,Lawrence H Silber Herc Rentals
2025-10-17,Hilton H Howell Jr,Gray Television,6,16,3,25,12.0,,Hilton H Howell Jr Gray Television
2025-10-17,Eric D Ashleman,IDEX,1,12,0,13,0.0,,Eric D Ashleman IDEX
2025-10-17,Owen D Thomas,Boston Properties,4,21,0,25,0.0,,Owen D Thomas Boston Properties
2025-10-17,Kurt Wolf,Pitney Bowes,6,19,0,25,0.0,,Kurt Wolf Pitney Bowes
2025-10-17,Sara E Armbruster,Steelcase,11,4,0,15,0.0,,Sara E Armbruster Steelcase
2025-10-17,Charles D. Young,Sun Communities,6,9,0,15,0.0,,Charles D. Young Sun Communities
2025-10-17,Suzanne Foster,AdaptHealth,3,13,1,17,5.9,,Suzanne Foster AdaptHealth
2025-10-17,Grant E Sims,Genesis Energy,5,2,0,7,0.0,,Grant E Sims Genesis Energy
2025-10-17,Laura Prieskorn,Jackson Financial,6,13,4,23,17.4,,Laura Prieskorn Jackson Financial
2025-10-17,Rick L Wessel,FirstCash,1,6,2,9,22.2,,Rick L Wessel FirstCash
2025-10-17,Sherman Miller,Cal-Maine Foods,7,17,1,25,4.0,,Sherman Miller Cal-Maine Foods
2025-10-17,Paul A Lang,Arch Resources,18,6,1,25,4.0,,Paul A Lang Arch Resources
2025-10-17,Ashish K Khandpur,Avient,1,7,1,9,11.1,,Ashish K Khandpur Avient
2025-10-17,Shyam K Reddy,BlueLinx,1,8,0,9,0.0,,Shyam K Reddy BlueLinx
2025-10-17,Christopher S Ripley,Sinclair,5,15,5,25,20.0,,Christopher S Ripley Sinclair
2025-10-17,Stacy Kymes,BOK Financial,13,9,1,23,4.3,,Stacy Kymes BOK Financial
2025-10-17,James H Walter,Permian Resources,1,4,0,5,0.0,,James H Walter Permian Resources
2025-10-17,Jason Murray,PACS Group,7,14,4,25,16.0,,Jason Murray PACS Group
2025-10-17,Brian Armstrong,Coinbase Global,5,15,5,25,20.0,,Brian Armstrong Coinbase Global
2025-10-17,Oscar K Brown,Western Midstream Partners,6,5,0,11,0.0,,Oscar K Brown Western Midstream Partners
2025-10-17,Nicholas R Lower,Federated Mutual Insurance,1,1,2,4,50.0,,Nicholas R Lower Federated Mutual Insurance
2025-10-17,Morris Goldfarb,G-III Apparel Group,7,11,7,25,28.0,,Morris Goldfarb G-III Apparel Group
2025-10-17,Mark D Morelli,Vontier,1,3,0,4,0.0,,Mark D Morelli Vontier
2025-10-17,Matthew J Cox,Matson Inc,4,10,0,14,0.0,,Matthew J Cox Matson Inc
2025-10-17,David W Grzebinski,Kirby Corporation,3,7,3,13,23.1,,David W Grzebinski Kirby Corporation
2025-10-17,Keith A Harvey,Kaiser Aluminum,3,10,2,15,13.3,,Keith A Harvey Kaiser Aluminum
2025-10-17,Eric Nyman,Vista Outdoor,2,11,1,14,7.1,,Eric Nyman Vista Outdoor
2025-10-17,Doug Howe,Designer Brands,6,18,1,25,4.0,,Doug Howe Designer Brands
2025-10-17,Jerry E Gahlhoff Jr,Rollins Inc,1,3,0,4,0.0,,Jerry E Gahlhoff Jr Rollins Inc
2025-10-17,D Scott Barbour,Advanced Drainage Systems,5,7,2,14,14.3,,D Scott Barbour Advanced Drainage Systems
2025-10-17,Sean Gamble,Cinemark,11,6,8,25,32.0,,Sean Gamble Cinemark
2025-10-17,George Kurtz,CrowdStrike,8,15,2,25,8.0,,George Kurtz CrowdStrike
2025-10-17,Bill Ready,Pinterest,10,14,1,25,4.0,,Bill Ready Pinterest
2025-10-17,Fidji Simo,Instacart,6,19,0,25,0.0,,Fidji Simo Instacart
2025-10-17,Kimberly K Ryan,Hillenbrand,1,10,0,11,0.0,,Kimberly K Ryan Hillenbrand
2025-10-17,David S Graziosi,Allison Transmission,0,23,2,25,8.0,,David S Graziosi Allison Transmission
2025-10-17,Gary G Friedman,Restoration Hardware,5,16,4,25,16.0,,Gary G Friedman Restoration Hardware
2025-10-17,Lucinda M Baier,Brookdale Senior Living,4,11,1,16,6.2,,Lucinda M Baier Brookdale Senior Living
2025-10-17,Brian J Blaser,QuidelOrtho,0,7,1,8,12.5,,Brian J Blaser QuidelOrtho
2025-10-17,E Jean Savage,Trinity Industries,3,15,7,25,28.0,,E Jean Savage Trinity Industries
2025-10-17,Liam J Kelly,Teleflex,2,3,1,6,16.7,,Liam J Kelly Teleflex
2025-10-17,Laurans A Mendelson,HEICO,7,16,2,25,8.0,,Laurans A Mendelson HEICO
2025-10-17,Frank H Laukien,Bruker,1,9,0,10,0.0,,Frank H Laukien Bruker
2025-10-17,Harvey M Schwartz,Carlyle Group,8,14,3,25,12.0,,Harvey M Schwartz Carlyle Group
2025-10-17,Mark S LaVigne,Energizer Holdings,5,2,0,7,0.0,,Mark S LaVigne Energizer Holdings
2025-10-17,Amar Maletira,Rackspace Technology,3,18,4,25,16.0,,Amar Maletira Rackspace Technology
2025-10-17,Udit Batra,Waters Corporation,8,12,5,25,20.0,,Udit Batra Waters Corporation
2025-10-17,Eric M Green,West Pharmaceutical Services,10,15,0,25,0.0,,Eric M Green West Pharmaceutical Services
2025-10-17,Doug Palladini,Carters Inc,1,8,1,10,10.0,,Doug Palladini Carters Inc
2025-10-17,G Mike Mikan,NeueHealth,4,5,1,10,10.0,,G Mike Mikan NeueHealth
2025-10-17,Russell Chip Childs,SkyWest,0,7,0,7,0.0,,Russell Chip Childs SkyWest
2025-10-17,Christopher H Hunter,Acadia Healthcare,3,4,2,9,22.2,,Christopher H Hunter Acadia Healthcare
2025-10-17,Prahlad Singh,Revvity,3,9,0,12,0.0,,Prahlad Singh Revvity
2025-10-17,Maria M Pope,Portland General Electric,9,13,3,25,12.0,,Maria M Pope Portland General Electric
2025-10-17,Charles Chip Blankenship,Woodward Inc,3,9,0,12,0.0,,Charles Chip Blankenship Woodward Inc
2025-10-17,Mike Steib,TEGNA,11,12,2,25,8.0,,Mike Steib TEGNA
2025-10-17,Kurt J Ekert,Sabre Corporation,1,0,0,1,0.0,,Kurt J Ekert Sabre Corporation
2025-10-17,Matt Wilson,Light & Wonder,8,10,7,25,28.0,,Matt Wilson Light & Wonder
2025-10-17,Rob Katz,Vail Resorts,4,3,18,25,72.0,,Rob Katz Vail Resorts
2025-10-17,Schnitzer Steel Industries,Radius Recycling,1,14,10,25,40.0,,Schnitzer Steel Industries Radius Recycling
2025-10-17,David A Spector,PennyMac Financial Services,9,15,1,25,4.0,,David A Spector PennyMac Financial Services
2025-10-17,Frederick J Holzgrefe III,Saia Inc,1,4,0,5,0.0,,Frederick J Holzgrefe III Saia Inc
2025-10-17,Mark J Parrell,Equity Residential,5,11,1,17,5.9,,Mark J Parrell Equity Residential
2025-10-17,John W Lindsay,Helmerich & Payne,1,7,1,9,11.1,,John W Lindsay Helmerich & Payne
2025-10-17,Gary D Burnison,Korn Ferry,9,13,3,25,12.0,,Gary D Burnison Korn Ferry
