date,ceo,company,positive,neutral,negative,total,neg_pct,theme,alias
2025-12-04,Doug McMillon,Walmart,5,20,0,25,0.0,,Doug McMillon Walmart
2025-12-04,Andy Jassy,Amazon,4,14,7,25,28.0,,Andy Jassy Amazon
2025-12-04,Stephen Hemsley,UnitedHealth,4,18,3,25,12.0,,Stephen Hemsley UnitedHealth
2025-12-04,Tim Cook,Apple,5,17,3,25,12.0,,Tim Cook Apple
2025-12-04,David Joyner,CVS Health,9,14,2,25,8.0,,David Joyner CVS Health
2025-12-04,Warren Buffett,Berkshire Hathaway,6,9,10,25,40.0,,Warren Buffett Berkshire Hathaway
2025-12-04,Sundar Pichai,Alphabet,7,11,7,25,28.0,,Sundar Pichai Alphabet
2025-12-04,Darren Woods,Exxon Mobil,6,12,7,25,28.0,,Darren Woods Exxon Mobil
2025-12-04,Brian Tyler,McKesson,5,13,7,25,28.0,,Brian Tyler McKesson
2025-12-04,Robert Mauch,Cencora,8,13,1,22,4.5,,Robert Mauch Cencora
2025-12-04,Jamie Dimon,JPMorgan Chase,3,17,5,25,20.0,,Jamie Dimon JPMorgan Chase
2025-12-04,Ron Vachris,Costco,4,21,0,25,0.0,,Ron Vachris Costco
2025-12-04,David Cordani,Cigna,16,6,3,25,12.0,,David Cordani Cigna
2025-12-04,Satya Nadella,Microsoft,11,6,8,25,32.0,,Satya Nadella Microsoft
2025-12-04,Jason Hollar,Cardinal Health,9,12,4,25,16.0,,Jason Hollar Cardinal Health
2025-12-04,Mike Wirth,Chevron,6,17,2,25,8.0,,Mike Wirth Chevron
2025-12-04,Brian Moynihan,Bank of America,5,17,3,25,12.0,,Brian Moynihan Bank of America
2025-12-04,Mary Barra,General Motors,9,12,4,25,16.0,,Mary Barra General Motors
2025-12-04,Jim Farley,Ford Motor,4,12,9,25,36.0,,Jim Farley Ford Motor
2025-12-04,Gail Boudreaux,Elevance Health,12,9,4,25,16.0,,Gail Boudreaux Elevance Health
2025-12-04,Jane Fraser,Citigroup,11,14,0,25,0.0,,Jane Fraser Citigroup
2025-12-04,Mark Zuckerberg,Meta Platforms,10,11,4,25,16.0,,Mark Zuckerberg Meta Platforms
2025-12-04,Sarah London,Centene,6,12,7,25,28.0,,Sarah London Centene
2025-12-04,Ted Decker,Home Depot,3,10,12,25,48.0,,Ted Decker Home Depot
2025-12-04,Priscilla Almodovar,Fannie Mae,4,15,6,25,24.0,,Priscilla Almodovar Fannie Mae
2025-12-04,Ron Sargent,Kroger,5,16,4,25,16.0,,Ron Sargent Kroger
2025-12-04,Mark Lashier,Phillips 66,7,13,5,25,20.0,,Mark Lashier Phillips 66
2025-12-04,Maryann Mannen,Marathon Petroleum,2,18,5,25,20.0,,Maryann Mannen Marathon Petroleum
2025-12-04,Dan Schulman,Verizon,3,10,12,25,48.0,,Dan Schulman Verizon
2025-12-04,Jensen Huang,Nvidia,7,11,7,25,28.0,,Jensen Huang Nvidia
2025-12-04,David Solomon,Goldman Sachs,6,13,6,25,24.0,,David Solomon Goldman Sachs
2025-12-04,Charles Scharf,Wells Fargo,17,2,6,25,24.0,,Charles Scharf Wells Fargo
2025-12-04,Lane Riggs,Valero Energy,14,9,2,25,8.0,,Lane Riggs Valero Energy
2025-12-04,Brian Roberts,Comcast,4,16,5,25,20.0,,Brian Roberts Comcast
2025-12-04,Jon Farney,State Farm Insurance,5,16,4,25,16.0,,Jon Farney State Farm Insurance
2025-12-04,John Stankey,AT&T,5,16,4,25,16.0,,John Stankey AT&T
2025-12-04,Michael Hutchins,Freddie Mac,3,20,2,25,8.0,,Michael Hutchins Freddie Mac
2025-12-04,Jim Rechtin,Humana,11,11,3,25,12.0,,Jim Rechtin Humana
2025-12-04,Ted Pick,Morgan Stanley,10,12,3,25,12.0,,Ted Pick Morgan Stanley
2025-12-04,Michael Fiddelke,Target Corporation,5,16,4,25,16.0,,Michael Fiddelke Target Corporation
2025-12-04,Philip Smith,StoneX Group,5,17,0,22,0.0,,Philip Smith StoneX Group
2025-12-04,Elon Musk,Tesla,5,8,12,25,48.0,,Elon Musk Tesla
2025-12-04,Michael Dell,Dell Technologies,9,16,0,25,0.0,,Michael Dell Dell Technologies
2025-12-04,Ramon Laguarta,PepsiCo,10,12,3,25,12.0,,Ramon Laguarta PepsiCo
2025-12-04,Bob Iger,Walt Disney,8,16,1,25,4.0,,Bob Iger Walt Disney
2025-12-04,Carol Tome,UPS,8,7,10,25,40.0,,Carol Tome UPS
2025-12-04,Joaquin Duato,Johnson & Johnson,12,9,4,25,16.0,,Joaquin Duato Johnson & Johnson
2025-12-04,Rajesh Subramaniam,FedEx,3,14,8,25,32.0,,Rajesh Subramaniam FedEx
2025-12-04,Juan Luciano,Archer Daniels Midland,4,7,14,25,56.0,,Juan Luciano Archer Daniels Midland
2025-12-04,Jon Moeller,Procter & Gamble,1,15,9,25,36.0,,Jon Moeller Procter & Gamble
2025-12-04,Marvin Ellison,Lowe's,7,16,2,25,8.0,,Marvin Ellison Lowe's
2025-12-04,Thomas Long,Energy Transfer,16,3,6,25,24.0,,Thomas Long Energy Transfer
2025-12-04,Christopher Calio,RTX,8,15,2,25,8.0,,Christopher Calio RTX
2025-12-04,Susan Morris,Albertsons,4,20,1,25,4.0,,Susan Morris Albertsons
2025-12-04,Kevin Hourican,Sysco,5,14,6,25,24.0,,Kevin Hourican Sysco
2025-12-04,Tricia Griffith,Progressive Insurance,10,12,3,25,12.0,,Tricia Griffith Progressive Insurance
2025-12-04,Stephen Squeri,American Express,7,17,1,25,4.0,,Stephen Squeri American Express
2025-12-04,James Taiclet,Lockheed Martin,7,11,7,25,28.0,,James Taiclet Lockheed Martin
2025-12-04,Michel Khalaf,MetLife Inc,11,13,1,25,4.0,,Michel Khalaf MetLife
2025-12-04,Samuel Hazen,HCA Healthcare,12,11,2,25,8.0,,Samuel Hazen HCA Healthcare
2025-12-04,Andrew Sullivan,Prudential Financial,10,14,1,25,4.0,,Andrew Sullivan Prudential Financial
2025-12-04,Kelly Ortberg,Boeing,7,14,4,25,16.0,,Kelly Ortberg Boeing
2025-12-04,Joe Creed,Caterpillar,8,17,0,25,0.0,,Joe Creed Caterpillar
2025-12-04,Robert M Davis,Merck,6,15,4,25,16.0,,Robert M Davis Merck
2025-12-04,Thomas J Wilson,Allstate,5,15,5,25,20.0,,Thomas J Wilson Allstate
2025-12-04,Albert Bourla,Pfizer,7,11,7,25,28.0,,Albert Bourla Pfizer
2025-12-04,Arvind Krishna,IBM,8,11,6,25,24.0,,Arvind Krishna IBM
2025-12-04,Craig DeSanto,New York Life Insurance,3,22,0,25,0.0,,Craig DeSanto New York Life Insurance
2025-12-04,Ed Bastian,Delta Air Lines,7,16,2,25,8.0,,Ed Bastian Delta Air Lines
2025-12-04,Kevin Murphy,Publix Super Markets,15,33,2,50,4.0,,Kevin Murphy Publix Super Markets
2025-12-04,Kirt Walker,Nationwide Insurance,8,16,1,25,4.0,,Kirt Walker Nationwide Insurance
2025-12-04,Patrick Zammit,TD Synnex,13,12,0,25,0.0,,Patrick Zammit TD Synnex
2025-12-04,Scott Kirby,United Airlines,22,1,2,25,8.0,,Scott Kirby United Airlines
2025-12-04,Ryan Lance,ConocoPhillips,12,7,6,25,24.0,,Ryan Lance ConocoPhillips
2025-12-04,Ernie Herrman,TJX,14,11,0,25,0.0,,Ernie Herrman TJX
2025-12-04,Bob Michael,AbbVie,6,18,1,25,4.0,,Bob Michael AbbVie
2025-12-04,AJ Jim Teague,Enterprise Products Partners,7,17,1,25,4.0,,AJ Jim Teague Enterprise Products Partners
2025-12-04,Christopher Winfrey,Charter Communications,8,14,3,25,12.0,,Christopher Winfrey Charter Communications
2025-12-04,George Holm,Performance Food,7,14,4,25,16.0,,George Holm Performance Food
2025-12-04,Robert Isom,American Airlines,3,20,2,25,8.0,,Robert Isom American Airlines
2025-12-04,Richard Fairbank,Capital One,14,9,2,25,8.0,,Richard Fairbank Capital One
2025-12-04,Chuck Robbins,Cisco Systems,8,15,2,25,8.0,,Chuck Robbins Cisco Systems
2025-12-04,Enrique Lores,HP,2,15,8,25,32.0,,Enrique Lores HP
2025-12-04,Donnie King,Tyson Foods,4,14,7,25,28.0,,Donnie King Tyson Foods
2025-12-04,Lip-Bu Tan,Intel,5,13,7,25,28.0,,Lip-Bu Tan Intel
2025-12-04,Clay Magouyrk,Oracle,8,14,3,25,12.0,,Clay Magouyrk Oracle
2025-12-04,Mike Sicilia,Oracle,9,13,3,25,12.0,,Mike Sicilia Oracle
2025-12-04,Hock Tan,Broadcom,5,15,5,25,20.0,,Hock Tan Broadcom
2025-12-04,John May,Deere,6,13,6,25,24.0,,John May Deere
2025-12-04,Elliott Hill,Nike,3,20,2,25,8.0,,Elliott Hill Nike
2025-12-04,Timothy M Sweeney,Liberty Mutual Insurance,25,0,0,25,0.0,,Timothy M Sweeney Liberty Mutual Insurance
2025-12-04,Willie Chiang,Plains GP,4,7,4,15,26.7,,Willie Chiang Plains GP
2025-12-04,Juan Andrade,USAA,4,16,5,25,20.0,,Juan Andrade USAA
2025-12-04,Chris Boerner,Bristol-Myers Squibb,3,19,3,25,12.0,,Chris Boerner Bristol-Myers Squibb
2025-12-04,Paul Bay,Ingram Micro,5,16,4,25,16.0,,Paul Bay Ingram Micro
2025-12-04,Phebe Novakovic,General Dynamics,17,7,1,25,4.0,,Phebe Novakovic General Dynamics
2025-12-04,James Quincey,The Coca-Cola Company,9,14,2,25,8.0,,James Quincey The Coca-Cola Company
2025-12-04,Thasunda Brown Duckett,TIAA,11,13,1,25,4.0,,Thasunda Brown Duckett TIAA
2025-12-04,Alan Schnitzer,Travelers Insurance,9,13,3,25,12.0,,Alan Schnitzer Travelers Insurance
2025-12-04,David Ricks,Eli Lilly,9,8,8,25,32.0,,David Ricks Eli Lilly
2025-12-04,Dara Khosrowshahi,Uber,11,12,2,25,8.0,,Dara Khosrowshahi Uber
2025-12-04,Roger Crandall,Mass Mutual,5,16,4,25,16.0,,Roger Crandall Mass Mutual
2025-12-04,Marc Casper,Thermo Fisher Scientific,6,17,2,25,8.0,,Marc Casper Thermo Fisher Scientific
2025-12-04,Gunjan Kedia,US Bancorp,7,16,2,25,8.0,,Gunjan Kedia US Bancorp
2025-12-04,Michael Kasbar,World Kinect,1,15,0,16,0.0,,Michael Kasbar World Kinect
2025-12-04,Robert Ford,Abbott Laboratories,5,13,7,25,28.0,,Robert Ford Abbott Laboratories
2025-12-04,Corie Barry,Best Buy,24,1,0,25,0.0,,Corie Barry Best Buy
2025-12-04,Tim Gerend,Northwestern Mutual,5,19,1,25,4.0,,Tim Gerend Northwestern Mutual
2025-12-04,Kathy Warden,Northrop Grumman,6,18,1,25,4.0,,Kathy Warden Northrop Grumman
2025-12-04,Joe Zubretsky,Molina Healthcare,6,13,6,25,24.0,,Joe Zubretsky Molina Healthcare
2025-12-04,Todd Vasos,Dollar General,1,21,3,25,12.0,,Todd Vasos Dollar General
2025-12-04,Robin Vince,Bank of New York Mellon,8,14,3,25,12.0,,Robin Vince Bank of New York Mellon
2025-12-04,David Zaslav,Warner Bros Discovery,8,14,3,25,12.0,,David Zaslav Warner Bros Discovery
2025-12-04,Jay Debertin,CHS,7,15,3,25,12.0,,Jay Debertin CHS
2025-12-04,Ted Sarandos,Netflix,5,12,8,25,32.0,,Ted Sarandos Netflix
2025-12-04,Cristiano Amon,Qualcomm,4,17,4,25,16.0,,Cristiano Amon Qualcomm
2025-12-04,Vimal Kapur,Honeywell,12,12,1,25,4.0,,Vimal Kapur Honeywell
2025-12-04,Marc Benioff,Salesforce,6,15,4,25,16.0,,Marc Benioff Salesforce
2025-12-04,Jacek Olczak,Philip Morris International,6,19,0,25,0.0,,Jacek Olczak Philip Morris International
2025-12-04,David Flitman,US Foods,3,19,3,25,12.0,,David Flitman US Foods
2025-12-04,Paul Romanowski,DR Horton Inc,5,13,7,25,28.0,,Paul Romanowski DR Horton
2025-12-04,Bryan DeBoer,Lithia Motors,9,16,0,25,0.0,,Bryan DeBoer Lithia Motors
2025-12-04,Dirk Van de Put,Mondelez,5,15,5,25,20.0,,Dirk Van de Put Mondelez
2025-12-04,Brian Niccol,Starbucks,4,8,13,25,52.0,,Brian Niccol Starbucks
2025-12-04,Ryan McInerney,Visa Inc,10,13,2,25,8.0,,Ryan McInerney Visa Inc
2025-12-04,Robert Sulentic,CBRE Group,7,16,2,25,8.0,,Robert Sulentic CBRE Group
2025-12-04,Jonathan Jaffe,Lennar,2,13,0,15,0.0,,Jonathan Jaffe Lennar
2025-12-04,Scott Strazik,GE Vernova,7,15,3,25,12.0,,Scott Strazik GE Vernova
2025-12-04,William Demchak,PNC Financial Services,7,16,2,25,8.0,,William Demchak PNC Financial Services
2025-12-04,Jennifer Rumsey,Cummins Inc,4,16,5,25,20.0,,Jennifer Rumsey Cummins Inc
2025-12-04,Preston Feight,Paccar,7,16,2,25,8.0,,Preston Feight Paccar
2025-12-04,Robert Bradway,Amgen,4,19,2,25,8.0,,Robert Bradway Amgen
2025-12-04,Matthew Lucey,PBF Energy,14,7,0,21,0.0,,Matthew Lucey PBF Energy
2025-12-04,Brian D Pieninck,GuideWell Mutual,0,6,0,6,0.0,,Brian D Pieninck GuideWell Mutual
2025-12-04,Alex Chriss,PayPal,7,15,3,25,12.0,,Alex Chriss PayPal
2025-12-04,Sandy Douglas,United Natural Foods,16,8,1,25,4.0,,Sandy Douglas United Natural Foods
2025-12-04,Michael Creedon,Dollar Tree,3,19,3,25,12.0,,Michael Creedon Dollar Tree
2025-12-04,Leon Topalian,Nucor,5,17,3,25,12.0,,Leon Topalian Nucor
2025-12-04,Roger Penske,Penske Automotive,13,10,2,25,8.0,,Roger Penske Penske Automotive
2025-12-04,Bom Kim,Coupang,4,13,8,25,32.0,,Bom Kim Coupang
2025-12-04,Antonio Neri,Hewlett Packard Enterprise,6,15,4,25,16.0,,Antonio Neri Hewlett Packard Enterprise
2025-12-04,Harry Sideris,Duke Energy,24,1,0,25,0.0,,Harry Sideris Duke Energy
2025-12-04,Joseph Bae,KKR & Co,9,14,2,25,8.0,,Joseph Bae KKR & Co
2025-12-04,Brian Robbins,Paramount Global,5,17,3,25,12.0,,Brian Robbins Paramount Global
2025-12-04,Michael Dastoor,Jabil,4,15,6,25,24.0,,Michael Dastoor Jabil
2025-12-04,Daniel O'Day,Gilead Sciences,11,12,2,25,8.0,,Daniel O'Day Gilead Sciences
2025-12-04,Tim Go,HF Sinclair,13,8,4,25,16.0,,Tim Go HF Sinclair
2025-12-04,William Nash,CarMax,5,12,8,25,32.0,,William Nash CarMax
2025-12-04,Michael Miebach,Mastercard,6,16,3,25,12.0,,Michael Miebach Mastercard
2025-12-04,Lawrence Coben,NRG Energy,7,5,3,15,20.0,,Lawrence Coben NRG Energy
2025-12-04,Sean Kerins,Arrow Electronics,6,17,2,25,8.0,,Sean Kerins Arrow Electronics
2025-12-04,Lorenzo Simonelli,Baker Hughes,7,15,3,25,12.0,,Lorenzo Simonelli Baker Hughes
2025-12-04,Bob Jordan,Southwest Airlines,4,15,6,25,24.0,,Bob Jordan Southwest Airlines
2025-12-04,Peter Zaffino,AIG,5,14,6,25,24.0,,Peter Zaffino AIG
2025-12-04,Gary Dickerson,Applied Materials,2,12,11,25,44.0,,Gary Dickerson Applied Materials
2025-12-04,Vicki Hollub,Occidental Petroleum,9,11,5,25,20.0,,Vicki Hollub Occidental Petroleum
2025-12-04,Michael Manley,AutoNation,5,19,1,25,4.0,,Michael Manley AutoNation
2025-12-04,Christopher Womack,Southern Company,9,14,2,25,8.0,,Christopher Womack Southern Company
2025-12-04,Christopher Swift,The Hartford,6,17,2,25,8.0,,Christopher Swift The Hartford
2025-12-04,Marc Rowan,Apollo Global Management,5,13,7,25,28.0,,Marc Rowan Apollo Global Management
2025-12-04,Rick Wurster,Charles Schwab,4,18,3,25,12.0,,Rick Wurster Charles Schwab
2025-12-04,Chris Kempczinski,McDonalds,10,10,5,25,20.0,,Chris Kempczinski McDonalds
2025-12-04,Carlos Abrams-Rivera,Kraft Heinz,6,14,5,25,20.0,,Carlos Abrams-Rivera Kraft Heinz
2025-12-04,Lisa Su,Advanced Micro Devices,8,12,5,25,20.0,,Lisa Su Advanced Micro Devices
2025-12-04,William H Rogers Jr,Truist Financial,8,11,4,23,17.4,,William H Rogers Jr Truist Financial
2025-12-04,Kathleen Quirk,Freeport-McMoRan,10,11,4,25,16.0,,Kathleen Quirk Freeport-McMoRan
2025-12-04,Sanjay Mehrotra,Micron Technology,8,16,1,25,4.0,,Sanjay Mehrotra Micron Technology
2025-12-04,Anthony Capuano,Marriott International,12,12,1,25,4.0,,Anthony Capuano Marriott International
2025-12-04,David Gitlin,Carrier Global,8,14,3,25,12.0,,David Gitlin Carrier Global
2025-12-04,John Ketchum,NextEra Energy,18,6,1,25,4.0,,John Ketchum NextEra Energy
2025-12-04,William M Brown,3M Company,5,18,2,25,8.0,,William M Brown 3M Company
2025-12-04,John Doyle,Marsh & McLennan,5,16,4,25,16.0,,John Doyle Marsh & McLennan
2025-12-04,Patricia Poppe,PG&E,9,14,2,25,8.0,,Patricia Poppe PG&E
2025-12-04,Jim Vena,Union Pacific,8,15,2,25,8.0,,Jim Vena Union Pacific
2025-12-04,Brian Doubles,Synchrony Financial,6,18,1,25,4.0,,Brian Doubles Synchrony Financial
2025-12-04,Rainer Blair,Danaher,8,15,2,25,8.0,,Rainer Blair Danaher
2025-12-04,Philip Gallagher,Avnet,4,16,0,20,0.0,,Philip Gallagher Avnet
2025-12-04,Glenn Fogel,Booking Holdings,10,12,3,25,12.0,,Glenn Fogel Booking Holdings
2025-12-04,Ezra Yacob,EOG Resources,11,13,1,25,4.0,,Ezra Yacob EOG Resources
2025-12-04,Earl Austin,Quanta Services,8,13,1,22,4.5,,Earl Austin Quanta Services
2025-12-04,Michael Shepherd,Discover Financial,8,16,1,25,4.0,,Michael Shepherd Discover Financial
2025-12-04,Joseph Dominguez,Constellation Energy,11,13,1,25,4.0,,Joseph Dominguez Constellation Energy
2025-12-04,William Stengel II,Genuine Parts,3,13,0,16,0.0,,William Stengel II Genuine Parts
2025-12-04,Christian Ulbrich,Jones Lang LaSalle,11,12,2,25,8.0,,Christian Ulbrich Jones Lang LaSalle
2025-12-04,Raymond E Scott,Lear Corporation,3,15,1,19,5.3,,Raymond E Scott Lear Corporation
2025-12-04,Michael Rapino,Live Nation Entertainment,7,12,6,25,24.0,,Michael Rapino Live Nation Entertainment
2025-12-04,Heidi Petz,Sherwin-Williams,3,16,6,25,24.0,,Heidi Petz Sherwin-Williams
2025-12-04,Calvin G Butler Jr,Exelon,6,12,1,19,5.3,,Calvin G Butler Jr Exelon
2025-12-04,Tony Spring,Macys,10,14,1,25,4.0,,Tony Spring Macys
2025-12-04,Jeff Miller,Halliburton,8,9,8,25,32.0,,Jeff Miller Halliburton
2025-12-04,Kevin Lobo,Stryker,8,12,5,25,20.0,,Kevin Lobo Stryker
2025-12-04,Tony Cheng,Reinsurance Group of America,0,12,2,14,14.3,,Tony Cheng Reinsurance Group of America
2025-12-04,Ronald P O'Hanley,State Street,5,17,3,25,12.0,,Ronald P O'Hanley State Street
2025-12-04,John Engel,WESCO International,6,18,1,25,4.0,,John Engel WESCO International
2025-12-04,Pierce Norton II,Oneok,11,10,4,25,16.0,,Pierce Norton II Oneok
2025-12-04,Shantanu Narayen,Adobe,11,12,2,25,8.0,,Shantanu Narayen Adobe
2025-12-04,Bill Westrate,American Family Insurance,7,15,3,25,12.0,,Bill Westrate American Family Insurance
2025-12-04,Chris Kubasik,L3Harris Technologies,12,13,0,25,0.0,,Chris Kubasik L3Harris Technologies
2025-12-04,James Conroy,Ross Stores,4,19,2,25,8.0,,James Conroy Ross Stores
2025-12-04,Christine Leahy,CDW,2,19,4,25,16.0,,Christine Leahy CDW
2025-12-04,Saumya Sutaria,Tenet Healthcare,3,4,2,9,22.2,,Saumya Sutaria Tenet Healthcare
2025-12-04,Bob Eddy,BJ's Wholesale Club,4,19,2,25,8.0,,Bob Eddy BJ's Wholesale Club
2025-12-04,Mike Lyons,Fiserv,3,15,7,25,28.0,,Mike Lyons Fiserv
2025-12-04,William Gifford,Altria,6,16,3,25,12.0,,William Gifford Altria
2025-12-04,Larry Fink,BlackRock,2,16,7,25,28.0,,Larry Fink BlackRock
2025-12-04,Thomas Polen,Becton Dickinson,10,13,2,25,8.0,,Thomas Polen Becton Dickinson
2025-12-04,Noel Wallace,Colgate-Palmolive,5,18,2,25,8.0,,Noel Wallace Colgate-Palmolive
2025-12-04,Michael Hsu,Kimberly-Clark,6,16,3,25,12.0,,Michael Hsu Kimberly-Clark
2025-12-04,Daryl Kenningham,Group 1 Automotive,5,15,5,25,20.0,,Daryl Kenningham Group 1 Automotive
2025-12-04,Jennifer Parmentier,Parker-Hannifin,4,20,0,24,0.0,,Jennifer Parmentier Parker-Hannifin
2025-12-04,Jeffrey Harmening,General Mills,6,14,5,25,20.0,,Jeffrey Harmening General Mills
2025-12-04,Ravi Kumar S,Cognizant Technology Solutions,8,15,2,25,8.0,,Ravi Kumar S Cognizant Technology Solutions
2025-12-04,William Fehrman,American Electric Power,6,14,0,20,0.0,,William Fehrman American Electric Power
2025-12-04,Peter Arduini,GE HealthCare Technologies,8,16,1,25,4.0,,Peter Arduini GE HealthCare Technologies
2025-12-04,Maria Black,Automatic Data Processing,11,14,0,25,0.0,,Maria Black Automatic Data Processing
2025-12-04,Lourenco Goncalves,Cleveland-Cliffs,6,11,8,25,32.0,,Lourenco Goncalves Cleveland-Cliffs
2025-12-04,Dan Amos,Aflac,3,16,6,25,24.0,,Dan Amos Aflac
2025-12-04,Mark Stewart,Goodyear Tire & Rubber,5,20,0,25,0.0,,Mark Stewart Goodyear Tire & Rubber
2025-12-04,Kevin Hogan,Corebridge Financial,7,10,1,18,5.6,,Kevin Hogan Corebridge Financial
2025-12-04,Thomas Palmer,Newmont,3,21,1,25,4.0,,Thomas Palmer Newmont
2025-12-04,Andrew Silvernail,International Paper,8,13,4,25,16.0,,Andrew Silvernail International Paper
2025-12-04,Philip Daniele III,AutoZone,2,18,5,25,20.0,,Philip Daniele III AutoZone
2025-12-04,Ellen Cooper,Lincoln National,6,17,2,25,8.0,,Ellen Cooper Lincoln National
2025-12-04,Ryan Marshall,PulteGroup,6,13,6,25,24.0,,Ryan Marshall PulteGroup
2025-12-04,James Cracchiolo,Ameriprise Financial,2,19,4,25,16.0,,James Cracchiolo Ameriprise Financial
2025-12-04,Andrew Clyde,Murphy USA,7,16,2,25,8.0,,Andrew Clyde Murphy USA
2025-12-04,Jonas Prising,ManpowerGroup,6,14,5,25,20.0,,Jonas Prising ManpowerGroup
2025-12-04,David Bozeman,CH Robinson Worldwide,4,19,2,25,8.0,,David Bozeman CH Robinson Worldwide
2025-12-04,Timothy Knavish,PPG Industries,2,8,0,10,0.0,,Timothy Knavish PPG Industries
2025-12-04,Pedro Pizarro,Edison International,3,9,13,25,52.0,,Pedro Pizarro Edison International
2025-12-04,Mark Millett,Steel Dynamics,23,2,0,25,0.0,,Mark Millett Steel Dynamics
2025-12-04,Benjamin Tisch,Loews,1,19,0,20,0.0,,Benjamin Tisch Loews
2025-12-04,Karsanbhai,Emerson Electric,2,19,4,25,16.0,,Karsanbhai Emerson Electric
2025-12-04,John Zillmer,Aramark,7,17,1,25,4.0,,John Zillmer Aramark
2025-12-04,William Hornbuckle,MGM Resorts International,8,9,8,25,32.0,,William Hornbuckle MGM Resorts International
2025-12-04,James Burke,Vistra,16,6,0,22,0.0,,James Burke Vistra
2025-12-04,David Hult,Asbury Automotive Group,4,19,2,25,8.0,,David Hult Asbury Automotive Group
2025-12-04,DG Macpherson,WW Grainger,5,9,3,17,17.6,,DG Macpherson WW Grainger
2025-12-04,Eric Slifka,Global Partners,3,16,6,25,24.0,,Eric Slifka Global Partners
2025-12-04,Bob Pragada,Jacobs Solutions,8,15,2,25,8.0,,Bob Pragada Jacobs Solutions
2025-12-04,Charles Magro,Corteva,1,10,1,12,8.3,,Charles Magro Corteva
2025-12-04,Rick Lanoha,Peter Kiewit Sons',0,6,0,6,0.0,,Rick Lanoha Peter Kiewit Sons'
2025-12-04,Michael Mahoney,Boston Scientific,6,16,3,25,12.0,,Michael Mahoney Boston Scientific
2025-12-04,Brad Beckham,O'Reilly Automotive,4,17,4,25,16.0,,Brad Beckham O'Reilly Automotive
2025-12-04,Thomas Bell,Leidos,7,17,1,25,4.0,,Thomas Bell Leidos
2025-12-04,Thomas Gayner,Markel Group,9,15,1,25,4.0,,Thomas Gayner Markel Group
2025-12-04,Marc Bitzer,Whirlpool,7,12,6,25,24.0,,Marc Bitzer Whirlpool
2025-12-04,Andrew McMahon,Guardian Life insurance,4,21,0,25,0.0,,Andrew McMahon Guardian Life insurance
2025-12-04,Peter Jackson,Builders FirstSource,3,17,1,21,4.8,,Peter Jackson Builders FirstSource
2025-12-04,Michael Rhodes,Ally Financial,5,18,2,25,8.0,,Michael Rhodes Ally Financial
2025-12-04,Matthew Meloy,Targa Resources,7,10,1,18,5.6,,Matthew Meloy Targa Resources
2025-12-04,James Breuer,Fluor,4,8,0,12,0.0,,James Breuer Fluor
2025-12-04,Sasan Goodarzi,Intuit,5,19,1,25,4.0,,Sasan Goodarzi Intuit
2025-12-04,Troy Rudd,AECOM,6,16,3,25,12.0,,Troy Rudd AECOM
2025-12-04,Penny Pennington,Edward Jones,6,14,5,25,20.0,,Penny Pennington Edward Jones
2025-12-04,Michael Bender,Kohl's,2,19,4,25,16.0,,Michael Bender Kohl's
2025-12-04,Beth Ford,Land O'Lakes,7,16,2,25,8.0,,Beth Ford Land O'Lakes
2025-12-04,Deanna Strable-Soethout,PrIncipal Financial,1,9,0,10,0.0,,Deanna Strable-Soethout PrIncipal Financial
2025-12-04,Robert Blue,Dominion Energy,15,8,2,25,8.0,,Robert Blue Dominion Energy
2025-12-04,Martin Schroeter,Kyndryl,9,14,2,25,8.0,,Martin Schroeter Kyndryl
2025-12-04,Jon Vander Ark,Republic Services,4,6,15,25,60.0,,Jon Vander Ark Republic Services
2025-12-04,Clay Gaspar,Devon Energy,22,1,2,25,8.0,,Clay Gaspar Devon Energy
2025-12-04,Christopher O'Herlihy,Illinois Tool Works,4,14,3,21,14.3,,Christopher O'Herlihy Illinois Tool Works
2025-12-04,Michael O'Grady,Northern Trust,19,6,0,25,0.0,,Michael O'Grady Northern Trust
2025-12-04,Jamie Whisnant,Auto-Owners Insurance,0,2,0,2,0.0,,Jamie Whisnant Auto-Owners Insurance
2025-12-04,Marc Miller,Universal Health Services,8,16,1,25,4.0,,Marc Miller Universal Health Services
2025-12-04,Darryl Button,Pacific Life,3,21,1,25,4.0,,Darryl Button Pacific Life
2025-12-04,Hamid Akhavan,EchoStar,9,9,7,25,28.0,,Hamid Akhavan EchoStar
2025-12-04,Christophe Beck,Ecolab,14,9,2,25,8.0,,Christophe Beck Ecolab
2025-12-04,Jack Fusco,Cheniere Energy,11,13,1,25,4.0,,Jack Fusco Cheniere Energy
2025-12-04,John Wren,Omnicom Group,8,14,3,25,12.0,,John Wren Omnicom Group
2025-12-04,Haviv Ilan,Texas Instruments,4,18,3,25,12.0,,Haviv Ilan Texas Instruments
2025-12-04,David Burritt,United States Steel,3,18,4,25,16.0,,David Burritt United States Steel
2025-12-04,Stéphane de La Faverie,Estée Lauder,10,13,2,25,8.0,,Stéphane de La Faverie Estée Lauder
2025-12-04,Raul Nicholas Vargas Ochoa,Farmers Insurance Exchange,0,0,0,0,0.0,,Raul Nicholas Vargas Ochoa Farmers Insurance Exchange
2025-12-04,Kirk Perry,Kenvue,5,18,2,25,8.0,,Kirk Perry Kenvue
2025-12-04,Ari Bousbib,IQVIA,9,13,3,25,12.0,,Ari Bousbib IQVIA
2025-12-04,Donald Allan,Stanley Black & Decker,5,18,2,25,8.0,,Donald Allan Stanley Black & Decker
2025-12-04,Timothy Cofer,Keurig Dr Pepper,4,10,1,15,6.7,,Timothy Cofer Keurig Dr Pepper
2025-12-04,Matthew Flannery,United Rentals,22,3,0,25,0.0,,Matthew Flannery United Rentals
2025-12-04,Timothy Cawley,Consolidated Edison,7,10,5,22,22.7,,Timothy Cawley Consolidated Edison
2025-12-04,Adam Norwitt,Amphenol,6,18,1,25,4.0,,Adam Norwitt Amphenol
2025-12-04,Brent Shafer,Baxter International,2,13,0,15,0.0,,Brent Shafer Baxter International
2025-12-04,Kimberly Dang,Kinder Morgan,12,2,1,15,6.7,,Kimberly Dang Kinder Morgan
2025-12-04,Erik Nordstrom,Nordstrom,5,17,3,25,12.0,,Erik Nordstrom Nordstrom
2025-12-04,Frank Holding,First Citizens BancShares,7,18,0,25,0.0,,Frank Holding First Citizens BancShares
2025-12-04,Paul Shoukry,Raymond James Financial,9,16,0,25,0.0,,Paul Shoukry Raymond James Financial
2025-12-04,Timothy Archer,Lam Research,8,11,6,25,24.0,,Timothy Archer Lam Research
2025-12-04,Harry Lawton III,Tractor Supply,3,7,1,11,9.1,,Harry Lawton III Tractor Supply
2025-12-04,Darren Rebelez,Caseys General Stores,8,15,2,25,8.0,,Darren Rebelez Caseys General Stores
2025-12-04,Scott Smith,Viatris,10,14,1,25,4.0,,Scott Smith Viatris
2025-12-04,James Blackledge,Mutual of Omaha,2,22,1,25,4.0,,James Blackledge Mutual of Omaha
2025-12-04,Anthony Guzzi,EMCOR Group,3,9,1,13,7.7,,Anthony Guzzi EMCOR Group
2025-12-04,Joseph Hinrichs,CSX,8,14,3,25,12.0,,Joseph Hinrichs CSX
2025-12-04,Justin Jude,LKQ,3,9,2,14,14.3,,Justin Jude LKQ
2025-12-04,Judith Marks,Otis Worldwide,5,15,5,25,20.0,,Judith Marks Otis Worldwide
2025-12-04,David Bruton Smith,Sonic Automotive,2,14,9,25,36.0,,David Bruton Smith Sonic Automotive
2025-12-04,Martina Cheung,S&P Global,8,16,1,25,4.0,,Martina Cheung S&P Global
2025-12-04,Leonard Schleifer,Regeneron Pharmaceuticals,2,18,5,25,20.0,,Leonard Schleifer Regeneron Pharmaceuticals
2025-12-04,Joseph Fadool,BorgWarner,1,14,0,15,0.0,,Joseph Fadool BorgWarner
2025-12-04,Karla Lewis,Reliance Inc,4,9,0,13,0.0,,Karla Lewis Reliance Inc
2025-12-04,John Barrett,Western & Southern Financial,5,20,0,25,0.0,,John Barrett Western & Southern Financial
2025-12-04,Scott Donnelly,Textron,7,17,1,25,4.0,,Scott Donnelly Textron
2025-12-04,Ariane Gorin,Expedia,9,14,2,25,8.0,,Ariane Gorin Expedia
2025-12-04,Michael Nolan,Fidelity National Financial,5,16,1,22,4.5,,Michael Nolan Fidelity National Financial
2025-12-04,Ernest Garcia III,Carvana,17,7,1,25,4.0,,Ernest Garcia III Carvana
2025-12-04,Raul Fernandez,DXC Technology,2,22,1,25,4.0,,Raul Fernandez DXC Technology
2025-12-04,Robert Berkley,WR Berkley,8,16,1,25,4.0,,Robert Berkley WR Berkley
2025-12-04,René Jones,M&T Bank,6,17,2,25,8.0,,René Jones M&T Bank
2025-12-04,Lauren Hobart,Dicks Sporting Goods,4,15,6,25,24.0,,Lauren Hobart Dicks Sporting Goods
2025-12-04,Robert Frenzel,Xcel Energy,14,4,7,25,28.0,,Robert Frenzel Xcel Energy
2025-12-04,Timothy Spence,Fifth Third Bancorp,7,13,5,25,20.0,,Timothy Spence Fifth Third Bancorp
2025-12-04,Stephen Schwarzman,Blackstone,6,16,3,25,12.0,,Stephen Schwarzman Blackstone
2025-12-04,Walker Martin,Sempra,1,4,0,5,0.0,,Walker Martin Sempra
