date,ceo,company,positive,neutral,negative,total,neg_pct,theme,alias
2025-10-20,Timothy J McGrath,PC Connection Inc,0,0,0,0,0.0,,Timothy J McGrath PC Connection Inc
2025-10-20,Lynn M Bamford,Curtiss-Wright,8,15,2,25,8.0,,Lynn M Bamford Curtiss-Wright
2025-10-20,Jonathan W Witter,Sallie Mae,2,4,1,7,14.3,,Jonathan W Witter Sallie Mae
2025-10-20,Jeff Benck,Benchmark Electronics,3,18,0,21,0.0,,Jeff Benck Benchmark Electronics
2025-10-20,Charles H Giancarlo,Pure Storage,4,10,0,14,0.0,,Charles H Giancarlo Pure Storage
2025-10-20,Brian R Gray,Knife River Corporation,1,1,0,2,0.0,,Brian R Gray Knife River Corporation
2025-10-20,Jay Schmidt,Caleres Inc,3,11,3,17,17.6,,Jay Schmidt Caleres Inc
2025-10-20,Dale Asplund,BrightView Holdings,0,8,0,8,0.0,,Dale Asplund BrightView Holdings
2025-10-20,Jeffrey S Edwards,Cooper-Standard,1,10,0,11,0.0,,Jeffrey S Edwards Cooper-Standard
2025-10-20,Glenn J Williams,Primerica,4,4,3,11,27.3,,Glenn J Williams Primerica
2025-10-20,Francois Locoh-Donou,F5,8,14,3,25,12.0,,Francois Locoh-Donou F5
2025-10-20,Joseph Wm Foran,Matador Resources,9,16,0,25,0.0,,Joseph Wm Foran Matador Resources
2025-10-20,Sridhar Ramaswamy,Snowflake Inc,7,16,2,25,8.0,,Sridhar Ramaswamy Snowflake Inc
2025-10-20,Mark D Dankberg,Viasat,2,7,3,12,25.0,,Mark D Dankberg Viasat
2025-10-20,Francisco J Leon,California Resources,1,4,1,6,16.7,,Francisco J Leon California Resources
2025-10-20,Peter Stern,Peloton Interactive,7,15,3,25,12.0,,Peter Stern Peloton Interactive
2025-10-20,David Baszucki,Roblox,2,17,6,25,24.0,,David Baszucki Roblox
2025-10-20,Jeffrey W Edwards,Installed Building Products,1,2,0,3,0.0,,Jeffrey W Edwards Installed Building Products
2025-10-20,Clark Lauritzen,First National of Nebraska,1,10,0,11,0.0,,Clark Lauritzen First National of Nebraska
2025-10-20,Carlos Alberini,Guess Inc,5,18,2,25,8.0,,Carlos Alberini Guess Inc
2025-10-20,Shyam P Kambeyanda,ESAB,3,3,0,6,0.0,,Shyam P Kambeyanda ESAB
2025-10-20,Edmund Shallcross III,Amica Mutual Insurance,4,6,0,10,0.0,,Edmund Shallcross III Amica Mutual Insurance
2025-10-20,Benjamin W Schall,AvalonBay Communities,2,10,0,12,0.0,,Benjamin W Schall AvalonBay Communities
2025-10-20,Allan C Thygesen,DocuSign,4,9,2,15,13.3,,Allan C Thygesen DocuSign
2025-10-20,Bryan J Knutson,Titan Machinery,1,1,1,3,33.3,,Bryan J Knutson Titan Machinery
2025-10-20,Heath Sampson,ModivCare,12,3,3,18,16.7,,Heath Sampson ModivCare
2025-10-20,Ara K Hovnanian,Hovnanian Enterprises,6,18,1,25,4.0,,Ara K Hovnanian Hovnanian Enterprises
2025-10-20,Joshua G Silverman,Etsy,6,16,3,25,12.0,,Joshua G Silverman Etsy
2025-10-20,Kevin Roycraft,Adams Resources & Energy,7,4,1,12,8.3,,Kevin Roycraft Adams Resources & Energy
2025-10-20,J Eric Evans,Surgery Partners,0,1,0,1,0.0,,J Eric Evans Surgery Partners
2025-10-20,Clint E Stein,Columbia Banking System,1,13,0,14,0.0,,Clint E Stein Columbia Banking System
2025-10-20,Lee M Shavel,Verisk Analytics,5,12,1,18,5.6,,Lee M Shavel Verisk Analytics
2025-10-20,Dave Banyard Jr,MasterBrand,0,0,0,0,0.0,,Dave Banyard Jr MasterBrand
2025-10-20,Peter R Ingram,Hawaiian Airlines Inc,2,11,1,14,7.1,,Peter R Ingram Hawaiian Airlines Inc
2025-10-20,Kristin A Dolan,AMC Networks,1,17,7,25,28.0,,Kristin A Dolan AMC Networks
2025-10-20,Brendan T Cavanagh,SBA Communications,3,7,0,10,0.0,,Brendan T Cavanagh SBA Communications
2025-10-20,George F Chappelle Jr,Americold Realty Trust,5,3,0,8,0.0,,George F Chappelle Jr Americold Realty Trust
2025-10-20,Thomas E Gottwald,NewMarket Corporation,1,11,0,12,0.0,,Thomas E Gottwald NewMarket Corporation
2025-10-20,Thomas J Baltimore Jr,Park Hotels & Resorts,4,20,1,25,4.0,,Thomas J Baltimore Jr Park Hotels & Resorts
2025-10-20,Peter M Moglia,Alexandria Real Estate Equities,2,8,0,10,0.0,,Peter M Moglia Alexandria Real Estate Equities
2025-10-20,Ronald J Kramer,Griffon Corporation,2,6,1,9,11.1,,Ronald J Kramer Griffon Corporation
2025-10-20,John L Plueger,Air Lease,5,18,1,24,4.2,,John L Plueger Air Lease
2025-10-20,Jennifer F Scanlon,UL Solutions,7,3,0,10,0.0,,Jennifer F Scanlon UL Solutions
2025-10-20,Greg Smith,Teradyne,3,14,3,20,15.0,,Greg Smith Teradyne
2025-10-20,Sean Trauschke,OGE Energy,18,6,1,25,4.0,,Sean Trauschke OGE Energy
2025-10-20,Norman D Schwartz,Bio-Rad Laboratories,3,3,1,7,14.3,,Norman D Schwartz Bio-Rad Laboratories
2025-10-20,Scott Doyle,Spire Inc,5,7,4,16,25.0,,Scott Doyle Spire Inc
2025-10-20,Michael E Reed,Gannett,0,4,2,6,33.3,,Michael E Reed Gannett
2025-10-20,Cindy J Miller,Stericycle,4,5,2,11,18.2,,Cindy J Miller Stericycle
2025-10-20,Phillip D Green,Cullen Frost Bankers,4,5,3,12,25.0,,Phillip D Green Cullen Frost Bankers
2025-10-20,Joseph D Margolis,Extra Space Storage,1,13,1,15,6.7,,Joseph D Margolis Extra Space Storage
2025-10-20,Mark A Skonieczny,REV Group,2,11,1,14,7.1,,Mark A Skonieczny REV Group
2025-10-20,Ladd Wilks,ProFrac Holding,5,1,0,6,0.0,,Ladd Wilks ProFrac Holding
2025-10-20,Sundaram Nagarajan,Nordson,9,16,0,25,0.0,,Sundaram Nagarajan Nordson
2025-10-20,Anne P Noonan,Summit Materials,1,7,0,8,0.0,,Anne P Noonan Summit Materials
2025-10-20,Lori Flees,Valvoline Inc,2,7,5,14,35.7,,Lori Flees Valvoline Inc
2025-10-20,Scott H Baxter,Kontoor Brands,3,6,1,10,10.0,,Scott H Baxter Kontoor Brands
2025-10-20,Tim Larson,Skyline Champion,19,0,0,19,0.0,,Tim Larson Skyline Champion
2025-10-20,Chuck Divita,Teladoc Health,6,16,3,25,12.0,,Chuck Divita Teladoc Health
2025-10-20,W Bradley Southern,Louisiana-Pacific Corporation,6,16,0,22,0.0,,W Bradley Southern Louisiana-Pacific Corporation
2025-10-20,George C Freeman III,Universal Corporation,7,18,0,25,0.0,,George C Freeman III Universal Corporation
2025-10-20,James A Brock,Consol Energy,7,5,0,12,0.0,,James A Brock Consol Energy
2025-10-20,Robert Antokol,Playtika Holding,0,8,1,9,11.1,,Robert Antokol Playtika Holding
2025-10-20,Joe Craft,Alliance Resource Partners,9,14,2,25,8.0,,Joe Craft Alliance Resource Partners
2025-10-20,Paul Keel,Envista,3,10,1,14,7.1,,Paul Keel Envista
2025-10-20,Jared Isaacman,Shift4 Payments,5,18,2,25,8.0,,Jared Isaacman Shift4 Payments
2025-10-20,Mark Mac McFarland,Talen Energy,6,1,1,8,12.5,,Mark Mac McFarland Talen Energy
2025-10-20,Tony R Thene,Carpenter Technology,2,12,1,15,6.7,,Tony R Thene Carpenter Technology
2025-10-20,Melissa D Smith,WEX,5,9,1,15,6.7,,Melissa D Smith WEX
2025-10-20,James Jim C Ryan III,Old National Bancorp,2,4,0,6,0.0,,James Jim C Ryan III Old National Bancorp
2025-10-20,Peter J Federico,AGNC Investment,1,1,0,2,0.0,,Peter J Federico AGNC Investment
2025-10-20,Brent L Yeagy,Wabash National,0,2,0,2,0.0,,Brent L Yeagy Wabash National
2025-10-20,Henry A Fernandez,MSCI,8,13,4,25,16.0,,Henry A Fernandez MSCI
2025-10-20,Mark Penn,Stagwell,4,17,4,25,16.0,,Mark Penn Stagwell
2025-10-20,Julie Schertell,Mativ,4,17,0,21,0.0,,Julie Schertell Mativ
2025-10-20,Ashish Chand,Belden,2,7,1,10,10.0,,Ashish Chand Belden
2025-10-20,Greg Anderson,Allegiant Travel Company,8,15,2,25,8.0,,Greg Anderson Allegiant Travel Company
2025-10-20,Drew Houston,Dropbox,6,15,4,25,16.0,,Drew Houston Dropbox
2025-10-20,Kevin T Conroy,Exact Sciences,2,15,8,25,32.0,,Kevin T Conroy Exact Sciences
2025-10-20,Rex D Geveden,BWX Technologies,8,9,2,19,10.5,,Rex D Geveden BWX Technologies
2025-10-20,Scott R Wells,Clear Channel Outdoor Hldgs,5,2,0,7,0.0,,Scott R Wells Clear Channel Outdoor Hldgs
2025-10-20,Casey Wasserman,Wasserman,8,14,3,25,12.0,,Casey Wasserman
2025-10-20,Mac Cummings,Terakeet,2,7,0,9,0.0,,Mac Cummings Terakeet
