date,ceo,company,positive,neutral,negative,total,neg_pct,theme,alias
2025-11-05,Timothy J McGrath,PC Connection Inc,0,0,0,0,0.0,,Timothy J McGrath PC Connection Inc
2025-11-05,Lynn M Bamford,Curtiss-Wright,11,12,2,25,8.0,,Lynn M Bamford Curtiss-Wright
2025-11-05,Jonathan W Witter,Sallie Mae,4,8,1,13,7.7,,Jonathan W Witter Sallie Mae
2025-11-05,Jeff Benck,Benchmark Electronics,3,19,0,22,0.0,,Jeff Benck Benchmark Electronics
2025-11-05,Charles H Giancarlo,Pure Storage,4,14,1,19,5.3,,Charles H Giancarlo Pure Storage
2025-11-05,Brian R Gray,Knife River Corporation,1,2,0,3,0.0,,Brian R Gray Knife River Corporation
2025-11-05,Jay Schmidt,Caleres Inc,2,14,2,18,11.1,,Jay Schmidt Caleres Inc
2025-11-05,Dale Asplund,BrightView Holdings,0,10,0,10,0.0,,Dale Asplund BrightView Holdings
2025-11-05,Jeffrey S Edwards,Cooper-Standard,1,10,1,12,8.3,,Jeffrey S Edwards Cooper-Standard
2025-11-05,Glenn J Williams,Primerica,4,3,5,12,41.7,,Glenn J Williams Primerica
2025-11-05,Francois Locoh-Donou,F5,8,17,0,25,0.0,,Francois Locoh-Donou F5
2025-11-05,Joseph Wm Foran,Matador Resources,9,16,0,25,0.0,,Joseph Wm Foran Matador Resources
2025-11-05,Sridhar Ramaswamy,Snowflake Inc,8,16,1,25,4.0,,Sridhar Ramaswamy Snowflake Inc
2025-11-05,Mark D Dankberg,Viasat,1,8,4,13,30.8,,Mark D Dankberg Viasat
2025-11-05,Francisco J Leon,California Resources,1,5,2,8,25.0,,Francisco J Leon California Resources
2025-11-05,Peter Stern,Peloton Interactive,6,15,4,25,16.0,,Peter Stern Peloton Interactive
2025-11-05,David Baszucki,Roblox,9,12,4,25,16.0,,David Baszucki Roblox
2025-11-05,Jeffrey W Edwards,Installed Building Products,1,2,0,3,0.0,,Jeffrey W Edwards Installed Building Products
2025-11-05,Clark Lauritzen,First National of Nebraska,1,10,0,11,0.0,,Clark Lauritzen First National of Nebraska
2025-11-05,Carlos Alberini,Guess Inc,5,18,2,25,8.0,,Carlos Alberini Guess Inc
2025-11-05,Shyam P Kambeyanda,ESAB,3,4,0,7,0.0,,Shyam P Kambeyanda ESAB
2025-11-05,Edmund Shallcross III,Amica Mutual Insurance,2,8,0,10,0.0,,Edmund Shallcross III Amica Mutual Insurance
2025-11-05,Benjamin W Schall,AvalonBay Communities,2,12,2,16,12.5,,Benjamin W Schall AvalonBay Communities
2025-11-05,Allan C Thygesen,DocuSign,6,9,2,17,11.8,,Allan C Thygesen DocuSign
2025-11-05,Bryan J Knutson,Titan Machinery,1,2,1,4,25.0,,Bryan J Knutson Titan Machinery
2025-11-05,Heath Sampson,ModivCare,9,4,4,17,23.5,,Heath Sampson ModivCare
2025-11-05,Ara K Hovnanian,Hovnanian Enterprises,6,18,1,25,4.0,,Ara K Hovnanian Hovnanian Enterprises
2025-11-05,Joshua G Silverman,Etsy,8,16,1,25,4.0,,Joshua G Silverman Etsy
2025-11-05,Kevin Roycraft,Adams Resources & Energy,9,1,0,10,0.0,,Kevin Roycraft Adams Resources & Energy
2025-11-05,J Eric Evans,Surgery Partners,0,2,0,2,0.0,,J Eric Evans Surgery Partners
2025-11-05,Clint E Stein,Columbia Banking System,2,11,0,13,0.0,,Clint E Stein Columbia Banking System
2025-11-05,Lee M Shavel,Verisk Analytics,3,15,2,20,10.0,,Lee M Shavel Verisk Analytics
2025-11-05,Dave Banyard Jr,MasterBrand,0,0,1,1,100.0,,Dave Banyard Jr MasterBrand
2025-11-05,Peter R Ingram,Hawaiian Airlines Inc,2,7,2,11,18.2,,Peter R Ingram Hawaiian Airlines Inc
2025-11-05,Kristin A Dolan,AMC Networks,4,16,5,25,20.0,,Kristin A Dolan AMC Networks
2025-11-05,Brendan T Cavanagh,SBA Communications,2,8,0,10,0.0,,Brendan T Cavanagh SBA Communications
2025-11-05,George F Chappelle Jr,Americold Realty Trust,6,2,0,8,0.0,,George F Chappelle Jr Americold Realty Trust
2025-11-05,Thomas E Gottwald,NewMarket Corporation,1,11,0,12,0.0,,Thomas E Gottwald NewMarket Corporation
2025-11-05,Thomas J Baltimore Jr,Park Hotels & Resorts,3,20,2,25,8.0,,Thomas J Baltimore Jr Park Hotels & Resorts
2025-11-05,Peter M Moglia,Alexandria Real Estate Equities,3,6,1,10,10.0,,Peter M Moglia Alexandria Real Estate Equities
2025-11-05,Ronald J Kramer,Griffon Corporation,2,7,1,10,10.0,,Ronald J Kramer Griffon Corporation
2025-11-05,John L Plueger,Air Lease,3,20,2,25,8.0,,John L Plueger Air Lease
2025-11-05,Jennifer F Scanlon,UL Solutions,7,3,0,10,0.0,,Jennifer F Scanlon UL Solutions
2025-11-05,Greg Smith,Teradyne,6,15,4,25,16.0,,Greg Smith Teradyne
2025-11-05,Sean Trauschke,OGE Energy,19,4,2,25,8.0,,Sean Trauschke OGE Energy
2025-11-05,Norman D Schwartz,Bio-Rad Laboratories,4,6,2,12,16.7,,Norman D Schwartz Bio-Rad Laboratories
2025-11-05,Scott Doyle,Spire Inc,8,7,2,17,11.8,,Scott Doyle Spire Inc
2025-11-05,Michael E Reed,Gannett,0,5,3,8,37.5,,Michael E Reed Gannett
2025-11-05,Cindy J Miller,Stericycle,2,5,3,10,30.0,,Cindy J Miller Stericycle
2025-11-05,Phillip D Green,Cullen Frost Bankers,2,8,3,13,23.1,,Phillip D Green Cullen Frost Bankers
2025-11-05,Joseph D Margolis,Extra Space Storage,3,10,1,14,7.1,,Joseph D Margolis Extra Space Storage
2025-11-05,Mark A Skonieczny,REV Group,2,10,2,14,14.3,,Mark A Skonieczny REV Group
2025-11-05,Ladd Wilks,ProFrac Holding,4,1,0,5,0.0,,Ladd Wilks ProFrac Holding
2025-11-05,Sundaram Nagarajan,Nordson,6,18,1,25,4.0,,Sundaram Nagarajan Nordson
2025-11-05,Anne P Noonan,Summit Materials,1,6,0,7,0.0,,Anne P Noonan Summit Materials
2025-11-05,Lori Flees,Valvoline Inc,2,7,6,15,40.0,,Lori Flees Valvoline Inc
2025-11-05,Scott H Baxter,Kontoor Brands,7,6,1,14,7.1,,Scott H Baxter Kontoor Brands
2025-11-05,Tim Larson,Skyline Champion,14,0,0,14,0.0,,Tim Larson Skyline Champion
2025-11-05,Chuck Divita,Teladoc Health,8,14,3,25,12.0,,Chuck Divita Teladoc Health
2025-11-05,W Bradley Southern,Louisiana-Pacific Corporation,3,20,0,23,0.0,,W Bradley Southern Louisiana-Pacific Corporation
2025-11-05,George C Freeman III,Universal Corporation,7,18,0,25,0.0,,George C Freeman III Universal Corporation
2025-11-05,James A Brock,Consol Energy,8,4,0,12,0.0,,James A Brock Consol Energy
2025-11-05,Robert Antokol,Playtika Holding,0,8,1,9,11.1,,Robert Antokol Playtika Holding
2025-11-05,Joe Craft,Alliance Resource Partners,8,14,3,25,12.0,,Joe Craft Alliance Resource Partners
2025-11-05,Paul Keel,Envista,3,13,3,19,15.8,,Paul Keel Envista
2025-11-05,Jared Isaacman,Shift4 Payments,1,24,0,25,0.0,,Jared Isaacman Shift4 Payments
2025-11-05,Mark Mac McFarland,Talen Energy,8,1,1,10,10.0,,Mark Mac McFarland Talen Energy
2025-11-05,Tony R Thene,Carpenter Technology,1,12,0,13,0.0,,Tony R Thene Carpenter Technology
2025-11-05,Melissa D Smith,WEX,4,9,0,13,0.0,,Melissa D Smith WEX
2025-11-05,James Jim C Ryan III,Old National Bancorp,3,15,0,18,0.0,,James Jim C Ryan III Old National Bancorp
2025-11-05,Peter J Federico,AGNC Investment,2,2,2,6,33.3,,Peter J Federico AGNC Investment
2025-11-05,Brent L Yeagy,Wabash National,0,3,0,3,0.0,,Brent L Yeagy Wabash National
2025-11-05,Henry A Fernandez,MSCI,9,14,2,25,8.0,,Henry A Fernandez MSCI
2025-11-05,Mark Penn,Stagwell,3,19,3,25,12.0,,Mark Penn Stagwell
2025-11-05,Julie Schertell,Mativ,5,16,0,21,0.0,,Julie Schertell Mativ
2025-11-05,Ashish Chand,Belden,1,7,1,9,11.1,,Ashish Chand Belden
2025-11-05,Greg Anderson,Allegiant Travel Company,9,14,2,25,8.0,,Greg Anderson Allegiant Travel Company
2025-11-05,Drew Houston,Dropbox,7,14,4,25,16.0,,Drew Houston Dropbox
2025-11-05,Kevin T Conroy,Exact Sciences,2,13,10,25,40.0,,Kevin T Conroy Exact Sciences
2025-11-05,Rex D Geveden,BWX Technologies,9,13,3,25,12.0,,Rex D Geveden BWX Technologies
2025-11-05,Scott R Wells,Clear Channel Outdoor Hldgs,3,2,0,5,0.0,,Scott R Wells Clear Channel Outdoor Hldgs
2025-11-05,Casey Wasserman,Wasserman,9,16,0,25,0.0,,Casey Wasserman
2025-11-05,Mac Cummings,Terakeet,3,6,0,9,0.0,,Mac Cummings Terakeet
