date,ceo,company,positive,neutral,negative,total,neg_pct,theme,alias
2025-10-17,Timothy J McGrath,PC Connection Inc,0,0,0,0,0.0,,Timothy J McGrath PC Connection Inc
2025-10-17,Lynn M Bamford,Curtiss-Wright,6,16,3,25,12.0,,Lynn M Bamford Curtiss-Wright
2025-10-17,Jonathan W Witter,Sallie Mae,2,5,1,8,12.5,,Jonathan W Witter Sallie Mae
2025-10-17,Jeff Benck,Benchmark Electronics,3,17,0,20,0.0,,Jeff Benck Benchmark Electronics
2025-10-17,Charles H Giancarlo,Pure Storage,4,10,0,14,0.0,,Charles H Giancarlo Pure Storage
2025-10-17,Brian R Gray,Knife River Corporation,1,1,0,2,0.0,,Brian R Gray Knife River Corporation
2025-10-17,Jay Schmidt,Caleres Inc,2,11,3,16,18.8,,Jay Schmidt Caleres Inc
2025-10-17,Dale Asplund,BrightView Holdings,1,7,0,8,0.0,,Dale Asplund BrightView Holdings
2025-10-17,Jeffrey S Edwards,Cooper-Standard,3,11,0,14,0.0,,Jeffrey S Edwards Cooper-Standard
2025-10-17,Glenn J Williams,Primerica,4,3,3,10,30.0,,Glenn J Williams Primerica
2025-10-17,Francois Locoh-Donou,F5,8,14,3,25,12.0,,Francois Locoh-Donou F5
2025-10-17,Joseph Wm Foran,Matador Resources,9,15,1,25,4.0,,Joseph Wm Foran Matador Resources
2025-10-17,Sridhar Ramaswamy,Snowflake Inc,9,15,1,25,4.0,,Sridhar Ramaswamy Snowflake Inc
2025-10-17,Mark D Dankberg,Viasat,2,7,3,12,25.0,,Mark D Dankberg Viasat
2025-10-17,Francisco J Leon,California Resources,1,5,1,7,14.3,,Francisco J Leon California Resources
2025-10-17,Peter Stern,Peloton Interactive,6,16,3,25,12.0,,Peter Stern Peloton Interactive
2025-10-17,David Baszucki,Roblox,4,16,5,25,20.0,,David Baszucki Roblox
2025-10-17,Jeffrey W Edwards,Installed Building Products,1,2,0,3,0.0,,Jeffrey W Edwards Installed Building Products
2025-10-17,Clark Lauritzen,First National of Nebraska,1,11,0,12,0.0,,Clark Lauritzen First National of Nebraska
2025-10-17,Carlos Alberini,Guess Inc,6,17,2,25,8.0,,Carlos Alberini Guess Inc
2025-10-17,Shyam P Kambeyanda,ESAB,5,4,0,9,0.0,,Shyam P Kambeyanda ESAB
2025-10-17,Edmund Shallcross III,Amica Mutual Insurance,3,7,0,10,0.0,,Edmund Shallcross III Amica Mutual Insurance
2025-10-17,Benjamin W Schall,AvalonBay Communities,2,10,1,13,7.7,,Benjamin W Schall AvalonBay Communities
2025-10-17,Allan C Thygesen,DocuSign,5,8,4,17,23.5,,Allan C Thygesen DocuSign
2025-10-17,Bryan J Knutson,Titan Machinery,1,2,1,4,25.0,,Bryan J Knutson Titan Machinery
2025-10-17,Heath Sampson,ModivCare,12,3,3,18,16.7,,Heath Sampson ModivCare
2025-10-17,Ara K Hovnanian,Hovnanian Enterprises,6,18,1,25,4.0,,Ara K Hovnanian Hovnanian Enterprises
2025-10-17,Joshua G Silverman,Etsy,5,16,4,25,16.0,,Joshua G Silverman Etsy
2025-10-17,Kevin Roycraft,Adams Resources & Energy,6,3,1,10,10.0,,Kevin Roycraft Adams Resources & Energy
2025-10-17,J Eric Evans,Surgery Partners,0,5,0,5,0.0,,J Eric Evans Surgery Partners
2025-10-17,Clint E Stein,Columbia Banking System,1,13,0,14,0.0,,Clint E Stein Columbia Banking System
2025-10-17,Lee M Shavel,Verisk Analytics,6,15,1,22,4.5,,Lee M Shavel Verisk Analytics
2025-10-17,Dave Banyard Jr,MasterBrand,0,0,0,0,0.0,,Dave Banyard Jr MasterBrand
2025-10-17,Peter R Ingram,Hawaiian Airlines Inc,2,10,2,14,14.3,,Peter R Ingram Hawaiian Airlines Inc
2025-10-17,Kristin A Dolan,AMC Networks,1,17,7,25,28.0,,Kristin A Dolan AMC Networks
2025-10-17,Brendan T Cavanagh,SBA Communications,3,6,0,9,0.0,,Brendan T Cavanagh SBA Communications
2025-10-17,George F Chappelle Jr,Americold Realty Trust,6,3,0,9,0.0,,George F Chappelle Jr Americold Realty Trust
2025-10-17,Thomas E Gottwald,NewMarket Corporation,1,10,0,11,0.0,,Thomas E Gottwald NewMarket Corporation
2025-10-17,Thomas J Baltimore Jr,Park Hotels & Resorts,4,19,2,25,8.0,,Thomas J Baltimore Jr Park Hotels & Resorts
2025-10-17,Peter M Moglia,Alexandria Real Estate Equities,2,8,0,10,0.0,,Peter M Moglia Alexandria Real Estate Equities
2025-10-17,Ronald J Kramer,Griffon Corporation,2,6,1,9,11.1,,Ronald J Kramer Griffon Corporation
2025-10-17,John L Plueger,Air Lease,6,17,0,23,0.0,,John L Plueger Air Lease
2025-10-17,Jennifer F Scanlon,UL Solutions,7,2,0,9,0.0,,Jennifer F Scanlon UL Solutions
2025-10-17,Greg Smith,Teradyne,0,0,0,0,0.0,,Greg Smith Teradyne
2025-10-17,Sean Trauschke,OGE Energy,19,5,1,25,4.0,,Sean Trauschke OGE Energy
2025-10-17,Norman D Schwartz,Bio-Rad Laboratories,3,3,1,7,14.3,,Norman D Schwartz Bio-Rad Laboratories
2025-10-17,Scott Doyle,Spire Inc,5,7,4,16,25.0,,Scott Doyle Spire Inc
2025-10-17,Michael E Reed,Gannett,0,6,2,8,25.0,,Michael E Reed Gannett
2025-10-17,Cindy J Miller,Stericycle,3,5,3,11,27.3,,Cindy J Miller Stericycle
2025-10-17,Phillip D Green,Cullen Frost Bankers,6,5,4,15,26.7,,Phillip D Green Cullen Frost Bankers
2025-10-17,Joseph D Margolis,Extra Space Storage,1,13,1,15,6.7,,Joseph D Margolis Extra Space Storage
2025-10-17,Mark A Skonieczny,REV Group,2,11,1,14,7.1,,Mark A Skonieczny REV Group
2025-10-17,Ladd Wilks,ProFrac Holding,4,1,0,5,0.0,,Ladd Wilks ProFrac Holding
2025-10-17,Sundaram Nagarajan,Nordson,8,17,0,25,0.0,,Sundaram Nagarajan Nordson
2025-10-17,Anne P Noonan,Summit Materials,1,8,0,9,0.0,,Anne P Noonan Summit Materials
2025-10-17,Lori Flees,Valvoline Inc,2,7,6,15,40.0,,Lori Flees Valvoline Inc
2025-10-17,Scott H Baxter,Kontoor Brands,3,6,1,10,10.0,,Scott H Baxter Kontoor Brands
2025-10-17,Tim Larson,Skyline Champion,18,1,0,19,0.0,,Tim Larson Skyline Champion
2025-10-17,Chuck Divita,Teladoc Health,8,14,3,25,12.0,,Chuck Divita Teladoc Health
2025-10-17,W Bradley Southern,Louisiana-Pacific Corporation,7,18,0,25,0.0,,W Bradley Southern Louisiana-Pacific Corporation
2025-10-17,George C Freeman III,Universal Corporation,7,17,1,25,4.0,,George C Freeman III Universal Corporation
2025-10-17,James A Brock,Consol Energy,9,5,0,14,0.0,,James A Brock Consol Energy
2025-10-17,Robert Antokol,Playtika Holding,0,9,1,10,10.0,,Robert Antokol Playtika Holding
2025-10-17,Joe Craft,Alliance Resource Partners,9,13,3,25,12.0,,Joe Craft Alliance Resource Partners
2025-10-17,Paul Keel,Envista,4,11,1,16,6.2,,Paul Keel Envista
2025-10-17,Jared Isaacman,Shift4 Payments,5,18,2,25,8.0,,Jared Isaacman Shift4 Payments
2025-10-17,Mark Mac McFarland,Talen Energy,7,1,1,9,11.1,,Mark Mac McFarland Talen Energy
2025-10-17,Tony R Thene,Carpenter Technology,2,11,1,14,7.1,,Tony R Thene Carpenter Technology
2025-10-17,Melissa D Smith,WEX,4,9,1,14,7.1,,Melissa D Smith WEX
2025-10-17,James Jim C Ryan III,Old National Bancorp,2,5,1,8,12.5,,James Jim C Ryan III Old National Bancorp
2025-10-17,Peter J Federico,AGNC Investment,1,1,0,2,0.0,,Peter J Federico AGNC Investment
2025-10-17,Brent L Yeagy,Wabash National,0,2,0,2,0.0,,Brent L Yeagy Wabash National
2025-10-17,Henry A Fernandez,MSCI,8,13,4,25,16.0,,Henry A Fernandez MSCI
2025-10-17,Mark Penn,Stagwell,0,0,0,0,0.0,,Mark Penn Stagwell
2025-10-17,Julie Schertell,Mativ,5,18,0,23,0.0,,Julie Schertell Mativ
2025-10-17,Ashish Chand,Belden,2,7,1,10,10.0,,Ashish Chand Belden
2025-10-17,Greg Anderson,Allegiant Travel Company,9,15,1,25,4.0,,Greg Anderson Allegiant Travel Company
2025-10-17,Drew Houston,Dropbox,8,13,4,25,16.0,,Drew Houston Dropbox
2025-10-17,Kevin T Conroy,Exact Sciences,4,12,9,25,36.0,,Kevin T Conroy Exact Sciences
2025-10-17,Rex D Geveden,BWX Technologies,8,11,2,21,9.5,,Rex D Geveden BWX Technologies
2025-10-17,Scott R Wells,Clear Channel Outdoor Hldgs,6,2,0,8,0.0,,Scott R Wells Clear Channel Outdoor Hldgs
2025-10-17,Casey Wasserman,Wasserman,9,15,1,25,4.0,,Casey Wasserman
2025-10-17,Mac Cummings,Terakeet,2,8,0,10,0.0,,Mac Cummings Terakeet
