date,ceo,company,positive,neutral,negative,total,neg_pct,theme,alias
2025-12-03,Timothy J McGrath,PC Connection Inc,0,0,0,0,0.0,,Timothy J McGrath PC Connection Inc
2025-12-03,Lynn M Bamford,Curtiss-Wright,11,13,1,25,4.0,,Lynn M Bamford Curtiss-Wright
2025-12-03,Jonathan W Witter,Sallie Mae,3,5,2,10,20.0,,Jonathan W Witter Sallie Mae
2025-12-03,Jeff Benck,Benchmark Electronics,2,18,0,20,0.0,,Jeff Benck Benchmark Electronics
2025-12-03,Charles H Giancarlo,Pure Storage,5,16,2,23,8.7,,Charles H Giancarlo Pure Storage
2025-12-03,Brian R Gray,Knife River Corporation,1,1,0,2,0.0,,Brian R Gray Knife River Corporation
2025-12-03,Jay Schmidt,Caleres Inc,3,10,3,16,18.8,,Jay Schmidt Caleres Inc
2025-12-03,Dale Asplund,BrightView Holdings,0,8,0,8,0.0,,Dale Asplund BrightView Holdings
2025-12-03,Jeffrey S Edwards,Cooper-Standard,1,16,2,19,10.5,,Jeffrey S Edwards Cooper-Standard
2025-12-03,Glenn J Williams,Primerica,6,2,2,10,20.0,,Glenn J Williams Primerica
2025-12-03,Francois Locoh-Donou,F5,7,15,3,25,12.0,,Francois Locoh-Donou F5
2025-12-03,Joseph Wm Foran,Matador Resources,10,15,0,25,0.0,,Joseph Wm Foran Matador Resources
2025-12-03,Sridhar Ramaswamy,Snowflake Inc,8,15,2,25,8.0,,Sridhar Ramaswamy Snowflake Inc
2025-12-03,Mark D Dankberg,Viasat,3,9,6,18,33.3,,Mark D Dankberg Viasat
2025-12-03,Francisco J Leon,California Resources,1,5,2,8,25.0,,Francisco J Leon California Resources
2025-12-03,Peter Stern,Peloton Interactive,9,11,5,25,20.0,,Peter Stern Peloton Interactive
2025-12-03,David Baszucki,Roblox,11,8,6,25,24.0,,David Baszucki Roblox
2025-12-03,Jeffrey W Edwards,Installed Building Products,1,5,0,6,0.0,,Jeffrey W Edwards Installed Building Products
2025-12-03,Clark Lauritzen,First National of Nebraska,1,10,0,11,0.0,,Clark Lauritzen First National of Nebraska
2025-12-03,Carlos Alberini,Guess Inc,4,19,2,25,8.0,,Carlos Alberini Guess Inc
2025-12-03,Shyam P Kambeyanda,ESAB,3,6,0,9,0.0,,Shyam P Kambeyanda ESAB
2025-12-03,Edmund Shallcross III,Amica Mutual Insurance,2,8,0,10,0.0,,Edmund Shallcross III Amica Mutual Insurance
2025-12-03,Benjamin W Schall,AvalonBay Communities,1,10,2,13,15.4,,Benjamin W Schall AvalonBay Communities
2025-12-03,Allan C Thygesen,DocuSign,7,8,4,19,21.1,,Allan C Thygesen DocuSign
2025-12-03,Bryan J Knutson,Titan Machinery,1,2,1,4,25.0,,Bryan J Knutson Titan Machinery
2025-12-03,Heath Sampson,ModivCare,8,6,3,17,17.6,,Heath Sampson ModivCare
2025-12-03,Ara K Hovnanian,Hovnanian Enterprises,8,15,2,25,8.0,,Ara K Hovnanian Hovnanian Enterprises
2025-12-03,Joshua G Silverman,Etsy,7,16,2,25,8.0,,Joshua G Silverman Etsy
2025-12-03,Kevin Roycraft,Adams Resources & Energy,9,1,1,11,9.1,,Kevin Roycraft Adams Resources & Energy
2025-12-03,J Eric Evans,Surgery Partners,0,2,1,3,33.3,,J Eric Evans Surgery Partners
2025-12-03,Clint E Stein,Columbia Banking System,2,10,0,12,0.0,,Clint E Stein Columbia Banking System
2025-12-03,Lee M Shavel,Verisk Analytics,2,15,1,18,5.6,,Lee M Shavel Verisk Analytics
2025-12-03,Dave Banyard Jr,MasterBrand,1,0,1,2,50.0,,Dave Banyard Jr MasterBrand
2025-12-03,Peter R Ingram,Hawaiian Airlines Inc,1,11,2,14,14.3,,Peter R Ingram Hawaiian Airlines Inc
2025-12-03,Kristin A Dolan,AMC Networks,2,17,6,25,24.0,,Kristin A Dolan AMC Networks
2025-12-03,Brendan T Cavanagh,SBA Communications,1,11,1,13,7.7,,Brendan T Cavanagh SBA Communications
2025-12-03,George F Chappelle Jr,Americold Realty Trust,3,4,0,7,0.0,,George F Chappelle Jr Americold Realty Trust
2025-12-03,Thomas E Gottwald,NewMarket Corporation,1,11,0,12,0.0,,Thomas E Gottwald NewMarket Corporation
2025-12-03,Thomas J Baltimore Jr,Park Hotels & Resorts,4,20,1,25,4.0,,Thomas J Baltimore Jr Park Hotels & Resorts
2025-12-03,Peter M Moglia,Alexandria Real Estate Equities,2,7,1,10,10.0,,Peter M Moglia Alexandria Real Estate Equities
2025-12-03,Ronald J Kramer,Griffon Corporation,2,7,1,10,10.0,,Ronald J Kramer Griffon Corporation
2025-12-03,John L Plueger,Air Lease,4,15,0,19,0.0,,John L Plueger Air Lease
2025-12-03,Jennifer F Scanlon,UL Solutions,6,3,0,9,0.0,,Jennifer F Scanlon UL Solutions
2025-12-03,Greg Smith,Teradyne,3,20,2,25,8.0,,Greg Smith Teradyne
2025-12-03,Sean Trauschke,OGE Energy,19,4,2,25,8.0,,Sean Trauschke OGE Energy
2025-12-03,Norman D Schwartz,Bio-Rad Laboratories,4,6,2,12,16.7,,Norman D Schwartz Bio-Rad Laboratories
2025-12-03,Scott Doyle,Spire Inc,5,8,2,15,13.3,,Scott Doyle Spire Inc
2025-12-03,Michael E Reed,Gannett,3,5,3,11,27.3,,Michael E Reed Gannett
2025-12-03,Cindy J Miller,Stericycle,2,7,5,14,35.7,,Cindy J Miller Stericycle
2025-12-03,Phillip D Green,Cullen Frost Bankers,3,8,4,15,26.7,,Phillip D Green Cullen Frost Bankers
2025-12-03,Joseph D Margolis,Extra Space Storage,1,10,1,12,8.3,,Joseph D Margolis Extra Space Storage
2025-12-03,Mark A Skonieczny,REV Group,0,11,1,12,8.3,,Mark A Skonieczny REV Group
2025-12-03,Ladd Wilks,ProFrac Holding,4,3,1,8,12.5,,Ladd Wilks ProFrac Holding
2025-12-03,Sundaram Nagarajan,Nordson,4,17,1,22,4.5,,Sundaram Nagarajan Nordson
2025-12-03,Anne P Noonan,Summit Materials,1,6,0,7,0.0,,Anne P Noonan Summit Materials
2025-12-03,Lori Flees,Valvoline Inc,3,7,5,15,33.3,,Lori Flees Valvoline Inc
2025-12-03,Scott H Baxter,Kontoor Brands,4,5,1,10,10.0,,Scott H Baxter Kontoor Brands
2025-12-03,Tim Larson,Skyline Champion,17,0,0,17,0.0,,Tim Larson Skyline Champion
2025-12-03,Chuck Divita,Teladoc Health,6,16,3,25,12.0,,Chuck Divita Teladoc Health
2025-12-03,W Bradley Southern,Louisiana-Pacific Corporation,2,10,0,12,0.0,,W Bradley Southern Louisiana-Pacific Corporation
2025-12-03,George C Freeman III,Universal Corporation,8,17,0,25,0.0,,George C Freeman III Universal Corporation
2025-12-03,James A Brock,Consol Energy,6,5,0,11,0.0,,James A Brock Consol Energy
2025-12-03,Robert Antokol,Playtika Holding,0,9,1,10,10.0,,Robert Antokol Playtika Holding
2025-12-03,Joe Craft,Alliance Resource Partners,9,14,2,25,8.0,,Joe Craft Alliance Resource Partners
2025-12-03,Paul Keel,Envista,2,9,1,12,8.3,,Paul Keel Envista
2025-12-03,Jared Isaacman,Shift4 Payments,5,18,2,25,8.0,,Jared Isaacman Shift4 Payments
2025-12-03,Mark Mac McFarland,Talen Energy,6,2,1,9,11.1,,Mark Mac McFarland Talen Energy
2025-12-03,Tony R Thene,Carpenter Technology,0,14,1,15,6.7,,Tony R Thene Carpenter Technology
2025-12-03,Melissa D Smith,WEX,4,8,2,14,14.3,,Melissa D Smith WEX
2025-12-03,James Jim C Ryan III,Old National Bancorp,2,5,1,8,12.5,,James Jim C Ryan III Old National Bancorp
2025-12-03,Peter J Federico,AGNC Investment,5,4,2,11,18.2,,Peter J Federico AGNC Investment
2025-12-03,Brent L Yeagy,Wabash National,0,3,0,3,0.0,,Brent L Yeagy Wabash National
2025-12-03,Henry A Fernandez,MSCI,9,13,3,25,12.0,,Henry A Fernandez MSCI
2025-12-03,Mark Penn,Stagwell,6,15,4,25,16.0,,Mark Penn Stagwell
2025-12-03,Julie Schertell,Mativ,4,17,0,21,0.0,,Julie Schertell Mativ
2025-12-03,Ashish Chand,Belden,0,8,1,9,11.1,,Ashish Chand Belden
2025-12-03,Greg Anderson,Allegiant Travel Company,10,14,1,25,4.0,,Greg Anderson Allegiant Travel Company
2025-12-03,Drew Houston,Dropbox,7,14,4,25,16.0,,Drew Houston Dropbox
2025-12-03,Kevin T Conroy,Exact Sciences,4,14,7,25,28.0,,Kevin T Conroy Exact Sciences
2025-12-03,Rex D Geveden,BWX Technologies,12,11,2,25,8.0,,Rex D Geveden BWX Technologies
2025-12-03,Scott R Wells,Clear Channel Outdoor Hldgs,7,2,1,10,10.0,,Scott R Wells Clear Channel Outdoor Hldgs
2025-12-03,Casey Wasserman,Wasserman,11,14,0,25,0.0,,Casey Wasserman
2025-12-03,Mac Cummings,Terakeet,2,8,0,10,0.0,,Mac Cummings Terakeet
