date,ceo,company,positive,neutral,negative,total,neg_pct,theme,alias
2025-10-19,Timothy J McGrath,PC Connection Inc,0,0,0,0,0.0,,Timothy J McGrath PC Connection Inc
2025-10-19,Lynn M Bamford,Curtiss-Wright,8,15,2,25,8.0,,Lynn M Bamford Curtiss-Wright
2025-10-19,Jonathan W Witter,Sallie Mae,2,4,1,7,14.3,,Jonathan W Witter Sallie Mae
2025-10-19,Jeff Benck,Benchmark Electronics,3,17,0,20,0.0,,Jeff Benck Benchmark Electronics
2025-10-19,Charles H Giancarlo,Pure Storage,4,9,0,13,0.0,,Charles H Giancarlo Pure Storage
2025-10-19,Brian R Gray,Knife River Corporation,1,1,0,2,0.0,,Brian R Gray Knife River Corporation
2025-10-19,Jay Schmidt,Caleres Inc,2,11,3,16,18.8,,Jay Schmidt Caleres Inc
2025-10-19,Dale Asplund,BrightView Holdings,1,7,0,8,0.0,,Dale Asplund BrightView Holdings
2025-10-19,Jeffrey S Edwards,Cooper-Standard,1,11,0,12,0.0,,Jeffrey S Edwards Cooper-Standard
2025-10-19,Glenn J Williams,Primerica,4,4,3,11,27.3,,Glenn J Williams Primerica
2025-10-19,Francois Locoh-Donou,F5,8,13,4,25,16.0,,Francois Locoh-Donou F5
2025-10-19,Joseph Wm Foran,Matador Resources,10,15,0,25,0.0,,Joseph Wm Foran Matador Resources
2025-10-19,Sridhar Ramaswamy,Snowflake Inc,7,16,2,25,8.0,,Sridhar Ramaswamy Snowflake Inc
2025-10-19,Mark D Dankberg,Viasat,2,7,3,12,25.0,,Mark D Dankberg Viasat
2025-10-19,Francisco J Leon,California Resources,1,4,1,6,16.7,,Francisco J Leon California Resources
2025-10-19,Peter Stern,Peloton Interactive,7,15,3,25,12.0,,Peter Stern Peloton Interactive
2025-10-19,David Baszucki,Roblox,2,17,6,25,24.0,,David Baszucki Roblox
2025-10-19,Jeffrey W Edwards,Installed Building Products,1,2,0,3,0.0,,Jeffrey W Edwards Installed Building Products
2025-10-19,Clark Lauritzen,First National of Nebraska,1,10,0,11,0.0,,Clark Lauritzen First National of Nebraska
2025-10-19,Carlos Alberini,Guess Inc,6,17,2,25,8.0,,Carlos Alberini Guess Inc
2025-10-19,Shyam P Kambeyanda,ESAB,5,4,0,9,0.0,,Shyam P Kambeyanda ESAB
2025-10-19,Edmund Shallcross III,Amica Mutual Insurance,3,7,0,10,0.0,,Edmund Shallcross III Amica Mutual Insurance
2025-10-19,Benjamin W Schall,AvalonBay Communities,2,10,0,12,0.0,,Benjamin W Schall AvalonBay Communities
2025-10-19,Allan C Thygesen,DocuSign,4,8,2,14,14.3,,Allan C Thygesen DocuSign
2025-10-19,Bryan J Knutson,Titan Machinery,1,1,1,3,33.3,,Bryan J Knutson Titan Machinery
2025-10-19,Heath Sampson,ModivCare,12,3,3,18,16.7,,Heath Sampson ModivCare
2025-10-19,Ara K Hovnanian,Hovnanian Enterprises,6,18,1,25,4.0,,Ara K Hovnanian Hovnanian Enterprises
2025-10-19,Joshua G Silverman,Etsy,6,16,3,25,12.0,,Joshua G Silverman Etsy
2025-10-19,Kevin Roycraft,Adams Resources & Energy,7,3,1,11,9.1,,Kevin Roycraft Adams Resources & Energy
2025-10-19,J Eric Evans,Surgery Partners,0,2,0,2,0.0,,J Eric Evans Surgery Partners
2025-10-19,Clint E Stein,Columbia Banking System,1,13,0,14,0.0,,Clint E Stein Columbia Banking System
2025-10-19,Lee M Shavel,Verisk Analytics,5,13,1,19,5.3,,Lee M Shavel Verisk Analytics
2025-10-19,Dave Banyard Jr,MasterBrand,0,0,0,0,0.0,,Dave Banyard Jr MasterBrand
2025-10-19,Peter R Ingram,Hawaiian Airlines Inc,2,11,1,14,7.1,,Peter R Ingram Hawaiian Airlines Inc
2025-10-19,Kristin A Dolan,AMC Networks,1,17,7,25,28.0,,Kristin A Dolan AMC Networks
2025-10-19,Brendan T Cavanagh,SBA Communications,3,7,0,10,0.0,,Brendan T Cavanagh SBA Communications
2025-10-19,George F Chappelle Jr,Americold Realty Trust,5,3,0,8,0.0,,George F Chappelle Jr Americold Realty Trust
2025-10-19,Thomas E Gottwald,NewMarket Corporation,1,11,0,12,0.0,,Thomas E Gottwald NewMarket Corporation
2025-10-19,Thomas J Baltimore Jr,Park Hotels & Resorts,4,19,2,25,8.0,,Thomas J Baltimore Jr Park Hotels & Resorts
2025-10-19,Peter M Moglia,Alexandria Real Estate Equities,2,8,0,10,0.0,,Peter M Moglia Alexandria Real Estate Equities
2025-10-19,Ronald J Kramer,Griffon Corporation,2,6,1,9,11.1,,Ronald J Kramer Griffon Corporation
2025-10-19,John L Plueger,Air Lease,5,19,0,24,0.0,,John L Plueger Air Lease
2025-10-19,Jennifer F Scanlon,UL Solutions,6,3,0,9,0.0,,Jennifer F Scanlon UL Solutions
2025-10-19,Greg Smith,Teradyne,3,12,3,18,16.7,,Greg Smith Teradyne
2025-10-19,Sean Trauschke,OGE Energy,17,7,1,25,4.0,,Sean Trauschke OGE Energy
2025-10-19,Norman D Schwartz,Bio-Rad Laboratories,3,3,1,7,14.3,,Norman D Schwartz Bio-Rad Laboratories
2025-10-19,Scott Doyle,Spire Inc,5,7,4,16,25.0,,Scott Doyle Spire Inc
2025-10-19,Michael E Reed,Gannett,0,6,2,8,25.0,,Michael E Reed Gannett
2025-10-19,Cindy J Miller,Stericycle,3,5,3,11,27.3,,Cindy J Miller Stericycle
2025-10-19,Phillip D Green,Cullen Frost Bankers,4,5,3,12,25.0,,Phillip D Green Cullen Frost Bankers
2025-10-19,Joseph D Margolis,Extra Space Storage,1,13,1,15,6.7,,Joseph D Margolis Extra Space Storage
2025-10-19,Mark A Skonieczny,REV Group,2,11,1,14,7.1,,Mark A Skonieczny REV Group
2025-10-19,Ladd Wilks,ProFrac Holding,5,1,0,6,0.0,,Ladd Wilks ProFrac Holding
2025-10-19,Sundaram Nagarajan,Nordson,9,16,0,25,0.0,,Sundaram Nagarajan Nordson
2025-10-19,Anne P Noonan,Summit Materials,1,7,0,8,0.0,,Anne P Noonan Summit Materials
2025-10-19,Lori Flees,Valvoline Inc,2,7,5,14,35.7,,Lori Flees Valvoline Inc
2025-10-19,Scott H Baxter,Kontoor Brands,3,6,1,10,10.0,,Scott H Baxter Kontoor Brands
2025-10-19,Tim Larson,Skyline Champion,18,1,0,19,0.0,,Tim Larson Skyline Champion
2025-10-19,Chuck Divita,Teladoc Health,7,15,3,25,12.0,,Chuck Divita Teladoc Health
2025-10-19,W Bradley Southern,Louisiana-Pacific Corporation,7,18,0,25,0.0,,W Bradley Southern Louisiana-Pacific Corporation
2025-10-19,George C Freeman III,Universal Corporation,7,17,1,25,4.0,,George C Freeman III Universal Corporation
2025-10-19,James A Brock,Consol Energy,9,5,0,14,0.0,,James A Brock Consol Energy
2025-10-19,Robert Antokol,Playtika Holding,0,9,1,10,10.0,,Robert Antokol Playtika Holding
2025-10-19,Joe Craft,Alliance Resource Partners,8,14,3,25,12.0,,Joe Craft Alliance Resource Partners
2025-10-19,Paul Keel,Envista,3,10,1,14,7.1,,Paul Keel Envista
2025-10-19,Jared Isaacman,Shift4 Payments,4,19,2,25,8.0,,Jared Isaacman Shift4 Payments
2025-10-19,Mark Mac McFarland,Talen Energy,6,1,1,8,12.5,,Mark Mac McFarland Talen Energy
2025-10-19,Tony R Thene,Carpenter Technology,2,11,1,14,7.1,,Tony R Thene Carpenter Technology
2025-10-19,Melissa D Smith,WEX,4,9,1,14,7.1,,Melissa D Smith WEX
2025-10-19,James Jim C Ryan III,Old National Bancorp,2,5,0,7,0.0,,James Jim C Ryan III Old National Bancorp
2025-10-19,Peter J Federico,AGNC Investment,1,1,0,2,0.0,,Peter J Federico AGNC Investment
2025-10-19,Brent L Yeagy,Wabash National,0,1,0,1,0.0,,Brent L Yeagy Wabash National
2025-10-19,Henry A Fernandez,MSCI,8,13,4,25,16.0,,Henry A Fernandez MSCI
2025-10-19,Mark Penn,Stagwell,4,17,4,25,16.0,,Mark Penn Stagwell
2025-10-19,Julie Schertell,Mativ,5,16,0,21,0.0,,Julie Schertell Mativ
2025-10-19,Ashish Chand,Belden,2,7,1,10,10.0,,Ashish Chand Belden
2025-10-19,Greg Anderson,Allegiant Travel Company,9,14,2,25,8.0,,Greg Anderson Allegiant Travel Company
2025-10-19,Drew Houston,Dropbox,7,14,4,25,16.0,,Drew Houston Dropbox
2025-10-19,Kevin T Conroy,Exact Sciences,2,15,8,25,32.0,,Kevin T Conroy Exact Sciences
2025-10-19,Rex D Geveden,BWX Technologies,8,9,2,19,10.5,,Rex D Geveden BWX Technologies
2025-10-19,Scott R Wells,Clear Channel Outdoor Hldgs,5,2,0,7,0.0,,Scott R Wells Clear Channel Outdoor Hldgs
2025-10-19,Casey Wasserman,Wasserman,9,13,3,25,12.0,,Casey Wasserman
2025-10-19,Mac Cummings,Terakeet,2,7,0,9,0.0,,Mac Cummings Terakeet
